"id","name","supertype","subtypes","hp","types","rarity","retreatCost","convertedRetreatCost","AbilityName","AbilityText","Attack1Name","Attack1Cost","Attack1ConvertedCost","Attack1Damage","Attack1Text","Attack2Name","Attack2Cost","Attack2ConvertedCost","Attack2Damage","Attack2Text","Weakness1Type","Weakness1Value"
"bp-1","Electabuzz","Pokemon","Basic","70","Lightning","Promo","Colorless, Colorless","2","","","Thundershock","Lightning","1","10","Flip a coin. If heads, the Defending Pokemon is now Paralyzed.","Thunderpunch","Lightning, Colorless","2","30+","Flip a coin. If heads, this attack does 30 damage plus 10 more damage; if tails, this attack does 30 damage plus Electabuzz does 10 damage to itself.","Fighting","×2"
"bp-2","Hitmonchan","Pokemon","Basic","60","Fighting","Promo","Colorless, Colorless","2","","","Jab","Fighting","1","20","","Special Punch","Fighting, Fighting, Colorless","3","40","","Psychic","×2"
"bp-4","Rocket's Scizor","Pokemon","Basic","60","Metal","Promo","Colorless, Colorless","2","","","Focus","Colorless","1","","During your next turn, Rocket's Scizor's Agility attack's damage is doubled.","Agility","Metal, Colorless, Colorless","3","20","Flip a coin. If heads, during your opponent's next turn, prevent all effects of attacks, including damage, done to Rocket's Scizor.","Fire","×2"
"bp-5","Rocket's Sneasel","Pokemon","Basic","60","Darkness","Promo","Colorless","1","","","Entrap","Darkness","1","","The Defending Pokemon can't retreat during your opponent's next turn.","Continuous Scratch","Colorless, Colorless","2","10×","Flip 4 coins. This attack does 10 damage times the number of heads.","Fighting","×2"
"bp-6","Dark Ivysaur","Pokemon","Stage 1","50","Grass","Promo","Colorless, Colorless","2","Vine Pull","Once during your turn when Dark Ivysaur retreats, choose 1 of your opponent's Benched Pokemon and switch it with his or her Active Pokemon.","Fury Strikes","Grass, Grass","2","","Your opponent puts 3 markers onto his or her Pokemon (divided as he or she chooses). (More than 1 marker can be put on the same Pokemon.) Then, this attack does 10 damage to each Pokemon for each marker on it. Don't apply Weakness and Resistance. Remove the markers at the end of the turn.","","","","","","Fire","×2"
"bp-7","Dark Venusaur","Pokemon","Stage 2","70","Grass","Promo","Colorless, Colorless","2","","","Horrid Pollen","Grass, Grass, Grass","3","30","Flip 2 coins. If 1 is heads, the Defending Pokemon is now Asleep and Poisoned. If both are heads, the Defending Pokemon is now Confused and Poisoned. If both are tails, the Defending Pokemon is now Paralyzed and Poisoned.","","","","","","Fire","×2"
"bp-8","Rocket's Mewtwo","Pokemon","Basic","70","Psychic","Promo","Colorless, Colorless","2","","","Juxtapose","Psychic","1","","Flip a coin. If heads, switch the number of damage counters on Rocket's Mewtwo with the number of damage counters on the Defending Pokemon (even if it would Knock Out either Pokemon). (It's okay if 1 of the Pokemon has no damage counters on it.)","Hypnoblast","Psychic, Psychic","2","20","Flip a coin. If heads, the Defending Pokemon is now Asleep.","Psychic","×2"
"bp-9","Rocket's Hitmonchan","Pokemon","Basic","60","Fighting","Promo","Colorless","1","","","Crosscounter","Fighting","1","","If an attack does damage to Rocket's Hitmonchan during your opponent's next turn (even if Rocket's Hitmonchan is Knocked Out), flip a coin. If heads, Rocket's Hitmonchan attacks your opponent's Active Pokemon for double that amount of damage. (If Rocket's Hitmonchan takes 20 damage, it does 40 damage to that Pokemon.)","Magnum Punch","Fighting, Fighting, Colorless","3","50","","Psychic","×2"
