"id","name","supertype","subtypes","hp","types","rarity","retreatCost","convertedRetreatCost","AbilityName","AbilityText","Attack1Name","Attack1Cost","Attack1ConvertedCost","Attack1Damage","Attack1Text","Attack2Name","Attack2Cost","Attack2ConvertedCost","Attack2Damage","Attack2Text","Weakness1Type","Weakness1Value"
"bw8-91","Durant","Pokemon","Basic, Team Plasma","70","Metal","Uncommon","Colorless","1","","","Gnaw","Colorless, Colorless","2","20","","Hard Crunch","Metal, Colorless, Colorless","3","40+","If the Defending Pokemon already has any damage counters on it, this attack does 30 more damage.","Fire","x2"
"bw8-92","Durant","Pokemon","Basic, Team Plasma","70","Metal","Uncommon","Colorless","1","","","Call for Backup","Colorless","1","","Search your deck for a Pokemon, reveal it, and put it into your hand. Shuffle your deck afterward.","Metal Jail","Metal, Colorless","2","30","The Defending Pokemon can't retreat during your opponent's next turn.","Fire","x2"
"bw8-94","Druddigon","Pokemon","Basic, Team Plasma","110","Dragon","Rare","Colorless","1","","","Guard Press","Colorless, Colorless","2","20","During your opponent's next turn, any damage done to this Pokemon by attacks is reduced by 20 (after applying Weakness and Resistance).","Dragon Claw","Fire, Fire, Water, Colorless","4","90","","Dragon","x2"
"bw8-97","Clefairy","Pokemon","Basic","60","Colorless","Common","Colorless","1","","","Pound","Colorless","1","10","","Double Slap","Colorless, Colorless","2","20x","Flip 2 coins. This attack does 20 damage times the number of heads.","Fighting","x2"
"bw8-98","Clefable","Pokemon","Stage 1","90","Colorless","Rare","Colorless","1","Moon Guidance","Once during your turn (before your attack), you may flip a coin. If heads, search your deck for a card that evolves from 1 of your Pokemon and put it onto that Pokemon. (This counts as evolving that Pokemon.) Shuffle your deck afterward.","Moon Impact","Colorless, Colorless, Colorless","3","50","","","","","","","Fighting","x2"
"bw8-99","Doduo","Pokemon","Basic","60","Colorless","Common","Colorless","1","","","Gatling Peck","Colorless, Colorless","2","10x","Flip 5 coins. This attack does 10 damage times the number of heads.","","","","","","Lightning","x2"
"bw8-100","Dodrio","Pokemon","Stage 1","90","Colorless","Rare","Colorless","1","","","Raging Pecks","Colorless","1","30x","Flip 3 coins. This attack does 30 damage times the number of heads. This Pokemon is now Confused.","Drill Peck","Colorless, Colorless, Colorless","3","60","","Lightning","x2"
"bw8-101","Snorlax","Pokemon","Basic, Team Plasma","130","Colorless","Rare","Colorless, Colorless, Colorless, Colorless","4","Block","As long as this Pokemon is your Active Pokemon, your opponent's Active Pokemon can't retreat.","Teampact","Colorless, Colorless, Colorless, Colorless, Colorless","5","30x","Does 30 damage times the number of Team Plasma Pokemon you have in play.","","","","","","Fighting","x2"
"bw8-102","Togepi","Pokemon","Basic","40","Colorless","Common","Colorless","1","","","Yawn","Colorless","1","","The Defending Pokemon is now Asleep.","","","","","","Fighting","x2"
"bw8-103","Togetic","Pokemon","Stage 1","80","Colorless","Uncommon","Colorless","1","","","Sweet Kiss","Colorless","1","30","Your opponent draws a card.","","","","","","Lightning","x2"
"bw8-104","Togekiss","Pokemon","Stage 2","140","Colorless","Rare Holo","Colorless","1","Bright Veil","As long as this Pokemon is your Active Pokemon, whenever your opponent plays an Item card from his or her hand, prevent all effects of that card done to your Pokemon.","Return","Colorless","1","30","Draw cards until you have 6 cards in your hand.","","","","","","Lightning","x2"
"bw8-105","Whismur","Pokemon","Basic","70","Colorless","Common","Colorless, Colorless","2","","","Shout","Colorless","1","","Flip a coin. If heads, discard a random card from your opponent's hand.","Hyper Voice","Colorless, Colorless, Colorless","3","30","","Fighting","x2"
"bw8-106","Loudred","Pokemon","Stage 1","90","Colorless","Uncommon","Colorless, Colorless, Colorless","3","","","Supersonic","Colorless","1","","The Defending Pokemon is now Confused.","Hyper Voice","Colorless, Colorless, Colorless","3","50","","Fighting","x2"
"bw8-107","Exploud","Pokemon","Stage 2","140","Colorless","Rare","Colorless, Colorless, Colorless, Colorless","4","","","Destructive Sound","Colorless, Colorless, Colorless","3","","Your opponent reveals his or her hand. Discard all Item cards you find there.","Round","Colorless, Colorless, Colorless, Colorless","4","50x","Does 50 damage times the number of your Pokemon that have the Round attack.","Fighting","x2"
"bw8-109","Skitty","Pokemon","Basic","50","Colorless","Common","Colorless","1","","","Triple Slap","Colorless, Colorless","2","20x","Flip 3 coins. This attack does 20 damage times the number of heads.","","","","","","Fighting","x2"
"bw8-110","Patrat","Pokemon","Basic","50","Colorless","Common","Colorless","1","","","Reckless Charge","Colorless","1","20","This Pokemon does 10 damage to itself.","","","","","","Fighting","x2"
"bw8-111","Patrat","Pokemon","Basic","50","Colorless","Common","Colorless","1","","","Collect","Colorless","1","","Draw a card.","Slam","Colorless, Colorless","2","20x","Flip 2 coins. This attack does 20 damage times the number of heads.","Fighting","x2"
"bw8-112","Watchog","Pokemon","Stage 1, Team Plasma","90","Colorless","Uncommon","Colorless","1","","","Fast Swipe","Colorless","1","","Discard a random card from your opponent's hand.","Biting Fang","Colorless, Colorless","2","30+","Flip a coin. If heads, this attack does 20 more damage.","Fighting","x2"
"bw8-113","Watchog","Pokemon","Stage 1, Team Plasma","90","Colorless","Rare","Colorless","1","","","Second Bite","Colorless, Colorless","2","20+","Does 10 more damage for each damage counter on the Defending Pokemon.","Low Kick","Colorless, Colorless, Colorless","3","60","","Fighting","x2"
"bw8-114","Bouffalant","Pokemon","Basic, Team Plasma","100","Colorless","Rare","Colorless, Colorless","2","","","Tool Breaker","Colorless","1","","Discard a Pokemon Tool card attached to the Defending Pokemon.","Hammer In","Colorless, Colorless, Colorless, Colorless","4","70","","Fighting","x2"
"bw8-115","Rufflet","Pokemon","Basic","50","Colorless","Common","Colorless","1","","","Incessant Peck","Colorless, Colorless","2","10+","Flip a coin until you get tails. This attack does 20 more damage for each heads.","","","","","","Lightning","x2"
"bw8-116","Braviary","Pokemon","Stage 1","100","Colorless","Rare","Colorless, Colorless","2","Big Wing","Once during your turn (before your attack), if this Pokemon is your Active Pokemon, you may have your opponent switch his or her Active Pokemon with 1 of his or her Benched Pokemon.","Wild Edge","Colorless, Colorless, Colorless","3","60+","You may do 20 more damage. If you do, this Pokemon does 20 damage to itself.","","","","","","Lightning","x2"
