"id","name","supertype","subtypes","hp","types","rarity","retreatCost","convertedRetreatCost","AbilityName","AbilityText","Attack1Name","Attack1Cost","Attack1ConvertedCost","Attack1Damage","Attack1Text","Attack2Name","Attack2Cost","Attack2ConvertedCost","Attack2Damage","Attack2Text","Weakness1Type","Weakness1Value"
"ex3-1","Absol","Pokemon","Basic","70","Darkness","Rare Holo","Colorless","1","","","Bad News","Darkness","1","","If the number of cards in your opponent's hand is at least 6, choose a number of cards there, without looking, until your opponent has 5 cards left. Have your opponent discard the cards you chose.","Prize Count","Darkness, Colorless","2","20+","If you have more Prize cards left than your opponent, this attack does 20 damage plus 20 more damage.","Fighting","x2"
"ex3-2","Altaria","Pokemon","Stage 1","80","Colorless","Rare Holo","Colorless","1","","","Dragon Dance","Colorless","1","","During your next turn, if any of your current Active Pokemon does damage to any Defending Pokemon, this attack does 40 more damage (before applying Weakness and Resistance).","Dragon Song","Water, Lightning","2","30","Each Defending Pokemon is now Asleep.","Colorless","x2"
"ex3-3","Crawdaunt","Pokemon","Stage 1","80","Water","Rare Holo","Colorless, Colorless","2","Power Pinchers","As long as Crawdaunt is your Active Pokemon, when any of your Active Pokemon does damage to the Defending Pokemon, the attack does 10 more damage (before applying Weakness and Resistance).","Guillotine","Water, Colorless, Colorless","3","50","","","","","","","Lightning","x2"
"ex3-4","Flygon","Pokemon","Stage 2","120","Colorless","Rare Holo","Colorless, Colorless","2","","","Energy Shower","Grass, Lightning","2","","Attach any number of basic Energy cards from your hand to your Pokemon in any way you like.","Rainbow Burn","Colorless, Colorless, Colorless","3","30+","Does 30 damage plus 10 more damage for each type of basic Energy card attached to Flygon.","Colorless","x2"
"ex3-5","Golem","Pokemon","Stage 2","120","Fighting","Rare Holo","Colorless, Colorless, Colorless, Colorless","4","","","Rock Vengeance","Fighting, Colorless, Colorless","3","20+","Does 20 damage plus 10 more damage for each damage counter on all of your Active Pokemon.","Rock Slide","Fighting, Fighting, Colorless, Colorless, Colorless","5","60","Does 20 damage to 2 of your opponent's Benched Pokemon (1 if there is only 1). (Don't apply Weakness and Resistance for Benched Pokemon.)","Water","x2"
"ex3-6","Grumpig","Pokemon","Stage 1","80","Psychic","Rare Holo","Colorless","1","","","Psychic Boom","Psychic, Colorless","2","20+","Does 20 damage plus 10 more damage for each Energy attached to the Defending Pokemon.","Mind Trip","Psychic, Colorless, Colorless","3","50","If Grumpig and the Defending Pokemon have the same amount of Energy attached to them, the Defending Pokemon is now Confused.","Psychic","x2"
"ex3-7","Minun","Pokemon","Basic","50","Lightning","Rare Holo","Colorless","1","Chain of Events","As long as Minun is your Active Pokemon, whenever your other Active Pokemon, if any, attacks, you may use Cheer On after the first attack (you still need the necessary Energy to use Cheer On). You can't use Cheer On more than once in this way even if your other Active Pokemon has the Chain of Events Poke-Body.","Cheer On","Colorless","1","","Remove 1 damage counter from each of your Pokemon (including Minun).","Special Circuit","Lightning, Colorless","2","","Choose 1 of your opponent's Pokemon. This attack does 20 damage to that Pokemon. If you choose Pokemon that has a Poke-Power or Poke-Body, this attack does 40 damage instead. (Don't apply Weakness and Resistance for Benched Pokemon.)","Fighting","x2"
"ex3-8","Plusle","Pokemon","Basic","50","Lightning","Rare Holo","Colorless","1","Chain of Events","As long as Plusle is your Active Pokemon, whenever your other Active Pokemon, if any, attacks, you may use Cheer On after the first attack (you still need the necessary Energy to use Cheer On). You can't use Cheer On more than once in this way even if your other Active Pokemon has the Chain of Events Poke-Body.","Cheer On","Colorless","1","","Remove 1 damage counter from each of your Pokemon (including Plusle).","Extra Circuit","Lightning, Colorless","2","","Choose 1 of your opponent's Pokemon. This attack does 20 damage to that Pokemon. If you choose Pokemon-ex, this attack does 40 damage instead. (Don't apply Weakness and Resistance for Benched Pokemon.)","Fighting","x2"
"ex3-9","Roselia","Pokemon","Basic","60","Grass","Rare Holo","Colorless","1","Thick Skin","Roselia can't be affected by any Special Conditions.","Speed Growth","Colorless","1","","Attach up to 2 Grass Energy cards from your hand to your Pokemon in any way you like.","Sleep Powder","Grass","1","10","The Defending Pokemon is now Asleep.","Fire","x2"
"ex3-10","Salamence","Pokemon","Stage 2","120","Colorless","Rare Holo","Colorless, Colorless","2","Dragon Wind","Once during your turn (before your attack), if Salamence is your Active Pokemon, you may switch 1 of your opponent's Benched Pokemon with 1 of the Defending Pokemon. Your opponent chooses the Defending Pokemon to switch. This power can't be used if Salamence is affected by a Special Condition.","Agility","Colorless, Colorless","2","20","Flip a coin. If heads, prevent all effects of an attack, including damage, done to Salamence during your opponent's next turn.","Dragon Claw","Fire, Water, Colorless, Colorless","4","60","","Colorless","x2"
"ex3-11","Shedinja","Pokemon","Stage 1","30","Grass","Rare Holo","Colorless","1","Wonder Guard","Prevent all effects of attacks, including damage, done to Shedinja by your opponent's Evolved Pokemon and Pokemon-ex.","Damage Curse","Colorless","1","","Put 1 damage counter, plus 1 more damage counter for each damage counter on Shedinja, on the Defending Pokemon.","","","","","",,
"ex3-12","Torkoal","Pokemon","Basic","80","Fire","Rare Holo","Colorless, Colorless, Colorless","3","","","Power Generation","Colorless","1","","Search your discard pile for up to 2 basic Energy cards, show them to your opponent, and put them into your hand.","Scorching Smoke","Fire","1","","The Defending Pokemon is now Burned. Flip a coin. If tails, discard a Fire Energy card attached to Torkoal.","Water","x2"
"ex3-13","Crawdaunt","Pokemon","Stage 1","80","Water","Rare","Colorless","1","","","Poison Claws","Water","1","10","Flip a coin. If heads, the Defending Pokemon is now Poisoned.","Rend","Colorless, Colorless, Colorless","3","30+","If the Defending Pokemon has any damage counters on it, this attack does 30 damage plus 30 more damage.","Lightning","x2"
"ex3-14","Dragonair","Pokemon","Stage 1","70","Colorless","Rare","Colorless, Colorless","2","","","Dazzle Blast","Lightning, Colorless","2","20","Flip a coin. If heads, the Defending Pokemon is now Confused.","Healing Wave","Water, Colorless, Colorless","3","30","Remove 1 damage counter from each of your Active Pokemon.","Colorless","x2"
"ex3-15","Flygon","Pokemon","Stage 2","100","Colorless","Rare","Colorless, Colorless","2","Sand Guard","Whenever Flygon would be damaged by your opponent's attack (after applying Weakness and Resistance), flip a coin. If heads, reduce that damage by 20.","Air Slash","Grass, Lightning, Colorless","3","60","Flip a coin. If tails, discard an Energy card attached to Flygon.","","","","","",,
"ex3-16","Girafarig","Pokemon","Basic","70","Psychic","Rare","Colorless","1","","","Synchronized Search","Colorless","1","","If Girafarig and the Defending Pokemon have the same amount of Energy attached to them, pick any 1 card from your deck and put it into your hand. Shuffle your deck afterward.","Breaking Impact","Psychic, Colorless","2","","Choose 1 of your opponent's Pokemon. This attack does 10 damage for each Colorless Energy in that Pokemon's Retreat Cost to that Pokemon (after applying effects to the Retreat Cost). (Don't apply Weakness and Resistance for Benched Pokemon.)","Psychic","x2"
"ex3-17","Magneton","Pokemon","Stage 1","70","Lightning","Rare","Colorless","1","Magnetic Field","Once during your turn (before your attack), if you have basic Energy cards in your discard pile, you may discard any 1 card from your hand. Then search for up to 2 basic Energy cards from your discard pile, show them to your opponent, and put them into your hand. You can't return the card you first discarded to your hand in this way. This power can't be used if Magneton is affected by a Special Condition.","Magnetic Force","Lightning, Colorless","2","10x","Does 10 damage times the amount of Energy attached to all of your Pokemon (including Magneton).","","","","","","Fighting","x2"
"ex3-18","Ninjask","Pokemon","Stage 1","70","Grass","Rare","","0","Loose Shell","Once during your turn, when you play Ninjask from your hand to evolve 1 of your Pokemon, you may search your deck for Shedinja and put it onto your Bench. Treat the new Benched Pokemon as a Basic Pokemon. Shuffle your deck afterward.","Quick Touch","Colorless, Colorless","2","30","You may switch Ninjask with 1 of your Benched Pokemon. If you do, you may move any number of Grass Energy cards attached to Ninjask to the new Active Pokemon.","","","","","","Fire","x2"
"ex3-19","Salamence","Pokemon","Stage 2","100","Colorless","Rare","Colorless, Colorless","2","Intimidating Fang","As long as Salamence is your Active Pokemon, any damage done to your Pokemon by an opponent's attack is reduced by 10 (before applying Weakness and Resistance).","Dragon Flame","Fire, Water, Colorless","3","40+","You may discard an Energy card attached to Salamence. If you do, this attack does 40 damage plus 20 more damage.","","","","","",,
"ex3-20","Shelgon","Pokemon","Stage 1","80","Colorless","Rare","Colorless, Colorless","2","","","Scrunch","Colorless","1","","Flip a coin. If heads, prevent all damage done to Shelgon during your opponent's next turn. (Any other effects of attacks still happen.)","Rolling Attack","Fire, Water, Colorless","3","50","","Colorless","x2"
"ex3-21","Skarmory","Pokemon","Basic","70","Metal","Rare","Colorless","1","","","Pick On","Metal","1","","If the number of cards in your opponent's hand is at least 6, look at his or her hand. Choose a number of cards there until your opponent has 5 cards left in his or her hand and have your opponent shuffle the cards you chose into his or her deck.","Power Count","Metal, Colorless","2","20+","Count the amount of Energy attached to all of your Pokemon and all of your opponent's Pokemon. If your Pokemon have less Energy than your opponent's, this attack does 20 damage plus 30 more damage.","Fire","x2"
"ex3-22","Vibrava","Pokemon","Stage 1","80","Colorless","Rare","Colorless","1","","","Quick Charge","Colorless","1","","Search your deck for up to 3 different types of basic Energy cards, show them to your opponent, and put them into your hand. Shuffle your deck afterward.","Dragon Spark","Grass, Lightning","2","","Flip a coin. If heads, this attack does 20 damage to each of your opponent's Pokemon. (Don't apply Weakness and Resistance for Benched Pokemon.)","Colorless","x2"
"ex3-23","Bagon","Pokemon","Basic","50","Colorless","Uncommon","Colorless","1","","","Paralyzing Gaze","Water","1","","Flip a coin. If heads, the Defending Pokemon is now Paralyzed.","Combustion","Fire, Colorless","2","20","","Colorless","x2"
"ex3-24","Camerupt","Pokemon","Stage 1","80","Fire","Uncommon","Colorless, Colorless","2","","","Super Singe","Fire, Colorless","2","20","Flip a coin. If heads, the Defending Pokemon is now Burned.","Ram","Fire, Colorless, Colorless","3","50","","Water","x2"
"ex3-25","Combusken","Pokemon","Stage 1","70","Fire","Uncommon","Colorless","1","","","Quick Attack","Colorless, Colorless","2","10+","Flip a coin. If heads, this attack does 10 damage plus 20 more damage.","Combustion","Fire, Colorless, Colorless","3","40","","Water","x2"
"ex3-26","Dratini","Pokemon","Basic","50","Colorless","Uncommon","Colorless","1","","","Dragon Dew","Water","1","","Remove 2 damage counters from 1 of your Pokemon (remove 1 if there is only 1).","Tail Slap","Lightning","1","10","","Colorless","x2"
"ex3-27","Flaaffy","Pokemon","Stage 1","80","Lightning","Uncommon","Colorless","1","","","Energy Recall","Lightning","1","","Attach up to 2 basic Energy cards from your discard pile to Flaaffy.","Lightning Ball","Lightning, Colorless","2","30","","Fighting","x2"
"ex3-28","Forretress","Pokemon","Stage 1","80","Metal","Uncommon","Colorless, Colorless","2","","","Double Metal Ball","Metal, Colorless","2","","Put 2 damage counters on each Defending Pokemon.","Backspin","Colorless, Colorless, Colorless","3","40","After your attack, you may discard 1 Energy card attached to Forretress. If you do, switch Forretress with 1 of your Benched Pokemon.","Fire","x2"
"ex3-29","Graveler","Pokemon","Stage 1","80","Fighting","Uncommon","Colorless, Colorless, Colorless","3","","","Grind","Colorless","1","10x","Does 10 damage times the amount of Energy attached to Graveler.","Big Explosion","Fighting, Fighting, Colorless, Colorless","4","","Does 80 damage to each Active Pokemon (both yours and your opponent's).","Water","x2"
"ex3-30","Graveler","Pokemon","Stage 1","80","Fighting","Uncommon","Colorless, Colorless, Colorless","3","","","Magnitude","Fighting, Colorless","2","20","Does 10 damage to each Benched Pokemon (both yours and your opponent's). (Don't apply Weakness and Resistance for Benched Pokemon.)","Rollout","Fighting, Colorless, Colorless","3","40","","Water","x2"
"ex3-31","Grovyle","Pokemon","Stage 1","70","Grass","Uncommon","Colorless","1","","","Fury Cutter","Grass, Colorless","2","10+","Flip 4 coins. If all of them are heads, this attack does 10 damage plus 60 more damage. If not, this attack does 10 damage plus 10 more damage for each heads.","","","","","","Fire","x2"
"ex3-32","Gyarados","Pokemon","Stage 1","100","Water","Uncommon","Colorless, Colorless","2","","","Dragon Crush","Water","1","","Flip a coin. If heads, this attack does 10 damage to each Defending Pokemon. Discard an Energy card from each Defending Pokemon.","Aqua Sonic","Water, Colorless, Colorless, Colorless, Colorless","5","80","This attack's damage is not affected by Resistance.","Lightning","x2"
"ex3-33","Horsea","Pokemon","Basic","40","Water","Uncommon","Colorless","1","","","Retaliate","Colorless","1","10x","Flip a coin. If heads, this attack does 10 damage times the number of damage counters on Horsea.","Smokescreen","Water","1","10","If the Defending Pokemon tries to attack during your opponent's next turn, your opponent flips a coin. If tails, that attack does nothing.","Lightning","x2"
"ex3-34","Houndoom","Pokemon","Stage 1","70","Darkness","Uncommon","Colorless","1","","","Feint Attack","Darkness, Colorless","2","","Choose 1 of your opponent's Pokemon. This attack does 20 damage to that Pokemon. This attack's damage isn't affected by Weakness, Resistance, Poke-Powers, Poke-Bodies, or any other effects on that Pokemon.","Flamethrower","Fighting, Colorless, Colorless","3","50","Discard a Fire Energy card attached to Houndoom.","Fighting","x2"
"ex3-35","Magneton","Pokemon","Stage 1","80","Lightning","Uncommon","Colorless","1","","","Ram","Colorless, Colorless","2","20","","Triple Smash","Lightning, Colorless, Colorless","3","20+","Flip 3 coins. This attack does 20 damage plus 20 more damage for each heads.","Fighting","x2"
"ex3-36","Marshtomp","Pokemon","Stage 1","80","Water","Uncommon","Colorless","1","","","Mud Splash","Water, Colorless","2","20","Does 10 damage to 1 of your opponent's Benched Pokemon. (Don't apply Weakness and Resistance for Benched Pokemon.)","","","","","","Lightning","x2"
"ex3-37","Meditite","Pokemon","Basic","50","Fighting","Uncommon","Colorless","1","","","Punch","Colorless","1","10","","Meditate","Fighting, Colorless","2","10+","Does 10 damage plus 10 more damage for each damage counter on the Defending Pokemon.","Psychic","x2"
"ex3-38","Ninjask","Pokemon","Stage 1","70","Grass","Uncommon","","0","","","Supersonic","Colorless","1","10","Flip a coin. If heads, the Defending Pokemon is now Confused.","Sonic Wing","Grass, Colorless","2","30","This attack's damage is not affected by Resistance.","Fire","x2"
"ex3-39","Seadra","Pokemon","Stage 1","70","Water","Uncommon","Colorless","1","","","Energy Cannon","Water","1","20+","Does 20 damage plus 10 more damage for each Energy attached to Seadra but not used to pay for this attack's Energy cost. You can't add more than 20 damage in this way.","Water Arrow","Water, Colorless, Colorless","3","","Choose 1 of your opponent's Pokemon. This attack does 30 damage to that Pokemon. (Don't apply Weakness and Resistance for Benched Pokemon.)","Lightning","x2"
"ex3-40","Seadra","Pokemon","Stage 1","70","Water","Uncommon","Colorless","1","","","Agility","Colorless, Colorless","2","20","Flip a coin. If heads, prevent all effects of an attack, including damage, done to Seadra during your opponent's next turn.","Waterfall","Water, Colorless, Colorless","3","40","","Lightning","x2"
"ex3-41","Shelgon","Pokemon","Stage 1","70","Colorless","Uncommon","Colorless, Colorless","2","Energy Guard","As long as Shelgon has any basic Energy cards attached to it, damage done to Shelgon by an opponent's attack is reduced by 10 (after applying Weakness and Resistance).","Rollout","Colorless, Colorless","2","20","","","","","","",,
"ex3-42","Shelgon","Pokemon","Stage 1","70","Colorless","Uncommon","Colorless, Colorless","2","","","Granite Head","Water, Colorless","2","20","Damage done to Shelgon by an opponent's attack is reduced by 10 (after applying Weakness and Resistance) during your opponent's next turn.","Flare","Fire, Colorless, Colorless","3","40","",,
"ex3-43","Shuppet","Pokemon","Basic","50","Psychic","Uncommon","Colorless","1","","","Hypnosis","Colorless","1","","The Defending Pokemon is now Asleep.","Night Attack","Psychic","1","","Put 1 damage counter on 1 of your opponent's Pokemon.","Darkness","x2"
"ex3-44","Snorunt","Pokemon","Basic","50","Water","Uncommon","Colorless","1","","","Powder Snow","Water","1","10","The Defending Pokemon is now Asleep.","","","","","","Metal","x2"
"ex3-45","Swellow","Pokemon","Stage 1","70","Colorless","Uncommon","","0","","","Clutch","Colorless","1","10","The Defending Pokemon can't retreat until the end of your opponent's next turn.","Quick Dive","Colorless, Colorless","2","","Flip a coin. If heads, choose 1 of your opponent's Pokemon. This attack does 50 damage to that Pokemon. This attack's damage isn't affected by Weakness or Resistance.","Lightning","x2"
"ex3-46","Vibrava","Pokemon","Stage 1","70","Colorless","Uncommon","Colorless","1","Levitate","If Vibrava has any basic Energy cards attached to it, Vibrava's Retreat Cost is 0.","Razor Wing","Colorless, Colorless","2","20","","","","","","",,
"ex3-47","Vibrava","Pokemon","Stage 1","70","Colorless","Uncommon","Colorless","1","","","Dive","Grass, Colorless","2","20","","Quick Turn","Lightning, Colorless, Colorless","3","40x","Flip 2 coins. This attack does 40 damage times the number of heads.",,
"ex3-48","Whiscash","Pokemon","Stage 1","90","Water","Uncommon","Colorless, Colorless","2","Submerge","As long as Whiscash is on your Bench, prevent all damage done to Whiscash by your opponent's attacks.","Surf","Water, Colorless","2","30","","Magnitude","Fighting, Colorless, Colorless, Colorless","4","60","Does 10 damage to each Benched Pokemon (both yours and your opponent's). (Don't apply Weakness and Resistance for Benched Pokemon.)","Grass","x2"
"ex3-49","Bagon","Pokemon","Basic","40","Colorless","Common","Colorless","1","","","Headbutt","Colorless","1","10","","Flare","Fire, Colorless","2","20","",,
"ex3-50","Bagon","Pokemon","Basic","50","Colorless","Common","Colorless","1","","","Risky Kick","Colorless","1","10","Flip a coin. If tails, this attack does nothing.","Dragon Eye","Fire, Water","2","20","The Defending Pokemon is now Asleep.",,
"ex3-51","Barboach","Pokemon","Basic","50","Water","Common","Colorless","1","","","Splash","Colorless","1","10","","Mud Slap","Fighting, Colorless","2","20","","Grass","x2"
"ex3-52","Corphish","Pokemon","Basic","40","Water","Common","Colorless","1","","","Poison Claws","Colorless","1","","Flip a coin. If heads, the Defending Pokemon is now Poisoned.","Bubble","Water","1","10","Flip a coin. If heads, the Defending Pokemon is now Paralyzed.","Lightning","x2"
"ex3-53","Corphish","Pokemon","Basic","50","Water","Common","Colorless","1","","","Irongrip","Colorless","1","10","","Slash","Water, Colorless","2","20","","Lightning","x2"
"ex3-54","Corphish","Pokemon","Basic","50","Water","Common","Colorless","1","","","Beat","Water","1","10","","Toxic Grip","Colorless, Colorless","2","","The Defending Pokemon is now Poisoned.","Lightning","x2"
"ex3-55","Geodude","Pokemon","Basic","50","Fighting","Common","Colorless","1","","","Light Punch","Colorless","1","10","","Pebble Throw","Fighting","1","","Choose 1 of your opponent's Benched Pokemon. This attack does 10 damage to that Pokemon. (Don't apply Weakness and Resistance for Benched Pokemon.)","Water","x2"
"ex3-56","Geodude","Pokemon","Basic","40","Fighting","Common","Colorless","1","","","Steady Punch","Fighting","1","10+","Flip a coin. If heads, this attack does 10 damage plus 10 more damage.","","","","","","Water","x2"
"ex3-57","Grimer","Pokemon","Basic","50","Grass","Common","Colorless","1","","","Pound","Colorless","1","10","","Poison Spurt","Grass","1","","Discard a Grass Energy card attached to Grimer. The Defending Pokemon is now Poisoned.","Psychic","x2"
"ex3-58","Horsea","Pokemon","Basic","50","Water","Common","Colorless","1","","","Paralyzing Gaze","Colorless","1","","Flip a coin. If heads, the Defending Pokemon is now Paralyzed.","Wave Splash","Colorless, Colorless","2","20","","Lightning","x2"
"ex3-59","Houndour","Pokemon","Basic","50","Darkness","Common","Colorless","1","","","Roar","Colorless","1","","Your opponent switches the Defending Pokemon with 1 of his or her Benched Pokemon.","Bite","Colorless, Colorless","2","20","","Fighting","x2"
"ex3-60","Magikarp","Pokemon","Basic","30","Water","Common","Colorless","1","","","Call for Family","Colorless","1","","Search your deck for Magikarp and put as many of them as you like onto your Bench. Shuffle your deck afterward.","Tackle","Water, Colorless","2","20","","Lightning","x2"
"ex3-61","Magnemite","Pokemon","Basic","40","Lightning","Common","Colorless","1","","","Rollout","Colorless","1","10","","Hook","Colorless, Colorless","2","20","","Fighting","x2"
"ex3-62","Magnemite","Pokemon","Basic","50","Lightning","Common","Colorless","1","","","Random Spark","Lightning","1","","Choose 1 of your opponent's Pokemon. This attack does 10 damage to that Pokemon. (Don't apply Weakness and Resistance for Benched Pokemon.)","","","","","","Fighting","x2"
"ex3-63","Magnemite","Pokemon","Basic","50","Lightning","Common","Colorless","1","","","Thundershock","Lightning","1","10","Flip a coin. If heads, the Defending Pokemon is now Paralyzed.","","","","","","Fighting","x2"
"ex3-64","Mareep","Pokemon","Basic","50","Lightning","Common","Colorless","1","","","Jolt","Colorless","1","","Flip a coin. If heads, the Defending Pokemon is now Paralyzed.","","","","","","Fighting","x2"
"ex3-65","Mudkip","Pokemon","Basic","50","Water","Common","Colorless","1","","","Water Gun","Colorless","1","10+","Does 10 damage plus 10 more damage for each Water Energy attached to Mudkip but not used to pay for this attack's Energy cost. You can't add more than 20 damage in this way.","","","","","","Lightning","x2"
"ex3-66","Nincada","Pokemon","Basic","40","Grass","Common","Colorless","1","","","Poison Breath","Grass","1","10","Flip a coin. If heads, the Defending Pokemon is now Poisoned.","","","","","","Fire","x2"
"ex3-67","Nincada","Pokemon","Basic","50","Grass","Common","Colorless","1","","","Bite","Colorless","1","10","","Double Scratch","Grass, Colorless","2","20x","Flip 2 coins. This attack does 20 damage times the number of heads.","Fire","x2"
"ex3-68","Nincada","Pokemon","Basic","50","Grass","Common","Colorless","1","","","Leech Life","Grass","1","10","After your attack, remove from Nincada the number of damage counters equal to the damage you did to the Defending Pokemon. If Nincada has fewer damage counters than that, remove all of them.","","","","","","Fire","x2"
"ex3-69","Numel","Pokemon","Basic","40","Fire","Common","Colorless","1","","","Firebreathing","Fire","1","10+","Flip a coin. If heads, this attack does 10 damage plus 10 more damage.","Tackle","Colorless, Colorless","2","20","","Water","x2"
"ex3-70","Numel","Pokemon","Basic","50","Fire","Common","Colorless, Colorless","2","","","Rollout","Colorless","1","10","","Kindle","Fire","1","10","Discard a Fire Energy card attached to Numel and then discard an Energy card attached to the Defending Pokemon.","Water","x2"
"ex3-71","Pineco","Pokemon","Basic","40","Grass","Common","Colorless","1","Exoskeleton","Any damage done to Pineco by attacks is reduced by 10 (after applying Weakness and Resistance).","Tackle","Grass, Colorless","2","20","","","","","","","Fire","x2"
"ex3-72","Slugma","Pokemon","Basic","50","Fire","Common","Colorless, Colorless","2","","","Ram","Colorless","1","10","","Luring Flame","Fire, Colorless","2","","Switch 1 of your opponent's Benched Pokemon with 1 of the Defending Pokemon. Your opponent chooses the Defending Pokemon to switch. The new Defending Pokemon is now Burned.","Water","x2"
"ex3-73","Spoink","Pokemon","Basic","50","Psychic","Common","Colorless","1","","","Bounce","Colorless","1","10","After your attack, you may switch Spoink with 1 of your Benched Pokemon.","","","","","","Psychic","x2"
"ex3-74","Spoink","Pokemon","Basic","50","Psychic","Common","Colorless","1","","","Hop","Colorless","1","10","","Psybeam","Psychic, Colorless","2","10","Flip a coin. If heads, the Defending Pokemon is now Confused.","Psychic","x2"
