"id","name","supertype","subtypes","hp","types","rarity","retreatCost","convertedRetreatCost","AbilityName","AbilityText","Attack1Name","Attack1Cost","Attack1ConvertedCost","Attack1Damage","Attack1Text","Attack2Name","Attack2Cost","Attack2ConvertedCost","Attack2Damage","Attack2Text","Weakness1Type","Weakness1Value"
"ex3-75","Swablu","Pokemon","Basic","40","Colorless","Common","Colorless","1","","","Lullaby","Water","1","10","The Defending Pokemon is now Asleep.","Stifling Fluff","Lightning","1","10","Flip a coin. If heads, the Defending Pokemon is now Paralyzed.","Lightning","x2"
"ex3-76","Taillow","Pokemon","Basic","50","Colorless","Common","Colorless","1","","","Whirlwind","Colorless","1","","Your opponent switches the Defending Pokemon with 1 of his or her Benched Pokemon.","","","","","","Lightning","x2"
"ex3-77","Torchic","Pokemon","Basic","50","Fire","Common","Colorless","1","","","Firebreathing","Fire, Colorless","2","20+","Flip a coin. If heads, this attack does 20 damage plus 20 more damage.","","","","","","Water","x2"
"ex3-78","Trapinch","Pokemon","Basic","50","Fighting","Common","Colorless","1","","","Dig","Colorless","1","10","","","","","","","Grass","x2"
"ex3-79","Trapinch","Pokemon","Basic","50","Fighting","Common","Colorless","1","","","Bind","Colorless","1","","Flip a coin. If heads, the Defending Pokemon is now Paralyzed.","Rock Smash","Colorless, Colorless","2","10+","Flip a coin. If heads, this attack does 10 damage plus 20 more damage.","Grass","x2"
"ex3-80","Treecko","Pokemon","Basic","50","Grass","Common","Colorless","1","","","Quick Attack","Colorless, Colorless","2","10+","Flip a coin. If heads, this attack does 10 damage plus 20 more damage.","","","","","","Fire","x2"
"ex3-81","Wurmple","Pokemon","Basic","50","Grass","Common","Colorless","1","","","Call for Friends","Colorless","1","","Search your deck for Grass Basic Pokemon and put as many of them as you like onto your Bench. Shuffle your deck afterward.","String Shot","Colorless","1","10","Flip a coin. If heads, the Defending Pokemon is now Paralyzed.","Fire","x2"
