"id","name","supertype","subtypes","hp","types","rarity","retreatCost","convertedRetreatCost","AbilityName","AbilityText","Attack1Name","Attack1Cost","Attack1ConvertedCost","Attack1Damage","Attack1Text","Attack2Name","Attack2Cost","Attack2ConvertedCost","Attack2Damage","Attack2Text","Weakness1Type","Weakness1Value"
"swsh5-107","Aegislash","Pokemon","Stage 2","150","Metal","Rare Holo","Colorless, Colorless, Colorless","3","Stance Change","Once during your turn, you may switch this Pokemon with an Aegislash in your hand. Any attached cards, damage counters, Special Conditions, turns in play, and any other effects remain on the new Pokemon.","Full Metal Blade","Metal, Metal, Colorless","3","210","Discard 2 Metal Energy from this Pokemon.","","","","","","Fire","x2"
"swsh5-108","Aegislash","Pokemon","Stage 2","150","Metal","Rare","Colorless, Colorless, Colorless","3","Stance Change","Once during your turn, you may switch this Pokemon with an Aegislash in your hand. Any attached cards, damage counters, Special Conditions, turns in play, and any other effects remain on the new Pokemon.","Gigaton Bash","Metal, Colorless","2","70","During your opponent's next turn, prevent all damage done to this Pokemon by attacks from Pokemon VMAX.","","","","","","Fire","x2"
"swsh5-111","Spearow","Pokemon","Basic","50","Colorless","Common","Colorless","1","","","Peck","Colorless","1","20","","","","","","","Lightning","x2"
"swsh5-112","Fearow","Pokemon","Stage 1","90","Colorless","Uncommon","","0","","","Drill Peck","Colorless","1","70","","","","","","","Lightning","x2"
"swsh5-113","Lickitung","Pokemon","Basic","110","Colorless","Common","Colorless, Colorless, Colorless, Colorless","4","","","Tongue Slap","Colorless, Colorless, Colorless","3","50","","Hammer In","Colorless, Colorless, Colorless, Colorless","4","80","","Fighting","x2"
"swsh5-114","Lickilicky","Pokemon","Stage 1","140","Colorless","Rare","Colorless, Colorless, Colorless, Colorless","4","","","Selickt","Colorless, Colorless, Colorless","3","","Your opponent chooses to discard the top 3 cards of their deck or to discard 3 cards from their hand.","Pitch","Colorless, Colorless, Colorless, Colorless","4","100","Your opponent switches their Active Pokemon with 1 of their Benched Pokemon.","Fighting","x2"
"swsh5-115","Glameow","Pokemon","Basic","60","Colorless","Common","Colorless","1","","","Cat Kick","Colorless","1","10","","Claw Slash","Colorless, Colorless, Colorless","3","40","","Fighting","x2"
"swsh5-116","Purugly","Pokemon","Stage 1","120","Colorless","Uncommon","Colorless, Colorless, Colorless","3","","","Caturday","Colorless","1","","Draw 3 cards. If you do, this Pokemon is now Asleep.","Claw Slash","Colorless, Colorless, Colorless, Colorless","4","120","","Fighting","x2"
"swsh5-118","Bouffalant","Pokemon","Basic","120","Colorless","Uncommon","Colorless, Colorless","2","Sap Sipper","This Pokemon's attacks do 60 more damage to your opponent's Grass Pokemon (before applying Weakness and Resistance).","Head Charge","Colorless, Colorless, Colorless","3","120","This Pokemon also does 30 damage to itself.","","","","","","Fighting","x2"
"swsh5-119","Drampa","Pokemon","Basic","120","Colorless","Rare","Colorless, Colorless","2","","","Call for Family","Colorless","1","","Search your deck for up to 2 Basic Pokemon and put them onto your Bench. Then, shuffle your deck.","Spiral Rush","Colorless, Colorless","2","30+","Flip a coin until you get tails. This attack does 30 more damage for each heads.","Fighting","x2"
"swsh5-120","Indeedee","Pokemon","Basic","90","Colorless","Uncommon","Colorless, Colorless","2","","","Collect","Colorless","1","","Draw 2 cards.","Hand Kinesis","Colorless, Colorless","2","10x","This attack does 10 damage for each card in your hand.","Fighting","x2"
