"id","name","supertype","hp","types","evolvesTo","evolvesFrom","number","artist","rarity","flavorText","nationalPokedexNumbers","regulationMark","imageSmall","imageLarge","legalitiesUnlimited","legalitiesStandard","legalitiesExpanded","retreatCost","convertedRetreatCost","Ability1Name","Ability1Text","Ability1Type","Ability2Name","Ability2Text","Ability2Type","Attack1Name","Attack1Cost","Attack1ConvertedCost","Attack1Damage","Attack1Text","Attack2Name","Attack2Cost","Attack2ConvertedCost","Attack2Damage","Attack2Text","Weakness1Type","Weakness1Value"
"ex7-98","Rocket's Hitmonchan ex","Pokémon","100","Darkness","",,"98","Mitsuhiro Arita","Rare Holo EX",,"107",,"https://images.pokemontcg.io/ex7/98.png","https://images.pokemontcg.io/ex7/98_hires.png","Legal",,,"Colorless","1","Strikes Back","If Rocket's Hitmonchan ex is your Active Pokémon and is damaged by an opponent's attack (even if Rocket's Hitmonchan ex is Knocked Out), put 2 damage counters on the Attacking Pokémon.","Poké-Body","","","","Mach Punch","Fighting","1","10","Does 10 damage to 1 of your opponent's Benched Pokémon. (Don't apply Weakness and Resistance for Benched Pokémon.)","Magnum Punch","Fighting, Fighting, Colorless","3","60","","Psychic","×2"
"ex7-99","Rocket's Mewtwo ex","Pokémon","100","Darkness","",,"99","Mitsuhiro Arita","Rare Holo EX",,"150",,"https://images.pokemontcg.io/ex7/99.png","https://images.pokemontcg.io/ex7/99_hires.png","Legal",,,"Colorless, Colorless","2","","","","","","","Darkness Switch","Psychic","1","","Discard an Energy card attached to Rocket's Mewtwo ex, and then switch all damage counters on Rocket's Mewtwo ex with those on the Defending Pokémon. (If an effect of this attack is prevented, this attack does nothing.)","Hypnoblast","Psychic, Colorless, Colorless","3","40","Flip a coin. If heads, the Defending Pokémon is now Asleep.","Psychic","×2"
"ex7-100","Rocket's Moltres ex","Pokémon","100","Darkness","",,"100","Ryo Ueda","Rare Holo EX",,"146",,"https://images.pokemontcg.io/ex7/100.png","https://images.pokemontcg.io/ex7/100_hires.png","Legal",,,"Colorless, Colorless","2","Dark Lift","If Rocket's Moltres ex has any Darkness Energy attached to it, the Retreat Cost for Rocket's Moltres ex is 0.","Poké-Body","","","","Fire Dance","Fire, Colorless","2","30","Search your discard pile for a Fire Energy card and attach it to 1 of your Pokémon.","Combustion","Fire, Fire, Colorless","3","50","","Water","×2"
"ex7-101","Rocket's Scizor ex","Pokémon","120","Darkness","","Rocket's Scyther ex","101","Hikaru Koike","Rare Holo EX",,"212",,"https://images.pokemontcg.io/ex7/101.png","https://images.pokemontcg.io/ex7/101_hires.png","Legal",,,"Colorless","1","Dual Armor","As long as Rocket's Scizor ex has any Metal Energy attached to it, Rocket's Scizor ex is both Darkness and Metal type.","Poké-Body","","","","Rotating Claws","Colorless, Colorless, Colorless","3","50","You may discard an Energy card attached to Rocket's Scizor ex. If you do, search your discard pile for an Energy card (excluding the one you discarded) and attach it to Rocket's Scizor ex.","","","","","","Fire","×2"
"ex7-102","Rocket's Scyther ex","Pokémon","80","Darkness","Scizor",,"102","Hikaru Koike","Rare Holo EX",,"123",,"https://images.pokemontcg.io/ex7/102.png","https://images.pokemontcg.io/ex7/102_hires.png","Legal",,,"Colorless","1","Dual Armor","As long as Rocket's Scyther ex has any Grass Energy attached to it, Rocket's Scyther ex is both Grass and Darkness type.","Poké-Body","","","","Bounce","Colorless","1","10","After your attack, you may switch Rocket's Scyther ex with 1 of your Benched Pokémon.","Slashing Strike","Colorless, Colorless, Colorless","3","40","Rocket's Scyther ex can't use Slashing Strike during your next turn.","Fire","×2"
"ex7-103","Rocket's Sneasel ex","Pokémon","90","Darkness","Weavile",,"103","Ryo Ueda","Rare Holo EX",,"215",,"https://images.pokemontcg.io/ex7/103.png","https://images.pokemontcg.io/ex7/103_hires.png","Legal",,,"Colorless","1","","","","","","","Drag Off","Darkness","1","10","Before doing damage, you may switch 1 of your opponent's Benched Pokémon with the Defending Pokémon. If you do, this attack does 10 damage to the new Defending Pokémon. Your opponent chooses the Defending Pokémon to switch.","Dark Ring","Darkness, Darkness, Colorless","3","30+","Does 30 damage plus 10 more damage for each of your Darkness Pokémon in play.","Fighting","×2"
"ex7-104","Rocket's Snorlax ex","Pokémon","100","Darkness","",,"104","Mitsuhiro Arita","Rare Holo EX",,"143",,"https://images.pokemontcg.io/ex7/104.png","https://images.pokemontcg.io/ex7/104_hires.png","Legal",,,"Colorless, Colorless, Colorless","3","Dark Healer","As long as Rocket's Snorlax ex has any Darkness Energy attached to it, remove 1 damage counter from Rocket's Snorlax ex between turns.","Poké-Body","","","","Poison Claws","Colorless, Colorless","2","20","Flip a coin. If heads, the Defending Pokémon is now Poisoned.","Collapse","Colorless, Colorless, Colorless, Colorless","4","60","Rocket's Snorlax ex is now Asleep.","Fighting","×2"
"ex7-105","Rocket's Suicune ex","Pokémon","100","Darkness","",,"105","Ryo Ueda","Rare Holo EX",,"245",,"https://images.pokemontcg.io/ex7/105.png","https://images.pokemontcg.io/ex7/105_hires.png","Legal",,,"Colorless","1","Dark and Clear","As long as Rocket's Suicune ex has any Darkness Energy attached to it, Rocket's Suicune ex can't be affected by any Special Conditions.","Poké-Body","","","","Icy Wind","Colorless","1","10","The Defending Pokémon is now Asleep.","Hyper Splash","Water, Water, Colorless","3","50+","If the Defending Pokémon is a Stage 2 Evolved Pokémon, this attack does 50 damage plus 40 more damage.","Lightning","×2"
"ex7-106","Rocket's Zapdos ex","Pokémon","100","Darkness","",,"106","Ryo Ueda","Rare Holo EX",,"145",,"https://images.pokemontcg.io/ex7/106.png","https://images.pokemontcg.io/ex7/106_hires.png","Legal",,,"Colorless","1","Darkness Guard","As long as Rocket's Zapdos ex has any Darkness Energy attached to it, damage done to Rocket's Zapdos ex by an opponent's attack is reduced by 10 (after applying Weakness and Resistance).","Poké-Body","","","","Plasma","Colorless","1","10","Search your discard pile for a Lightning Energy card and attach it to Rocket's Zapdos ex.","Raging Thunder","Lightning, Lightning, Colorless","3","60","This attack does 30 damage to 1 of your Pokémon.","Lightning","×2"
"ex7-107","Mudkip ★","Pokémon","70","Water","",,"107","Masakazu Fukuda","Rare Holo Star",,"258",,"https://images.pokemontcg.io/ex7/107.png","https://images.pokemontcg.io/ex7/107_hires.png","Legal",,,"Colorless","1","","","","","","","Whirlpool","Water","1","","Flip a coin. If heads, discard an Energy card attached to the Defending Pokémon.","Spring Back","Water, Water","2","20+","If your opponent has only 1 Prize card left, this attack does 20 damage plus 50 more damage and the Defending Pokémon is now Asleep.","Lightning","×2"
"ex7-108","Torchic ★","Pokémon","70","Fire","",,"108","Masakazu Fukuda","Rare Holo Star",,"255",,"https://images.pokemontcg.io/ex7/108.png","https://images.pokemontcg.io/ex7/108_hires.png","Legal",,,"Colorless","1","","","","","","","Fireworks","Fire","1","20","Flip a coin. If tails, discard a Fire Energy card attached to Torchic Star.","Spring Back","Fire, Fire","2","20+","If your opponent has only 1 Prize card left, this attack does 20 damage plus 50 more damage and the Defending Pokémon is now Confused.","Water","×2"
"ex7-109","Treecko ★","Pokémon","70","Grass","",,"109","Masakazu Fukuda","Rare Holo Star",,"252",,"https://images.pokemontcg.io/ex7/109.png","https://images.pokemontcg.io/ex7/109_hires.png","Legal",,,"Colorless","1","","","","","","","Tackle","Colorless","1","10","","Spring Back","Grass, Grass","2","20+","If your opponent has only 1 Prize card left, this attack does 20 damage plus 50 more damage and the Defending Pokémon is now Poisoned.","Fire","×2"
"ex7-110","Charmeleon","Pokémon","70","Fire","Charizard","Charmander","110","Ken Sugimori","Rare Secret",,"5",,"https://images.pokemontcg.io/ex7/110.png","https://images.pokemontcg.io/ex7/110_hires.png","Legal",,,"Colorless","1","","","","","","","Smokescreen","Fire","1","10","If the Defending Pokémon tries to attack during your opponent's next turn, your opponent flips a coin. If tails, that attack does nothing.","Fireworks","Fire, Colorless","2","40","Flip a coin. If tails, discard a Fire Energy card attached to Charmeleon.","Water","×2"
"ex7-111","Here Comes Team Rocket!","Trainer",,"","",,"111","Ken Sugimori","Rare Secret",,"",,"https://images.pokemontcg.io/ex7/111.png","https://images.pokemontcg.io/ex7/111_hires.png","Legal",,"Legal","",,"","","","","","","","","","","","","","","","",,
