"id","name","supertype","hp","types","evolvesTo","evolvesFrom","number","artist","rarity","flavorText","nationalPokedexNumbers","regulationMark","imageSmall","imageLarge","legalitiesUnlimited","legalitiesStandard","legalitiesExpanded","retreatCost","convertedRetreatCost","Ability1Name","Ability1Text","Ability1Type","Ability2Name","Ability2Text","Ability2Type","Attack1Name","Attack1Cost","Attack1ConvertedCost","Attack1Damage","Attack1Text","Attack2Name","Attack2Cost","Attack2ConvertedCost","Attack2Damage","Attack2Text","Weakness1Type","Weakness1Value"
"pop2-1","Entei","Pokémon","70","Fire","",,"1","Kouki Saitou","Rare",,"244",,"https://images.pokemontcg.io/pop2/1.png","https://images.pokemontcg.io/pop2/1_hires.png","Legal",,,"Colorless","1","","","","","","","Stomp","Colorless, Colorless","2","10+","Flip a coin. If heads, this attack does 10 damage plus 20 more damage.","Fire Spin","Fire, Fire, Colorless","3","50","Discard 2 Basic Energy cards attached to Entei or this attack does nothing.","Water","×2"
"pop2-2","Pidgeot","Pokémon","80","Colorless","","Pidgeotto","2","Ken Sugimori","Rare",,"18",,"https://images.pokemontcg.io/pop2/2.png","https://images.pokemontcg.io/pop2/2_hires.png","Legal",,,"",,"Beating Wings","Once during your turn (before your attack), if Pidgeot is your Active Pokémon, you may shuffle 1 of your Benched Pokémon and all cards attached to it into your deck. This power can't be used if Pidgeot is affected by a Special Condition.","Poké-Power","","","","Sharp Beak","Colorless, Colorless, Colorless","3","20+","Flip a coin. If heads, this attack does 20 damage plus 30 more damage.","","","","","","Lightning","×2"
"pop2-3","Raikou","Pokémon","70","Lightning","",,"3","Kouki Saitou","Rare",,"243",,"https://images.pokemontcg.io/pop2/3.png","https://images.pokemontcg.io/pop2/3_hires.png","Legal",,,"Colorless","1","","","","","","","Roar","Colorless","1","","Your opponent switches the Defending Pokémon with 1 of his or her Benched Pokémon, if any.","Thunder","Lightning, Lightning, Colorless","3","50","Flip a coin. If tails, Raikou does 20 damage to itself.","Fighting","×2"
"pop2-4","Suicune","Pokémon","70","Water","",,"4","Kouki Saitou","Rare",,"245",,"https://images.pokemontcg.io/pop2/4.png","https://images.pokemontcg.io/pop2/4_hires.png","Legal",,,"Colorless","1","Mirror Coat","If Suicune is Burned or Poisoned by an opponent's attack (even if Suicune is Knocked Out), the Attacking Pokémon is now affected by the same Special Conditions (1 if there is only 1).","Poké-Body","","","","Bubblebeam","Water, Colorless","2","20","Flip a coin. If heads, the Defending Pokémon is now Paralyzed.","","","","","","Lightning","×2"
"pop2-5","Tauros","Pokémon","70","Colorless","",,"5","Kouki Saitou","Rare",,"128",,"https://images.pokemontcg.io/pop2/5.png","https://images.pokemontcg.io/pop2/5_hires.png","Legal",,,"Colorless","1","","","","","","","Rage","Colorless, Colorless","2","10+","Does 10 damage plus 10 more damage for each damage counter on Tauros.","Take Down","Colorless, Colorless, Colorless","3","40","Tauros does 10 damage to itself.","Fighting","×2"
"pop2-6","Venusaur","Pokémon","120","Grass","","Ivysaur","6","Mitsuhiro Arita","Rare",,"3",,"https://images.pokemontcg.io/pop2/6.png","https://images.pokemontcg.io/pop2/6_hires.png","Legal",,,"Colorless, Colorless, Colorless","3","","","","","","","Wide Solarbeam","Grass, Grass, Colorless","3","20","Does 20 damage to 2 of your opponent's Benched Pokémon. (Don't apply Weakness and Resistance for Benched Pokémon.)","Hard Plant","Grass, Grass, Grass, Colorless","4","80","Venusaur can't use Hard Plant during your next turn.","Fire","×2"
"pop2-7","Ivysaur","Pokémon","80","Grass","Venusaur","Bulbasaur","7","Ken Sugimori","Uncommon",,"2",,"https://images.pokemontcg.io/pop2/7.png","https://images.pokemontcg.io/pop2/7_hires.png","Legal",,,"Colorless","1","","","","","","","Poison Seed","Colorless","1","","The Defending Pokémon is now Poisoned.","Razor Leaf","Grass, Grass, Colorless","3","50","","Psychic","×2"
"pop2-8","Mr. Briney's Compassion","Trainer",,"","",,"8","Ken Sugimori","Uncommon",,"",,"https://images.pokemontcg.io/pop2/8.png","https://images.pokemontcg.io/pop2/8_hires.png","Legal",,,"",,"","","","","","","","","","","","","","","","",,
"pop2-9","Multi Technical Machine 01","Trainer",,"","",,"9","""Big Mama"" Tagawa","Uncommon",,"",,"https://images.pokemontcg.io/pop2/9.png","https://images.pokemontcg.io/pop2/9_hires.png","Legal",,,"",,"","","","","","","Paralyzing Gaze","Colorless","1","","The Defending Pokémon is now Paralyzed.","","","","","",,
"pop2-10","Pokémon Park","Trainer",,"","",,"10","Kazuo Yazawa","Uncommon",,"",,"https://images.pokemontcg.io/pop2/10.png","https://images.pokemontcg.io/pop2/10_hires.png","Legal",,,"",,"","","","","","","","","","","","","","","","",,
"pop2-11","TV Reporter","Trainer",,"","",,"11","Ken Sugimori","Uncommon",,"",,"https://images.pokemontcg.io/pop2/11.png","https://images.pokemontcg.io/pop2/11_hires.png","Legal",,"Legal","",,"","","","","","","","","","","","","","","","",,
"pop2-12","Bulbasaur","Pokémon","40","Grass","Ivysaur",,"12","Midori Harada","Common",,"1",,"https://images.pokemontcg.io/pop2/12.png","https://images.pokemontcg.io/pop2/12_hires.png","Legal",,,"Colorless","1","","","","","","","Bite","Colorless","1","10","","Razor Leaf","Grass, Colorless","2","20","","Psychic","×2"
"pop2-13","Cacnea","Pokémon","40","Grass","Cacturne",,"13","Ken Sugimori","Common",,"331",,"https://images.pokemontcg.io/pop2/13.png","https://images.pokemontcg.io/pop2/13_hires.png","Legal",,,"Colorless","1","","","","","","","Sand Attack","Colorless","1","10","If the Defending Pokémon tries to attack during your opponent's next turn, your opponent flips a coin. If tails, that attack does nothing.","","","","","","Fire","×2"
"pop2-14","Luvdisc","Pokémon","60","Water","",,"14","Atsuko Nishida","Common",,"370",,"https://images.pokemontcg.io/pop2/14.png","https://images.pokemontcg.io/pop2/14_hires.png","Legal",,,"Colorless","1","","","","","","","Paralyzing Kiss","Colorless","1","","If there are 2 Defending Pokémon in play, choose 1 of the Defending Pokémon. That Pokémon is now Paralyzed. (If there is only 1 Defending Pokémon, this attack does nothing.)","Fast Stream","Water, Colorless","2","20","Move 1 Energy card attached to the Defending Pokémon to the other Defending Pokémon. (Ignore this effect if your opponent has only 1 Defending Pokémon.)","Lightning","×2"
"pop2-15","Phanpy","Pokémon","50","Fighting","Donphan",,"15","Tomokazu Komiya","Common",,"231",,"https://images.pokemontcg.io/pop2/15.png","https://images.pokemontcg.io/pop2/15_hires.png","Legal",,,"Colorless","1","","","","","","","Double Spin","Fighting","1","10×","Flip 2 coins. This attack does 10 damage times the number of heads.","Body Slam","Colorless, Colorless","2","10","Flip a coin. If heads, the Defending Pokémon is now Paralyzed.","Grass","×2"
"pop2-16","Pikachu","Pokémon","40","Lightning","Raichu",,"16","Yuka Morii","Common",,"25",,"https://images.pokemontcg.io/pop2/16.png","https://images.pokemontcg.io/pop2/16_hires.png","Legal",,,"Colorless","1","","","","","","","Gnaw","Colorless","1","10","","Thunder Jolt","Lightning, Colorless","2","30","Flip a coin. If tails, Pikachu does 10 damage to itself.","Fighting","×2"
"pop2-17","Celebi ex","Pokémon","80","Psychic","",,"17","Ryo Ueda","Rare",,"251",,"https://images.pokemontcg.io/pop2/17.png","https://images.pokemontcg.io/pop2/17_hires.png","Legal",,,"Colorless","1","Time Reversal","Once during your turn, when you put Celebi ex from your hand onto your Bench, you may search your discard pile for a card, show it to your opponent, and put it on top of your deck.","Poké-Power","","","","Psychic Shield","Psychic, Colorless","2","30","Prevent all effects of attacks, including damage, done to Celebi ex by your opponent's Pokémon-ex during your opponent's next turn.","","","","","","Psychic","×2"
