"id","name","supertype","hp","types","evolvesTo","evolvesFrom","number","artist","rarity","flavorText","nationalPokedexNumbers","regulationMark","imageSmall","imageLarge","legalitiesUnlimited","legalitiesStandard","legalitiesExpanded","retreatCost","convertedRetreatCost","Ability1Name","Ability1Text","Ability1Type","Ability2Name","Ability2Text","Ability2Type","Attack1Name","Attack1Cost","Attack1ConvertedCost","Attack1Damage","Attack1Text","Attack2Name","Attack2Cost","Attack2ConvertedCost","Attack2Damage","Attack2Text","Weakness1Type","Weakness1Value"
"si1-1","Mew","Pokémon","30","Psychic","",,"1","Keiko Fukuyama",,"This Pokémon's body is covered by fine hairs that can be seen only under a microscope.","151",,"https://images.pokemontcg.io/si1/1.png","https://images.pokemontcg.io/si1/1_hires.png","Legal",,,"",,"","","","","","","Rainbow Wave","Psychic","1","","Choose a type of Energy other than Colorless attached to Mew. This attack does 20 damage to each of your opponent's Pokémon of that type (including Benched Pokémon). Don't apply Weakness and Resistance.","","","","","","Psychic","×2"
"si1-2","Pidgeot","Pokémon","70","Colorless","","Pidgeotto","2","Keiko Fukuyama",,"This Pokémon searches for food while flying at Mach 2. Its large claws make fearsome weapons.","18",,"https://images.pokemontcg.io/si1/2.png","https://images.pokemontcg.io/si1/2_hires.png","Legal",,,"",,"","","","","","","Supersonic Flight","Colorless, Colorless","2","40","Flip a coin. If tails, this attack does nothing.","Slicing Wind","Colorless, Colorless, Colorless, Colorless","4","50","","Lightning","×2"
"si1-3","Onix","Pokémon","90","Fighting","Steelix",,"3","Keiko Fukuyama",,"This Pokémon burrows through the earth at high speed, looking for food. The tunnels it digs are used by Diglett as nests.","95",,"https://images.pokemontcg.io/si1/3.png","https://images.pokemontcg.io/si1/3_hires.png","Legal",,,"Colorless, Colorless, Colorless","3","","","","","","","Slam","Colorless, Colorless","2","20×","Flip 2 coins. This attack does 20 damage times the number of heads.","Body Slam","Fighting, Fighting, Fighting, Fighting","4","40","Flip a coin. If heads, the Defending Pokémon is now Paralyzed.","Grass","×2"
"si1-4","Togepi","Pokémon","40","Colorless","Togetic",,"4","Keiko Fukuyama",,"This Pokémon is still immature. When threatened, it releases poison from its head and tries to drive its enemies away.","175",,"https://images.pokemontcg.io/si1/4.png","https://images.pokemontcg.io/si1/4_hires.png","Legal",,,"Colorless","1","","","","","","","Bawl","Colorless","1","10","Flip a coin. If heads, the Defending Pokémon is now Confused.","","","","","",,
"si1-5","Ivysaur","Pokémon","60","Grass","Venusaur","Bulbasaur","5","Keiko Fukuyama",,"A sure sign spring is on its way is when the seed on this Pokémon's back flowers.","2",,"https://images.pokemontcg.io/si1/5.png","https://images.pokemontcg.io/si1/5_hires.png","Legal",,,"Colorless","1","","","","","","","Strange Scent","Grass","1","","Each player flips a coin. Each player who gets heads chooses a total of 3 damage counters from among his or her Pokémon and removes them. (If the player's Pokémon have fewer total damage counters than that, he or she removes all of them.)","Razor Leaf","Grass, Grass","2","30","","Fire","×2"
"si1-6","Raticate","Pokémon","60","Colorless","","Rattata","6","Keiko Fukuyama",,"This Pokémon sometimes hunts for food in rivers, swimming using the small webs between the toes on its rear legs.","20",,"https://images.pokemontcg.io/si1/6.png","https://images.pokemontcg.io/si1/6_hires.png","Legal",,,"",,"","","","","","","Sharp Teeth","Colorless, Colorless","2","10+","Flip a coin. If heads, this attack does 10 damage plus 30 more damage; if tails, this attack does 10 damage.","","","","","","Fighting","×2"
"si1-7","Ledyba","Pokémon","40","Grass","Ledian",,"7","Keiko Fukuyama",,"When it senses enemies approaching, this Pokémon releases an orange fluid from the joints in its legs and flees.","165",,"https://images.pokemontcg.io/si1/7.png","https://images.pokemontcg.io/si1/7_hires.png","Legal",,,"Colorless","1","","","","","","","Gnaw","Colorless","1","10","","Agility","Grass, Grass","2","20","Flip a coin. If heads, during your opponent's next turn, prevent all effects of attacks, including damage, done to Ledyba.","Fire","×2"
"si1-8","Jigglypuff","Pokémon","50","Colorless","Wigglytuff",,"8","Keiko Fukuyama",,"After lulling its enemies with its large eyes, this Pokémon sings them to sleep with a relaxing melody.","39",,"https://images.pokemontcg.io/si1/8.png","https://images.pokemontcg.io/si1/8_hires.png","Legal",,,"Colorless","1","","","","","","","Tempting Eyes","Colorless","1","","Choose 1 of your opponent's Benched Pokémon and switch it with the Defending Pokémon.","Sing","Colorless","1","","Flip a coin. If heads, the Defending Pokémon is now Asleep.","Fighting","×2"
"si1-9","Butterfree","Pokémon","80","Grass","","Metapod","9","Keiko Fukuyama",,"The poison scales on its wings are waterproof, allowing this Pokémon to be active even on rainy days.","12",,"https://images.pokemontcg.io/si1/9.png","https://images.pokemontcg.io/si1/9_hires.png","Legal",,,"Colorless","1","","","","","","","Fly","Colorless, Colorless, Colorless","3","30","Flip a coin. If heads, during your opponent's next turn, prevent all effects of attacks, including damage, done to Butterfree. If tails, this attack does nothing (not even damage).","Rainbow Powder","Grass, Grass, Colorless","3","20","Flip a coin. If heads, the Defending Pokémon is now Paralyzed. If tails, the Defending Pokémon is now Poisoned.","Fire","×2"
"si1-10","Tentacruel","Pokémon","60","Water","","Tentacool","10","Naoyo Kimura",,"This Pokémon attacks its prey with its eighty toxin-producing tentacles.","73",,"https://images.pokemontcg.io/si1/10.png","https://images.pokemontcg.io/si1/10_hires.png","Legal",,,"Colorless","1","","","","","","","Tentacle Grip","Water","1","","Flip a number of coins equal to the number of Water Energy attached to Tentacruel. For each heads, draw 2 cards.","Poison Sting","Water, Water","2","20","Flip a coin. If heads, the Defending Pokémon is now Paralyzed.","Lightning","×2"
"si1-11","Marill","Pokémon","40","Water","Azumarill",,"11","Naoyo Kimura",,"This Pokémon's fur repels water like a duck's feathers, allowing it to stay dry and fluffy even in water.","183",,"https://images.pokemontcg.io/si1/11.png","https://images.pokemontcg.io/si1/11_hires.png","Legal",,,"Colorless","1","","","","","","","Squirt","Water","1","","Choose 1 of your opponent's Pokémon. This attack does 10 damage to that Pokémon. Don't apply Weakness and Resistance.","Rolling Tackle","Colorless, Colorless","2","20","","Lightning","×2"
"si1-12","Lapras","Pokémon","70","Water","",,"12","Naoyo Kimura",,"This gentle Pokémon can understand human language and allows people to ride on its back.","131",,"https://images.pokemontcg.io/si1/12.png","https://images.pokemontcg.io/si1/12_hires.png","Legal",,,"Colorless","1","","","","","","","Gentle Song","Colorless","1","","If Lapras has any damage counters on it, remove 2 of them from it (1 if it only has 1). If the Defending Pokémon has any damage counters on it, remove 2 of them from it (1 if it only has 1). The Defending Pokémon is now Asleep.","Ice Beam","Water, Water","2","20","Flip a coin. If heads, the Defending Pokémon is now Paralyzed.","Lightning","×2"
"si1-13","Exeggutor","Pokémon","70","Grass","","Exeggcute","13","Naoyo Kimura",,"This Pokémon has a unique cry, as all three of its heads are always talking independently of one another.","103",,"https://images.pokemontcg.io/si1/13.png","https://images.pokemontcg.io/si1/13_hires.png","Legal",,,"Colorless, Colorless","2","","","","","","","Sharpshooter","Grass","1","","Choose 1 of your opponent's Pokémon. Flip a number of coins equal to the number of Grass Energy attached to Exeggutor. This attack does 10 damage times the number of heads to that Pokémon. Don't apply Weakness and Resistance.","","","","","","Fire","×2"
"si1-14","Slowking","Pokémon","70","Psychic","","Slowpoke","14","Naoyo Kimura",,"Its nonchalant reaction to everything somehow gives this Pokémon an imposing presence.","199",,"https://images.pokemontcg.io/si1/14.png","https://images.pokemontcg.io/si1/14_hires.png","Legal",,,"Colorless, Colorless","2","","","","","","","Revelation","Psychic","1","","Flip a coin. If heads, search your deck for a Trainer card, show it to your opponent, and put it into your hand. Shuffle your deck afterward.","Psychic","Psychic, Colorless","2","10+","Does 10 damage plus 10 more damage for each Energy card attached to the Defending Pokémon.","Psychic","×2"
"si1-15","Wartortle","Pokémon","60","Water","Blastoise","Squirtle","15","Naoyo Kimura",,"When attacked, this Pokémon withdraws into its shell, although it can't quite pull in all of its long tail.","8",,"https://images.pokemontcg.io/si1/15.png","https://images.pokemontcg.io/si1/15_hires.png","Legal",,,"Colorless","1","","","","","","","Water Gun","Water, Water","2","20+","Does 20 damage plus 10 more damage for each Water Energy attached to Wartortle but not used to pay for this attack's Energy cost. You can't add more than 20 damage in this way.","","","","","","Lightning","×2"
"si1-16","Lickitung","Pokémon","70","Colorless","Lickilicky",,"16","Naoyo Kimura",,"This Pokémon uses its six-foot tongue as if it were a hand. The origin of its anaesthetic properties is still a mystery.","108",,"https://images.pokemontcg.io/si1/16.png","https://images.pokemontcg.io/si1/16_hires.png","Legal",,,"Colorless, Colorless","2","","","","","","","Lick Wounds","Colorless","1","","Flip a coin. If heads, choose 1 Pokémon (yours or your opponent's) with damage counters on it and remove 2 damage counters from it (1 if it only has 1).","Tongue Stretch","Colorless, Colorless","2","","Flip a coin. If heads, choose 1 of your opponent's Pokémon. This attack does 20 damage to that Pokémon. Don't apply Weakness and Resistance.","Fighting","×2"
"si1-17","Vileplume","Pokémon","70","Grass","","Gloom","17","Naoyo Kimura",,"This Pokémon makes a loud jangling noise when it shakes its petals to spread poison powder.","45",,"https://images.pokemontcg.io/si1/17.png","https://images.pokemontcg.io/si1/17_hires.png","Legal",,,"Colorless, Colorless","2","","","","","","","Paradise Pollen","Grass","1","","Flip a coin. If heads, remove 2 damage counters from Vileplume (1 if it only has 1). Then, if you have any Benched Pokémon with damage counters on them, choose 1 of them and remove 2 damage counters from it (1 if it only has 1).","Horrid Pollen","Grass, Grass, Colorless","3","30","Flip a coin. If heads, the Defending Pokémon is now Paralyzed. If tails, the Defending Pokémon is now Confused.","Fire","×2"
"si1-18","Primeape","Pokémon","60","Fighting","","Mankey","18","Naoyo Kimura",,"This Pokémon only calms down when there are no other animals or people around—which means no one has ever seen it when it's not angry.","57",,"https://images.pokemontcg.io/si1/18.png","https://images.pokemontcg.io/si1/18_hires.png","Legal",,,"Colorless","1","","","","","","","Low Kick","Fighting","1","20","","Rampage","Fighting, Fighting","2","20+","Does 20 damage plus 10 more damage for each damage counter on Primeape. Flip a coin. If tails, Primeape is now Confused (after doing damage).","Psychic","×2"
