"id","name","supertype","hp","types","evolvesTo","evolvesFrom","number","artist","rarity","flavorText","nationalPokedexNumbers","regulationMark","imageSmall","imageLarge","legalitiesUnlimited","legalitiesStandard","legalitiesExpanded","retreatCost","convertedRetreatCost","Ability1Name","Ability1Text","Ability1Type","Ability2Name","Ability2Text","Ability2Type","Attack1Name","Attack1Cost","Attack1ConvertedCost","Attack1Damage","Attack1Text","Attack2Name","Attack2Cost","Attack2ConvertedCost","Attack2Damage","Attack2Text","Weakness1Type","Weakness1Value"
"sm9-1","Celebi & Venusaur-GX","Pokémon","270","Grass","",,"1","Mitsuhiro Arita","Rare Holo GX",,"3, 251",,"https://images.pokemontcg.io/sm9/1.png","https://images.pokemontcg.io/sm9/1_hires.png","Legal",,"Legal","Colorless, Colorless, Colorless, Colorless","4","","","","","","","Pollen Hazard","Grass, Colorless, Colorless","3","50","Your opponent's Active Pokémon is now Burned, Confused, and Poisoned.","Solar Beam","Grass, Grass, Colorless, Colorless","4","150","","Fire","×2"
"sm9-2","Weedle","Pokémon","40","Grass","Kakuna",,"2","Shibuzoh.","Common","Often found in forests and grasslands. It has a sharp, toxic barb of around two inches on top of its head.","13",,"https://images.pokemontcg.io/sm9/2.png","https://images.pokemontcg.io/sm9/2_hires.png","Legal",,"Legal","Colorless","1","","","","","","","Tangle Drag","Grass","1","","Switch 1 of your opponent's Benched Pokémon with their Active Pokémon.","Bug Bite","Grass","1","10","","Fire","×2"
"sm9-3","Weedle","Pokémon","50","Grass","Kakuna",,"3","SATOSHI NAKAI","Common","Often found in forests and grasslands. It has a sharp, toxic barb of around two inches on top of its head.","13",,"https://images.pokemontcg.io/sm9/3.png","https://images.pokemontcg.io/sm9/3_hires.png","Legal",,"Legal","Colorless","1","","","","","","","Reckless Charge","Colorless","1","20","This Pokémon does 10 damage to itself.","","","","","","Fire","×2"
"sm9-4","Kakuna","Pokémon","80","Grass","Beedrill","Weedle","4","Yuka Morii","Uncommon","Almost incapable of moving, this Pokémon can only harden its shell to protect itself when it is in danger.","14",,"https://images.pokemontcg.io/sm9/4.png","https://images.pokemontcg.io/sm9/4_hires.png","Legal",,"Legal","Colorless, Colorless, Colorless","3","Grass Cushion","If this Pokémon has any Grass Energy attached to it, it takes 30 less damage from attacks (after applying Weakness and Resistance).","Ability","","","","Bug Bite","Colorless, Colorless","2","20","","","","","","","Fire","×2"
"sm9-5","Beedrill","Pokémon","130","Grass","","Kakuna","5","You Iribi","Rare","It has three poisonous stingers on its forelegs and its tail. They are used to jab its enemy repeatedly.","15",,"https://images.pokemontcg.io/sm9/5.png","https://images.pokemontcg.io/sm9/5_hires.png","Legal",,"Legal","Colorless","1","","","","","","","Destiny Stinger","Grass","1","","You can use this attack only if this Pokémon has any damage counters on it. Both Active Pokémon are Knocked Out.","Reckless Charge","Colorless, Colorless","2","90","This Pokémon does 10 damage to itself.","Fire","×2"
"sm9-6","Paras","Pokémon","70","Grass","Parasect",,"6","Naoyo Kimura","Common","Whether it's due to a lack of moisture or a lack of nutrients, in Alola the mushrooms on Paras don't grow up quite right.","46",,"https://images.pokemontcg.io/sm9/6.png","https://images.pokemontcg.io/sm9/6_hires.png","Legal",,"Legal","Colorless","1","","","","","","","Scratch","Colorless","1","10","","Slash","Grass, Colorless","2","20","","Fire","×2"
"sm9-7","Parasect","Pokémon","100","Grass","","Paras","7","Satoshi Shirai","Rare","The bug is mostly dead, with the mushroom on its back having become the main body. If the mushroom comes off, the bug stops moving.","47",,"https://images.pokemontcg.io/sm9/7.png","https://images.pokemontcg.io/sm9/7_hires.png","Legal",,"Legal","Colorless, Colorless","2","Panic Spores","Put 2 damage counters on your opponent's Confused Pokémon between turns.","Ability","","","","Mysterious Powder","Grass, Colorless","2","30","Flip a coin. If heads, your opponent's Active Pokémon is now Confused.","","","","","","Fire","×2"
"sm9-8","Exeggcute","Pokémon","50","Grass","Exeggutor",,"8","Ken Sugimori","Common","Six of them form a single Pokémon. Should one of the six be lost, the next morning there will once more be six.","102",,"https://images.pokemontcg.io/sm9/8.png","https://images.pokemontcg.io/sm9/8_hires.png","Legal",,"Legal","Colorless","1","","","","","","","Bullet Seed","Grass","1","10×","Flip 4 coins. This attack does 10 damage for each heads.","","","","","","Fire","×2"
"sm9-9","Pinsir","Pokémon","120","Grass","",,"9","Eri Yamaki","Rare","It gets into territorial disputes with Vikavolt. For some reason, it apparently gets along well with Heracross in Alola.","127",,"https://images.pokemontcg.io/sm9/9.png","https://images.pokemontcg.io/sm9/9_hires.png","Legal",,"Legal","Colorless, Colorless, Colorless","3","","","","","","","Grip and Squeeze","Colorless, Colorless","2","30","The Defending Pokémon can't retreat during your opponent's next turn.","Guillotine Hug","Grass, Colorless, Colorless","3","","Flip 2 coins. If both of them are heads, your opponent's Active Pokémon is Knocked Out.","Fire","×2"
"sm9-10","Shaymin ◇","Pokémon","80","Grass","",,"10","kawayoo","Rare Prism Star","The blooming of Gracidea flowers confers the power of flight upon it. Feelings of gratitude are the message it delivers.","492",,"https://images.pokemontcg.io/sm9/10.png","https://images.pokemontcg.io/sm9/10_hires.png","Legal",,"Legal","",,"","","","","","","Flower Storm","Grass, Grass","2","30×","This attack does 30 damage times the amount of basic Energy attached to all of your Pokémon.","","","","","","Fire","×2"
"sm9-11","Charmander","Pokémon","50","Fire","Charmeleon",,"11","Naoyo Kimura","Common","The flame on its tail indicates Charmander's life force. If it is healthy, the flame burns brightly.","4",,"https://images.pokemontcg.io/sm9/11.png","https://images.pokemontcg.io/sm9/11_hires.png","Legal",,"Legal","Colorless","1","","","","","","","Scratch","Fire","1","10","","Reprisal","Colorless, Colorless","2","20×","This attack does 20 damage for each damage counter on this Pokémon.","Water","×2"
"sm9-12","Charmander","Pokémon","70","Fire","Charmeleon",,"12","Atsuko Nishida","Common","The flame on its tail indicates Charmander's life force. If it is healthy, the flame burns brightly.","4",,"https://images.pokemontcg.io/sm9/12.png","https://images.pokemontcg.io/sm9/12_hires.png","Legal",,"Legal","Colorless","1","","","","","","","Ember","Fire","1","30","Discard an Energy from this Pokémon.","","","","","","Water","×2"
"sm9-13","Charmeleon","Pokémon","90","Fire","Charizard","Charmander","13","Ayaka Yoshida","Uncommon","It lashes about with its tail to knock down its foe. It then tears up the fallen opponent with sharp claws.","5",,"https://images.pokemontcg.io/sm9/13.png","https://images.pokemontcg.io/sm9/13_hires.png","Legal",,"Legal","Colorless, Colorless","2","","","","","","","Fire Fang","Fire, Fire","2","30","Your opponent's Active Pokémon is now Burned.","","","","","","Water","×2"
"sm9-14","Charizard","Pokémon","150","Fire","","Charmeleon","14","Masakazu Fukuda","Rare","When expelling a blast of superhot fire, the red flame at the tip of its tail burns more intensely.","6",,"https://images.pokemontcg.io/sm9/14.png","https://images.pokemontcg.io/sm9/14_hires.png","Legal",,"Legal","Colorless, Colorless","2","Roaring Resolve","Once during your turn (before your attack), you may put 2 damage counters on this Pokémon. If you do, search your deck for up to 2 Fire Energy cards and attach them to this Pokémon. Then, shuffle your deck.","Ability","","","","Continuous Blaze Ball","Fire, Fire","2","30+","Discard all Fire Energy from this Pokémon. This attack does 50 more damage for each card you discarded in this way.","","","","","","Water","×2"
"sm9-15","Vulpix","Pokémon","60","Fire","Ninetales",,"15","Ken Sugimori","Common","Its beautiful tails have made it very popular. However, if it's not brushed diligently, it will be a mass of tangles before you know it.","37",,"https://images.pokemontcg.io/sm9/15.png","https://images.pokemontcg.io/sm9/15_hires.png","Legal",,"Legal","Colorless","1","","","","","","","Tail Whip","Colorless","1","","Flip a coin. If heads, the Defending Pokémon can't attack during your opponent's next turn.","","","","","","Water","×2"
"sm9-16","Ninetales","Pokémon","100","Fire","","Vulpix","16","You Iribi","Rare","It is vindictive and relentless by nature. Those who cross it even once will be cursed for a thousand years, along with their descendants.","38",,"https://images.pokemontcg.io/sm9/16.png","https://images.pokemontcg.io/sm9/16_hires.png","Legal",,"Legal","Colorless","1","Nine Temptations","Once during your turn (before your attack), you may discard 2 Fire Energy cards from your hand. If you do, switch 1 of your opponent's Benched Pokémon with their Active Pokémon.","Ability","","","","Flame Tail","Fire, Colorless, Colorless","3","90","","","","","","","Water","×2"
"sm9-17","Ponyta","Pokémon","70","Fire","Rapidash",,"17","Saya Tsuruta","Common","As a newborn, it can barely stand. However, through galloping, its legs are made tougher and faster.","77",,"https://images.pokemontcg.io/sm9/17.png","https://images.pokemontcg.io/sm9/17_hires.png","Legal",,"Legal","Colorless","1","","","","","","","Live Coal","Fire","1","10","","Stomp","Fire, Fire","2","10+","Flip a coin. If heads, this attack does 30 more damage.","Water","×2"
"sm9-18","Rapidash","Pokémon","100","Fire","","Ponyta","18","Shigenori Negishi","Uncommon","Very competitive, this Pokémon will chase anything that moves fast in the hopes of racing it.","78",,"https://images.pokemontcg.io/sm9/18.png","https://images.pokemontcg.io/sm9/18_hires.png","Legal",,"Legal","Colorless","1","","","","","","","Searing Flame","Fire","1","20","Your opponent's Active Pokémon is now Burned.","Agility","Fire, Fire","2","60","Flip a coin. If heads, prevent all effects of attacks, including damage, done to this Pokémon during your opponent's next turn.","Water","×2"
"sm9-19","Moltres","Pokémon","120","Fire","",,"19","Shin Nagasawa","Rare Holo","It is said to be the legendary bird Pokémon of fire. Every flap of its wings creates a dazzling flare of flames.","146",,"https://images.pokemontcg.io/sm9/19.png","https://images.pokemontcg.io/sm9/19_hires.png","Legal",,"Legal","Colorless, Colorless","2","","","","","","","Top Burner","Fire","1","","Discard all Fire Energy from this Pokémon. Then, discard a card from the top of your opponent's deck for each Energy you discarded in this way.","Fire Spin","Fire, Fire, Fire, Colorless","4","180","Discard 3 Energy from this Pokémon.","Lightning","×2"
"sm9-20","Litten","Pokémon","60","Fire","Torracat",,"20","sui","Common","It doesn't allow its emotions to be easily seen. Earning its trust takes time. It prefers solitude.","725",,"https://images.pokemontcg.io/sm9/20.png","https://images.pokemontcg.io/sm9/20_hires.png","Legal",,"Legal","Colorless","1","","","","","","","Fasten Claws","Colorless","1","10+","Flip a coin. If heads, this attack does 10 more damage.","","","","","","Water","×2"
"sm9-21","Torracat","Pokémon","90","Fire","Incineroar","Litten","21","Sanosuke Sakuma","Uncommon","It boasts powerful front legs. With a single punch, it can bend an iron bar right over.","726",,"https://images.pokemontcg.io/sm9/21.png","https://images.pokemontcg.io/sm9/21_hires.png","Legal",,"Legal","Colorless, Colorless","2","","","","","","","Roar","Colorless","1","","Your opponent switches their Active Pokémon with 1 of their Benched Pokémon.","Claw Slash","Colorless, Colorless, Colorless","3","60","","Water","×2"
"sm9-22","Squirtle","Pokémon","50","Water","Wartortle",,"22","sui","Common","It shelters itself in its shell, then strikes back with spouts of water at every opportunity.","7",,"https://images.pokemontcg.io/sm9/22.png","https://images.pokemontcg.io/sm9/22_hires.png","Legal",,"Legal","Colorless","1","Floating Shell","If you have a Stadium card in play, this Pokémon has no Retreat Cost.","Ability","","","","Water Gun","Water, Colorless","2","30","","","","","","","Grass","×2"
"sm9-23","Squirtle","Pokémon","70","Water","Wartortle",,"23","HYOGONOSUKE","Common","It shelters itself in its shell, then strikes back with spouts of water at every opportunity.","7",,"https://images.pokemontcg.io/sm9/23.png","https://images.pokemontcg.io/sm9/23_hires.png","Legal",,"Legal","Colorless","1","","","","","","","Tackle","Colorless","1","10","","Rain Splash","Water, Colorless","2","20","","Grass","×2"
"sm9-24","Wartortle","Pokémon","90","Water","Blastoise","Squirtle","24","Misa Tsutsui","Uncommon","When tapped, this Pokémon will pull in its head, but its tail will still stick out a little bit.","8",,"https://images.pokemontcg.io/sm9/24.png","https://images.pokemontcg.io/sm9/24_hires.png","Legal",,"Legal","Colorless, Colorless","2","","","","","","","Tackle","Colorless, Colorless","2","30","","Waterfall","Water, Water, Colorless","3","70","","Grass","×2"
"sm9-25","Blastoise","Pokémon","160","Water","","Wartortle","25","Hitoshi Ariga","Rare","It crushes its foe under its heavy body to cause fainting. In a pinch, it will withdraw inside its shell.","9",,"https://images.pokemontcg.io/sm9/25.png","https://images.pokemontcg.io/sm9/25_hires.png","Legal",,"Legal","Colorless, Colorless, Colorless","3","Powerful Squall","Once during your turn (before your attack), you may look at the top 6 cards of your deck and attach any number of Water Energy cards you find there to your Pokémon in any way you like. Shuffle the other cards back into your deck.","Ability","","","","Hydro Tackle","Water, Water, Water","3","150","This Pokémon does 30 damage to itself.","","","","","","Grass","×2"
"sm9-26","Psyduck","Pokémon","60","Water","Golduck",,"26","Kouki Saitou","Common","Using psychokinesis gives it a headache, so it normally passes the time spacing out and doing as little as possible.","54",,"https://images.pokemontcg.io/sm9/26.png","https://images.pokemontcg.io/sm9/26_hires.png","Legal",,"Legal","Colorless, Colorless","2","","","","","","","Headache","Colorless","1","10","Flip a coin. If heads, your opponent can't play any Trainer cards from their hand during their next turn.","","","","","","Grass","×2"
"sm9-27","Golduck","Pokémon","110","Water","","Psyduck","27","Masakazu Fukuda","Uncommon","Even fast-swimming fish Pokémon can be disabled by Golduck. It brings them to a standstill and seizes them.","55",,"https://images.pokemontcg.io/sm9/27.png","https://images.pokemontcg.io/sm9/27_hires.png","Legal",,"Legal","Colorless","1","","","","","","","Amnesia","Water","1","20","Choose 1 of your opponent's Active Pokémon's attacks. That Pokémon can't use that attack during your opponent's next turn.","Swim","Colorless, Colorless, Colorless","3","90","If any of your opponent's Pokémon have any Water Energy attached to them, you may do 90 damage to 1 of your opponent's Benched Pokémon instead of their Active Pokémon. (Don't apply Weakness and Resistance for Benched Pokémon.)","Grass","×2"
"sm9-28","Staryu","Pokémon","50","Water","Starmie",,"28","Ken Sugimori","Common","In many places, there are folktales of stardust falling into the ocean and becoming Staryu.","120",,"https://images.pokemontcg.io/sm9/28.png","https://images.pokemontcg.io/sm9/28_hires.png","Legal",,"Legal","Colorless","1","","","","","","","Numbing Water","Colorless","1","10","Flip a coin. If heads, your opponent's Active Pokémon is now Paralyzed.","","","","","","Grass","×2"
"sm9-29","Magikarp","Pokémon","30","Water","Gyarados",,"29","sui","Common","In the distant past, they were fairly strong, but they have become gradually weaker over time.","129",,"https://images.pokemontcg.io/sm9/29.png","https://images.pokemontcg.io/sm9/29_hires.png","Legal",,"Legal","Colorless","1","","","","","","","Enter the Dragon","Water","1","","Flip a coin. If heads, put a card that evolves from this Pokémon from your discard pile onto this Pokémon to evolve it.","","","","","","Lightning","×2"
"sm9-30","Gyarados","Pokémon","150","Water","","Magikarp","30","Hasuno","Rare Holo","It fires hyper beams in all directions, burning the surrounding area to ash. There are some regions where it's called ""the deity of destruction.""","130",,"https://images.pokemontcg.io/sm9/30.png","https://images.pokemontcg.io/sm9/30_hires.png","Legal",,"Legal","Colorless, Colorless, Colorless, Colorless","4","","","","","","","Distilled Blast","Water","1","30+","Reveal the top 7 cards of your deck. This attack does 30 more damage times the amount of Water Energy you find there. Then, shuffle those Energy cards back into your deck and discard the other cards.","Hyper Beam","Water, Water, Water","3","100","Discard an Energy from your opponent's Active Pokémon.","Lightning","×2"
"sm9-31","Lapras","Pokémon","130","Water","",,"31","Ken Sugimori","Rare","It likes swimming around with people on its back. In the Alola region, it's an important means of transportation over water.","131",,"https://images.pokemontcg.io/sm9/31.png","https://images.pokemontcg.io/sm9/31_hires.png","Legal",,"Legal","Colorless, Colorless, Colorless","3","","","","","","","Confuse Ray","Water","1","","Your opponent's Active Pokémon is now Confused.","Hydro Pump","Colorless","1","10+","This attack does 30 more damage times the amount of Water Energy attached to this Pokémon.","Metal","×2"
"sm9-32","Articuno","Pokémon","110","Water","",,"32","Yusuke Ohmura","Rare Holo","A legendary bird Pokémon. It can create blizzards by freezing moisture in the air.","144",,"https://images.pokemontcg.io/sm9/32.png","https://images.pokemontcg.io/sm9/32_hires.png","Legal",,"Legal","Colorless, Colorless","2","Blizzard Veil","As long as this Pokémon is your Active Pokémon, whenever your opponent plays a Supporter card from their hand, prevent all effects of that card done to your Benched Water Pokémon.","Ability","","","","Cold Cyclone","Water, Water","2","70","Move 2 Water Energy from this Pokémon to 1 of your Benched Pokémon.","","","","","","Lightning","×2"
"sm9-33","Pikachu & Zekrom-GX","Pokémon","240","Lightning","Raichu",,"33","Mitsuhiro Arita","Rare Holo GX",,"25, 644",,"https://images.pokemontcg.io/sm9/33.png","https://images.pokemontcg.io/sm9/33_hires.png","Legal",,"Legal","Colorless, Colorless, Colorless","3","","","","","","","Full Blitz","Lightning, Lightning, Lightning","3","150","Search your deck for up to 3 Lightning Energy cards and attach them to 1 of your Pokémon. Then, shuffle your deck.","Tag Bolt-GX","Lightning, Lightning, Lightning","3","200","If this Pokémon has at least 3 extra Lightning Energy attached to it (in addition to this attack's cost), this attack does 170 damage to 1 of your opponent's Benched Pokémon. (Don't apply Weakness and Resistance for Benched Pokémon.) (You can't use more than 1 GX attack in a game.)","Fighting","×2"
"sm9-34","Alolan Geodude","Pokémon","60","Lightning","Graveler",,"34","Yukiko Baba","Common","If you mistake it for a rock and step on it, it will headbutt you in anger. In addition to the pain, it will also zap you with a shock.","74",,"https://images.pokemontcg.io/sm9/34.png","https://images.pokemontcg.io/sm9/34_hires.png","Legal",,"Legal","Colorless, Colorless","2","","","","","","","Self-Destruct","Lightning, Colorless","2","60","This Pokémon does 60 damage to itself.","","","","","","Fighting","×2"
"sm9-35","Alolan Geodude","Pokémon","70","Lightning","Graveler",,"35","Yuka Morii","Common","If you mistake it for a rock and step on it, it will headbutt you in anger. In addition to the pain, it will also zap you with a shock.","74",,"https://images.pokemontcg.io/sm9/35.png","https://images.pokemontcg.io/sm9/35_hires.png","Legal",,"Legal","Colorless, Colorless, Colorless","3","","","","","","","Charge","","0","","Search your deck for up to 2 Lightning Energy cards and attach them to this Pokémon. Then, shuffle your deck.","Smash Bomb","Lightning, Colorless, Colorless","3","50","Flip a coin. If tails, this attack does nothing.","Fighting","×2"
"sm9-36","Alolan Graveler","Pokémon","100","Lightning","Golem","Alolan Geodude","36","Misa Tsutsui","Uncommon","When two Graveler fight each other, it fills the surroundings with flashes of light and sound. People call it the ""fireworks of the earth.""","75",,"https://images.pokemontcg.io/sm9/36.png","https://images.pokemontcg.io/sm9/36_hires.png","Legal",,"Legal","Colorless, Colorless, Colorless, Colorless","4","","","","","","","Rollout","","0","30","","Electroslug","Lightning, Colorless, Colorless, Colorless","4","100","","Fighting","×2"
"sm9-37","Alolan Golem","Pokémon","180","Lightning","","Alolan Graveler","37","kawayoo","Rare","It's grumpy and stubborn. If you upset it, it discharges electricity from the surface of its body and growls with a voice like thunder.","76",,"https://images.pokemontcg.io/sm9/37.png","https://images.pokemontcg.io/sm9/37_hires.png","Legal",,"Legal","Colorless, Colorless, Colorless, Colorless","4","","","","","","","Electromagnetic Bomb","","0","20×","Move any number of Lightning Energy from your Benched Pokémon to this Pokémon. This attack does 20 damage for each Energy card you moved in this way.","Super Zap Cannon","Lightning, Colorless, Colorless, Colorless, Colorless","5","190","Discard 2 Energy from this Pokémon.","Fighting","×2"
"sm9-38","Voltorb","Pokémon","50","Lightning","Electrode",,"38","Ken Sugimori","Common","It was discovered when Poké Balls were introduced. It is said that there is some connection.","100",,"https://images.pokemontcg.io/sm9/38.png","https://images.pokemontcg.io/sm9/38_hires.png","Legal",,"Legal","Colorless","1","","","","","","","Tackle","Colorless","1","20","","","","","","","Fighting","×2"
"sm9-39","Electrode","Pokémon","90","Lightning","","Voltorb","39","Asako Ito","Rare Holo","It explodes in response to even minor stimuli. It is feared, with the nickname of ""The Bomb Ball.""","101",,"https://images.pokemontcg.io/sm9/39.png","https://images.pokemontcg.io/sm9/39_hires.png","Legal",,"Legal","Colorless","1","Electro Shaker","When you play this Pokémon from your hand to evolve 1 of your Pokémon during your turn, you may move any number of Lightning Energy from your Pokémon to your other Pokémon in any way you like.","Ability","","","","Speed Ball","Lightning, Colorless","2","50","","","","","","","Fighting","×2"
"sm9-40","Zapdos","Pokémon","110","Lightning","",,"40","kawayoo","Rare Holo","A legendary Pokémon that is said to live in thunderclouds. It freely controls lightning bolts.","145",,"https://images.pokemontcg.io/sm9/40.png","https://images.pokemontcg.io/sm9/40_hires.png","Legal",,"Legal","Colorless, Colorless","2","","","","","","","Thunderous Assault","Lightning","1","10+","If this Pokémon was on the Bench and became your Active Pokémon this turn, this attack does 70 more damage. This attack's damage isn't affected by Weakness.","","","","","","Lightning","×2"
"sm9-41","Mareep","Pokémon","60","Lightning","Flaaffy",,"41","Akira Komayama","Common","It stores lots of air in its soft fur, allowing it to stay cool in summer and warm in winter.","179",,"https://images.pokemontcg.io/sm9/41.png","https://images.pokemontcg.io/sm9/41_hires.png","Legal",,"Legal","Colorless","1","","","","","","","Shock Bolt","Lightning","1","30","Discard all Lightning Energy from this Pokémon.","","","","","","Fighting","×2"
"sm9-42","Flaaffy","Pokémon","90","Lightning","Ampharos","Mareep","42","Shibuzoh.","Uncommon","If its coat becomes fully charged with electricity, its tail lights up. It fires hair that zaps on impact.","180",,"https://images.pokemontcg.io/sm9/42.png","https://images.pokemontcg.io/sm9/42_hires.png","Legal",,"Legal","Colorless, Colorless","2","","","","","","","Electric Punch","Lightning","1","30","","Shock Bolt","Lightning, Lightning","2","60","Discard all Lightning Energy from this Pokémon.","Fighting","×2"
"sm9-43","Ampharos-GX","Pokémon","240","Lightning","","Flaaffy","43","5ban Graphics","Rare Holo GX",,"181",,"https://images.pokemontcg.io/sm9/43.png","https://images.pokemontcg.io/sm9/43_hires.png","Legal",,"Legal","Colorless, Colorless, Colorless","3","","","","","","","Power Recharge","Lightning","1","30","Put all Electropower cards from your discard pile into your hand.","Impact Bolt","Lightning, Lightning","2","150","Discard all Lightning Energy from this Pokémon.","Fighting","×2"
"sm9-44","Blitzle","Pokémon","60","Lightning","Zebstrika",,"44","Akira Komayama","Common","Its mane shines when it discharges electricity. They use the frequency and rhythm of these flashes to communicate.","522",,"https://images.pokemontcg.io/sm9/44.png","https://images.pokemontcg.io/sm9/44_hires.png","Legal",,"Legal","Colorless","1","","","","","","","Delivery Dash","Lightning","1","","Search your deck for up to 2 Electropower cards, reveal them, and put them into your hand. Then, shuffle your deck.","Zap Kick","Lightning, Colorless","2","20","","Fighting","×2"
"sm9-45","Zebstrika","Pokémon","120","Lightning","","Blitzle","45","Shin Nagasawa","Rare","They have lightning-like movements. When Zebstrika run at full speed, the sound of thunder reverberates.","523",,"https://images.pokemontcg.io/sm9/45.png","https://images.pokemontcg.io/sm9/45_hires.png","Legal",,"Legal","Colorless","1","","","","","","","Raid","Lightning, Colorless","2","30+","If this Pokémon evolved from Blitzle during this turn, this attack does 90 more damage.","Mach Bolt","Lightning, Lightning, Colorless","3","100","","Fighting","×2"
