"id","name","supertype","hp","types","evolvesTo","evolvesFrom","number","artist","rarity","flavorText","nationalPokedexNumbers","regulationMark","imageSmall","imageLarge","legalitiesUnlimited","legalitiesStandard","legalitiesExpanded","retreatCost","convertedRetreatCost","Ability1Name","Ability1Text","Ability1Type","Ability2Name","Ability2Text","Ability2Type","Attack1Name","Attack1Cost","Attack1ConvertedCost","Attack1Damage","Attack1Text","Attack2Name","Attack2Cost","Attack2ConvertedCost","Attack2Damage","Attack2Text","Weakness1Type","Weakness1Value"
"sm9-88","Absol","Pokémon","100","Darkness","",,"88","nagimiso","Rare Holo","Although it's said to bring disaster, in actuality, this Pokémon possesses a calm disposition and warns people of any crises that loom.","359",,"https://images.pokemontcg.io/sm9/88.png","https://images.pokemontcg.io/sm9/88_hires.png","Legal",,"Legal","Colorless","1","Dark Ambition","If your opponent's Active Pokémon is a Basic Pokémon, its Retreat Cost is Colorless more.","Ability","","","","Shadow Seeker","Darkness, Colorless, Colorless","3","30+","This attack does 30 more damage for each Colorless in your opponent's Active Pokémon's Retreat Cost.","","","","","","Fighting","×2"
"sm9-89","Spiritomb","Pokémon","70","Darkness","",,"89","HYOGONOSUKE","Uncommon","It was bound to a fissure in an odd keystone as punishment for misdeeds 500 years ago","442",,"https://images.pokemontcg.io/sm9/89.png","https://images.pokemontcg.io/sm9/89_hires.png","Legal",,"Legal","Colorless","1","","","","","","","Spirit Compressor","Colorless","1","","Search your deck for up to 4 Pokémon and discard them. Then, shuffle your deck.","Spooky Shot","Colorless","1","20","",,
"sm9-90","Zorua","Pokémon","60","Darkness","Zoroark",,"90","Naoyo Kimura","Common","To protect themselves from danger, they hide their true identities by transforming into people and Pokémon.","570",,"https://images.pokemontcg.io/sm9/90.png","https://images.pokemontcg.io/sm9/90_hires.png","Legal",,"Legal","Colorless","1","","","","","","","Hide in Shadows","Darkness","1","","Switch this Pokémon with 1 of your Benched Pokémon.","","","","","","Fighting","×2"
"sm9-91","Zoroark","Pokémon","110","Darkness","","Zorua","91","Masakazu Fukuda","Rare Holo","Bonds between these Pokémon are very strong. It protects the safety of its pack by tricking its opponents.","571",,"https://images.pokemontcg.io/sm9/91.png","https://images.pokemontcg.io/sm9/91_hires.png","Legal",,"Legal","Colorless, Colorless","2","","","","","","","Taunt","Darkness","1","","Switch 1 of your opponent's Benched Pokémon with their Active Pokémon.","Night Punishment","Darkness, Colorless, Colorless","3","20×","This attack does 20 damage for each Pokémon in your discard pile. You can't do more than 200 damage in this way.","Fighting","×2"
"sm9-92","Vullaby","Pokémon","60","Darkness","Mandibuzz",,"92","Eri Yamaki","Common","It can't fly yet and must wait until its wings have developed more. Since it's still at a playful age, it hops around friskily.","629",,"https://images.pokemontcg.io/sm9/92.png","https://images.pokemontcg.io/sm9/92_hires.png","Legal",,"Legal","Colorless","1","","","","","","","Collect","Colorless","1","","Draw a card.","Corkscrew Punch","Darkness","1","10","","Lightning","×2"
"sm9-93","Mandibuzz","Pokémon","120","Darkness","","Vullaby","93","Ayaka Yoshida","Rare","It circles in the sky, keeping a keen eye out for Pokémon in a weakened state. Its choicest food is Cubone.","630",,"https://images.pokemontcg.io/sm9/93.png","https://images.pokemontcg.io/sm9/93_hires.png","Legal",,"Legal","Colorless, Colorless","2","","","","","","","Trash Crash","Darkness","1","","Discard an Item card from your hand. If you do, this attack does 60 damage to 1 of your opponent's Pokémon. This damage isn't affected by Weakness or Resistance.","Brave Bird","Darkness, Colorless, Colorless","3","120","This Pokémon does 30 damage to itself.","Lightning","×2"
"sm9-94","Pangoro","Pokémon","140","Darkness","","Pancham","94","Satoshi Shirai","Rare","From the slight twitches of its bamboo leaf, it deduces its opponent's movements. It's eager to tussle but kindhearted toward its companions.","675",,"https://images.pokemontcg.io/sm9/94.png","https://images.pokemontcg.io/sm9/94_hires.png","Legal",,"Legal","Colorless, Colorless, Colorless, Colorless","4","","","","","","","Tighten Up","Darkness, Colorless, Colorless","3","60","Your opponent discards 2 cards from their hand.","Tantrum","Darkness, Darkness, Colorless, Colorless","4","170","This Pokémon is now Confused.","Fighting","×2"
"sm9-95","Yveltal","Pokémon","110","Darkness","",,"95","Misa Tsutsui","Rare Holo","When its life comes to an end, it absorbs the life energy of every living thing and turns into a cocoon once more.","717",,"https://images.pokemontcg.io/sm9/95.png","https://images.pokemontcg.io/sm9/95_hires.png","Legal",,"Legal","",,"","","","","","","Derail","Darkness","1","30","Discard a Special Energy from your opponent's Active Pokémon.","Clutch","Darkness, Darkness","2","60","The Defending Pokémon can't retreat during your opponent's next turn.","Lightning","×2"
"sm9-96","Hoopa-GX","Pokémon","190","Darkness","",,"96","5ban Graphics","Rare Holo GX",,"720",,"https://images.pokemontcg.io/sm9/96.png","https://images.pokemontcg.io/sm9/96_hires.png","Legal",,"Legal","Colorless, Colorless, Colorless","3","","","","","","","Rogue Ring","Darkness","1","","Search your deck for up to 2 cards and put them into your hand. Then, shuffle your deck.","Dark Strike","Darkness, Darkness, Darkness","3","160","This Pokémon can't use Dark Strike during your next turn.","Fighting","×2"
"sm9-97","Incineroar-GX","Pokémon","250","Darkness","","Torracat","97","5ban Graphics","Rare Holo GX",,"727",,"https://images.pokemontcg.io/sm9/97.png","https://images.pokemontcg.io/sm9/97_hires.png","Legal",,"Legal","Colorless, Colorless, Colorless","3","Scar Charge","Once during your turn (before your attack), you may put 3 damage counters on this Pokémon. If you do, search your deck for up to 3 Darkness Energy cards and attach them to this Pokémon. Then, shuffle your deck.","Ability","","","","Crushing Punch","Colorless, Colorless, Colorless","3","130","Discard a Special Energy from your opponent's Active Pokémon.","Darkest Tornado-GX","Colorless, Colorless, Colorless","3","10+","This attack does 50 more damage for each damage counter on this Pokémon. (You can't use more than 1 GX attack in a game.)","Fighting","×2"
"sm9-98","Skarmory","Pokémon","110","Metal","",,"98","kirisAki","Rare","Its metal body is sturdy, but it does rust rather easily. So on rainy days, this Pokémon prefers to stay put in its nest.","227",,"https://images.pokemontcg.io/sm9/98.png","https://images.pokemontcg.io/sm9/98_hires.png","Legal",,"Legal","Colorless","1","","","","","","","Calm Strike","Metal, Colorless","2","20+","If you have used your GX attack, this attack does 70 more damage.","Steel Wing","Metal, Metal, Colorless","3","90","During your opponent's next turn, this Pokémon takes 30 less damage from attacks (after applying Weakness and Resistance).","Lightning","×2"
"sm9-99","Jirachi","Pokémon","70","Metal","",,"99","HYOGONOSUKE","Rare Holo","It is said to have the ability to grant any wish for just one week every thousand years.","385",,"https://images.pokemontcg.io/sm9/99.png","https://images.pokemontcg.io/sm9/99_hires.png","Legal",,"Legal","Colorless","1","Stellar Wish","Once during your turn (before your attack), if this Pokémon is your Active Pokémon, you may look at the top 5 cards of your deck, reveal a Trainer card you find there, and put it into your hand. Then, shuffle the other cards back into your deck, and this Pokémon is now Asleep.","Ability","","","","Slap","Metal, Colorless","2","30","","","","","","","Fire","×2"
"sm9-100","Bronzor","Pokémon","50","Metal","Bronzong",,"100","Ken Sugimori","Common","Implements shaped like it were discovered in ancient tombs. It is unknown if they are related.","436",,"https://images.pokemontcg.io/sm9/100.png","https://images.pokemontcg.io/sm9/100_hires.png","Legal",,"Legal","Colorless","1","Evolutionary Advantage","If you go second, this Pokémon can evolve during your first turn.","Ability","","","","Tackle","Metal, Colorless","2","20","","","","","","","Fire","×2"
"sm9-101","Bronzong","Pokémon","130","Metal","","Bronzor","101","Misa Tsutsui","Rare","Ancient people believed that petitioning Bronzong for rain was the way to make crops grow.","437",,"https://images.pokemontcg.io/sm9/101.png","https://images.pokemontcg.io/sm9/101_hires.png","Legal",,"Legal","Colorless, Colorless, Colorless","3","Heatproof","Prevent all damage done to this Pokémon by attacks from your opponent's Fire Pokémon.","Ability","","","","Shady Stamp","Metal, Colorless, Colorless","3","70","Your opponent's Active Pokémon is now Confused.","","","","","","Fire","×2"
"sm9-102","Ferroseed","Pokémon","60","Metal","Ferrothorn",,"102","Shigenori Negishi","Common","It absorbs the iron it finds in the rock while clinging to the ceiling. It shoots spikes when in danger.","597",,"https://images.pokemontcg.io/sm9/102.png","https://images.pokemontcg.io/sm9/102_hires.png","Legal",,"Legal","Colorless, Colorless, Colorless","3","","","","","","","Continuous Tumble","Metal","1","20×","Flip a coin until you get tails. This attack does 20 damage for each heads.","","","","","","Fire","×2"
"sm9-103","Ferrothorn","Pokémon","120","Metal","","Ferroseed","103","Hasuno","Rare","They attach themselves to cave ceilings, firing steel spikes at targets passing beneath them.","598",,"https://images.pokemontcg.io/sm9/103.png","https://images.pokemontcg.io/sm9/103_hires.png","Legal",,"Legal","Colorless, Colorless, Colorless","3","","","","","","","Guard Press","Metal","1","20","During your opponent's next turn, this Pokémon takes 20 less damage from attacks (after applying Weakness and Resistance).","Thorn Pod Throw","Colorless, Colorless, Colorless","3","80","This attack does 20 damage times the amount of Metal Energy attached to this Pokémon to 1 of your opponent's Benched Pokémon. You can't do more than 100 damage to a Benched Pokémon in this way. (Don't apply Weakness and Resistance for Benched Pokémon.)","Fire","×2"
"sm9-104","Pawniard","Pokémon","60","Metal","Bisharp",,"104","Masakazu Fukuda","Common","Ignoring their injuries, groups attack by sinking the blades that cover their bodies into their prey.","624",,"https://images.pokemontcg.io/sm9/104.png","https://images.pokemontcg.io/sm9/104_hires.png","Legal",,"Legal","Colorless","1","","","","","","","Rigidify","Metal","1","","During your opponent's next turn, this Pokémon takes 30 less damage from attacks (after applying Weakness and Resistance).","Scratch","Colorless, Colorless","2","20","","Fire","×2"
"sm9-105","Bisharp","Pokémon","110","Metal","","Pawniard","105","Anesaki Dynamic","Rare","Bisharp pursues prey in the company of a large group of Pawniard. Then Bisharp finishes off the prey.","625",,"https://images.pokemontcg.io/sm9/105.png","https://images.pokemontcg.io/sm9/105_hires.png","Legal",,"Legal","Colorless, Colorless","2","","","","","","","Single Lunge","Metal","1","30+","If this Pokémon has no damage counters on it, this attack does 90 more damage.","Power Edge","Metal, Colorless, Colorless","3","90","","Fire","×2"
"sm9-106","Cobalion-GX","Pokémon","170","Metal","",,"106","5ban Graphics","Rare Holo GX",,"638",,"https://images.pokemontcg.io/sm9/106.png","https://images.pokemontcg.io/sm9/106_hires.png","Legal",,"Legal","Colorless","1","Metal Symbol","Each of your Pokémon that has any Metal Energy attached to it can't be affected by any Special Conditions. Remove any Special Conditions affecting those Pokémon.","Ability","","","","Dueling Saber","Metal, Metal","2","50+","If there is any Stadium card in play, this attack does 60 more damage.","Iron Rule-GX","Colorless","1","","During your opponent's next turn, their Pokémon can't attack. (This includes Pokémon that come into play on that turn.) (You can't use more than 1 GX attack in a game.)","Fire","×2"
"sm9-107","Honedge","Pokémon","60","Metal","Doublade",,"107","sui","Common","If anyone dares to grab its hilt, it wraps a blue cloth around that person's arm and drains that person's life energy completely.","679",,"https://images.pokemontcg.io/sm9/107.png","https://images.pokemontcg.io/sm9/107_hires.png","Legal",,"Legal","Colorless, Colorless","2","","","","","","","Cut Down","Metal","1","","Flip a coin. If heads, discard an Energy from your opponent's Active Pokémon.","","","","","","Fire","×2"
"sm9-108","Doublade","Pokémon","90","Metal","Aegislash","Honedge","108","Shin Nagasawa","Uncommon","The complex attack patterns of its two swords are unstoppable, even for an opponent greatly accomplished at swordplay.","680",,"https://images.pokemontcg.io/sm9/108.png","https://images.pokemontcg.io/sm9/108_hires.png","Legal",,"Legal","Colorless, Colorless","2","","","","","","","Tool Drop","Colorless, Colorless","2","30×","This attack does 30 damage for each Pokémon Tool card attached to all Pokémon.","","","","","","Fire","×2"
"sm9-109","Aegislash","Pokémon","140","Metal","","Doublade","109","Kagemaru Himeno","Rare Holo","Apparently, it can detect the innate qualities of leadership. According to legend, whoever it recognizes is destined to become king.","681",,"https://images.pokemontcg.io/sm9/109.png","https://images.pokemontcg.io/sm9/109_hires.png","Legal",,"Legal","Colorless, Colorless, Colorless","3","Royal Guard","This Pokémon takes 40 less damage from attacks (after applying Weakness and Resistance).","Ability","","","","Shield Bash","Metal, Colorless, Colorless","3","100","This attack's damage isn't affected by any effects on your opponent's Active Pokémon.","","","","","","Fire","×2"
"sm9-110","Klefki","Pokémon","60","Metal","",,"110","Shigenori Negishi","Common","It never lets go of a key that it likes, so people give it the keys to vaults and safes as a way to prevent crime.","707",,"https://images.pokemontcg.io/sm9/110.png","https://images.pokemontcg.io/sm9/110_hires.png","Legal",,"Legal","Colorless","1","Key of Secrets","Each of your Metal Pokémon's Resistance is now -40.","Ability","","","","Ram","Metal, Colorless","2","30","","","","","","","Fire","×2"
"sm9-111","Alolan Ninetales","Pokémon","110","Fairy","","Alolan Vulpix","111","Misa Tsutsui","Rare Holo","It creates drops of ice in its coat and showers them over its enemies. Anyone who angers it will be frozen stiff in an instant.","38",,"https://images.pokemontcg.io/sm9/111.png","https://images.pokemontcg.io/sm9/111_hires.png","Legal",,"Legal","Colorless","1","Luminous Barrier","Prevent all effects of attacks, including damage, done to this Pokémon by your opponent's Pokémon-GX or Pokémon-EX.","Ability","","","","Aurora Beam","Fairy, Colorless, Colorless","3","80","","","","","","","Metal","×2"
"sm9-112","Mimikyu","Pokémon","70","Fairy","",,"112","Eri Yamaki","Rare","Its actual appearance is unknown. A scholar who saw what was under its rag was overwhelmed by terror and died from the shock.","778",,"https://images.pokemontcg.io/sm9/112.png","https://images.pokemontcg.io/sm9/112_hires.png","Legal",,"Legal","Colorless","1","","","","","","","Filch","Colorless","1","","Draw 2 cards.","Copycat","Fairy, Colorless","2","","If your opponent's Pokémon used an attack that isn't a GX attack during their last turn, use it as this attack.",,
"sm9-113","Latias & Latios-GX","Pokémon","250","Dragon","",,"113","Mitsuhiro Arita","Rare Holo GX",,"380, 381",,"https://images.pokemontcg.io/sm9/113.png","https://images.pokemontcg.io/sm9/113_hires.png","Legal",,"Legal","Colorless","1","","","","","","","Buster Purge","Water, Psychic, Psychic, Colorless","4","240","Discard 3 Energy from this Pokémon.","Aero Unit-GX","Psychic","1","","Attach 5 basic Energy cards from your discard pile to your Pokémon in any way you like. If this Pokémon has at least 1 extra Energy attached to it (in addition to this attack's cost), prevent all effects of attacks, including damage, done to it during your opponent's next turn. (You can't use more than 1 GX attack in a game.)","Fairy","×2"
"sm9-114","Alolan Exeggutor","Pokémon","160","Dragon","","Exeggcute","114","Anesaki Dynamic","Rare","As it grew taller and taller, it outgrew its reliance on psychic powers, while within it awakened the power of the sleeping dragon.","103",,"https://images.pokemontcg.io/sm9/114.png","https://images.pokemontcg.io/sm9/114_hires.png","Legal",,"Legal","Colorless, Colorless, Colorless","3","","","","","","","Tropical Shake","Grass","1","20+","This attack does 20 more damage for each type of basic Energy card in your discard pile. You can't add more than 100 damage in this way.","","","","","","Fairy","×2"
"sm9-115","Alolan Exeggutor","Pokémon","160","Dragon","","Exeggcute","115","Sanosuke Sakuma","Rare","Exeggutor is the pride of the Alolan people. Its image is carved into historical buildings and murals.","103",,"https://images.pokemontcg.io/sm9/115.png","https://images.pokemontcg.io/sm9/115_hires.png","Legal",,"Legal","Colorless, Colorless, Colorless, Colorless","4","","","","","","","Paradise Draw","","0","","You may discard any number of cards from your hand. Then, draw cards until you have 6 cards in your hand.","Egg Splat","Grass, Colorless","2","60×","Discard any number of Exeggcute from your hand. This attack does 60 damage for each card you discarded in this way.","Fairy","×2"
"sm9-116","Dratini","Pokémon","60","Dragon","Dragonair",,"116","Midori Harada","Common","It's still weak, so it lurks on the floor of bodies of water, eating whatever food sinks down and living a quiet life.","147",,"https://images.pokemontcg.io/sm9/116.png","https://images.pokemontcg.io/sm9/116_hires.png","Legal",,"Legal","Colorless, Colorless","2","","","","","","","Dragon Rage","Lightning","1","60","Flip 2 coins. If either of them is tails, this attack does nothing.","","","","","","Fairy","×2"
"sm9-117","Dratini","Pokémon","70","Dragon","Dragonair",,"117","Kouki Saitou","Common","It's still weak, so it lurks on the floor of bodies of water, eating whatever food sinks down and living a quiet life.","147",,"https://images.pokemontcg.io/sm9/117.png","https://images.pokemontcg.io/sm9/117_hires.png","Legal",,"Legal","Colorless, Colorless","2","Defensive Scales","Prevent all effects of your opponent's attacks, except damage, done to this Pokémon.","Ability","","","","Rain Splash","Water","1","10","","","","","","","Fairy","×2"
"sm9-118","Dragonair","Pokémon","90","Dragon","Dragonite","Dratini","118","kirisAki","Uncommon","Lakes where Dragonair live are filled with offerings from people, because they believe this Pokémon is able to control the weather.","148",,"https://images.pokemontcg.io/sm9/118.png","https://images.pokemontcg.io/sm9/118_hires.png","Legal",,"Legal","Colorless, Colorless","2","","","","","","","Twister","Water, Lightning","2","30","Flip 2 coins. For each heads, discard an Energy from your opponent's Active Pokémon. If both of them are tails, this attack does nothing.","","","","","","Fairy","×2"
"sm9-119","Dragonite","Pokémon","160","Dragon","","Dragonair","119","Megumi Mizutani","Rare Holo","It flies over raging seas as if they were nothing. Observing this, a ship's captain dubbed this Pokémon ""the sea incarnate.""","149",,"https://images.pokemontcg.io/sm9/119.png","https://images.pokemontcg.io/sm9/119_hires.png","Legal",,"Legal","Colorless, Colorless, Colorless","3","Fast Call","Once during your turn (before your attack), you may search your deck for a Supporter card, reveal it, and put it into your hand. Then, shuffle your deck.","Ability","","","","Dragon Claw","Water, Lightning, Colorless","3","120","","","","","","","Fairy","×2"
"sm9-120","Eevee & Snorlax-GX","Pokémon","270","Colorless","Vaporeon, Jolteon, Flareon, Sylveon, Espeon, Umbreon, Leafeon, Glaceon",,"120","Mitsuhiro Arita","Rare Holo GX",,"133, 143",,"https://images.pokemontcg.io/sm9/120.png","https://images.pokemontcg.io/sm9/120_hires.png","Legal",,"Legal","Colorless, Colorless, Colorless, Colorless","4","","","","","","","Cheer Up","Colorless","1","","Attach an Energy card from your hand to 1 of your Pokémon.","Dump Truck Press","Colorless, Colorless, Colorless, Colorless","4","120+","If your opponent's Active Pokémon is an Evolution Pokémon, this attack does 120 more damage.","Fighting","×2"
"sm9-121","Pidgey","Pokémon","50","Colorless","Pidgeotto",,"121","Shigenori Negishi","Common","A common sight in forests and woods. It flaps its wings at ground level to kick up blinding sand.","16",,"https://images.pokemontcg.io/sm9/121.png","https://images.pokemontcg.io/sm9/121_hires.png","Legal",,"Legal","Colorless","1","","","","","","","Collect","Colorless","1","","Draw a card.","Gust","Colorless, Colorless","2","20","","Lightning","×2"
"sm9-122","Pidgey","Pokémon","60","Colorless","Pidgeotto",,"122","Sumiyoshi Kizuki","Common","A common sight in forests and woods. It flaps its wings at ground level to kick up blinding sand.","16",,"https://images.pokemontcg.io/sm9/122.png","https://images.pokemontcg.io/sm9/122_hires.png","Legal",,"Legal","Colorless","1","","","","","","","Quick Attack","Colorless","1","10+","Flip a coin. If heads, this attack does 10 more damage.","","","","","","Lightning","×2"
"sm9-123","Pidgeotto","Pokémon","60","Colorless","Pidgeot","Pidgey","123","Mizue","Common","The claws on its feet are well developed. It can carry prey such as an Exeggcute to its nest over 60 miles away.","17",,"https://images.pokemontcg.io/sm9/123.png","https://images.pokemontcg.io/sm9/123_hires.png","Legal",,"Legal","Colorless","1","Air Mail","Once during your turn (before your attack), you may look at the top 2 cards of your deck and put 1 of them into your hand. Put the other card on the bottom of your deck.","Ability","","","","Gust","Colorless, Colorless","2","30","","","","","","","Lightning","×2"
"sm9-124","Pidgeot","Pokémon","130","Colorless","","Pidgeotto","124","Akira Komayama","Rare","When hunting, it skims the surface of water at high speed to pick off unwary prey such as Magikarp.","18",,"https://images.pokemontcg.io/sm9/124.png","https://images.pokemontcg.io/sm9/124_hires.png","Legal",,"Legal","",,"","","","","","","Whirlwind","Colorless, Colorless","2","60","Your opponent switches their Active Pokémon with 1 of their Benched Pokémon.","Spin Storm","Colorless, Colorless, Colorless","3","","Your opponent puts their Active Pokémon and all cards attached to it into their hand.","Lightning","×2"
"sm9-125","Meowth","Pokémon","70","Colorless","Persian",,"125","Ken Sugimori","Common","When visiting a junkyard, you may catch sight of it having an intense fight with Murkrow over shiny objects.","52",,"https://images.pokemontcg.io/sm9/125.png","https://images.pokemontcg.io/sm9/125_hires.png","Legal",,"Legal","Colorless","1","","","","","","","Scratch","Colorless","1","10","","Bite","Colorless, Colorless","2","20","","Fighting","×2"
"sm9-126","Persian","Pokémon","100","Colorless","","Meowth","126","Yukiko Baba","Uncommon","Although the jewel on its forehead appears to be a different color than those of Alolan Persian, it's mostly made of the same material.","53",,"https://images.pokemontcg.io/sm9/126.png","https://images.pokemontcg.io/sm9/126_hires.png","Legal",,"Legal","Colorless","1","","","","","","","Make 'Em Pay","Colorless","1","20","If your opponent has 4 or more cards in their hand, they reveal their hand. Discard cards you find there until your opponent has exactly 4 cards in their hand.","Sharp Claws","Colorless, Colorless","2","30+","Flip a coin. If heads, this attack does 60 more damage.","Fighting","×2"
"sm9-127","Farfetch'd","Pokémon","80","Colorless","Sirfetch'd",,"127","Shibuzoh.","Uncommon","The plant stalk it holds is its weapon. The stalk is used like a sword to cut all sorts of things.","83",,"https://images.pokemontcg.io/sm9/127.png","https://images.pokemontcg.io/sm9/127_hires.png","Legal",,"Legal","Colorless","1","","","","","","","Collect","Colorless","1","","Draw 2 cards.","Tool Buster","Colorless","1","20+","Before doing damage, discard all Pokémon Tool cards from your opponent's Active Pokémon. If you discarded a Pokémon Tool card in this way, this attack does 70 more damage.","Lightning","×2"
"sm9-128","Kangaskhan","Pokémon","130","Colorless","",,"128","Mizue","Uncommon","Kangaskhan protects its child by keeping it in its pouch. It has zero forgiveness for those who harm its child and will beat them down.","115",,"https://images.pokemontcg.io/sm9/128.png","https://images.pokemontcg.io/sm9/128_hires.png","Legal",,"Legal","Colorless, Colorless","2","","","","","","","Fast Evolution","Colorless","1","","Search your deck for up to 2 Evolution Pokémon, reveal them, and put them into your hand. Then, shuffle your deck.","Mega Punch","Colorless, Colorless, Colorless","3","80","","Fighting","×2"
"sm9-129","Tauros","Pokémon","130","Colorless","",,"129","kodama","Uncommon","They live in groups. The one with the longest, thickest, and most-scarred horns is the boss of the herd.","128",,"https://images.pokemontcg.io/sm9/129.png","https://images.pokemontcg.io/sm9/129_hires.png","Legal",,"Legal","Colorless, Colorless","2","","","","","","","Raging Herd","Colorless, Colorless","2","10+","This attack does 10 more damage for each damage counter on all of your Tauros and Tauros-GX.","","","","","","Fighting","×2"
