"id","name","supertype","hp","types","evolvesTo","evolvesFrom","number","artist","rarity","flavorText","nationalPokedexNumbers","regulationMark","imageSmall","imageLarge","legalitiesUnlimited","legalitiesStandard","legalitiesExpanded","retreatCost","convertedRetreatCost","Ability1Name","Ability1Text","Ability1Type","Ability2Name","Ability2Text","Ability2Type","Attack1Name","Attack1Cost","Attack1ConvertedCost","Attack1Damage","Attack1Text","Attack2Name","Attack2Cost","Attack2ConvertedCost","Attack2Damage","Attack2Text","Weakness1Type","Weakness1Value"
"sv4pt5-98","Jumpluff","Pokémon","90","Grass","","Skiploom","98","Lee HyunJung","Shiny Rare","Jumpluff travels on seasonal winds. Once its cotton spores run out, its journey ends, as does its life.","189","G","https://images.pokemontcg.io/sv4pt5/98.png","https://images.pokemontcg.io/sv4pt5/98_hires.png","Legal","Legal","Legal","Colorless","1","Drifting Dodge","If any damage is done to this Pokémon by attacks, flip a coin. If heads, prevent that damage.","Ability","","","","Fluffy Breeze","Grass","1","60","This attack also does 30 damage to 1 of your opponent's Benched Pokémon. (Don't apply Weakness and Resistance for Benched Pokémon.)","","","","","","Fire","×2"
"sv4pt5-99","Pineco","Pokémon","70","Grass","Forretress",,"99","Scav","Shiny Rare","It likes to make its shell thicker by adding layers of tree bark. The additional weight doesn't bother it.","204","G","https://images.pokemontcg.io/sv4pt5/99.png","https://images.pokemontcg.io/sv4pt5/99_hires.png","Legal","Legal","Legal","Colorless, Colorless","2","","","","","","","Rollout","Grass, Grass","2","30","","","","","","","Fire","×2"
"sv4pt5-100","Snover","Pokémon","90","Grass","Abomasnow",,"100","Saya Tsuruta","Shiny Rare","During cold seasons, it migrates to the mountain's lower reaches. It returns to the snow-covered summit in the spring.","459","G","https://images.pokemontcg.io/sv4pt5/100.png","https://images.pokemontcg.io/sv4pt5/100_hires.png","Legal","Legal","Legal","Colorless, Colorless, Colorless","3","","","","","","","Corkscrew Punch","Grass, Colorless","2","30","","","","","","","Fire","×2"
"sv4pt5-101","Abomasnow","Pokémon","150","Grass","","Snover","101","Hitoshi Ariga","Shiny Rare","It lives a quiet life on mountains that are perpetually covered in snow. It hides itself by whipping up blizzards.","460","G","https://images.pokemontcg.io/sv4pt5/101.png","https://images.pokemontcg.io/sv4pt5/101_hires.png","Legal","Legal","Legal","Colorless, Colorless, Colorless","3","Freezing Disaster","Pokémon (both yours and your opponent's) can't be healed.","Ability","","","","Magnum Punch","Grass, Grass, Colorless","3","110","","","","","","","Fire","×2"
"sv4pt5-102","Smoliv","Pokémon","60","Grass","",,"102","otumami","Shiny Rare","It protects itself from enemies by emitting oil from the fruit on its head. This oil is bitter and astringent enough to make someone flinch.","928","G","https://images.pokemontcg.io/sv4pt5/102.png","https://images.pokemontcg.io/sv4pt5/102_hires.png","Legal","Legal","Legal","Colorless","1","","","","","","","Nutrients","Grass","1","","Heal 30 damage from 1 of your Pokémon.","Spray Fluid","Grass, Colorless","2","20","","Fire","×2"
"sv4pt5-103","Dolliv","Pokémon","90","Grass","","Smoliv","103","saino misaki","Shiny Rare","Dolliv shares its tasty, fresh-scented oil with others. This species has coexisted with humans since times long gone.","929","G","https://images.pokemontcg.io/sv4pt5/103.png","https://images.pokemontcg.io/sv4pt5/103_hires.png","Legal","Legal","Legal","Colorless","1","","","","","","","Slap","Colorless","1","20","","Apply Oil","Grass, Colorless","2","40","During your opponent's next turn, if the Defending Pokémon tries to attack, your opponent flips a coin. If tails, that attack doesn't happen.","Fire","×2"
"sv4pt5-104","Arboliva","Pokémon","150","Grass","","Dolliv","104","Hideki Ishikawa","Shiny Rare","This calm Pokémon is very compassionate. It will share its delicious, nutrient-rich oil with weakened Pokémon.","930","G","https://images.pokemontcg.io/sv4pt5/104.png","https://images.pokemontcg.io/sv4pt5/104_hires.png","Legal","Legal","Legal","Colorless, Colorless","2","Enriching Oil","When you play this Pokémon from your hand to evolve 1 of your Pokémon during your turn, you may heal all damage from 1 of your Pokémon.","Ability","","","","Solar Beam","Grass, Grass, Colorless","3","150","","","","","","","Fire","×2"
"sv4pt5-105","Toedscool","Pokémon","50","Grass","",,"105","Ryuta Fuse","Shiny Rare","Though it looks like Tentacool, Toedscool is a completely different species. Its legs may be thin, but it can run at a speed of 30 mph.","948","G","https://images.pokemontcg.io/sv4pt5/105.png","https://images.pokemontcg.io/sv4pt5/105_hires.png","Legal","Legal","Legal","Colorless","1","","","","","","","Furious Kicks","Grass","1","10×","Flip 3 coins. This attack does 10 damage for each heads.","","","","","","Fire","×2"
"sv4pt5-106","Capsakid","Pokémon","70","Grass","",,"106","OKACHEKE","Shiny Rare","Traditional Paldean dishes can be extremely spicy because they include the shed front teeth of Capsakid among their ingredients.","951","G","https://images.pokemontcg.io/sv4pt5/106.png","https://images.pokemontcg.io/sv4pt5/106_hires.png","Legal","Legal","Legal","Colorless","1","","","","","","","Increasing Spice","Colorless","1","","Search your deck for a Basic Fire Energy card and attach it to this Pokémon. Then, shuffle your deck.","Playful Kick","Grass, Colorless, Colorless","3","50","","Fire","×2"
"sv4pt5-107","Scovillain","Pokémon","110","Grass","","Capsakid","107","Kouki Saitou","Shiny Rare","The red head converts spicy chemicals into fire energy and blasts the surrounding area with a super spicy stream of flame.","952","G","https://images.pokemontcg.io/sv4pt5/107.png","https://images.pokemontcg.io/sv4pt5/107_hires.png","Legal","Legal","Legal","Colorless, Colorless","2","Double Type","As long as this Pokémon is in play, it is Grass and Fire type.","Ability","","","","Spicy Headbutt","Grass, Colorless, Colorless","3","110","This attack's damage isn't affected by Resistance.","","","","","","Fire","×2"
"sv4pt5-108","Rellor","Pokémon","50","Grass","",,"108","Misa Tsutsui","Shiny Rare","This Pokémon creates a mud ball by mixing sand and dirt with psychic energy. It treasures its mud ball more than its own life.","953","G","https://images.pokemontcg.io/sv4pt5/108.png","https://images.pokemontcg.io/sv4pt5/108_hires.png","Legal","Legal","Legal","Colorless","1","","","","","","","Ball Roll","Colorless, Colorless","2","30×","Flip a coin until you get tails. This attack does 30 damage for each heads.","","","","","","Fire","×2"
"sv4pt5-109","Charmander","Pokémon","70","Fire","Charmeleon",,"109","sowsow","Shiny Rare","From the time it is born, a flame burns at the tip of its tail. Its life would end if the flame were to go out.","4","G","https://images.pokemontcg.io/sv4pt5/109.png","https://images.pokemontcg.io/sv4pt5/109_hires.png","Legal","Legal","Legal","Colorless","1","","","","","","","Blazing Destruction","Fire","1","","Discard a Stadium in play.","Steady Firebreathing","Fire, Fire","2","30","","Water","×2"
"sv4pt5-110","Charmeleon","Pokémon","90","Fire","Charizard","Charmander","110","Kouki Saitou","Shiny Rare","If it becomes agitated during battle, it spouts intense flames, incinerating its surroundings.","5","G","https://images.pokemontcg.io/sv4pt5/110.png","https://images.pokemontcg.io/sv4pt5/110_hires.png","Legal","Legal","Legal","Colorless, Colorless","2","Flare Veil","Prevent all effects of attacks used by your opponent's Pokémon done to this Pokémon. (Damage is not an effect.)","Ability","","","","Combustion","Fire, Fire","2","50","","","","","","","Water","×2"
"sv4pt5-111","Paldean Tauros","Pokémon","130","Fire","",,"111","Hitoshi Ariga","Shiny Rare","People call this kind of Tauros the Blaze Breed due to the hot air it snorts from its nostrils. Its three tails are intertwined.","128","G","https://images.pokemontcg.io/sv4pt5/111.png","https://images.pokemontcg.io/sv4pt5/111_hires.png","Legal","Legal","Legal","Colorless, Colorless","2","","","","","","","Raging Horns","Colorless, Colorless","2","20+","This attack does 10 more damage for each damage counter on this Pokémon.","Blaze Dash","Fire, Fire, Colorless","3","120","Discard an Energy from this Pokémon.","Water","×2"
"sv4pt5-112","Entei","Pokémon","130","Fire","",,"112","Ryuta Fuse","Shiny Rare","It is said that when it roars, a volcano erupts somewhere around the globe.","244","G","https://images.pokemontcg.io/sv4pt5/112.png","https://images.pokemontcg.io/sv4pt5/112_hires.png","Legal","Legal","Legal","Colorless, Colorless","2","Pressure","As long as this Pokémon is in the Active Spot, attacks used by your opponent's Active Pokémon do 20 less damage (before applying Weakness and Resistance).","Ability","","","","Blaze Ball","Colorless, Colorless, Colorless","3","60+","This attack does 20 more damage for each Fire Energy attached to this Pokémon.","","","","","","Water","×2"
"sv4pt5-113","Oricorio","Pokémon","90","Fire","",,"113","Akira Komayama","Shiny Rare","This Pokémon is incredibly popular, possibly because its passionate dancing is a great match with the temperament of Paldean people.","741","G","https://images.pokemontcg.io/sv4pt5/113.png","https://images.pokemontcg.io/sv4pt5/113_hires.png","Legal","Legal","Legal","Colorless","1","Ardent Dancing","Once during your turn, you may heal 20 damage from your Active Evolution Pokémon.","Ability","","","","Flap","Fire, Colorless","2","30","","","","","","","Water","×2"
"sv4pt5-114","Charcadet","Pokémon","70","Fire","",,"114","Masakazu Fukuda","Shiny Rare","Burnt charcoal came to life and became a Pokémon. Possessing a fiery fighting spirit, Charcadet will battle even tough opponents.","935","G","https://images.pokemontcg.io/sv4pt5/114.png","https://images.pokemontcg.io/sv4pt5/114_hires.png","Legal","Legal","Legal","Colorless","1","","","","","","","Heat Blast","Fire, Fire, Colorless","3","60","","","","","","","Water","×2"
"sv4pt5-115","Armarouge","Pokémon","130","Fire","","Charcadet","115","Atsushi Furusawa","Shiny Rare","Armarouge evolved through the use of a set of armor that belonged to a distinguished warrior. This Pokémon is incredibly loyal.","936","G","https://images.pokemontcg.io/sv4pt5/115.png","https://images.pokemontcg.io/sv4pt5/115_hires.png","Legal","Legal","Legal","Colorless, Colorless","2","Fire Off","As often as you like during your turn, you may move a Fire Energy from 1 of your Benched Pokémon to your Active Pokémon.","Ability","","","","Flame Cannon","Fire, Fire, Colorless","3","90","Your opponent's Active Pokémon is now Burned.","","","","","","Water","×2"
"sv4pt5-116","Slowpoke","Pokémon","70","Water","Slowbro, Slowking",,"116","Taira Akitsu","Shiny Rare","It is always vacantly lost in thought, but no one knows what it is thinking about. It is good at fishing with its tail.","79","G","https://images.pokemontcg.io/sv4pt5/116.png","https://images.pokemontcg.io/sv4pt5/116_hires.png","Legal","Legal","Legal","Colorless, Colorless","2","","","","","","","Rest","Colorless","1","","This Pokémon is now Asleep. Heal 30 damage from it.","Headbutt","Water, Colorless","2","20","","Lightning","×2"
"sv4pt5-117","Slowbro","Pokémon","100","Water","","Slowpoke","117","Souichirou Gunjima","Shiny Rare","If the tail-biting Shellder is thrown off in a harsh battle, this Pokémon reverts to being an ordinary Slowpoke.","80","G","https://images.pokemontcg.io/sv4pt5/117.png","https://images.pokemontcg.io/sv4pt5/117_hires.png","Legal","Legal","Legal","Colorless, Colorless, Colorless","3","Strange Behavior","As often as you like during your turn, you may move 1 damage counter from 1 of your other Pokémon to this Pokémon.","Ability","","","","Bubble Drain","Water, Colorless","2","60","Heal 30 damage from this Pokémon.","","","","","","Lightning","×2"
"sv4pt5-118","Staryu","Pokémon","60","Water","Starmie",,"118","Nisota Niso","Shiny Rare","Fish Pokémon nibble at it, but Staryu isn't bothered. Its body regenerates quickly, even if part of it is completely torn off.","120","G","https://images.pokemontcg.io/sv4pt5/118.png","https://images.pokemontcg.io/sv4pt5/118_hires.png","Legal","Legal","Legal","Colorless","1","","","","","","","Swift","Water, Colorless","2","30","This attack's damage isn't affected by Weakness or Resistance, or by any effects on your opponent's Active Pokémon.","","","","","","Lightning","×2"
"sv4pt5-119","Starmie","Pokémon","90","Water","","Staryu","119","Shigenori Negishi","Shiny Rare","Starmie swims by spinning its body at high speed. As this Pokémon cruises through the ocean, it absorbs tiny plankton.","121","G","https://images.pokemontcg.io/sv4pt5/119.png","https://images.pokemontcg.io/sv4pt5/119_hires.png","Legal","Legal","Legal","Colorless","1","Mysterious Comet","Once during your turn, you may put 2 damage counters on 1 of your opponent's Pokémon. If you placed any damage counters in this way, discard this Pokémon and all attached cards.","Ability","","","","Speed Attack","Water, Colorless","2","50","","","","","","","Lightning","×2"
"sv4pt5-120","Paldean Tauros","Pokémon","130","Water","",,"120","GOSSAN","Shiny Rare","It swims by jetting water from its horns. The most notable characteristic of the Aqua Breed is its high body fat, which allows it to float easily.","128","G","https://images.pokemontcg.io/sv4pt5/120.png","https://images.pokemontcg.io/sv4pt5/120_hires.png","Legal","Legal","Legal","Colorless, Colorless","2","","","","","","","Raging Horns","Colorless, Colorless","2","20+","This attack does 10 more damage for each damage counter on this Pokémon.","Aqua Dive","Water, Colorless, Colorless","3","","This attack does 60 damage to 1 of your opponent's Pokémon. (Don't apply Weakness and Resistance for Benched Pokémon.)","Lightning","×2"
"sv4pt5-121","Wiglett","Pokémon","50","Water","",,"121","Misa Tsutsui","Shiny Rare","This Pokémon can pick up the scent of a Veluza just over 65 feet away and will hide itself in the sand.","960","G","https://images.pokemontcg.io/sv4pt5/121.png","https://images.pokemontcg.io/sv4pt5/121_hires.png","Legal","Legal","Legal","Colorless","1","","","","","","","Twisting Strike","Water","1","10","Flip a coin. If heads, during your opponent's next turn, prevent all damage from and effects of attacks done to this Pokémon.","","","","","","Lightning","×2"
"sv4pt5-122","Wugtrio","Pokémon","90","Water","","Wiglett","122","Kyoko Umemoto","Shiny Rare","It has a vicious temperament, contrary to what its appearance may suggest. It wraps its long bodies around prey, then drags the prey into its den.","961","G","https://images.pokemontcg.io/sv4pt5/122.png","https://images.pokemontcg.io/sv4pt5/122_hires.png","Legal","Legal","Legal","Colorless, Colorless","2","","","","","","","Headbutt","Water","1","30","","Undersea Tunnel","Colorless, Colorless, Colorless","3","","Flip 3 coins. For each heads, discard the top 3 cards of your opponent's deck.","Lightning","×2"
"sv4pt5-123","Finizen","Pokémon","50","Water","",,"123","kurumitsu","Shiny Rare","It likes playing with others of its kind using the water ring on its tail. It uses ultrasonic waves to sense the emotions of other living creatures.","963","G","https://images.pokemontcg.io/sv4pt5/123.png","https://images.pokemontcg.io/sv4pt5/123_hires.png","Legal","Legal","Legal","Colorless, Colorless","2","","","","","","","Valiant Evolution","Water","1","","Switch this Pokémon with 1 of your Benched Pokémon. If you do, search your deck for a card that evolves from this Pokémon and put it onto this Pokémon to evolve it. Then, shuffle your deck.","Razor Fin","Water","1","10","","Lightning","×2"
"sv4pt5-124","Palafin","Pokémon","150","Water","","Finizen","124","Shin Nagasawa","Shiny Rare","This Pokémon's ancient genes have awakened. It is now so extraordinarily strong that it can easily lift a cruise ship with one fin.","964","G","https://images.pokemontcg.io/sv4pt5/124.png","https://images.pokemontcg.io/sv4pt5/124_hires.png","Legal","Legal","Legal","Colorless, Colorless","2","","","","","","","Jet Punch","Water","1","30","This attack also does 30 damage to 1 of your opponent's Benched Pokémon. (Don't apply Weakness and Resistance for Benched Pokémon.)","Justice Kick","Water, Water","2","210","If this Pokémon didn't move from the Bench to the Active Spot this turn, this attack does nothing.","Lightning","×2"
"sv4pt5-125","Veluza","Pokémon","130","Water","",,"125","Nelnal","Shiny Rare","When Veluza discards unnecessary flesh, its mind becomes honed and its psychic power increases. The spare flesh has a mild but delicious flavor.","976","G","https://images.pokemontcg.io/sv4pt5/125.png","https://images.pokemontcg.io/sv4pt5/125_hires.png","Legal","Legal","Legal","Colorless, Colorless","2","","","","","","","Ram","Water","1","20","","Slim Screw","Water, Colorless, Colorless, Colorless","4","120","If you have no cards in your hand, this attack can be used for Water.","Lightning","×2"
"sv4pt5-126","Dondozo","Pokémon","160","Water","",,"126","Shigenori Negishi","Shiny Rare","This Pokémon is a glutton, but it's bad at getting food. It teams up with a Tatsugiri to catch prey.","977","G","https://images.pokemontcg.io/sv4pt5/126.png","https://images.pokemontcg.io/sv4pt5/126_hires.png","Legal","Legal","Legal","Colorless, Colorless, Colorless, Colorless","4","","","","","","","Release Rage","Colorless, Colorless","2","50×","This attack does 50 damage for each Tatsugiri in your discard pile.","Heavy Splash","Water, Water, Colorless, Colorless","4","120","","Lightning","×2"
"sv4pt5-127","Tatsugiri","Pokémon","70","Water","",,"127","Kagemaru Himeno","Shiny Rare","This is a small dragon Pokémon. It lives inside the mouth of Dondozo to protect itself from enemies on the outside.","978","G","https://images.pokemontcg.io/sv4pt5/127.png","https://images.pokemontcg.io/sv4pt5/127_hires.png","Legal","Legal","Legal","Colorless","1","","","","","","","Mise en Place","Water","1","","Search your deck for up to 2 Basic Water Energy cards and attach them to 1 of your Basic Pokémon. Then, shuffle your deck.","Curl Up","Water","1","30","Put this Pokémon and all attached cards into your hand.","Lightning","×2"
"sv4pt5-128","Frigibax","Pokémon","70","Water","",,"128","Taira Akitsu","Shiny Rare","Frigibax absorbs heat through its dorsal fin and converts the heat into ice energy. The higher the temperature, the more energy Frigibax stores.","996","G","https://images.pokemontcg.io/sv4pt5/128.png","https://images.pokemontcg.io/sv4pt5/128_hires.png","Legal","Legal","Legal","Colorless, Colorless","2","","","","","","","Collect","Water","1","","Draw a card.","Beat","Water, Colorless","2","20","","Metal","×2"
"sv4pt5-129","Arctibax","Pokémon","90","Water","","Frigibax","129","Kouki Saitou","Shiny Rare","Arctibax freezes the air around it, protecting its face with an ice mask and turning its dorsal fin into a blade of ice.","997","G","https://images.pokemontcg.io/sv4pt5/129.png","https://images.pokemontcg.io/sv4pt5/129_hires.png","Legal","Legal","Legal","Colorless, Colorless","2","","","","","","","Sharp Fin","Water, Colorless","2","40","","Frost Smash","Water, Water, Colorless","3","80","","Metal","×2"
"sv4pt5-130","Baxcalibur","Pokémon","160","Water","","Arctibax","130","GOSSAN","Shiny Rare","This Pokémon blasts cryogenic air out from its mouth. This air can instantly freeze even liquid-hot lava.","998","G","https://images.pokemontcg.io/sv4pt5/130.png","https://images.pokemontcg.io/sv4pt5/130_hires.png","Legal","Legal","Legal","Colorless, Colorless","2","Super Cold","As often as you like during your turn, you may attach a Basic Water Energy card from your hand to 1 of your Pokémon.","Ability","","","","Buster Tail","Water, Water, Colorless","3","130","","","","","","","Metal","×2"
"sv4pt5-131","Pikachu","Pokémon","70","Lightning","Raichu",,"131","Yuu Nishida","Shiny Rare","﻿When it is angered, it immediately discharges the energy stored in the pouches in its cheeks.","25","G","https://images.pokemontcg.io/sv4pt5/131.png","https://images.pokemontcg.io/sv4pt5/131_hires.png","Legal","Legal","Legal","Colorless","1","","","","","","","Growl","Colorless","1","","During your opponent's next turn, the Defending Pokémon's attacks do 20 less damage (before applying Weakness and Resistance).","Pika Bolt","Lightning, Colorless","2","30","","Fighting","×2"
"sv4pt5-132","Raichu","Pokémon","120","Lightning","","Pikachu","132","Sanosuke Sakuma","Shiny Rare","Its tail discharges electricity into the ground, protecting it from getting shocked.","26","G","https://images.pokemontcg.io/sv4pt5/132.png","https://images.pokemontcg.io/sv4pt5/132_hires.png","Legal","Legal","Legal","Colorless","1","Electrical Grounding","When 1 of your Pokémon is Knocked Out by damage from an attack from your opponent's Pokémon, you may move a Lightning Energy from that Pokémon to this Pokémon.","Ability","","","","Thunder","Lightning, Lightning, Colorless","3","180","This Pokémon also does 50 damage to itself.","","","","","","Fighting","×2"
"sv4pt5-133","Voltorb","Pokémon","60","Lightning","Electrode",,"133","Misa Tsutsui","Shiny Rare","It rolls to move. If the ground is uneven, a sudden jolt from hitting a bump can cause it to explode.","100","G","https://images.pokemontcg.io/sv4pt5/133.png","https://images.pokemontcg.io/sv4pt5/133_hires.png","Legal","Legal","Legal","Colorless","1","","","","","","","Tumbling Attack","Lightning","1","10+","Flip a coin. If heads, this attack does 20 more damage.","","","","","","Fighting","×2"
"sv4pt5-134","Electrode","Pokémon","90","Lightning","","Voltorb","134","Masakazu Fukuda","Shiny Rare","The more energy it charges up, the faster it gets. But this also makes it more likely to explode.","101","G","https://images.pokemontcg.io/sv4pt5/134.png","https://images.pokemontcg.io/sv4pt5/134_hires.png","Legal","Legal","Legal","Colorless","1","","","","","","","Bang Boom Chain","Lightning","1","20+","Before doing damage, you may discard any number of Pokémon Tools from your Pokémon. This attack does 40 more damage for each card you discarded in this way.","Electro Ball","Lightning, Colorless","2","70","","Fighting","×2"
"sv4pt5-135","Shinx","Pokémon","70","Lightning","Luxio",,"135","Saya Tsuruta","Shiny Rare","The extension and contraction of its muscles generates electricity. It glows when in trouble.","403","G","https://images.pokemontcg.io/sv4pt5/135.png","https://images.pokemontcg.io/sv4pt5/135_hires.png","Legal","Legal","Legal","Colorless","1","","","","","","","Wild Kick","Lightning","1","30","Flip a coin. If tails, this attack does nothing.","","","","","","Fighting","×2"
"sv4pt5-136","Luxio","Pokémon","90","Lightning","Luxray","Shinx","136","Souichirou Gunjima","Shiny Rare","Strong electricity courses through the tips of its sharp claws. A light scratch causes fainting in foes.","404","G","https://images.pokemontcg.io/sv4pt5/136.png","https://images.pokemontcg.io/sv4pt5/136_hires.png","Legal","Legal","Legal","Colorless","1","","","","","","","Zap Kick","Lightning","1","30","","Head Bolt","Lightning, Colorless, Colorless","3","60","","Fighting","×2"
"sv4pt5-137","Luxray","Pokémon","150","Lightning","","Luxio","137","kantaro","Shiny Rare","It can see clearly through walls to track down its prey and seek its lost young.","405","G","https://images.pokemontcg.io/sv4pt5/137.png","https://images.pokemontcg.io/sv4pt5/137_hires.png","Legal","Legal","Legal","Colorless","1","Swelling Flash","Once during your turn, if this Pokémon is in your hand and you have more Prize cards remaining than your opponent, you may put this Pokémon onto your Bench.","Ability","","","","Wild Charge","Lightning, Colorless, Colorless","3","180","This Pokémon also does 20 damage to itself.","","","","","","Fighting","×2"
"sv4pt5-138","Pachirisu","Pokémon","70","Lightning","",,"138","saino misaki","Shiny Rare","A pair may be seen rubbing their cheek pouches together in an effort to share stored electricity.","417","G","https://images.pokemontcg.io/sv4pt5/138.png","https://images.pokemontcg.io/sv4pt5/138_hires.png","Legal","Legal","Legal","Colorless","1","Electricity Pouches","This Pokémon can't be Paralyzed.","Ability","","","","Everyone Discharge","Lightning, Colorless","2","10+","This attack does 20 more damage for each of your Benched Lightning Pokémon. This attack's damage isn't affected by Weakness.","","","","","","Fighting","×2"
"sv4pt5-139","Thundurus","Pokémon","110","Lightning","",,"139","Shin Nagasawa","Shiny Rare","As it flies around, it shoots lightning all over the place and causes forest fires. It is therefore disliked.","642","G","https://images.pokemontcg.io/sv4pt5/139.png","https://images.pokemontcg.io/sv4pt5/139_hires.png","Legal","Legal","Legal","Colorless, Colorless","2","Adverse Weather","As long as this Pokémon is in the Active Spot, prevent all damage done to your Benched Pokémon by attacks from your opponent's Pokémon.","Ability","","","","Gigantic Bolt","Lightning, Lightning","2","140","This Pokémon also does 90 damage to itself.","","","","","","Fighting","×2"
"sv4pt5-140","Toxel","Pokémon","70","Lightning","Toxtricity",,"140","Lee HyunJung","Shiny Rare","It has no problem drinking dirty water. An organ inside Toxel's body filters such water into a poisonous liquid that is harmless to Toxel.","848","G","https://images.pokemontcg.io/sv4pt5/140.png","https://images.pokemontcg.io/sv4pt5/140_hires.png","Legal","Legal","Legal","Colorless","1","","","","","","","Slight Intrusion","Lightning","1","30","This Pokémon also does 10 damage to itself.","","","","","","Fighting","×2"
