"id","name","supertype","hp","types","evolvesTo","evolvesFrom","number","artist","rarity","flavorText","nationalPokedexNumbers","regulationMark","imageSmall","imageLarge","legalitiesUnlimited","legalitiesStandard","legalitiesExpanded","retreatCost","convertedRetreatCost","Ability1Name","Ability1Text","Ability1Type","Ability2Name","Ability2Text","Ability2Type","Attack1Name","Attack1Cost","Attack1ConvertedCost","Attack1Damage","Attack1Text","Attack2Name","Attack2Cost","Attack2ConvertedCost","Attack2Damage","Attack2Text","Weakness1Type","Weakness1Value"
"bw2-1","Pansage","Pokemon","70","Grass","Simisage",,"1","Kouki Saitou","Common","This Pokemon dwells deep in the forest. Eating a leaf from its head whisks weariness away as if by magic.","511",,"https://images.pokemontcg.io/bw2/1.png","https://images.pokemontcg.io/bw2/1_hires.png","Legal",,"Legal","Colorless","1","","","","","","","Collect","Colorless","1","","Draw a card.","Scratch","Colorless, Colorless","2","20","","Fire","x2"
"bw2-2","Simisage","Pokemon","90","Grass","","Pansage","2","match","Rare","Ill tempered, it fights by swinging its barbed tail around wildly. The leaf growing on its head is very bitter.","512",,"https://images.pokemontcg.io/bw2/2.png","https://images.pokemontcg.io/bw2/2_hires.png","Legal",,"Legal","Colorless, Colorless","2","","","","","","","Fire's Power","Colorless, Colorless","2","30","If this Pokemon has any Fire Energy attached to it, the Defending Pokemon is now Burned.","Seed Bomb","Grass, Colorless, Colorless","3","60","","Fire","x2"
"bw2-3","Sewaddle","Pokemon","40","Grass","Swadloon",,"3","Kagemaru Himeno","Common","Leavanny dress it in clothes they made for it when it hatched. It hides its head in its hood while it is sleeping.","540",,"https://images.pokemontcg.io/bw2/3.png","https://images.pokemontcg.io/bw2/3_hires.png","Legal",,"Legal","Colorless","1","","","","","","","Tackle","Colorless","1","10","","String Shot","Grass","1","","Flip a coin. If heads, the Defending Pokemon is now Paralyzed.","Fire","x2"
"bw2-4","Sewaddle","Pokemon","50","Grass","Swadloon",,"4","Naoki Saito","Common","This Pokemon makes clothes for itself. It chews up leaves and sews them with sticky thread extruded from its mouth.","540",,"https://images.pokemontcg.io/bw2/4.png","https://images.pokemontcg.io/bw2/4_hires.png","Legal",,"Legal","Colorless","1","","","","","","","Gnaw","Colorless","1","10","","Razor Leaf","Grass, Colorless","2","20","","Fire","x2"
"bw2-5","Swadloon","Pokemon","80","Grass","Leavanny","Sewaddle","5","Naoki Saito","Uncommon","It protects itself from the cold by wrapping up in leaves. It stays on the move, eating leaves in forests.","541",,"https://images.pokemontcg.io/bw2/5.png","https://images.pokemontcg.io/bw2/5_hires.png","Legal",,"Legal","Colorless","1","","","","","","","Gnaw","Colorless","1","20","","Double Razor Leaf","Grass, Colorless, Colorless","3","50x","Flip 2 coins. This attack does 50 damage times the number of heads.","Fire","x2"
"bw2-6","Swadloon","Pokemon","70","Grass","Leavanny","Sewaddle","6","MAHOU","Uncommon","Forests where Swadloon live have superb foliage because the nutrients they make from fallen leaves nourish the plant life.","541",,"https://images.pokemontcg.io/bw2/6.png","https://images.pokemontcg.io/bw2/6_hires.png","Legal",,"Legal","Colorless, Colorless","2","","","","","","","Grass Cocooning","Grass","1","","Heal 40 damage from this Pokemon.","Razor Leaf","Grass, Colorless","2","20","","Fire","x2"
"bw2-7","Leavanny","Pokemon","130","Grass","","Swadloon","7","Kouki Saitou","Rare","Upon finding a small Pokemon, it weaves clothing for it from leaves, using the cutters on its arms and sticky silk.","542",,"https://images.pokemontcg.io/bw2/7.png","https://images.pokemontcg.io/bw2/7_hires.png","Legal",,"Legal","Colorless","1","","","","","","","Nurturing","Colorless","1","","Choose 1 of your Pokemon. Search your deck for a card that evolves from that Pokemon and put it onto that Pokemon. (This counts as evolving that Pokemon.) Shuffle your deck afterward.","X-Scissor","Grass, Colorless","2","30+","Flip a coin. If heads, this attack does 50 more damage.","Fire","x2"
"bw2-8","Leavanny","Pokemon","130","Grass","","Swadloon","8","Masakazu Fukuda","Rare","It keeps its eggs warm with heat from fermenting leaves. It also uses leaves to make warm wrappings for Sewaddle.","542",,"https://images.pokemontcg.io/bw2/8.png","https://images.pokemontcg.io/bw2/8_hires.png","Legal",,"Legal","Colorless","1","","","","","","","Slash","Colorless","1","30","","Triple Cutter","Grass, Grass, Colorless","3","60x","Flip 3 coins. This attack does 60 damage times the number of heads.","Fire","x2"
"bw2-9","Cottonee","Pokemon","40","Grass","Whimsicott",,"9","Atsuko Nishida","Common","They go wherever the wind takes them. On rainy days, their bodies are heavier, so they take shelter beneath big trees.","546",,"https://images.pokemontcg.io/bw2/9.png","https://images.pokemontcg.io/bw2/9_hires.png","Legal",,"Legal","Colorless","1","","","","","","","Absorb","Grass","1","10","Heal 10 damage from this Pokemon.","","","","","","Fire","x2"
"bw2-10","Cottonee","Pokemon","50","Grass","Whimsicott",,"10","Kagemaru Himeno","Common","When attacked, it escapes by shooting cotton from its body. The cotton serves as a decoy to distract the attacker.","546",,"https://images.pokemontcg.io/bw2/10.png","https://images.pokemontcg.io/bw2/10_hires.png","Legal",,"Legal","Colorless","1","","","","","","","Cotton Guard","Grass","1","10","During your opponent's next turn, any damage done to this Pokemon by attacks is reduced by 10 (after applying Weakness and Resistance).","","","","","","Fire","x2"
"bw2-11","Whimsicott","Pokemon","80","Grass","","Cottonee","11","sui","Uncommon","Like the wind, it can slip through any gap, no matter how small. It leaves balls of white fluff behind.","547",,"https://images.pokemontcg.io/bw2/11.png","https://images.pokemontcg.io/bw2/11_hires.png","Legal",,"Legal","",,"","","","","","","Helping Hand","Colorless","1","","Search your deck for a basic Energy card and attach it to 1 of your Benched Pokemon. Shuffle your deck afterward.","Cotton Guard","Grass","1","30","During your opponent's next turn, any damage done to this Pokemon by attacks is reduced by 30 (after applying Weakness and Resistance).","Fire","x2"
"bw2-12","Whimsicott","Pokemon","80","Grass","","Cottonee","12","Mizue","Rare","Riding whirlwinds, they appear. These Pokemon sneak through gaps into houses and cause all sorts of mischief.","547",,"https://images.pokemontcg.io/bw2/12.png","https://images.pokemontcg.io/bw2/12_hires.png","Legal",,"Legal","Colorless","1","","","","","","","Encore","Colorless","1","20","Choose 1 of the Defending Pokemon's attacks. During your opponent's next turn, that Pokemon can only use that attack.","U-turn","Grass, Grass","2","40","Switch this Pokemon with 1 of your Benched Pokemon.","Fire","x2"
"bw2-13","Petilil","Pokemon","50","Grass","Lilligant",,"13","Sumiyoshi Kizuki","Common","The leaves on its head are very bitter. Eating one of these leaves is known to refresh a tired body.","548",,"https://images.pokemontcg.io/bw2/13.png","https://images.pokemontcg.io/bw2/13_hires.png","Legal",,"Legal","Colorless","1","","","","","","","Stun Spore","Grass","1","","Flip a coin. If heads, the Defending Pokemon is now Paralyzed.","Cut","Grass, Colorless","2","20","","Fire","x2"
"bw2-14","Lilligant","Pokemon","90","Grass","","Petilil","14","Shin Nagasawa","Uncommon","Even veteran Trainers face a challenge in getting its beautiful flower to bloom. This Pokemon is popular with celebrities.","549",,"https://images.pokemontcg.io/bw2/14.png","https://images.pokemontcg.io/bw2/14_hires.png","Legal",,"Legal","Colorless","1","","","","","","","Bemusing Aroma","Grass","1","20","Flip a coin. If heads, the Defending Pokemon is now Paralyzed and Poisoned. If tails, the Defending Pokemon is now Confused.","Cut","Grass, Colorless, Colorless","3","60","","Fire","x2"
"bw2-15","Deerling","Pokemon","60","Grass","Sawsbuck",,"15","sui","Common","The turning of the seasons changes the color and scent of this Pokemon's fur. People use it to mark the seasons.","585",,"https://images.pokemontcg.io/bw2/15.png","https://images.pokemontcg.io/bw2/15_hires.png","Legal",,"Legal","Colorless","1","","","","","","","Tackle","Colorless","1","10","","Wild Kick","Grass, Grass","2","40","Flip a coin. If tails, this attack does nothing.","Fire","x2"
"bw2-16","Sawsbuck","Pokemon","100","Grass","","Deerling","16","Kagemaru Himeno","Rare","The plants growing on its horns change according to the season. The leaders of the herd possess magnificent horns.","586",,"https://images.pokemontcg.io/bw2/16.png","https://images.pokemontcg.io/bw2/16_hires.png","Legal",,"Legal","Colorless, Colorless","2","","","","","","","Push Down","Colorless, Colorless","2","30","Your opponent switches the Defending Pokemon with 1 of his or her Benched Pokemon.","Take Down","Grass, Colorless","2","60","This Pokemon does 20 damage to itself.","Fire","x2"
"bw2-17","Virizion","Pokemon","100","Grass","",,"17","5ban Graphics","Rare Holo","This Pokemon fought humans in order to protect its friends. Legends about it continue to be passed down.","640",,"https://images.pokemontcg.io/bw2/17.png","https://images.pokemontcg.io/bw2/17_hires.png","Legal",,"Legal","Colorless","1","","","","","","","Giga Drain","Grass, Colorless","2","30","Heal from this Pokemon the same amount of damage you did to the Defending Pokemon.","Sacred Sword","Grass, Grass, Colorless","3","100","This Pokemon can't use Sacred Sword during your next turn.","Fire","x2"
"bw2-18","Pansear","Pokemon","70","Fire","Simisear",,"18","Masakazu Fukuda","Common","This Pokemon lives in caves in volcanoes. The fire within the tuft on its head can reach 600ยบ F.","513",,"https://images.pokemontcg.io/bw2/18.png","https://images.pokemontcg.io/bw2/18_hires.png","Legal",,"Legal","Colorless","1","","","","","","","Collect","Colorless","1","","Draw a card.","Scratch","Colorless, Colorless","2","20","","Water","x2"
"bw2-19","Simisear","Pokemon","90","Fire","","Pansear","19","Mitsuhiro Arita","Rare","A flame burns inside its body. It scatters embers from its head and tail to sear its opponents.","514",,"https://images.pokemontcg.io/bw2/19.png","https://images.pokemontcg.io/bw2/19_hires.png","Legal",,"Legal","Colorless","1","","","","","","","Water's Power","Colorless, Colorless","2","30","If this Pokemon has any Water Energy attached to it, the Defending Pokemon is now Asleep.","Flamethrower","Fire, Colorless, Colorless","3","70","Discard an Energy attached to this Pokemon.","Water","x2"
"bw2-20","Darumaka","Pokemon","70","Fire","Darmanitan",,"20","Mitsuhiro Arita","Common","When its internal fire is burning, it cannot calm down and it runs around. When the fire diminishes, it falls asleep.","554",,"https://images.pokemontcg.io/bw2/20.png","https://images.pokemontcg.io/bw2/20_hires.png","Legal",,"Legal","Colorless, Colorless","2","","","","","","","Tackle","Colorless","1","10","","Combustion","Fire, Colorless, Colorless","3","30","","Water","x2"
"bw2-21","Darmanitan","Pokemon","100","Fire","","Darumaka","21","Mitsuhiro Arita","Rare","Its internal fire burns at 2,500ยบ F, making enough power that it can destroy a dump truck with one punch.","555",,"https://images.pokemontcg.io/bw2/21.png","https://images.pokemontcg.io/bw2/21_hires.png","Legal",,"Legal","Colorless, Colorless, Colorless","3","","","","","","","Rock Smash","Colorless, Colorless","2","20+","Flip a coin. If heads, this attack does 20 more damage.","Fire Punch","Fire, Fire, Colorless, Colorless","4","70","The Defending Pokemon is now Burned.","Water","x2"
"bw2-22","Panpour","Pokemon","70","Water","Simipour",,"22","Kagemaru Himeno","Common","It does not thrive in dry environments. It keeps itself damp by shooting water stored in its head tuft from its tail.","515",,"https://images.pokemontcg.io/bw2/22.png","https://images.pokemontcg.io/bw2/22_hires.png","Legal",,"Legal","Colorless","1","","","","","","","Collect","Colorless","1","","Draw a card.","Scratch","Colorless, Colorless","2","20","","Lightning","x2"
"bw2-23","Simipour","Pokemon","90","Water","","Panpour","23","Sumiyoshi Kizuki","Rare","The tuft on its head holds water. When the level runs low, it replenishes the tuft by siphoning up water with its tail.","516",,"https://images.pokemontcg.io/bw2/23.png","https://images.pokemontcg.io/bw2/23_hires.png","Legal",,"Legal","Colorless","1","","","","","","","Grass' Power","Colorless, Colorless","2","30","If this Pokemon has any Grass Energy attached to it, heal 20 damage from this Pokemon.","Rushing Water","Water, Colorless, Colorless","3","60","Move an Energy attached to the Defending Pokemon to 1 of your opponent's Benched Pokemon.","Lightning","x2"
"bw2-24","Basculin","Pokemon","80","Water","",,"24","match","Common","Red and blue Basculin get along so poorly, they'll start fighting instantly. These Pokemon are very hostile.","550",,"https://images.pokemontcg.io/bw2/24.png","https://images.pokemontcg.io/bw2/24_hires.png","Legal",,"Legal","Colorless","1","","","","","","","Flail","Colorless","1","10x","Does 10 damage times the number of damage counters on this Pokemon.","Final Gambit","Water, Colorless, Colorless","3","80","Flip 2 coins. If both of them are tails, this Pokemon does 80 damage to itself.","Lightning","x2"
"bw2-25","Basculin","Pokemon","80","Water","",,"25","Akira Komayama","Uncommon","Red and blue Basculin usually do not get along, but sometimes members of one school mingle with the other's school.","550",,"https://images.pokemontcg.io/bw2/25.png","https://images.pokemontcg.io/bw2/25_hires.png","Legal",,"Legal","Colorless","1","","","","","","","Tackle","Colorless","1","10","","Splatter","Water, Colorless","2","","Does 30 damage to 1 of your opponent's Pokemon. (Don't apply Weakness and Resistance for Benched Pokemon.)","Lightning","x2"
"bw2-26","Ducklett","Pokemon","60","Water","Swanna",,"26","MAHOU","Common","When attacked, it uses its feathers to splash water, escaping under cover of the spray.","580",,"https://images.pokemontcg.io/bw2/26.png","https://images.pokemontcg.io/bw2/26_hires.png","Legal",,"Legal","Colorless","1","","","","","","","Roost","Colorless","1","","Heal 40 damage from this Pokemon. This Pokemon can't retreat during your next turn.","Rain Splash","Water, Water","2","20","","Lightning","x2"
"bw2-27","Swanna","Pokemon","90","Water","","Ducklett","27","Atsuko Nishida","Rare","It administers sharp, powerful pecks with its bill. It whips its long neck to deliver forceful repeated strikes.","581",,"https://images.pokemontcg.io/bw2/27.png","https://images.pokemontcg.io/bw2/27_hires.png","Legal",,"Legal","Colorless","1","","","","","","","Wing Dance","Colorless, Colorless","2","30","Flip a coin. If heads, prevent all effects of attacks, including damage, done to this Pokemon during your opponent's next turn.","Air Slash","Water, Colorless, Colorless","3","70","Discard an Energy attached to this Pokemon.","Lightning","x2"
"bw2-28","Cubchoo","Pokemon","70","Water","Beartic",,"28","sui","Common","When it is not feeling well, its mucus gets watery and the power of its Ice-type moves decreases.","613",,"https://images.pokemontcg.io/bw2/28.png","https://images.pokemontcg.io/bw2/28_hires.png","Legal",,"Legal","Colorless, Colorless","2","","","","","","","Powder Snow","Water","1","10","Flip a coin. If heads, the Defending Pokemon is now Asleep.","Rest","Colorless, Colorless","2","","Heal 60 damage from this Pokemon. This Pokemon is now Asleep.","Metal","x2"
"bw2-29","Cubchoo","Pokemon","70","Water","Beartic",,"29","Kanako Eo","Common","Its nose is always running. It sniffs the snot back up because the mucus provides the raw material for its moves.","613",,"https://images.pokemontcg.io/bw2/29.png","https://images.pokemontcg.io/bw2/29_hires.png","Legal",,"Legal","Colorless, Colorless","2","","","","","","","Icicle Punch","Water, Water","2","30","","","","","","","Metal","x2"
"bw2-30","Beartic","Pokemon","130","Water","","Cubchoo","30","Kouki Saitou","Rare Holo","It can make its breath freeze at will. Very able in the water, it swims around in northern seas and catches prey.","614",,"https://images.pokemontcg.io/bw2/30.png","https://images.pokemontcg.io/bw2/30_hires.png","Legal",,"Legal","Colorless, Colorless, Colorless","3","","","","","","","Sheer Cold","Water, Colorless, Colorless","3","50","The Defending Pokemon can't attack during your opponent's next turn.","Icicle Crash","Water, Water, Colorless, Colorless","4","80","This attack's damage isn't affected by Resistance.","Metal","x2"
"bw2-31","Beartic","Pokemon","130","Water","","Cubchoo","31","Kagemaru Himeno","Rare","It freezes its breath to create fangs and claws of ice to fight with. Cold northern areas are its habitat.","614",,"https://images.pokemontcg.io/bw2/31.png","https://images.pokemontcg.io/bw2/31_hires.png","Legal",,"Legal","Colorless, Colorless","2","","","","","","","Icy Wind","Water","1","30","The Defending Pokemon is now Asleep.","Superpower","Water, Water, Colorless","3","60+","You may do 20 more damage. If you do, this Pokemon does 20 damage to itself.","Metal","x2"
"bw2-32","Emolga","Pokemon","70","Lightning","",,"32","Kouki Saitou","Common","The energy made in its cheeks' electric pouches is stored inside its membranes and released while it is gliding.","587",,"https://images.pokemontcg.io/bw2/32.png","https://images.pokemontcg.io/bw2/32_hires.png","Legal",,"Legal","",,"","","","","","","Thundershock","Lightning","1","10","Flip a coin. If heads, the Defending Pokemon is now Paralyzed.","Acrobatics","Colorless, Colorless","2","10+","Flip 2 coins. This attack does 20 more damage for each heads.","Fighting","x2"
"bw2-33","Joltik","Pokemon","40","Lightning","Galvantula",,"33","Kagemaru Himeno","Common","Joltik that live in cities have learned a technique for sucking electricity from the outlets in houses.","595",,"https://images.pokemontcg.io/bw2/33.png","https://images.pokemontcg.io/bw2/33_hires.png","Legal",,"Legal","Colorless","1","","","","","","","Gnaw","Colorless","1","10","","","","","","","Fighting","x2"
"bw2-34","Galvantula","Pokemon","80","Lightning","","Joltik","34","Kagemaru Himeno","Uncommon","When attacked, they create an electric barrier by spitting out many electrically charged threads.","596",,"https://images.pokemontcg.io/bw2/34.png","https://images.pokemontcg.io/bw2/34_hires.png","Legal",,"Legal","",,"","","","","","","Gnaw","Colorless","1","20","","Stun Needle","Lightning, Colorless","2","30","Flip a coin. If heads, the Defending Pokemon is now Paralyzed.","Fighting","x2"
"bw2-35","Thundurus","Pokemon","110","Lightning","",,"35","5ban Graphics","Rare Holo","The spikes on its tail discharge immense bolts of lightning. It flies around the Unova region firing off lightning bolts.","642",,"https://images.pokemontcg.io/bw2/35.png","https://images.pokemontcg.io/bw2/35_hires.png","Legal",,"Legal","Colorless","1","","","","","","","Charge","Colorless","1","","Search your deck for a Lightning Energy card and attach it to this Pokemon. Shuffle your deck afterward.","Disaster Volt","Lightning, Lightning, Colorless","3","80","Discard an Energy attached to this Pokemon.","Fighting","x2"
"bw2-36","Woobat","Pokemon","60","Psychic","Swoobat",,"36","Masakazu Fukuda","Common","Its habitat is dark forests and caves. It emits ultrasonic waves from its nose to learn about its surroundings.","527",,"https://images.pokemontcg.io/bw2/36.png","https://images.pokemontcg.io/bw2/36_hires.png","Legal",,"Legal","Colorless","1","","","","","","","Psy Bolt","Psychic, Colorless","2","20","Flip a coin. If heads, the Defending Pokemon is now Paralyzed.","","","","","","Psychic","x2"
"bw2-37","Swoobat","Pokemon","90","Psychic","","Woobat","37","Shigenori Negishi","Rare","Anyone who comes into contact with the ultrasonic waves emitted by a courting male experiences a positive mood shift.","528",,"https://images.pokemontcg.io/bw2/37.png","https://images.pokemontcg.io/bw2/37_hires.png","Legal",,"Legal","Colorless","1","","","","","","","Psyshot","Psychic","1","30","","Phat Sound","Psychic, Colorless","2","","Flip 3 coins. This attack does 10 damage times the number of heads to each of your opponent's Pokemon. (Don't apply Weakness and Resistance for Benched Pokemon.)","Lightning","x2"
"bw2-38","Venipede","Pokemon","70","Psychic","Whirlipede",,"38","Kouki Saitou","Common","It discovers what is going on around it by using the feelers on its head and tail. It is brutally aggressive.","543",,"https://images.pokemontcg.io/bw2/38.png","https://images.pokemontcg.io/bw2/38_hires.png","Legal",,"Legal","Colorless, Colorless","2","","","","","","","Poison Sting","Psychic","1","","Flip a coin. If heads, the Defending Pokemon is now Poisoned.","Tackle","Colorless, Colorless","2","20","","Psychic","x2"
"bw2-39","Whirlipede","Pokemon","90","Psychic","Scolipede","Venipede","39","Shin Nagasawa","Uncommon","It is usually motionless, but when attacked, it rotates at high speed and then crashes into its opponent.","544",,"https://images.pokemontcg.io/bw2/39.png","https://images.pokemontcg.io/bw2/39_hires.png","Legal",,"Legal","Colorless, Colorless, Colorless","3","","","","","","","Venoshock","Psychic","1","10+","If the Defending Pokemon is Poisoned, this attack does 60 more damage.","Steamroller","Colorless, Colorless, Colorless","3","40","This attack's damage isn't affected by Resistance.","Psychic","x2"
"bw2-40","Scolipede","Pokemon","140","Psychic","","Whirlipede","40","kawayoo","Rare","With quick movements, it chases down its foes, attacking relentlessly with its horns until it prevails.","545",,"https://images.pokemontcg.io/bw2/40.png","https://images.pokemontcg.io/bw2/40_hires.png","Legal",,"Legal","Colorless, Colorless","2","","","","","","","Toxic Claws","Psychic, Colorless","2","30","The Defending Pokemon is now Poisoned. Put 2 damage counters instead of 1 on that Pokemon between turns.","Wild Horn","Psychic, Colorless, Colorless","3","50+","Flip 2 coins. This attack does 20 more damage for each heads.","Psychic","x2"
"bw2-41","Sigilyph","Pokemon","90","Psychic","",,"41","Midori Harada","Uncommon","The guardians of an ancient city, they use their psychic power to attack enemies that invade their territory.","561",,"https://images.pokemontcg.io/bw2/41.png","https://images.pokemontcg.io/bw2/41_hires.png","Legal",,"Legal","Colorless","1","","","","","","","Reflect","Psychic","1","","During your opponent's next turn, any damage done to this Pokemon by attacks is reduced by 40 (after applying Weakness and Resistance).","Telekinesis","Psychic, Colorless, Colorless","3","","Does 50 damage to 1 of your opponent's Pokemon. This attack's damage isn't affected by Weakness or Resistance.","Lightning","x2"
"bw2-42","Sigilyph","Pokemon","90","Psychic","",,"42","match","Uncommon","They never vary the route they fly, because their memories of guarding an ancient city remain steadfast.","561",,"https://images.pokemontcg.io/bw2/42.png","https://images.pokemontcg.io/bw2/42_hires.png","Legal",,"Legal","Colorless","1","","","","","","","Quick Turn","Psychic","1","10x","Flip 2 coins. This attack does 10 damage times the number of heads.","Psychic Assault","Colorless, Colorless, Colorless","3","40+","Does 10 more damage for each damage counter on the Defending Pokemon.","Lightning","x2"
"bw2-43","Gothita","Pokemon","60","Psychic","Gothorita",,"43","MAHOU","Common","Their ribbonlike feelers increase their psychic power. They are always staring at something.","574",,"https://images.pokemontcg.io/bw2/43.png","https://images.pokemontcg.io/bw2/43_hires.png","Legal",,"Legal","Colorless","1","","","","","","","Hypnotic Gaze","Colorless","1","","The Defending Pokemon is now Asleep.","Double Slap","Colorless, Colorless","2","20x","Flip 2 coins. This attack does 20 damage times the number of heads.","Psychic","x2"
"bw2-44","Gothita","Pokemon","60","Psychic","Gothorita",,"44","sui","Common","They intently observe both Trainers and Pokemon. Apparently, they are looking at something that only Gothita can see.","574",,"https://images.pokemontcg.io/bw2/44.png","https://images.pokemontcg.io/bw2/44_hires.png","Legal",,"Legal","Colorless","1","","","","","","","Smack","Colorless, Colorless","2","20","","","","","","","Psychic","x2"
"bw2-45","Gothorita","Pokemon","80","Psychic","Gothitelle","Gothita","45","Atsuko Nishida","Uncommon","They use hypnosis to control people and Pokemon. Tales of Gothorita leading people astray are told in every corner.","575",,"https://images.pokemontcg.io/bw2/45.png","https://images.pokemontcg.io/bw2/45_hires.png","Legal",,"Legal","Colorless","1","","","","","","","Double Slap","Colorless","1","20x","Flip 2 coins. This attack does 20 damage times the number of heads.","Psybeam","Psychic, Colorless","2","20","The Defending Pokemon is now Confused.","Psychic","x2"
"bw2-46","Gothorita","Pokemon","80","Psychic","Gothitelle","Gothita","46","Naoki Saito","Uncommon","Starlight is the source of their power. At night, they mark star positions by using psychic power to float stones.","575",,"https://images.pokemontcg.io/bw2/46.png","https://images.pokemontcg.io/bw2/46_hires.png","Legal",,"Legal","Colorless","1","","","","","","","Deleting Glare","Psychic","1","","Flip a coin. If heads, discard an Energy attached to 1 of your opponent's Pokemon.","Super Psy Bolt","Psychic, Colorless, Colorless","3","50","","Psychic","x2"
