"id","name","supertype","hp","types","evolvesTo","evolvesFrom","number","artist","rarity","flavorText","nationalPokedexNumbers","regulationMark","imageSmall","imageLarge","legalitiesUnlimited","legalitiesStandard","legalitiesExpanded","retreatCost","convertedRetreatCost","Ability1Name","Ability1Text","Ability1Type","Ability2Name","Ability2Text","Ability2Type","Attack1Name","Attack1Cost","Attack1ConvertedCost","Attack1Damage","Attack1Text","Attack2Name","Attack2Cost","Attack2ConvertedCost","Attack2Damage","Attack2Text","Weakness1Type","Weakness1Value"
"bw4-48","Zebstrika","Pokémon","90","Lightning","","Blitzle","48","Naoki Saito","Rare","They have lightning-like movements. When Zebstrika run at full speed, the sound of thunder reverberates.","523",,"https://images.pokemontcg.io/bw4/48.png","https://images.pokemontcg.io/bw4/48_hires.png","Legal",,"Legal","",,"","","","","","","Disconnect","Lightning, Colorless","2","40","Your opponent can't play any Item cards from his or her hand during your opponent's next turn.","Lightning Crash","Lightning, Lightning, Colorless","3","","Discard all Lightning Energy attached to this Pokémon. This attack does 80 damage to 1 of your opponent's Pokémon. (Don't apply Weakness and Resistance for Benched Pokémon.)","Fighting","×2"
"bw4-49","Emolga","Pokémon","70","Lightning","",,"49","Akira Komayama","Uncommon","The energy made in its cheeks' electric pouches is stored inside its membrane and released while it is gliding.","587",,"https://images.pokemontcg.io/bw4/49.png","https://images.pokemontcg.io/bw4/49_hires.png","Legal",,"Legal","Colorless","1","","","","","","","Bounce","Lightning, Colorless","2","30","Switch this Pokémon with 1 of your Benched Pokémon.","","","","","","Fighting","×2"
"bw4-50","Zekrom","Pokémon","130","Lightning","",,"50","5ban Graphics","Rare","This Pokémon appears in legends. In its tail, it has a giant generator that creates electricity.","644",,"https://images.pokemontcg.io/bw4/50.png","https://images.pokemontcg.io/bw4/50_hires.png","Legal",,"Legal","Colorless, Colorless","2","","","","","","","Outrage","Colorless, Colorless","2","20+","Does 10 more damage for each damage counter on this Pokémon.","Bolt Strike","Lightning, Lightning, Colorless","3","120","This Pokémon does 40 damage to itself.","Fighting","×2"
"bw4-51","Zekrom-EX","Pokémon","180","Lightning","",,"51","Shizurow","Rare Holo EX",,"644",,"https://images.pokemontcg.io/bw4/51.png","https://images.pokemontcg.io/bw4/51_hires.png","Legal",,"Legal","Colorless, Colorless, Colorless","3","","","","","","","Glinting Claw","Lightning, Colorless, Colorless","3","50+","Flip a coin. If heads, this attack does 30 more damage.","Strong Volt","Lightning, Lightning, Colorless, Colorless","4","150","Discard 2 Energy attached to this Pokémon.","Fighting","×2"
"bw4-52","Grimer","Pokémon","70","Psychic","Muk",,"52","Kagemaru Himeno","Common","It was born when sludge in a dirty stream was exposed to the moon's X-rays. It appears among filth.","88",,"https://images.pokemontcg.io/bw4/52.png","https://images.pokemontcg.io/bw4/52_hires.png","Legal",,"Legal","Colorless, Colorless","2","","","","","","","Nasty Goo","Psychic, Colorless","2","20","Flip a coin. If heads, the Defending Pokémon is now Paralyzed.","","","","","","Psychic","×2"
"bw4-53","Muk","Pokémon","110","Psychic","","Grimer","53","match","Rare","A toxic fluids seeps from its body. The fluid instantly kills plants and trees on contact.","89",,"https://images.pokemontcg.io/bw4/53.png","https://images.pokemontcg.io/bw4/53_hires.png","Legal",,"Legal","Colorless, Colorless, Colorless, Colorless","4","","","","","","","Gentle Wrap","Psychic, Colorless","2","20","The Defending Pokémon can't retreat during your opponent's next turn.","Toxic Secretion","Psychic, Colorless, Colorless, Colorless","4","60","The Defending Pokémon is now Poisoned. Put 2 damage counters instead of 1 on that Pokémon between turns.","Psychic","×2"
"bw4-54","Mewtwo-EX","Pokémon","170","Psychic","M Mewtwo-EX",,"54","Shizurow","Rare Holo EX",,"150",,"https://images.pokemontcg.io/bw4/54.png","https://images.pokemontcg.io/bw4/54_hires.png","Legal",,"Legal","Colorless, Colorless","2","","","","","","","X Ball","Colorless, Colorless","2","20×","Does 20 damage times the amount of Energy attached to this Pokémon and the Defending Pokémon.","Psydrive","Psychic, Psychic, Colorless","3","120","Discard an Energy attached to this Pokémon.","Psychic","×2"
"bw4-55","Ralts","Pokémon","60","Psychic","Kirlia",,"55","Mitsuhiro Arita","Common","If its horns capture the warm feelings of people or Pokémon, its body warms up slightly.","280",,"https://images.pokemontcg.io/bw4/55.png","https://images.pokemontcg.io/bw4/55_hires.png","Legal",,"Legal","Colorless","1","","","","","","","Psyshot","Psychic","1","10","","Smack","Colorless, Colorless","2","20","","Psychic","×2"
"bw4-56","Kirlia","Pokémon","80","Psychic","Gardevoir, Gallade","Ralts","56","MAHOU","Uncommon","If its Trainer becomes happy, it overflows with energy, dancing joyously while spinning about.","281",,"https://images.pokemontcg.io/bw4/56.png","https://images.pokemontcg.io/bw4/56_hires.png","Legal",,"Legal","Colorless","1","","","","","","","Smack","Colorless, Colorless","2","20","","Psychic","Psychic, Colorless, Colorless","3","40+","Does 10 more damage for each Energy attached to the Defending Pokémon.","Psychic","×2"
"bw4-57","Gardevoir","Pokémon","110","Psychic","","Kirlia","57","Mizue","Rare Holo","To protect its Trainer, it will expend all its psychic power to create a small black hole.","282",,"https://images.pokemontcg.io/bw4/57.png","https://images.pokemontcg.io/bw4/57_hires.png","Legal",,"Legal","Colorless, Colorless","2","Psychic Mirage","Each basic Psychic Energy attached to your Psychic Pokémon provides PsychicPsychic Energy. You can't apply more than 1 Psychic Mirage Ability at a time.","Ability","","","","Mind Shock","Psychic, Psychic, Colorless, Colorless","4","60","This attack's damage isn't affected by Weakness or Resistance.","","","","","","Psychic","×2"
"bw4-58","Munna","Pokémon","70","Psychic","Musharna",,"58","Mitsuhiro Arita","Common","It eats the dreams of people and Pokémon. When it eats a pleasant dream, it expels pink-colored mist.","517",,"https://images.pokemontcg.io/bw4/58.png","https://images.pokemontcg.io/bw4/58_hires.png","Legal",,"Legal","Colorless, Colorless","2","","","","","","","Ram","Colorless, Colorless","2","20","","","","","","","Psychic","×2"
"bw4-59","Musharna","Pokémon","100","Psychic","","Munna","59","Maiko Fujiwara","Rare","With the mist from its forehead, it can create shapes of things from dreams it has eaten.","518",,"https://images.pokemontcg.io/bw4/59.png","https://images.pokemontcg.io/bw4/59_hires.png","Legal",,"Legal","Colorless, Colorless, Colorless","3","Forewarn","Once during your turn (before your attack), you may look at the top 2 cards of your deck, choose 1 of them, and put it into your hand. Put the other card back on top of your deck.","Ability","","","","Fluffy Dream","Psychic, Psychic","2","40","This Pokémon is now Asleep.","","","","","","Psychic","×2"
"bw4-60","Darmanitan","Pokémon","110","Psychic","","Darumaka","60","Shin Nagasawa","Rare","When weakened in battle, it transforms into a stone statue. Then it sharpens its mind and fights on mentally.","555",,"https://images.pokemontcg.io/bw4/60.png","https://images.pokemontcg.io/bw4/60_hires.png","Legal",,"Legal","Colorless, Colorless, Colorless","3","","","","","","","Synchrodraw","Psychic","1","","Shuffle your hand into your deck. Then, draw a number of cards equal to the number of cards in your opponent's hand.","DarMAXitan","Colorless, Colorless","2","50×","Flip a coin for each Energy attached to this Pokémon. This attack does 50 damage times the number of heads.","Psychic","×2"
"bw4-61","Elgyem","Pokémon","60","Psychic","Beheeyem",,"61","Sumiyoshi Kizuki","Common","It uses its strong psychic power to squeeze its opponent's brain, causing unendurable headaches.","605",,"https://images.pokemontcg.io/bw4/61.png","https://images.pokemontcg.io/bw4/61_hires.png","Legal",,"Legal","Colorless","1","","","","","","","Psy Bolt","Psychic","1","10","Flip a coin. If heads, the Defending Pokémon is now Paralyzed.","","","","","","Psychic","×2"
"bw4-62","Beheeyem","Pokémon","80","Psychic","","Elgyem","62","Kouki Saitou","Rare","It can manipulate an opponent's memory. Apparently, it communicates by flashing its three different-colored fingers.","606",,"https://images.pokemontcg.io/bw4/62.png","https://images.pokemontcg.io/bw4/62_hires.png","Legal",,"Legal","Colorless","1","","","","","","","Brain Control","Psychic","1","","Your opponent reveals his or her hand. Choose a card from there and put it on the bottom of your opponent's deck.","Psybeam","Psychic, Colorless, Colorless","3","40","The Defending Pokémon is now Confused.","Psychic","×2"
"bw4-63","Riolu","Pokémon","70","Fighting","Lucario",,"63","Sumiyoshi Kizuki","Common","It has the peculiar power of being able to see emotions such as joy and rage in the form of waves.","447",,"https://images.pokemontcg.io/bw4/63.png","https://images.pokemontcg.io/bw4/63_hires.png","Legal",,"Legal","Colorless","1","","","","","","","Punch","Colorless","1","10","","Quick Attack","Fighting, Colorless","2","10+","Flip a coin. If heads, this attack does 20 more damage.","Psychic","×2"
"bw4-64","Lucario","Pokémon","100","Fighting","","Riolu","64","Naoki Saito","Rare Holo","A well-trained one can sense auras to identify and take in the feelings of creatures over half a mile away.","448",,"https://images.pokemontcg.io/bw4/64.png","https://images.pokemontcg.io/bw4/64_hires.png","Legal",,"Legal","Colorless","1","Reflexive Retaliation","If this Pokémon is your Active Pokémon and is damaged by an opponent's attack (even if this Pokémon is Knocked Out), put 2 damage counters on the Attacking Pokémon.","Ability","","","","Aura Sphere","Fighting, Fighting","2","50","Does 20 damage to 1 of your opponent's Benched Pokémon. (Don't apply Weakness and Resistance for Benched Pokémon.)","","","","","","Psychic","×2"
"bw4-65","Hippopotas","Pokémon","90","Fighting","Hippowdon",,"65","match","Common","It shuts its nostrils tight then travels through sand as if walking. They form colonies of around ten.","449",,"https://images.pokemontcg.io/bw4/65.png","https://images.pokemontcg.io/bw4/65_hires.png","Legal",,"Legal","Colorless, Colorless, Colorless, Colorless","4","","","","","","","Sand Jet","Fighting","1","","Does 20 damage to 1 of your opponent's Benched Pokémon. (Don't apply Weakness and Resistance for Benched Pokémon.)","Bite","Fighting, Colorless, Colorless","3","30","","Water","×2"
"bw4-66","Hippowdon","Pokémon","130","Fighting","","Hippopotas","66","Naoki Saito","Uncommon","It is surprisingly quick to anger. It holds its mouth agape as a display of its strength.","450",,"https://images.pokemontcg.io/bw4/66.png","https://images.pokemontcg.io/bw4/66_hires.png","Legal",,"Legal","Colorless, Colorless, Colorless, Colorless","4","","","","","","","Sand Bazooka","Fighting, Colorless, Colorless","3","70","You may move 1 Energy attached to this Pokémon to 1 of your Benched Pokémon.","Rock Tumble","Fighting, Fighting, Colorless, Colorless","4","90","This attack's damage isn't affected by Resistance.","Water","×2"
"bw4-67","Mienfoo","Pokémon","60","Fighting","Mienshao",,"67","Midori Harada","Common","They has mastered elegant combos. As they concentrate, their battle moves become swifter and more precise.","619",,"https://images.pokemontcg.io/bw4/67.png","https://images.pokemontcg.io/bw4/67_hires.png","Legal",,"Legal","Colorless","1","","","","","","","Triple Smash","Colorless","1","10×","Flip 3 coins. This attack does 10 times the number of heads.","","","","","","Psychic","×2"
"bw4-68","Mienshao","Pokémon","90","Fighting","","Mienfoo","68","Suwama Chiaki","Uncommon","They use the long fur on their arms as a whip to strike their opponents.","620",,"https://images.pokemontcg.io/bw4/68.png","https://images.pokemontcg.io/bw4/68_hires.png","Legal",,"Legal","Colorless","1","","","","","","","Haul In","Colorless","1","","Search your deck for 2 Pokémon Tool cards, reveal them, and put them into your hand. Shuffle your deck afterward.","Meditate","Fighting, Colorless","2","30+","Does 10 more damage for each damage counter on the Defending Pokémon.","Psychic","×2"
"bw4-69","Sneasel","Pokémon","60","Darkness","Weavile",,"69","Masakazu Fukuda","Common","A smart and sneaky Pokémon. A pair may work together to steal eggs by having one lure the parents away.","215",,"https://images.pokemontcg.io/bw4/69.png","https://images.pokemontcg.io/bw4/69_hires.png","Legal",,"Legal","Colorless","1","","","","","","","Corner","Darkness","1","10","The Defending Pokémon can't retreat during your opponent's next turn.","Scratch","Colorless, Colorless","2","20","","Fighting","×2"
"bw4-70","Weavile","Pokémon","90","Darkness","","Sneasel","70","Akira Komayama","Rare","Evolution made it even more devious. It communicates by clawing signs in boulders.","461",,"https://images.pokemontcg.io/bw4/70.png","https://images.pokemontcg.io/bw4/70_hires.png","Legal",,"Legal","Colorless","1","","","","","","","Dark Penalty","Darkness","1","90","If the Defending Pokémon has no Pokémon Tool card attached to it, this attack does nothing.","Fury Swipes","Colorless, Colorless, Colorless","3","30×","Flip 3 coins. This attack does 30 damage times the number of heads.","Fighting","×2"
"bw4-71","Nuzleaf","Pokémon","80","Darkness","Shiftry","Seedot","71","Naoyo Kimura","Uncommon","The sound of its grass flute makes its listeners uneasy. It lives deep in forests.","274",,"https://images.pokemontcg.io/bw4/71.png","https://images.pokemontcg.io/bw4/71_hires.png","Legal",,"Legal","Colorless","1","","","","","","","Surprise Punch","Darkness, Colorless","2","20","Move an Energy attached to the Defending Pokémon to 1 of your opponent's Benched Pokémon.","","","","","","Fighting","×2"
"bw4-72","Shiftry","Pokémon","130","Darkness","","Nuzleaf","72","match","Rare","By flapping its leafy fan, it can whip up gusts of 100 ft/second that can level houses.","275",,"https://images.pokemontcg.io/bw4/72.png","https://images.pokemontcg.io/bw4/72_hires.png","Legal",,"Legal","Colorless","1","Giant Fan","When you play this Pokémon from your hand to evolve 1 of your Pokémon, you may flip a coin. If heads, choose 1 of your opponent's Pokémon. Your opponent shuffles that Pokémon and all cards attached to it into his or her deck.","Ability","","","","Whirlwind","Darkness, Darkness, Colorless","3","60","Your opponent switches the Defending Pokémon with 1 of his or her Benched Pokémon.","","","","","","Fighting","×2"
"bw4-73","Scraggy","Pokémon","70","Darkness","Scrafty",,"73","Mizue","Uncommon","It immediately headbutts anyones that makes eye contact with it. Its skull is massively thick.","559",,"https://images.pokemontcg.io/bw4/73.png","https://images.pokemontcg.io/bw4/73_hires.png","Legal",,"Legal","Colorless, Colorless","2","","","","","","","Shed Skin","Colorless","1","","Heal 40 damage from this Pokémon.","Lunge","Darkness, Darkness","2","40","Flip a coin. If tails, this attack does nothing.","Fighting","×2"
"bw4-74","Scrafty","Pokémon","90","Darkness","","Scraggy","74","Naoki Saito","Rare Holo","It can smash concrete blocks with its kicking attacks. The one with the biggest crest is the group leader.","560",,"https://images.pokemontcg.io/bw4/74.png","https://images.pokemontcg.io/bw4/74_hires.png","Legal",,"Legal","Colorless, Colorless","2","","","","","","","Rock Head","Darkness","1","20","During your opponent's next turn, any damage done to this Pokémon by attacks is reduced by 20 (after applying Weakness and Resistance).","Hammer Kick","Darkness, Colorless, Colorless","3","50+","If this Pokémon has fewer remaining HP than the Defending Pokémon, this attack does 30 more damage.","Fighting","×2"
"bw4-75","Bronzor","Pokémon","70","Metal","Bronzong",,"75","Naoki Saito","Common","There are researchers who believe this Pokémon reflected like a mirror in the distant past.","436",,"https://images.pokemontcg.io/bw4/75.png","https://images.pokemontcg.io/bw4/75_hires.png","Legal",,"Legal","Colorless, Colorless, Colorless","3","","","","","","","Knock Away","Metal, Colorless","2","10+","Flip a coin. If heads, this attack does 10 more damage.","Spinning Attack","Metal, Colorless, Colorless","3","40","","Fire","×2"
"bw4-76","Bronzong","Pokémon","110","Metal","","Bronzor","76","Kouki Saitou","Rare","It brought rains by opening portals to another world. It was revered as a bringer of plentiful harvests.","437",,"https://images.pokemontcg.io/bw4/76.png","https://images.pokemontcg.io/bw4/76_hires.png","Legal",,"Legal","Colorless, Colorless, Colorless, Colorless","4","Heal Block","Damage can't be healed from any Pokémon (both yours and your opponent's). (Damage counters can still be moved.)","Ability","","","","Oracle Inflict","Metal, Colorless, Colorless","3","30+","Does 10 more damage for each card in your opponent's hand.","","","","","","Fire","×2"
"bw4-77","Ferroseed","Pokémon","60","Metal","Ferrothorn",,"77","match","Common","When threatened, it attacks by shooting a barrage of spikes, which gives it a chance to escape by rolling away.","597",,"https://images.pokemontcg.io/bw4/77.png","https://images.pokemontcg.io/bw4/77_hires.png","Legal",,"Legal","Colorless, Colorless, Colorless","3","","","","","","","Self Destruct","Metal, Colorless","2","60","This Pokémon does 60 damage to itself.","","","","","","Fire","×2"
"bw4-78","Jigglypuff","Pokémon","70","Colorless","Wigglytuff",,"78","sui","Uncommon","When it wavers its big, round eyes, it begins singing a lullaby that makes everyone drowsy.","39",,"https://images.pokemontcg.io/bw4/78.png","https://images.pokemontcg.io/bw4/78_hires.png","Legal",,"Legal","Colorless, Colorless","2","","","","","","","Sing","Colorless","1","","The Defending Pokémon is now Asleep.","Double Slap","Colorless, Colorless","2","20×","Flip 2 coins. This attack does 20 damage times the number of heads.","Fighting","×2"
"bw4-79","Wigglytuff","Pokémon","90","Colorless","","Jigglypuff","79","Shin Nagasawa","Rare","Its fine fur feels sublime to the touch. It can expand its body by inhaling air.","40",,"https://images.pokemontcg.io/bw4/79.png","https://images.pokemontcg.io/bw4/79_hires.png","Legal",,"Legal","Colorless, Colorless","2","","","","","","","Round","Colorless, Colorless","2","20×","Does 20 damage times the number of your Pokémon that have the Round attack.","Hypnoblast","Colorless, Colorless, Colorless","3","60","Flip a coin. If heads, the Defending Pokémon is now Asleep.","Fighting","×2"
"bw4-80","Meowth","Pokémon","70","Colorless","Persian",,"80","Naoki Saito","Common","It is nocturnal in nature. If it spots something shiny, its eyes glitter brightly.","52",,"https://images.pokemontcg.io/bw4/80.png","https://images.pokemontcg.io/bw4/80_hires.png","Legal",,"Legal","Colorless","1","","","","","","","Double Scratch","Colorless","1","10×","Flip 2 coins. This attack does 10 damage times the number of heads.","Cat Kick","Colorless, Colorless","2","20","","Fighting","×2"
"bw4-81","Persian","Pokémon","90","Colorless","","Meowth","81","Shigenori Negishi","Rare","A very haughty Pokémon. Among fans, the size of the jewel in its forehead is a topic of much talk.","53",,"https://images.pokemontcg.io/bw4/81.png","https://images.pokemontcg.io/bw4/81_hires.png","Legal",,"Legal","Colorless","1","","","","","","","Nasty Plot","Colorless","1","","Search your deck for a card and put it into your hand. Shuffle your deck afterward.","Shadow Claw","Colorless, Colorless","2","30","Flip a coin. If heads, discard a random card from your opponent's hand.","Fighting","×2"
"bw4-82","Regigigas-EX","Pokémon","180","Colorless","",,"82","Shizurow","Rare Holo EX",,"486",,"https://images.pokemontcg.io/bw4/82.png","https://images.pokemontcg.io/bw4/82_hires.png","Legal",,"Legal","Colorless, Colorless, Colorless, Colorless","4","","","","","","","Giga Power","Colorless, Colorless, Colorless","3","60+","You may do 20 more damage. If you do, this Pokémon does 20 damage to itself.","Raging Hammer","Colorless, Colorless, Colorless, Colorless","4","50+","Does 10 more damage for each damage counter on this Pokémon.","Fighting","×2"
"bw4-83","Pidove","Pokémon","60","Colorless","Tranquill",,"83","MAHOU","Common","These Pokémon live in cities. They are accustomed to people. Flocks often gather in parks and plazas.","519",,"https://images.pokemontcg.io/bw4/83.png","https://images.pokemontcg.io/bw4/83_hires.png","Legal",,"Legal","Colorless","1","","","","","","","Scout","Colorless","1","","Your opponent reveals his or her hand.","Gust","Colorless, Colorless","2","20","","Lightning","×2"
"bw4-84","Minccino","Pokémon","60","Colorless","Cinccino",,"84","Tomohiro Kitakaze","Uncommon","These Pokémon prefer a tidy habitat. They are always sweeping and dusting, using their tails as brooms.","572",,"https://images.pokemontcg.io/bw4/84.png","https://images.pokemontcg.io/bw4/84_hires.png","Legal",,"Legal","Colorless","1","","","","","","","Call for Family","Colorless","1","","Search your deck for a Basic Pokémon and put it onto your Bench. Shuffle your deck afterward.","Tail Smack","Colorless, Colorless","2","20","","Fighting","×2"
"bw4-85","Cinccino","Pokémon","90","Colorless","","Minccino","85","Kanako Eo","Rare Holo","Their white fur is coated in a special oil that makes it easy for them to deflect attacks.","573",,"https://images.pokemontcg.io/bw4/85.png","https://images.pokemontcg.io/bw4/85_hires.png","Legal",,"Legal","Colorless","1","Smooth Coat","If any damage is done to this Pokémon by attacks, flip a coin. If heads, prevent that damage.","Ability","","","","Echoed Voice","Colorless, Colorless, Colorless","3","50","During your next turn, this Pokémon's Echoed Voice attack does 50 more damage (before applying Weakness and Resistance).","","","","","","Fighting","×2"
"bw4-86","Cilan","Trainer",,"","",,"86","Yusuke Ohmura","Uncommon",,"",,"https://images.pokemontcg.io/bw4/86.png","https://images.pokemontcg.io/bw4/86_hires.png","Legal",,"Legal","",,"","","","","","","","","","","","","","","","",,
"bw4-87","Exp. Share","Trainer",,"","",,"87","Ryo Ueda","Uncommon",,"",,"https://images.pokemontcg.io/bw4/87.png","https://images.pokemontcg.io/bw4/87_hires.png","Legal","Legal","Legal","",,"","","","","","","","","","","","","","","","",,
"bw4-88","Heavy Ball","Trainer",,"","",,"88","Ryo Ueda","Uncommon",,"",,"https://images.pokemontcg.io/bw4/88.png","https://images.pokemontcg.io/bw4/88_hires.png","Legal",,"Legal","",,"","","","","","","","","","","","","","","","",,
"bw4-89","Level Ball","Trainer",,"","",,"89","5ban Graphics","Uncommon",,"",,"https://images.pokemontcg.io/bw4/89.png","https://images.pokemontcg.io/bw4/89_hires.png","Legal",,"Legal","",,"","","","","","","","","","","","","","","","",,
"bw4-90","Pokémon Center","Trainer",,"","",,"90","5ban Graphics","Uncommon",,"",,"https://images.pokemontcg.io/bw4/90.png","https://images.pokemontcg.io/bw4/90_hires.png","Legal",,"Legal","",,"","","","","","","","","","","","","","","","",,
"bw4-91","Skyarrow Bridge","Trainer",,"","",,"91","Ryo Ueda","Uncommon",,"",,"https://images.pokemontcg.io/bw4/91.png","https://images.pokemontcg.io/bw4/91_hires.png","Legal",,"Legal","",,"","","","","","","","","","","","","","","","",,
"bw4-92","Double Colorless Energy","Energy",,"","",,"92","5ban Graphics","Uncommon",,"",,"https://images.pokemontcg.io/bw4/92.png","https://images.pokemontcg.io/bw4/92_hires.png","Legal",,"Legal","",,"","","","","","","","","","","","","","","","",,
"bw4-93","Prism Energy","Energy",,"","",,"93","5ban Graphics","Uncommon",,"",,"https://images.pokemontcg.io/bw4/93.png","https://images.pokemontcg.io/bw4/93_hires.png","Legal",,"Legal","",,"","","","","","","","","","","","","","","","",,
"bw4-94","Shaymin-EX","Pokémon","110","Grass","",,"94","5ban Graphics","Rare Ultra",,"492",,"https://images.pokemontcg.io/bw4/94.png","https://images.pokemontcg.io/bw4/94_hires.png","Legal",,"Legal","Colorless","1","","","","","","","Synthesis","Grass","1","","Search your deck for a Grass Energy card and attach it to 1 of your Pokémon. Shuffle your deck afterward.","Revenge Blast","Grass, Colorless","2","30+","Does 30 more damage for each Prize card your opponent has taken.","Fire","×2"
"bw4-95","Reshiram-EX","Pokémon","180","Fire","",,"95","5ban Graphics","Rare Ultra",,"643",,"https://images.pokemontcg.io/bw4/95.png","https://images.pokemontcg.io/bw4/95_hires.png","Legal",,"Legal","Colorless, Colorless, Colorless","3","","","","","","","Glinting Claw","Fire, Colorless, Colorless","3","50+","Flip a coin. If heads, this attack does 30 more damage.","Brave Fire","Fire, Fire, Colorless, Colorless","4","150","Flip a coin. If tails, this Pokémon does 50 damage to itself.","Water","×2"
"bw4-96","Kyurem-EX","Pokémon","180","Water","",,"96","5ban Graphics","Rare Ultra",,"646",,"https://images.pokemontcg.io/bw4/96.png","https://images.pokemontcg.io/bw4/96_hires.png","Legal",,"Legal","Colorless, Colorless, Colorless","3","","","","","","","Frozen Wings","Water, Colorless, Colorless","3","60","Discard a Special Energy attached to the Defending Pokémon.","Hail Blizzard","Water, Water, Colorless, Colorless","4","120","This Pokémon can't use Hail Blizzard during your next turn.","Metal","×2"
