"id","name","supertype","hp","types","rarity","retreatCost","convertedRetreatCost","AbilityName","AbilityText","Attack1Name","Attack1Cost","Attack1ConvertedCost","Attack1Damage","Attack1Text","Attack2Name","Attack2Cost","Attack2ConvertedCost","Attack2Damage","Attack2Text","Weakness1Type","Weakness1Value"
"col1-SL7","Lugia","Pokemon","100","Water","Rare Holo","Colorless, Colorless, Colorless","3","","","Linear Attack","Water, Colorless, Colorless","3","","Choose 1 of your opponent's Pokemon. This attack does 30 damage to that Pokemon. (Don't apply Weakness and Resistance for Benched Pokemon.)","Hydro Splash","Water, Water, Water, Colorless, Colorless","5","80","","Lightning","x2"
"col1-SL8","Palkia","Pokemon","100","Water","Rare Holo","Colorless, Colorless, Colorless","3","","","Wormhole","Water, Water, Water, Water","4","60","Switch Palkia with 1 of your Benched Pokemon. Then, your opponent switches the Defending Pokemon with 1 of his or her Benched Pokemon.","","","","","","Lightning","x2"
"col1-SL9","Raikou","Pokemon","90","Lightning","Rare Holo","Colorless, Colorless","2","Extreme Speed","Raikou's Retreat Cost is Colorless less for each Lightning Energy attached to Raikou.","Raging Thunder","Lightning, Lightning, Colorless","3","70","Does 20 damage to 1 of your Pokemon and don't apply Weakness and Resistance to this damage.","","","","","","Fighting","x2"
"col1-SL10","Rayquaza","Pokemon","100","Colorless","Rare Holo","Colorless, Colorless","2","","","Inferno Spear","Fire, Fire, Lightning, Lightning","4","100","Discard a Fire Energy and a Lightning Energy attached to Rayquaza.","","","","","","Colorless","x2"
"col1-SL11","Suicune","Pokemon","90","Water","Rare Holo","Colorless, Colorless","2","Extreme Speed","Suicune's Retreat Cost is Colorless less for each Water Energy attached to Suicune.","Tsunami","Water, Water, Colorless","3","","This attack does 20 damage to each of your opponent's Pokemon. (Don't apply Weakness and Resistance for Benched Pokemon.)","","","","","","Lightning","x2"
