"id","name","supertype","hp","types","evolvesTo","evolvesFrom","number","artist","rarity","flavorText","nationalPokedexNumbers","regulationMark","imageSmall","imageLarge","legalitiesUnlimited","legalitiesStandard","legalitiesExpanded","retreatCost","convertedRetreatCost","Ability1Name","Ability1Text","Ability1Type","Ability2Name","Ability2Text","Ability2Type","Attack1Name","Attack1Cost","Attack1ConvertedCost","Attack1Damage","Attack1Text","Attack2Name","Attack2Cost","Attack2ConvertedCost","Attack2Damage","Attack2Text","Weakness1Type","Weakness1Value"
"ecard3-90","Rattata","Pokemon","30","Colorless","Raticate",,"90","Masako Yamashita","Common",,"19",,"https://images.pokemontcg.io/ecard3/90.png","https://images.pokemontcg.io/ecard3/90_hires.png","Legal",,,"Colorless","1","","","","","","","Call for Friends","Colorless","1","","Search your deck for a Baby Pokemon or Basic Pokemon card and put it onto your Bench. Shuffle your deck afterward. (You can't use this attack if your Bench is full.)","Body Slam","Colorless","1","10","Flip a coin. If heads, the Defending Pokemon is now Paralyzed.","Fighting","x2"
"ecard3-91","Rhyhorn","Pokemon","60","Fighting","Rhydon",,"91","Hisao Nakamura","Common",,"111",,"https://images.pokemontcg.io/ecard3/91.png","https://images.pokemontcg.io/ecard3/91_hires.png","Legal",,,"Colorless, Colorless","2","","","","","","","Horn Attack","Colorless","1","10","","Retaliate","Fighting, Colorless","2","10x","This attack does 10 damage times the number of damage counters on Rhyhorn.","Grass","x2"
"ecard3-92","Sandshrew","Pokemon","40","Fighting","Sandslash",,"92","Naoyo Kimura","Common",,"27",,"https://images.pokemontcg.io/ecard3/92.png","https://images.pokemontcg.io/ecard3/92_hires.png","Legal",,,"Colorless","1","","","","","","","Double Scratch","Colorless","1","10x","Flip 2 coins. This attack does 10 damage times the number of heads.","Dig Under","Fighting","1","","Choose 1 of your opponent's Pokemon. This attack does 10 damage to that Pokemon. Don't apply Weakness and Resistance. (Any other effects that would happen after applying Weakness and Resistance still happen.)","Grass","x2"
"ecard3-93","Sandslash","Pokemon","70","Fighting","","Sandshrew","93","Miki Tanaka","Common",,"28",,"https://images.pokemontcg.io/ecard3/93.png","https://images.pokemontcg.io/ecard3/93_hires.png","Legal",,,"Colorless","1","","","","","","","Sand Trap","Fighting, Colorless","2","10","If your opponent has any Benched Pokemon, choose up to 2 of them. This attack does 10 damage to each of them. (Don't apply Weakness and Resistance for Benched Pokemon.)","Poison Needle Rush","Fighting, Colorless, Colorless","3","20x","Flip 3 coins. This attack does 20 damage times the number of heads. If you get at least 1 heads, the Defending Pokemon is now Poisoned.","Grass","x2"
"ecard3-94","Seel","Pokemon","50","Water","Dewgong",,"94","Hisao Nakamura","Common",,"86",,"https://images.pokemontcg.io/ecard3/94.png","https://images.pokemontcg.io/ecard3/94_hires.png","Legal",,,"Colorless","1","","","","","","","Cold Breath","Water","1","10","Flip a coin. If heads, the Defending Pokemon is now Asleep.","","","","","","Lightning","x2"
"ecard3-95","Seel","Pokemon","50","Water","Dewgong",,"95","Yukiko Baba","Common",,"86",,"https://images.pokemontcg.io/ecard3/95.png","https://images.pokemontcg.io/ecard3/95_hires.png","Legal",,,"Colorless","1","","","","","","","Double Headbutt","Colorless","1","10x","Flip 2 coins. This attack does 10 damage times the number of heads.","Ice Beam","Water, Colorless","2","10","Flip a coin. If heads, the Defending Pokemon is now Paralyzed.","Lightning","x2"
"ecard3-96","Shuckle","Pokemon","30","Grass","",,"96","Sumiyoshi Kizuki","Common",,"213",,"https://images.pokemontcg.io/ecard3/96.png","https://images.pokemontcg.io/ecard3/96_hires.png","Legal",,,"Colorless, Colorless","2","Vase Body","All damage done by attacks to Shuckle is reduced by 20 (after applying Weakness and Resistance).","Poke-Body","","","","Poisonous Saliva","Grass, Colorless","2","10","The Defending Pokemon is now Poisoned.","","","","","","Fire","x2"
"ecard3-97","Skarmory","Pokemon","60","Metal","",,"97","Katsura Tabata","Common",,"227",,"https://images.pokemontcg.io/ecard3/97.png","https://images.pokemontcg.io/ecard3/97_hires.png","Legal",,,"Colorless, Colorless","2","","","","","","","Double Peck","Colorless","1","10x","Flip 2 coins. This attack does 10 damage times the number of heads.","Spinning Head","Metal, Colorless, Colorless","3","30","Flip a coin. If heads, switch Skarmory with 1 of your Benched Pokemon.","Fire","x2"
"ecard3-98","Slugma","Pokemon","50","Fire","Magcargo",,"98","Naoyo Kimura","Common",,"218",,"https://images.pokemontcg.io/ecard3/98.png","https://images.pokemontcg.io/ecard3/98_hires.png","Legal",,,"Colorless, Colorless","2","","","","","","","Tackle","Colorless","1","10","","Scorching Lava","Fire","1","","Discard a Fire Energy card attached to Slugma in order to use this attack. The Defending Pokemon is now Burned.","Water","x2"
"ecard3-99","Slugma","Pokemon","50","Fire","Magcargo",,"99","Yukiko Baba","Common",,"218",,"https://images.pokemontcg.io/ecard3/99.png","https://images.pokemontcg.io/ecard3/99_hires.png","Legal",,,"Colorless, Colorless","2","","","","","","","Singe","Fire, Colorless","2","10","The Defending Pokemon is now Burned.","","","","","","Water","x2"
"ecard3-100","Snorlax","Pokemon","80","Colorless","",,"100","Naoyo Kimura","Common",,"143",,"https://images.pokemontcg.io/ecard3/100.png","https://images.pokemontcg.io/ecard3/100_hires.png","Legal",,,"Colorless, Colorless, Colorless","3","Lolling About","Once during your turn (before your attack), if Snorlax is your Active Pokemon, you may remove 1 damage counter from Snorlax. Snorlax is now Asleep. This power can't be used if Snorlax is affected by a Special Condition.","Poke-Power","","","","Continuous Tumble","Colorless, Colorless, Colorless","3","30x","Flip a coin until you get tails. This attack does 30 damage times the number of heads.","","","","","","Fighting","x2"
"ecard3-101","Snubbull","Pokemon","50","Colorless","Granbull",,"101","Hisao Nakamura","Common",,"209",,"https://images.pokemontcg.io/ecard3/101.png","https://images.pokemontcg.io/ecard3/101_hires.png","Legal",,,"Colorless","1","","","","","","","Scary Face","Colorless","1","","Flip a coin. If heads, until the end of your opponent's next turn the Defending Pokemon can't attack or retreat.","Bite","Colorless, Colorless","2","20","","Fighting","x2"
"ecard3-102","Stantler","Pokemon","60","Colorless","",,"102","Aya Kusube","Common",,"234",,"https://images.pokemontcg.io/ecard3/102.png","https://images.pokemontcg.io/ecard3/102_hires.png","Legal",,,"Colorless","1","","","","","","","Threaten","Colorless","1","","Flip a coin. If heads, look at your opponent's hand. If he or she has any Trainer cards there, choose 1 of them. Your opponent shuffles that card into his or her deck.","Antler Swipe","Colorless, Colorless","2","","Flip a coin. If heads, this attack does 20 damage to the Defending Pokemon (don't apply Weakness or Resistance). If tails and your opponent has any Benched Pokemon, choose 1 of them and this attack does 20 damage to it. (Don't apply Weakness and Resistance for Benched Pokemon.)","Fighting","x2"
"ecard3-103","Staryu","Pokemon","40","Water","Starmie",,"103","Kyoko Umemoto","Common",,"120",,"https://images.pokemontcg.io/ecard3/103.png","https://images.pokemontcg.io/ecard3/103_hires.png","Legal",,,"Colorless","1","","","","","","","Energy Healing","Colorless","1","","Remove 2 damage counters from Staryu for each Energy attached to it. If it has fewer damage counters than that, remove all of them.","Doubleslap","Water","1","10x","Flip 2 coins. This attack does 10 damage times the number of heads.","Lightning","x2"
"ecard3-104","Staryu","Pokemon","50","Water","Starmie",,"104","Keiko Fukuyama","Common",,"120",,"https://images.pokemontcg.io/ecard3/104.png","https://images.pokemontcg.io/ecard3/104_hires.png","Legal",,,"Colorless","1","","","","","","","Slap","Colorless","1","10","","Confuse Ray","Water, Colorless","2","10","Flip a coin. If heads, the Defending Pokemon is now Confused.","Lightning","x2"
"ecard3-105","Sunflora","Pokemon","70","Grass","","Sunkern","105","Miki Tanaka","Common",,"192",,"https://images.pokemontcg.io/ecard3/105.png","https://images.pokemontcg.io/ecard3/105_hires.png","Legal",,,"Colorless","1","","","","","","","Energy Plant","Grass, Colorless","2","","Search your deck for a basic Energy card and attach it to 1 of your Pokemon. Shuffle your deck afterward.","Trip Over","Grass, Colorless, Colorless","3","30+","Flip a coin. If heads, this attack does 30 damage plus 30 more damage.","Fire","x2"
"ecard3-106","Sunkern","Pokemon","40","Grass","Sunflora",,"106","Toshinao Aoki","Common",,"191",,"https://images.pokemontcg.io/ecard3/106.png","https://images.pokemontcg.io/ecard3/106_hires.png","Legal",,,"Colorless","1","","","","","","","Rollout","Colorless","1","10","","Blot","Grass","1","10","If there are any damage counters on Sunkern, remove 1 of them.","Fire","x2"
"ecard3-107","Swinub","Pokemon","50","Water","Piloswine",,"107","Yuka Morii","Common",,"220",,"https://images.pokemontcg.io/ecard3/107.png","https://images.pokemontcg.io/ecard3/107_hires.png","Legal",,,"Colorless","1","","","","","","","Ram","Colorless","1","10","","Freezing Breath","Water","1","","Flip a coin. If heads, the Defending Pokemon is now Paralyzed. If tails, the Defending Pokemon is now Asleep.","Metal","x2"
"ecard3-108","Swinub","Pokemon","50","Fighting","Piloswine",,"108","Toshinao Aoki","Common",,"220",,"https://images.pokemontcg.io/ecard3/108.png","https://images.pokemontcg.io/ecard3/108_hires.png","Legal",,,"Colorless","1","","","","","","","Mud Slap","Fighting","1","10","","Overrun","Colorless, Colorless","2","10","If your opponent has any Benched Pokemon, flip a coin. If heads, choose 1 of them and this attack does 10 damage to it. (Don't apply Weakness and Resistance for Benched Pokemon.)","Grass","x2"
"ecard3-109","Teddiursa","Pokemon","40","Colorless","Ursaring",,"109","Kagemaru Himeno","Common",,"216",,"https://images.pokemontcg.io/ecard3/109.png","https://images.pokemontcg.io/ecard3/109_hires.png","Legal",,,"Colorless","1","","","","","","","Surprise Attack","Colorless","1","20","Flip a coin. If tails, this attack does nothing.","Rage","Colorless, Colorless","2","10+","This attack does 10 damage plus 10 more damage for each damage counter on Teddiursa.","Fighting","x2"
"ecard3-110","Ursaring","Pokemon","80","Colorless","","Teddiursa","110","Mitsuhiro Arita","Common",,"217",,"https://images.pokemontcg.io/ecard3/110.png","https://images.pokemontcg.io/ecard3/110_hires.png","Legal",,,"Colorless, Colorless","2","","","","","","","Bear Hug","Colorless, Colorless, Colorless","3","30","The Defending Pokemon can't retreat during your opponent's next turn.","Rend","Colorless, Colorless, Colorless, Colorless","4","40+","If the Defending Pokemon already has any damage counters on it, this attack does 40 damage plus 20 more damage. If not, this attack does 40 damage.","Fighting","x2"
"ecard3-111","Venomoth","Pokemon","70","Grass","","Venonat","111","Yukiko Baba","Common",,"49",,"https://images.pokemontcg.io/ecard3/111.png","https://images.pokemontcg.io/ecard3/111_hires.png","Legal",,,"",,"","","","","","","Healing Dust","Colorless, Colorless","2","","Flip 2 coins. For each heads, remove 1 damage counter from each of your Pokemon. If a Pokemon has fewer damage counters than the number of heads, remove all of them.","Miracle Powder","Grass, Colorless, Colorless","3","30","Flip a coin. If heads, choose a Special Condition (Asleep, Burned, Confused, Paralyzed, or Poisoned). The Defending Pokemon is now affected by that Special Condition.","Fire","x2"
"ecard3-112","Venonat","Pokemon","50","Grass","Venomoth",,"112","Tomokazu Komiya","Common",,"48",,"https://images.pokemontcg.io/ecard3/112.png","https://images.pokemontcg.io/ecard3/112_hires.png","Legal",,,"Colorless","1","","","","","","","Double Spin","Colorless","1","10x","Flip 2 coins. This attack does 10 damage times the number of heads.","Supersonic","Grass, Colorless","2","10","Flip a coin. If heads, the Defending Pokemon is now Confused.","Fire","x2"
"ecard3-113","Voltorb","Pokemon","50","Lightning","Electrode",,"113","Sumiyoshi Kizuki","Common",,"100",,"https://images.pokemontcg.io/ecard3/113.png","https://images.pokemontcg.io/ecard3/113_hires.png","Legal",,,"Colorless","1","","","","","","","Magnetic Pull","Lightning","1","","If your opponent has any Benched Pokemon, choose 1 of them and switch it with the Defending Pokemon.","Spin Tackle","Lightning, Colorless","2","30","Voltorb does 10 damage to itself.","Fighting","x2"
"ecard3-114","Weedle","Pokemon","40","Grass","Kakuna",,"114","Keiko Fukuyama","Common",,"13",,"https://images.pokemontcg.io/ecard3/114.png","https://images.pokemontcg.io/ecard3/114_hires.png","Legal",,,"Colorless","1","","","","","","","Fury Attack","Grass","1","10x","Flip 3 coins. This attack does 10 damage times the number of heads.","","","","","","Fire","x2"
"ecard3-115","Weedle","Pokemon","50","Grass","Kakuna",,"115","Sumiyoshi Kizuki","Common",,"13",,"https://images.pokemontcg.io/ecard3/115.png","https://images.pokemontcg.io/ecard3/115_hires.png","Legal",,,"Colorless","1","","","","","","","Entangling Thread","Colorless","1","","Flip a coin. If heads, the Defending Pokemon is now Paralyzed.","Poison Horn","Grass","1","","Flip a coin. If heads, the Defending Pokemon is now Poisoned.","Fire","x2"
"ecard3-116","Yanma","Pokemon","60","Grass","Yanmega",,"116","Miki Tanaka","Common",,"193",,"https://images.pokemontcg.io/ecard3/116.png","https://images.pokemontcg.io/ecard3/116_hires.png","Legal",,,"Colorless","1","","","","","","","Agility","Grass, Colorless","2","10","Flip a coin. If heads, during your opponent's next turn, prevent all effects of attacks, including damage, done to Yanma.","Triple Smash","Grass, Colorless, Colorless","3","20+","Flip 3 coins. This attack does 20 damage plus 10 more damage for each heads.","Lightning","x2"
"ecard3-117","Zubat","Pokemon","40","Grass","Golbat",,"117","Hisao Nakamura","Common",,"41",,"https://images.pokemontcg.io/ecard3/117.png","https://images.pokemontcg.io/ecard3/117_hires.png","Legal",,,"Colorless","1","","","","","","","Sound Waves","Colorless","1","","Flip a coin. If heads, the Defending Pokemon is now Confused.","Flitter","Grass","1","","Choose 1 of your opponent's Pokemon. This attack does 10 damage to that Pokemon. Don't apply Weakness and Resistance. (Any other effects that would happen after applying Weakness and Resistance still happen.)","Lightning","x2"
"ecard3-118","Zubat","Pokemon","50","Grass","Golbat",,"118","Kyoko Umemoto","Common",,"41",,"https://images.pokemontcg.io/ecard3/118.png","https://images.pokemontcg.io/ecard3/118_hires.png","Legal",,,"Colorless","1","","","","","","","Wing Attack","Colorless","1","10","","Poison Spray","Grass, Colorless","2","10","The Defending Pokemon is now Poisoned.","Psychic","x2"
"ecard3-119","Ancient Ruins","Trainer",,"","",,"119","Midori Harada","Uncommon",,"",,"https://images.pokemontcg.io/ecard3/119.png","https://images.pokemontcg.io/ecard3/119_hires.png","Legal",,,"",,"","","","","","","","","","","","","","","","",,
"ecard3-120","Relic Hunter","Trainer",,"","",,"120","Kagemaru Himeno","Uncommon",,"",,"https://images.pokemontcg.io/ecard3/120.png","https://images.pokemontcg.io/ecard3/120_hires.png","Legal",,,"",,"","","","","","","","","","","","","","","","",,
"ecard3-121","Apricorn Maker","Trainer",,"","",,"121","Kagemaru Himeno","Uncommon",,"",,"https://images.pokemontcg.io/ecard3/121.png","https://images.pokemontcg.io/ecard3/121_hires.png","Legal",,,"",,"","","","","","","","","","","","","","","","",,
"ecard3-122","Crystal Shard","Trainer",,"","",,"122","Jungo Suzuki","Uncommon",,"",,"https://images.pokemontcg.io/ecard3/122.png","https://images.pokemontcg.io/ecard3/122_hires.png","Legal",,,"",,"","","","","","","","","","","","","","","","",,
"ecard3-123","Desert Shaman","Trainer",,"","",,"123","Kagemaru Himeno","Uncommon",,"",,"https://images.pokemontcg.io/ecard3/123.png","https://images.pokemontcg.io/ecard3/123_hires.png","Legal",,,"",,"","","","","","","","","","","","","","","","",,
"ecard3-124","Fast Ball","Trainer",,"","",,"124","Katsura Tabata","Uncommon",,"",,"https://images.pokemontcg.io/ecard3/124.png","https://images.pokemontcg.io/ecard3/124_hires.png","Legal",,,"",,"","","","","","","","","","","","","","","","",,
"ecard3-125","Fisherman","Trainer",,"","",,"125","Kagemaru Himeno","Uncommon",,"",,"https://images.pokemontcg.io/ecard3/125.png","https://images.pokemontcg.io/ecard3/125_hires.png","Legal",,"Legal","",,"","","","","","","","","","","","","","","","",,
"ecard3-126","Friend Ball","Trainer",,"","",,"126","Katsura Tabata","Uncommon",,"",,"https://images.pokemontcg.io/ecard3/126.png","https://images.pokemontcg.io/ecard3/126_hires.png","Legal",,,"",,"","","","","","","","","","","","","","","","",,
"ecard3-127","Hyper Potion","Trainer",,"","",,"127","Katsura Tabata","Uncommon",,"",,"https://images.pokemontcg.io/ecard3/127.png","https://images.pokemontcg.io/ecard3/127_hires.png","Legal",,"Legal","",,"","","","","","","","","","","","","","","","",,
"ecard3-128","Lure Ball","Trainer",,"","",,"128","Katsura Tabata","Uncommon",,"",,"https://images.pokemontcg.io/ecard3/128.png","https://images.pokemontcg.io/ecard3/128_hires.png","Legal",,"Legal","",,"","","","","","","","","","","","","","","","",,
"ecard3-129","Miracle Sphere α","Trainer",,"","",,"129","Hiromichi Sugiyama","Uncommon",,"",,"https://images.pokemontcg.io/ecard3/129.png","https://images.pokemontcg.io/ecard3/129_hires.png","Legal",,,"",,"","","","","","","Fire Force","Fire, Colorless, Colorless","3","30+","If the Pokemon using this attack has Fire and Lightning basic Energy cards attached to it, the Defending Pokemon is now Confused. If the Pokemon using this attack has Fire and Fighting basic Energy cards attached to it, this attack does 30 damage plus 10 more damage and remove 3 damage counters from the Pokemon that Miracle Plate α is attached to.","","","","","",,
"ecard3-130","Miracle Sphere β","Trainer",,"","",,"130","Hiromichi Sugiyama","Uncommon",,"",,"https://images.pokemontcg.io/ecard3/130.png","https://images.pokemontcg.io/ecard3/130_hires.png","Legal",,,"",,"","","","","","","Freezing Force","Water, Colorless, Colorless","3","30+","If the Pokemon using this attack has Fire and Water basic Energy cards attached to it, this attack does 30 damage plus 10 more damage and the Defending Pokemon is now Burned. If the Pokemon using this attack has Water and Psychic basic Energy cards attached to it, choose an Energy card attached to the Defending Pokemon, if any, and your opponent shuffles that card into his or her deck.","","","","","",,
"ecard3-131","Miracle Sphere γ","Trainer",,"","",,"131","Hiromichi Sugiyama","Uncommon",,"",,"https://images.pokemontcg.io/ecard3/131.png","https://images.pokemontcg.io/ecard3/131_hires.png","Legal",,,"",,"","","","","","","Thunder Force","Lightning, Colorless, Colorless","3","30+","If the Pokemon using this attack has Grass and Lightning basic Energy cards attached to it, the Defending Pokemon is now Asleep and Poisoned. If the Pokemon using this attack has Water and Lightning basic Energy cards attached to it, this attack does 30 damage plus 10 more damage and lets you put 1 damage counter on each of your opponent's Benched Pokemon.","","","","","",,
"ecard3-132","Mirage Stadium","Trainer",,"","",,"132","Midori Harada","Uncommon",,"",,"https://images.pokemontcg.io/ecard3/132.png","https://images.pokemontcg.io/ecard3/132_hires.png","Legal",,,"",,"","","","","","","","","","","","","","","","",,
"ecard3-133","Mystery Plate α","Trainer",,"","",,"133","Hiromichi Sugiyama","Uncommon",,"",,"https://images.pokemontcg.io/ecard3/133.png","https://images.pokemontcg.io/ecard3/133_hires.png","Legal",,,"",,"","","","","","","Desert Burn","Colorless","1","","If your opponent has 5 or more Prizes, search your deck for a Trainer card, show it to your opponent, and put it into your hand. If your opponent has only 1 Prize, the Defending Pokemon is now Burned, Paralyzed, and Poisoned.","","","","","",,
"ecard3-134","Mystery Plate β","Trainer",,"","",,"134","Hiromichi Sugiyama","Uncommon",,"",,"https://images.pokemontcg.io/ecard3/134.png","https://images.pokemontcg.io/ecard3/134_hires.png","Legal",,,"",,"","","","","","","Stone Crush","Colorless","1","","If your opponent has 5 or more Prizes, draw 3 cards. If your opponent has only 1 Prize, choose 2 Energy cards attached to the Defending Pokemon (1 if there is only 1). Your opponent shuffles those cards into his or her deck.","","","","","",,
"ecard3-135","Mystery Plate γ","Trainer",,"","",,"135","Hiromichi Sugiyama","Uncommon",,"",,"https://images.pokemontcg.io/ecard3/135.png","https://images.pokemontcg.io/ecard3/135_hires.png","Legal",,,"",,"","","","","","","Retro Cave","Colorless","1","","If your opponent has 5 or more Prizes, shuffle your hand into your deck and then draw 6 cards. If your opponent has exactly 2 Prizes, choose 1 of your opponent's Evolved Pokemon. Your opponent puts the top card on that Evolved Pokemon on the bottom of his or her deck. (This counts as devolving that Pokemon.)","","","","","",,
"ecard3-136","Mystery Plate δ","Trainer",,"","",,"136","Hiromichi Sugiyama","Uncommon",,"",,"https://images.pokemontcg.io/ecard3/136.png","https://images.pokemontcg.io/ecard3/136_hires.png","Legal",,,"",,"","","","","","","Healing Oasis","Colorless","1","","If your opponent has 5 or more Prizes, search your deck for up to 3 basic Energy cards, show them to your opponent, and put them into your hand. Shuffle your deck afterward. If your opponent has exactly 2 Prizes, remove all damage counters from 1 of your Pokemon.","","","","","",,
"ecard3-137","Mystery Zone","Trainer",,"","",,"137","Ken Ikuji","Uncommon",,"",,"https://images.pokemontcg.io/ecard3/137.png","https://images.pokemontcg.io/ecard3/137_hires.png","Legal",,,"",,"","","","","","","","","","","","","","","","",,
"ecard3-138","Oracle","Trainer",,"","",,"138","Kagemaru Himeno","Uncommon",,"",,"https://images.pokemontcg.io/ecard3/138.png","https://images.pokemontcg.io/ecard3/138_hires.png","Legal",,,"",,"","","","","","","","","","","","","","","","",,
"ecard3-139","Star Piece","Trainer",,"","",,"139","Jungo Suzuki","Uncommon",,"",,"https://images.pokemontcg.io/ecard3/139.png","https://images.pokemontcg.io/ecard3/139_hires.png","Legal",,,"",,"","","","","","","","","","","","","","","","",,
"ecard3-140","Underground Expedition","Trainer",,"","",,"140","Kagemaru Himeno","Uncommon",,"",,"https://images.pokemontcg.io/ecard3/140.png","https://images.pokemontcg.io/ecard3/140_hires.png","Legal",,"Legal","",,"","","","","","","","","","","","","","","","",,
"ecard3-141","Underground Lake","Trainer",,"","",,"141","Midori Harada","Uncommon",,"",,"https://images.pokemontcg.io/ecard3/141.png","https://images.pokemontcg.io/ecard3/141_hires.png","Legal",,,"",,"","","","","","","","","","","","","","","","",,
"ecard3-142","Bounce Energy","Energy",,"","",,"142","Shin-ichi Yoshikawa","Uncommon",,"",,"https://images.pokemontcg.io/ecard3/142.png","https://images.pokemontcg.io/ecard3/142_hires.png","Legal",,,"",,"","","","","","","","","","","","","","","","",,
"ecard3-143","Cyclone Energy","Energy",,"","",,"143","Shin-ichi Yoshikawa","Uncommon",,"",,"https://images.pokemontcg.io/ecard3/143.png","https://images.pokemontcg.io/ecard3/143_hires.png","Legal",,,"",,"","","","","","","","","","","","","","","","",,
"ecard3-144","Retro Energy","Energy",,"","",,"144","Shin-ichi Yoshikawa","Uncommon",,"",,"https://images.pokemontcg.io/ecard3/144.png","https://images.pokemontcg.io/ecard3/144_hires.png","Legal",,,"",,"","","","","","","","","","","","","","","","",,
"ecard3-145","Celebi","Pokemon","60","Colorless","",,"145","Mitsuhiro Arita","Rare Secret",,"251",,"https://images.pokemontcg.io/ecard3/145.png","https://images.pokemontcg.io/ecard3/145_hires.png","Legal",,,"Colorless","1","Crystal Type","Whenever you attach a Grass, Water, or Psychic basic Energy card from your hand to Celebi, Celebi's type (color) becomes the same as that type of Energy until the end of the turn.","Poke-Body","","","","Empathic Healing","Grass, Water","2","","Remove 2 damage counters from Celebi and each Pokemon that's the same type (color) as Celebi.","Mind Bend","Grass, Psychic, Colorless","3","20","Flip a coin. If heads, the Defending Pokemon is now Confused.","Fire","x2"
"ecard3-146","Charizard","Pokemon","110","Colorless","","Charmeleon","146","Kouki Saitou","Rare Secret",,"6",,"https://images.pokemontcg.io/ecard3/146.png","https://images.pokemontcg.io/ecard3/146_hires.png","Legal",,,"Colorless, Colorless, Colorless, Colorless","4","Crystal Type","Whenever you attach a Fire, Lightning, or Fighting basic Energy card from your hand to Charizard, Charizard's type (color) becomes the same as that type of Energy until the end of the turn.","Poke-Body","","","","Fireblast","Fire, Fire, Fighting","3","40","Discard an Energy card attached to Charizard.","Dragon Tail","Fire, Lightning, Lightning, Colorless","4","50x","Flip 2 coins. This attack does 50 damage times the number of heads.","Water","x2"
