"id","name","supertype","hp","types","evolvesTo","evolvesFrom","number","artist","rarity","flavorText","nationalPokedexNumbers","regulationMark","imageSmall","imageLarge","legalitiesUnlimited","legalitiesStandard","legalitiesExpanded","retreatCost","convertedRetreatCost","Ability1Name","Ability1Text","Ability1Type","Ability2Name","Ability2Text","Ability2Type","Attack1Name","Attack1Cost","Attack1ConvertedCost","Attack1Damage","Attack1Text","Attack2Name","Attack2Cost","Attack2ConvertedCost","Attack2Damage","Attack2Text","Weakness1Type","Weakness1Value"
"ex6-110","Mr. Mime ex","Pokemon","80","Psychic","",,"110","Ryo Ueda","Rare Holo EX",,"122",,"https://images.pokemontcg.io/ex6/110.png","https://images.pokemontcg.io/ex6/110_hires.png","Legal",,,"Colorless","1","Magic Odds","If Mr. Mime ex would be damaged by an attack, prevent that attack's damage done to Mr. Mime ex if that damage is 10, 30, 50, 70, 90, 110, 130, 150, or 170.","Poke-Body","","","","Breakdown","Psychic, Colorless","2","","Count the number of cards in your opponent's hand. Put that many damage counters on the Defending Pokemon.","","","","","",,
"ex6-111","Mr. Mime ex","Pokemon","80","Psychic","",,"111","Ryo Ueda","Rare Holo EX",,"122",,"https://images.pokemontcg.io/ex6/111.png","https://images.pokemontcg.io/ex6/111_hires.png","Legal",,,"Colorless","1","Magic Evens","If Mr. Mime ex would be damaged by an attack, prevent that attack's damage done to Mr. Mime ex if that damage is 20, 40, 60, 80, 100, 120, 140, 160, or 180.","Poke-Body","","","","Breakdown","Psychic, Colorless","2","","Count the number of cards in your opponent's hand. Put that many damage counters on the Defending Pokemon.","","","","","",,
"ex6-112","Venusaur ex","Pokemon","150","Grass","","Ivysaur","112","Ryo Ueda","Rare Holo EX",,"3",,"https://images.pokemontcg.io/ex6/112.png","https://images.pokemontcg.io/ex6/112_hires.png","Legal",,,"Colorless, Colorless, Colorless","3","Energy Trans","As often as you like during your turn (before your attack), move a Grass Energy card attached to 1 of your Pokemon to another of your Pokemon. This power can't be used if Venusaur ex is affected by a Special Condition.","Poke-Power","","","","Pollen Hazard","Grass, Colorless, Colorless","3","20","The Defending Pokemon is now Poisoned, Burned, and Confused.","Solarbeam","Grass, Grass, Grass, Colorless, Colorless","5","90","","Psychic","x2"
"ex6-113","Charmander","Pokemon","50","Fire","Charmeleon",,"113","Ken Sugimori","Rare Secret",,"4",,"https://images.pokemontcg.io/ex6/113.png","https://images.pokemontcg.io/ex6/113_hires.png","Legal",,,"Colorless","1","","","","","","","Flare","Fire","1","10","","Rage","Colorless, Colorless","2","10+","Does 10 damage plus 10 more damage for each damage counter on Charmander.","Water","x2"
"ex6-114","Articuno ex","Pokemon","110","Water","",,"114","Ryo Ueda","Rare Secret",,"144",,"https://images.pokemontcg.io/ex6/114.png","https://images.pokemontcg.io/ex6/114_hires.png","Legal",,,"Colorless, Colorless","2","Legendary Ascent","Once during your turn, when you put Articuno ex from your hand onto your Bench, you may switch 1 of your Active Pokemon with Articuno ex. If you do, you may also move any number of basic Water Energy cards attached to your Pokemon to Articuno ex.","Poke-Power","","","","Cold Crush","Water, Water, Colorless","3","50","You may discard an Energy card attached to Articuno ex. If you do, your opponent discards an Energy card attached to the Defending Pokemon.","","","","","","Metal","x2"
"ex6-115","Moltres ex","Pokemon","110","Fire","",,"115","Ryo Ueda","Rare Secret",,"146",,"https://images.pokemontcg.io/ex6/115.png","https://images.pokemontcg.io/ex6/115_hires.png","Legal",,,"Colorless, Colorless","2","Legendary Ascent","Once during your turn, when you put Moltres ex from your hand onto your Bench, you may switch 1 of your Active Pokemon with Moltres ex. If you do, you may also move any number of basic Fire Energy cards attached to your Pokemon to Moltres ex.","Poke-Power","","","","Crushing Flames","Fire, Fire, Colorless","3","60","You may discard an Energy card attached to Moltres ex. If you do, the Defending Pokemon is now Confused.","","","","","","Water","x2"
"ex6-116","Zapdos ex","Pokemon","110","Lightning","",,"116","Ryo Ueda","Rare Secret",,"145",,"https://images.pokemontcg.io/ex6/116.png","https://images.pokemontcg.io/ex6/116_hires.png","Legal",,,"Colorless, Colorless","2","Legendary Ascent","Once during your turn, when you put Zapdos ex from your hand onto your Bench, you may switch 1 of your Active Pokemon with Zapdos ex. If you do, you may also move any number of basic Lightning Energy cards attached to your Pokemon to Zapdos ex.","Poke-Power","","","","Electron Crush","Lightning, Lightning, Colorless","3","50+","You may discard an Energy card attached to Zapdos ex. If you do, this attack does 50 damage plus 20 more damage.","","","","","","Lightning","x2"
