"id","name","supertype","hp","types","evolvesTo","evolvesFrom","number","artist","rarity","flavorText","nationalPokedexNumbers","regulationMark","imageSmall","imageLarge","legalitiesUnlimited","legalitiesStandard","legalitiesExpanded","retreatCost","convertedRetreatCost","Ability1Name","Ability1Text","Ability1Type","Ability2Name","Ability2Text","Ability2Type","Attack1Name","Attack1Cost","Attack1ConvertedCost","Attack1Damage","Attack1Text","Attack2Name","Attack2Cost","Attack2ConvertedCost","Attack2Damage","Attack2Text","Weakness1Type","Weakness1Value"
"ex6-1","Beedrill","Pokemon","90","Grass","","Kakuna","1","Hajime Kusajima","Rare Holo",,"15",,"https://images.pokemontcg.io/ex6/1.png","https://images.pokemontcg.io/ex6/1_hires.png","Legal",,,"",,"","","","","","","Poison Sting","Grass","1","20","The Defending Pokemon is now Poisoned.","Link Needle","Grass, Colorless, Colorless","3","50+","This attack does 50 damage plus 30 more damage for each Beedrill (excluding this one) you have in play.","Fire","x2"
"ex6-2","Butterfree","Pokemon","100","Grass","","Metapod","2","Atsuko Nishida","Rare Holo",,"12",,"https://images.pokemontcg.io/ex6/2.png","https://images.pokemontcg.io/ex6/2_hires.png","Legal",,,"",,"Sooth Dust","As long as Butterfree is your Active Pokemon, remove 1 damage counter from each of your Pokemon between turns.","Poke-Body","","","","Whirlwind","Colorless, Colorless","2","30","Your opponent switches the Defending Pokemon with 1 of his or her Benched Pokemon.","Gust","Grass, Colorless, Colorless","3","50","","Lightning","x2"
"ex6-3","Dewgong","Pokemon","80","Water","","Seel","3","Toshinao Aoki","Rare Holo",,"87",,"https://images.pokemontcg.io/ex6/3.png","https://images.pokemontcg.io/ex6/3_hires.png","Legal",,,"Colorless, Colorless","2","Safeguard","Prevent all effects of attacks, including damage, done to Dewgong by your opponent's Pokemon-ex.","Poke-Body","","","","Cold Breath","Water","1","10","The Defending Pokemon is now Asleep.","Aurora Beam","Colorless, Colorless, Colorless","3","40","","Metal","x2"
"ex6-4","Ditto","Pokemon","60","Colorless","",,"4","Miki Tanaka","Rare Holo",,"132",,"https://images.pokemontcg.io/ex6/4.png","https://images.pokemontcg.io/ex6/4_hires.png","Legal",,,"Colorless","1","Form Variation","Once during your turn (before your attack), you may search your discard pile for a Basic Pokemon (excluding Pokemon-ex and Ditto) and switch it with Ditto. (Any cards attached to Ditto, damage counters, Special Conditions, and effects on it are now on the new Pokemon.) Place Ditto in the discard pile.","Poke-Power","","","","Energy Ball","Colorless","1","10+","Does 10 damage plus 10 more damage for each Energy attached to Ditto but not used to pay for this attack's Energy cost. You can't add more then 20 damage in this way.","","","","","","Fighting","x2"
"ex6-5","Exeggutor","Pokemon","80","Psychic","","Exeggcute","5","Tomokazu Komiya","Rare Holo",,"103",,"https://images.pokemontcg.io/ex6/5.png","https://images.pokemontcg.io/ex6/5_hires.png","Legal",,,"Colorless, Colorless","2","","","","","","","Psychic Exchange","Colorless","1","","Shuffle your hand into your deck. Draw up to 8 cards.","Big Eggsplosion","Psychic, Colorless","2","40x","Flip a coin for each Energy attached to Exeggutor. This attack does 40 damage times the number of heads.","Psychic","x2"
"ex6-6","Kangaskhan","Pokemon","80","Colorless","",,"6","Naoyo Kimura","Rare Holo",,"115",,"https://images.pokemontcg.io/ex6/6.png","https://images.pokemontcg.io/ex6/6_hires.png","Legal",,,"Colorless, Colorless","2","","","","","","","Fetch","Colorless","1","","Draw a card.","Headbutt","Colorless, Colorless","2","20","","Fighting","x2"
"ex6-7","Marowak","Pokemon","80","Fighting","","Cubone","7","Aya Kusube","Rare Holo",,"105",,"https://images.pokemontcg.io/ex6/7.png","https://images.pokemontcg.io/ex6/7_hires.png","Legal",,,"Colorless","1","","","","","","","Linear Attack","Fighting, Colorless","2","","Choose 1 of your opponent's Pokemon. This attack does 30 damage to that Pokemon. (Don't apply Weakness and Resistance for Benched Pokemon.)","Vengeance","Fighting, Colorless, Colorless","3","30+","Does 30 damage plus 10 more damage for each Basic Pokemon and each Evolution card in your discard pile. You can't add more than 60 damage in this way.","Grass","x2"
"ex6-8","Nidoking","Pokemon","120","Fighting","","Nidorino","8","Hisao Nakamura","Rare Holo",,"34",,"https://images.pokemontcg.io/ex6/8.png","https://images.pokemontcg.io/ex6/8_hires.png","Legal",,,"Colorless, Colorless, Colorless","3","Power Gene","As long as Nidoking is in play, your attacks by Nidoran ♀, Nidorina, Nidoqueen, Nidoran ♂, and Nidorino do 10 more damage to the Defending Pokemon.","Poke-Body","","","","Earth Poison","Fighting, Colorless","2","40","If the Defending Pokemon already has any damage counters on it, the Defending Pokemon is now Poisoned.","Bound Crush","Fighting, Fighting, Colorless, Colorless","4","","Choose 1 of your opponent's Pokemon. This attack does 60 damage to that Pokemon. (Don't apply Weakness and Resistance for Benched Pokemon.) Nidoking can't use Bound Crush during your next turn.","Water","x2"
"ex6-9","Nidoqueen","Pokemon","120","Fighting","","Nidorina","9","Naoyo Kimura","Rare Holo",,"31",,"https://images.pokemontcg.io/ex6/9.png","https://images.pokemontcg.io/ex6/9_hires.png","Legal",,,"Colorless, Colorless","2","Family Bonds","As long as Nidoqueen is in play, the Retreat Cost for Nidoran ♀, Nidorina, Nidoran ♂, Nidorino and Nidoking is 0.","Poke-Body","","","","Toxic","Grass","1","","The Defending Pokemon is now Poisoned. Put 2 damage counters instead of 1 on the Defending Pokemon between turns.","Power Lariat","Fighting, Colorless, Colorless","3","40+","Does 40 damage plus 10 more damage for each Evolved Pokemon you have in play.","Grass","x2"
"ex6-10","Pidgeot","Pokemon","100","Colorless","","Pidgeotto","10","Midori Harada","Rare Holo",,"18",,"https://images.pokemontcg.io/ex6/10.png","https://images.pokemontcg.io/ex6/10_hires.png","Legal",,,"",,"Quick Search","Once during your turn (before your attack), you may choose any 1 card from your deck and put it into your hand. Shuffle your deck afterward. You can't use more than 1 Quick Search Poke-Power each turn. This power can't be used if Pidgeot is affected by a Special Condition.","Poke-Power","","","","Clutch","Colorless, Colorless","2","40","The Defending Pokemon can't retreat until the end of your opponent's next turn.","","","","","","Lightning","x2"
"ex6-11","Poliwrath","Pokemon","120","Water","","Poliwhirl","11","Ken Sugimori","Rare Holo",,"62",,"https://images.pokemontcg.io/ex6/11.png","https://images.pokemontcg.io/ex6/11_hires.png","Legal",,,"Colorless, Colorless","2","Spiral","As long as Poliwrath is your Active Pokemon, your opponent's Confused Pokemon can't retreat.","Poke-Body","","","","Split Spiral Punch","Colorless, Colorless","2","20","The Defending Pokemon is now Confused.","Mega Throw","Water, Colorless, Colorless","3","50+","If the Defending Pokemon is Pokemon-ex, this attack does 50 damage plus 30 more damage.","Lightning","x2"
"ex6-12","Raichu","Pokemon","80","Lightning","","Pikachu","12","Midori Harada","Rare Holo",,"26",,"https://images.pokemontcg.io/ex6/12.png","https://images.pokemontcg.io/ex6/12_hires.png","Legal",,,"Colorless","1","","","","","","","Recharge","Colorless","1","","Search your deck for up to 2 Lightning Energy cards and attach them to Raichu. Shuffle your deck afterward.","Thunder Reflection","Lightning, Lightning, Colorless","3","50","You may move any number of Lightning Energy cards attached to Raichu to another of your Pokemon.","Fighting","x2"
"ex6-13","Rapidash","Pokemon","80","Fire","","Ponyta","13","Ken Sugimori","Rare Holo",,"78",,"https://images.pokemontcg.io/ex6/13.png","https://images.pokemontcg.io/ex6/13_hires.png","Legal",,,"Colorless","1","Fiery Aura","As long as Rapidash is your Active Pokemon, put 4 damage counters instead of 2 on Burned Pokemon between turns.","Poke-Body","","","","Searing Flame","Fire, Colorless","2","10","The Defending Pokemon is now Burned.","Rear Kick","Fire, Colorless, Colorless","3","40","","Water","x2"
"ex6-14","Slowbro","Pokemon","60","Psychic","","Slowpoke","14","Yuka Morii","Rare Holo",,"80",,"https://images.pokemontcg.io/ex6/14.png","https://images.pokemontcg.io/ex6/14_hires.png","Legal",,,"Colorless","1","Strange Behavior","As often as you like during your turn (before your attack), you may move 1 damage counter from 1 of your Pokemon to Slowbro as long as you don't Knock Out Slowbro. This power can't be used if Slowbro is affected by a Special Condition.","Poke-Power","","","","Psyshock","Psychic, Colorless","2","30","Flip a coin. If heads, the Defending Pokemon is now Paralyzed.","","","","","","Psychic","x2"
"ex6-15","Snorlax","Pokemon","90","Colorless","",,"15","Kagemaru Himeno","Rare Holo",,"143",,"https://images.pokemontcg.io/ex6/15.png","https://images.pokemontcg.io/ex6/15_hires.png","Legal",,,"Colorless, Colorless, Colorless","3","Rest Up","If Snorlax remains Asleep between turns, remove 2 damage counters from Snorlax (remove 1 if there is only 1).","Poke-Body","","","","Collapse","Colorless","1","10","Snorlax is now Asleep.","Toss and Turn","Colorless, Colorless, Colorless","3","30+","If Snorlax is Asleep, this attack does 30 damage plus 30 more damage. (This attack can be used even if Snorlax is Asleep.)","Fighting","x2"
"ex6-16","Tauros","Pokemon","70","Colorless","",,"16","Masakazu Fukuda","Rare Holo",,"128",,"https://images.pokemontcg.io/ex6/16.png","https://images.pokemontcg.io/ex6/16_hires.png","Legal",,,"Colorless","1","","","","","","","Knock Over","Colorless","1","10","You may discard any Stadium card in play.","Rampage","Colorless, Colorless, Colorless","3","20+","Does 20 damage plus 10 more damage for each damage counter on Tauros. After doing damage, flip a coin. If tails, Tauros is now Confused.","Fighting","x2"
"ex6-17","Victreebel","Pokemon","110","Grass","","Weepinbell","17","Tomokazu Komiya","Rare Holo",,"71",,"https://images.pokemontcg.io/ex6/17.png","https://images.pokemontcg.io/ex6/17_hires.png","Legal",,,"Colorless, Colorless","2","Acid Sampler","As long as Victreebel is your Active Pokemon, put 1 damage counter on each Defending Pokemon between turns. Acid Sampler stops working if your other Active Pokemon is not a Victreebel.","Poke-Body","","","","Acid","Grass, Colorless, Colorless","3","50","The Defending Pokemon can't retreat until the end of your opponent's next turn.","","","","","","Fire","x2"
"ex6-18","Arcanine","Pokemon","90","Fire","","Growlithe","18","Ken Sugimori","Rare",,"59",,"https://images.pokemontcg.io/ex6/18.png","https://images.pokemontcg.io/ex6/18_hires.png","Legal",,,"Colorless, Colorless","2","","","","","","","Flare","Fire","1","20","","Heat Tackle","Fire, Colorless, Colorless, Colorless","4","70","Arcanine does 10 damage to itself.","Water","x2"
"ex6-19","Chansey","Pokemon","90","Colorless","Blissey",,"19","Miki Tanaka","Rare",,"113",,"https://images.pokemontcg.io/ex6/19.png","https://images.pokemontcg.io/ex6/19_hires.png","Legal",,,"Colorless, Colorless","2","","","","","","","Sing","Colorless","1","","The Defending Pokemon is now Asleep.","Egg Surprise","Colorless, Colorless, Colorless","3","","Flip a coin. If heads, Chansey does 50 damage to the Defending Pokemon. If tails, remove 5 damage counters from Chansey. (All if there are less than 5.)","Fighting","x2"
"ex6-20","Cloyster","Pokemon","70","Water","","Shellder","20","Aya Kusube","Rare",,"91",,"https://images.pokemontcg.io/ex6/20.png","https://images.pokemontcg.io/ex6/20_hires.png","Legal",,,"Colorless","1","Exoskeleton","Any damage done to Cloyster by attacks is reduced by 20 (after applying Weakness and Resistance).","Poke-Body","","","","Double Bubble","Colorless, Colorless","2","10x","Flip 2 coins. This attack does 10 damage times the number of heads. If either of the coins is heads, the Defending Pokemon is now Paralyzed.","Shell Attack","Water, Colorless, Colorless","3","50","","Lightning","x2"
"ex6-21","Dodrio","Pokemon","70","Colorless","","Doduo","21","Kagemaru Himeno","Rare",,"85",,"https://images.pokemontcg.io/ex6/21.png","https://images.pokemontcg.io/ex6/21_hires.png","Legal",,,"Colorless","1","Retreat Aid","As long as Dodrio is on your Bench, you pay ColorlessColorless less to retreat your Active Pokemon (excluding Pokemon-ex and Baby Pokemon.)","Poke-Body","","","","Tri Attack","Colorless, Colorless","2","20x","Flip 3 coins. This attack does 20 damage times the number of heads.","","","","","","Lightning","x2"
"ex6-22","Dugtrio","Pokemon","80","Fighting","","Diglett","22","Hajime Kusajima","Rare",,"51",,"https://images.pokemontcg.io/ex6/22.png","https://images.pokemontcg.io/ex6/22_hires.png","Legal",,,"Colorless","1","","","","","","","Sonicboom","Fighting, Colorless","2","30","This attack's damage isn't affected by Weakness or Resistance.","Rumble","Fighting, Colorless, Colorless","3","50","The Defending Pokemon can't retreat until the end of your opponent's next turn.","Grass","x2"
"ex6-23","Farfetch'd","Pokemon","70","Colorless","Sirfetch'd",,"23","Yukiko Baba","Rare",,"83",,"https://images.pokemontcg.io/ex6/23.png","https://images.pokemontcg.io/ex6/23_hires.png","Legal",,,"Colorless","1","","","","","","","Hoard","Colorless","1","","Search your deck for up to 2 Pokemon Tool cards and attach them to any of your Pokemon (excluding Pokemon that already have a Pokemon Tool attached to them). Shuffle your deck afterward.","Cross-Cut","Colorless","1","10+","If the Defending Pokemon is an Evolved Pokemon, this attack does 10 damage plus 20 more damage.","Lightning","x2"
"ex6-24","Fearow","Pokemon","80","Colorless","","Spearow","24","Hisao Nakamura","Rare",,"22",,"https://images.pokemontcg.io/ex6/24.png","https://images.pokemontcg.io/ex6/24_hires.png","Legal",,,"Colorless","1","Free Flight","If Fearow has no Energy attached to it, Fearow's Retreat Cost is 0.","Poke-Body","","","","Shot Air","Colorless, Colorless","2","10","Does 20 damage to 1 of your opponent's Benched Pokemon. (Don't apply Weakness and Resistance for Benched Pokemon.)","Drill Peck","Colorless, Colorless, Colorless","3","50","","Lightning","x2"
"ex6-25","Hypno","Pokemon","80","Psychic","","Drowzee","25","Yukiko Baba","Rare",,"97",,"https://images.pokemontcg.io/ex6/25.png","https://images.pokemontcg.io/ex6/25_hires.png","Legal",,,"Colorless","1","Eerie Aura","As long as Hypno is your Active Pokemon, put 2 damage counters on each Pokemon that remains Asleep between turns.","Poke-Body","","","","Hypnotic Ray","Psychic, Colorless","2","20","The Defending Pokemon is now Asleep.","","","","","","Psychic","x2"
"ex6-26","Kingler","Pokemon","80","Water","","Krabby","26","Kouki Saitou","Rare",,"99",,"https://images.pokemontcg.io/ex6/26.png","https://images.pokemontcg.io/ex6/26_hires.png","Legal",,,"Colorless, Colorless","2","","","","","","","Salt Water","Colorless","1","","Search your deck for up to 2 Water Energy cards and attach them to Kingler. Shuffle your deck afterward.","Hyper Pump","Water, Colorless","2","30+","Does 30 damage plus 20 more damage for each basic Energy attached to Kingler but not used to pay for this attack's Energy cost. You can't add more than 40 damage in this way.","Lightning","x2"
"ex6-27","Magneton","Pokemon","80","Lightning","Magnezone","Magnemite","27","Ken Sugimori","Rare",,"82",,"https://images.pokemontcg.io/ex6/27.png","https://images.pokemontcg.io/ex6/27_hires.png","Legal",,,"Colorless","1","","","","","","","Thundershock","Lightning, Colorless","2","20","Flip a coin. If heads, the Defending Pokemon is now Paralyzed.","Speed Shot","Colorless, Colorless, Colorless","3","","Choose 1 of your opponent's Pokemon. This attack does 40 damage to that Pokemon. This attack's damage isn't affected by Weakness, Resistance, Poke-Powers, Poke-Bodies, or any other effects on that Pokemon.","Fighting","x2"
"ex6-28","Primeape","Pokemon","70","Fighting","","Mankey","28","Miki Tanaka","Rare",,"57",,"https://images.pokemontcg.io/ex6/28.png","https://images.pokemontcg.io/ex6/28_hires.png","Legal",,,"",,"","","","","","","Toss","Colorless, Colorless","2","30x","You may discard from your hand as many Technical Machine and Pokemon Tool cards as you like. This attack does 30 damage times the number of cards you discarded.","Low Kick","Fighting, Colorless","2","40","","Psychic","x2"
"ex6-29","Scyther","Pokemon","60","Grass","Scizor",,"29","Kouki Saitou","Rare",,"123",,"https://images.pokemontcg.io/ex6/29.png","https://images.pokemontcg.io/ex6/29_hires.png","Legal",,,"Colorless","1","Leaf Ride","If Scyther has any Energy attached to it, Scyther's Retreat Cost is 0.","Poke-Body","","","","Fury Cutter","Grass, Colorless","2","10+","Flip 3 coins. If 1 of them is heads, this attack does 10 damage plus 10 more damage. If 2 of them are heads, this attack does 10 damage plus 20 more damage. If all of them are heads, this attack does 10 damage plus 40 more damage.","","","","","","Fire","x2"
"ex6-30","Tangela","Pokemon","60","Grass","Tangrowth",,"30","Yuka Morii","Rare",,"114",,"https://images.pokemontcg.io/ex6/30.png","https://images.pokemontcg.io/ex6/30_hires.png","Legal",,,"Colorless","1","","","","","","","Vine Tease","Colorless","1","","Look at your Prize cards without showing your opponent. Choose 1 of the Prize cards and switch it with the top card of your deck without looking at the top card of your deck. If you have no cards in your deck, this attack does nothing.","Wiggle","Grass","1","","Flip a coin. If heads, the Defending Pokemon is now Confused. If tails, the Defending Pokemon is now Poisoned.","Fire","x2"
"ex6-31","Charmeleon","Pokemon","70","Fire","Charizard","Charmander","31","Kouki Saitou","Uncommon",,"5",,"https://images.pokemontcg.io/ex6/31.png","https://images.pokemontcg.io/ex6/31_hires.png","Legal",,,"Colorless","1","","","","","","","Flare","Fire, Colorless","2","30","","Damage Burn","Fire, Colorless, Colorless","3","40+","If the Defending Pokemon already has any damage counters on it, this attack does 40 damage plus 20 more damage.","Water","x2"
"ex6-32","Drowzee","Pokemon","50","Psychic","Hypno",,"32","Yukiko Baba","Uncommon",,"96",,"https://images.pokemontcg.io/ex6/32.png","https://images.pokemontcg.io/ex6/32_hires.png","Legal",,,"Colorless","1","","","","","","","Hypnosis","Colorless","1","","The Defending Pokemon is now Asleep.","Ambush","Psychic","1","10+","Flip a coin. If heads, this attack does 10 damage plus 10 more damage.","Psychic","x2"
"ex6-33","Exeggcute","Pokemon","50","Psychic","Exeggutor",,"33","Tomokazu Komiya","Uncommon",,"102",,"https://images.pokemontcg.io/ex6/33.png","https://images.pokemontcg.io/ex6/33_hires.png","Legal",,,"Colorless","1","","","","","","","Psybeam","Psychic","1","10","Flip a coin. If heads, the Defending Pokemon is now Confused.","Double Spin","Colorless, Colorless","2","20x","Flip 2 coins. This attack does 20 damage times the number of heads.","Psychic","x2"
"ex6-34","Haunter","Pokemon","70","Psychic","Gengar","Gastly","34","Ken Sugimori","Uncommon",,"93",,"https://images.pokemontcg.io/ex6/34.png","https://images.pokemontcg.io/ex6/34_hires.png","Legal",,,"Colorless","1","Head Trip","Once during your turn (before your attack), if Haunter is on your Bench, you may use this power. One of your Active Pokemon is now Confused.","Poke-Power","","","","Confuse Ray","Psychic, Colorless","2","20","Flip a coin. If heads, the Defending Pokemon is now Confused.","","","","","","Darkness","x2"
"ex6-35","Ivysaur","Pokemon","80","Grass","Venusaur","Bulbasaur","35","Atsuko Nishida","Uncommon",,"2",,"https://images.pokemontcg.io/ex6/35.png","https://images.pokemontcg.io/ex6/35_hires.png","Legal",,,"Colorless","1","","","","","","","Poison Seed","Colorless","1","","The Defending Pokemon is now Poisoned.","Razor Leaf","Grass, Grass, Colorless","3","50","","Psychic","x2"
"ex6-36","Kakuna","Pokemon","70","Grass","Beedrill","Weedle","36","Hajime Kusajima","Uncommon",,"14",,"https://images.pokemontcg.io/ex6/36.png","https://images.pokemontcg.io/ex6/36_hires.png","Legal",,,"Colorless, Colorless","2","Poison Payback","If Kakuna is your Active Pokemon and is damaged by an opponent's attack (even if Kakuna is Knocked Out), the Attacking Pokemon is now Poisoned.","Poke-Body","","","","Headbutt","Colorless","1","10","","","","","","","Fire","x2"
"ex6-37","Lickitung","Pokemon","80","Colorless","Lickilicky",,"37","Sumiyoshi Kizuki","Uncommon",,"108",,"https://images.pokemontcg.io/ex6/37.png","https://images.pokemontcg.io/ex6/37_hires.png","Legal",,,"Colorless, Colorless","2","","","","","","","Lick","Colorless","1","10","Flip a coin. If heads, the Defending Pokemon is now Paralyzed.","Tongue Whip","Colorless, Colorless","2","","Choose 1 of your opponent's Pokemon. This attack does 20 damage to that Pokemon. (Don't apply Weakness and Resistance for Benched Pokemon.)","Fighting","x2"
"ex6-38","Mankey","Pokemon","50","Fighting","Primeape",,"38","Miki Tanaka","Uncommon",,"56",,"https://images.pokemontcg.io/ex6/38.png","https://images.pokemontcg.io/ex6/38_hires.png","Legal",,,"Colorless","1","","","","","","","Mischief","Colorless","1","","Shuffle your opponent's deck.","Light Punch","Fighting, Colorless","2","30","","Psychic","x2"
"ex6-39","Metapod","Pokemon","80","Grass","Butterfree","Caterpie","39","Atsuko Nishida","Uncommon",,"11",,"https://images.pokemontcg.io/ex6/39.png","https://images.pokemontcg.io/ex6/39_hires.png","Legal",,,"Colorless, Colorless","2","Energy Protection","Any damage done to Metapod by attacks is reduced by 10 for each Energy attached to Metapod. You can't reduce more than 30 damage in this way.","Poke-Body","","","","Sharpen","Colorless, Colorless","2","20","","","","","","","Fire","x2"
"ex6-40","Nidorina","Pokemon","80","Grass","Nidoqueen","Nidoran ♀","40","Naoyo Kimura","Uncommon",,"30",,"https://images.pokemontcg.io/ex6/40.png","https://images.pokemontcg.io/ex6/40_hires.png","Legal",,,"Colorless","1","","","","","","","Scratch","Colorless","1","20","","Fast Evolution","Colorless, Colorless","2","","Search your deck for up to 2 Evolution cards, show them to your opponent, and put them into your hand. Shuffle your deck afterward.","Psychic","x2"
"ex6-41","Nidorino","Pokemon","70","Grass","Nidoking","Nidoran ♂","41","Hisao Nakamura","Uncommon",,"33",,"https://images.pokemontcg.io/ex6/41.png","https://images.pokemontcg.io/ex6/41_hires.png","Legal",,,"Colorless","1","","","","","","","Double Stab","Colorless","1","20x","Flip 2 coins. This attack does 20 damage times the number of heads.","Rend","Colorless, Colorless, Colorless","3","30+","If the Defending Pokemon already has any damage counters on it, this attack does 30 damage plus 30 more damage.","Psychic","x2"
"ex6-42","Onix","Pokemon","80","Fighting","Steelix",,"42","Kouki Saitou","Uncommon",,"95",,"https://images.pokemontcg.io/ex6/42.png","https://images.pokemontcg.io/ex6/42_hires.png","Legal",,,"Colorless, Colorless, Colorless","3","","","","","","","Rock Throw","Fighting","1","10","","Tunneling","Fighting, Colorless","2","","Choose up to 2 of your opponent's Benched Pokemon. This attack does 10 damage to each of them. (Don't apply Weakness and Resistance for Benched Pokemon.) Onix can't attack during your next turn.","Water","x2"
"ex6-43","Parasect","Pokemon","70","Grass","","Paras","43","Yuka Morii","Uncommon",,"47",,"https://images.pokemontcg.io/ex6/43.png","https://images.pokemontcg.io/ex6/43_hires.png","Legal",,,"Colorless","1","","","","","","","Energy Powder","Grass","1","","Search your deck for up to 2 basic Energy cards and attach them to any of your Pokemon (excluding Pokemon-ex) in any way you like. Shuffle your deck afterward.","Toxic Spore","Grass, Colorless","2","20","The Defending Pokemon is now Poisoned.","Fire","x2"
"ex6-44","Persian","Pokemon","80","Colorless","","Meowth","44","Masakazu Fukuda","Uncommon",,"53",,"https://images.pokemontcg.io/ex6/44.png","https://images.pokemontcg.io/ex6/44_hires.png","Legal",,,"Colorless","1","Thick Skin","Persian can't be affected by any Special Conditions.","Poke-Body","","","","Poison Claws","Colorless","1","","The Defending Pokemon is now Poisoned.","Shining Claws","Colorless, Colorless","2","30","The Defending Pokemon is now Confused.","Fighting","x2"
"ex6-45","Pidgeotto","Pokemon","70","Colorless","Pidgeot","Pidgey","45","Midori Harada","Uncommon",,"17",,"https://images.pokemontcg.io/ex6/45.png","https://images.pokemontcg.io/ex6/45_hires.png","Legal",,,"",,"","","","","","","Clutch","Colorless","1","10","The Defending Pokemon can't retreat until the end of your opponent's next turn.","Cutting Wind","Colorless, Colorless","2","30","","Lightning","x2"
"ex6-46","Poliwhirl","Pokemon","80","Water","Poliwrath, Politoed","Poliwag","46","Ken Sugimori","Uncommon",,"61",,"https://images.pokemontcg.io/ex6/46.png","https://images.pokemontcg.io/ex6/46_hires.png","Legal",,,"Colorless","1","","","","","","","Energy Stream","Colorless","1","10","Search your discard pile for a basic Energy card and attach it to Poliwhirl.","Bubble","Water, Colorless","2","20","Flip a coin. If heads, the Defending Pokemon is now Paralyzed.","Lightning","x2"
"ex6-47","Porygon","Pokemon","50","Colorless","Porygon2",,"47","Tomoaki Imakuni","Uncommon",,"137",,"https://images.pokemontcg.io/ex6/47.png","https://images.pokemontcg.io/ex6/47_hires.png","Legal",,,"Colorless","1","","","","","","","Data Retrieval","Colorless","1","","If you have less than 4 cards in your hand, draw cards until you have 4 cards in your hand.","Confuse Ray","Colorless, Colorless","2","10","The Defending Pokemon is now Confused.","Fighting","x2"
