"id","name","supertype","hp","types","evolvesTo","evolvesFrom","number","artist","rarity","flavorText","nationalPokedexNumbers","regulationMark","imageSmall","imageLarge","legalitiesUnlimited","legalitiesStandard","legalitiesExpanded","retreatCost","convertedRetreatCost","Ability1Name","Ability1Text","Ability1Type","Ability2Name","Ability2Text","Ability2Type","Attack1Name","Attack1Cost","Attack1ConvertedCost","Attack1Damage","Attack1Text","Attack2Name","Attack2Cost","Attack2ConvertedCost","Attack2Damage","Attack2Text","Weakness1Type","Weakness1Value"
"ex8-100","Hariyama ex","Pokemon","110","Fighting","","Makuhita","100","Ryo Ueda","Rare Holo EX",,"297",,"https://images.pokemontcg.io/ex8/100.png","https://images.pokemontcg.io/ex8/100_hires.png","Legal",,,"Colorless, Colorless","2","Commanding Aura","As long as Hariyama ex is your Active Pokemon, your opponent can't play any Stadium cards from his or her hand.","Poke-Body","","","","Knock Off","Fighting, Colorless","2","40","Choose 1 card from your opponent's hand without looking and discard it.","Pivot Throw","Fighting, Fighting, Colorless","3","80","During your opponent's next turn, any damage done to Hariyama ex by attacks is increased by 10 (before applying Weakness and Resistance).","Psychic","x2"
"ex8-101","Manectric ex","Pokemon","100","Lightning","","Electrike","101","Hikaru Koike","Rare Holo EX",,"310",,"https://images.pokemontcg.io/ex8/101.png","https://images.pokemontcg.io/ex8/101_hires.png","Legal",,,"Colorless","1","","","","","","","Disconnect","Lightning, Colorless","2","40","Your opponent can't play any Trainer cards (except for Supporter cards) from his or her hand during your opponent's next turn.","Mega Shot","Lightning, Lightning, Colorless","3","","Discard all Lightning Energy attached to Manectric ex and then choose 1 of your opponent's Pokemon. This attack does 80 damage to that Pokemon. (Don't apply Weakness and Resistance for Benched Pokemon.)","Fighting","x2"
"ex8-102","Rayquaza ex","Pokemon","100","Colorless","",,"102","Shin-ichi Yoshikawa","Rare Holo EX",,"384",,"https://images.pokemontcg.io/ex8/102.png","https://images.pokemontcg.io/ex8/102_hires.png","Legal",,,"Colorless, Colorless","2","Dragon Boost","Once during your turn, when you put Rayquaza ex from your hand onto your Bench, you may move any number of basic Energy cards attached to your Pokemon to Rayquaza ex.","Poke-Power","","","","Spiral Blast","Fire, Lightning","2","20x","Does 20 damage for each basic Energy card attached to Rayquaza ex.","","","","","","Colorless","x2"
"ex8-103","Salamence ex","Pokemon","160","Colorless","","Shelgon","103","Hikaru Koike","Rare Holo EX",,"373",,"https://images.pokemontcg.io/ex8/103.png","https://images.pokemontcg.io/ex8/103_hires.png","Legal",,,"Colorless, Colorless","2","Dragon Lift","The Retreat Cost for each of your Pokemon (excluding Pokemon-ex and Baby Pokemon) is 0.","Poke-Body","","","","Flame Jet","Fire, Colorless","2","","Choose 1 of your opponent's Pokemon. This attack does 40 damage to that Pokemon. This attack's damage isn't affected by Weakness or Resistance.","Bright Flame","Fire, Water, Colorless, Colorless","4","120","Discard 2 Energy attached to Salamence ex.","Colorless","x2"
"ex8-104","Sharpedo ex","Pokemon","100","Darkness","","Carvanha","104","Hikaru Koike","Rare Holo EX",,"319",,"https://images.pokemontcg.io/ex8/104.png","https://images.pokemontcg.io/ex8/104_hires.png","Legal",,,"",,"","","","","","","Drag Off","Colorless, Colorless","2","20","Before doing damage, you may switch 1 of your opponent's Benched Pokemon with the Defending Pokemon. If you do, this attack does 20 damage to the new Defending Pokemon. Your opponent chooses the Defending Pokemon to switch.","Darkness Blast","Darkness, Darkness, Colorless","3","60+","You may discard a Darkness Energy attached to Sharpedo ex. If you do, this attack does 60 damage plus 20 more damage and discard 1 Energy card attached to the Defending Pokemon.","Grass","x2"
"ex8-105","Latias ","Pokemon","80","Colorless","",,"105","Masakazu Fukuda","Rare Holo Star",,"380",,"https://images.pokemontcg.io/ex8/105.png","https://images.pokemontcg.io/ex8/105_hires.png","Legal",,,"Colorless","1","","","","","","","Healing Light","Colorless","1","10","Remove 1 damage counter from each of your Pokemon (including Latias Star).","Shooting Star","Fire, Water, Psychic","3","50+","If the Defending Pokemon is Pokemon-ex, discard all Energy cards attached to Latias Star and this attack does 50 damage plus 100 more damage.","Colorless","x2"
"ex8-106","Latios ","Pokemon","80","Colorless","",,"106","Masakazu Fukuda","Rare Holo Star",,"381",,"https://images.pokemontcg.io/ex8/106.png","https://images.pokemontcg.io/ex8/106_hires.png","Legal",,,"Colorless","1","","","","","","","Miraculous Light","Colorless","1","10","Remove 1 damage counter and all Special Conditions from Latios Star.","Shining Star","Grass, Lightning, Psychic","3","50+","If the Defending Pokemon is a Stage 2 Evolved Pokemon, discard all Energy cards attached to Latios Star and this attack does 50 damage plus 100 more damage.","Colorless","x2"
"ex8-107","Rayquaza ","Pokemon","90","Colorless","",,"107","Masakazu Fukuda","Rare Holo Star",,"384",,"https://images.pokemontcg.io/ex8/107.png","https://images.pokemontcg.io/ex8/107_hires.png","Legal",,,"Colorless, Colorless","2","","","","","","","Spiral Rush","Fire, Lightning","2","30x","Flip a coin until you get tails. This attack does 30 damage times the number of heads.","Holy Star","Fire, Fire, Lightning, Lightning","4","","Discard all Energy cards attached to Rayquaza Star. This attack does 100 damage to each of your opponent's Pokemon-ex. (Don't apply Weakness and Resistance for Benched Pokemon.)","Colorless","x2"
"ex8-108","Rocket's Raikou ex","Pokemon","100","Darkness","",,"108","Ryo Ueda","Rare Secret",,"243",,"https://images.pokemontcg.io/ex8/108.png","https://images.pokemontcg.io/ex8/108_hires.png","Legal",,,"Colorless, Colorless","2","Lightning Burst","Whenever you attach a Darkness Energy card from your hand to Rocket's Raikou ex, you may choose 1 of the Defending Pokemon and switch it with 1 of your opponent's Benched Pokemon. Your opponent chooses the Benched Pokemon to switch. This power can't be used if Rocket's Raikou ex is affected by a Special Condition.","Poke-Power","","","","Thunderous Blow","Lightning, Colorless, Colorless","3","40+","Does 40 damage plus 10 more damage for each Lightning Energy attached to Rocket's Raikou ex.","","","","","","Fighting","x2"
