"id","name","supertype","hp","types","evolvesTo","evolvesFrom","number","artist","rarity","flavorText","nationalPokedexNumbers","regulationMark","imageSmall","imageLarge","legalitiesUnlimited","legalitiesStandard","legalitiesExpanded","retreatCost","convertedRetreatCost","Ability1Name","Ability1Text","Ability1Type","Ability2Name","Ability2Text","Ability2Type","Attack1Name","Attack1Cost","Attack1ConvertedCost","Attack1Damage","Attack1Text","Attack2Name","Attack2Cost","Attack2ConvertedCost","Attack2Damage","Attack2Text","Weakness1Type","Weakness1Value"
"neo1-38","Lanturn","Pokemon","70","Lightning","","Chinchou","38","Ken Sugimori","Uncommon","The light it emits is so bright that it can illuminate the sea's surface from a depth of over three miles.","171",,"https://images.pokemontcg.io/neo1/38.png","https://images.pokemontcg.io/neo1/38_hires.png","Legal",,,"Colorless, Colorless","2","Hydroelectric Power","You may make Floodlight do 10 more damage for each Water Energy attached to Lanturn, but not used to pay for Floodlight's Energy cost. This power can't be used if Lanturn is Asleep, Confused, or Paralyzed.","Pokemon Power","","","","Floodlight","Lightning, Lightning","2","20","Flip a coin. If heads, the Defending Pokemon is now Paralyzed.","","","","","","Fighting","x2"
"neo1-39","Ledian","Pokemon","60","Grass","","Ledyba","39","Ken Sugimori","Uncommon","When the stars flicker in the night sky, Ledian flutters about, scattering a glowing powder.","166",,"https://images.pokemontcg.io/neo1/39.png","https://images.pokemontcg.io/neo1/39_hires.png","Legal",,,"",,"","","","","","","Baton Pass","Grass, Grass","2","30","If you have any Grass Pokemon on your Bench, remove all Grass Energy cards from Ledian and attach them to 1 of those Pokemon, then switch Ledian with that Pokemon.","","","","","","Fire","x2"
"neo1-40","Magmar","Pokemon","70","Fire","Magmortar",,"40","Naoyo Kimura","Uncommon","It dislikes cold places, so it blows scorching flames to make the environment suitable for itself.","126",,"https://images.pokemontcg.io/neo1/40.png","https://images.pokemontcg.io/neo1/40_hires.png","Legal",,,"Colorless, Colorless","2","","","","","","","Tail Slap","Colorless, Colorless","2","20","","Magma Punch","Fire, Fire, Colorless","3","40","","Water","x2"
"neo1-41","Miltank","Pokemon","70","Colorless","",,"41","Ken Sugimori","Uncommon","Its milk is packed with nutrition, making it the ultimate beverage for the sick or weary.","241",,"https://images.pokemontcg.io/neo1/41.png","https://images.pokemontcg.io/neo1/41_hires.png","Legal",,,"Colorless, Colorless","2","","","","","","","Milk Drink","Colorless","1","","Flip 2 coins. Remove 2 damage counters times the number of heads from Miltank. If it has fewer damage counters than that, remove all of them.","Body Slam","Colorless, Colorless, Colorless","3","20","Flip a coin. If heads, the Defending Pokemon is now Paralyzed.","Fighting","x2"
"neo1-42","Noctowl","Pokemon","60","Colorless","","Hoothoot","42","Ken Sugimori","Uncommon","Its eyes are specially adapted. They concentrate even faint light and enable it to see in the dark.","164",,"https://images.pokemontcg.io/neo1/42.png","https://images.pokemontcg.io/neo1/42_hires.png","Legal",,,"",,"Glaring Gaze","Once during your turn (before your attack), you may flip a coin. If heads, look at your opponent's hand. If your opponent has any Trainer cards there, choose 1 of them. Your opponent shuffles that card into his or her deck. This power can't be used if Noctowl is Asleep, Confused, or Paralyzed.","Pokemon Power","","","","Wing Attack","Colorless, Colorless, Colorless","3","30","","","","","","","Lightning","x2"
"neo1-43","Phanpy","Pokemon","40","Fighting","Donphan",,"43","Ken Sugimori","Uncommon","It swings its long snout around playfully, but, because it is so strong, that can be dangerous.","231",,"https://images.pokemontcg.io/neo1/43.png","https://images.pokemontcg.io/neo1/43_hires.png","Legal",,,"Colorless","1","","","","","","","Tackle","Colorless","1","10","","Endure","Fighting","1","","Flip a coin. If heads, then if, during your opponent's next turn, Phanpy would be Knocked Out by an attack, Phanpy isn't Knocked Out and its remaining HP become 10 instead.","Grass","x2"
"neo1-44","Piloswine","Pokemon","80","Water","Mamoswine","Swinub","44","Ken Sugimori","Uncommon","Because the long hair all over its body obscures its sight, it just keeps charging repeatedly.","221",,"https://images.pokemontcg.io/neo1/44.png","https://images.pokemontcg.io/neo1/44_hires.png","Legal",,,"Colorless, Colorless, Colorless","3","","","","","","","Freeze","Water, Water","2","10","Flip a coin. If heads, the Defending Pokemon can't attack. (Benching or evolving the Defending Pokemon ends this effect.)","Blizzard","Water, Water, Water","3","30","Flip a coin. If heads, this attack does 10 damage to each of your opponent's Benched Pokemon; if tails, this attack does 10 damage to each of your own Benched Pokemon. (Don't apply Weakness and Resistance for Benched Pokemon.)","Grass","x2"
"neo1-45","Quagsire","Pokemon","70","Water","","Wooper","45","Atsuko Nishida","Uncommon","Due to its relaxed and carefree attitude, it often bumps its head on boulders and boat hulls as it swims.","195",,"https://images.pokemontcg.io/neo1/45.png","https://images.pokemontcg.io/neo1/45_hires.png","Legal",,,"Colorless, Colorless","2","","","","","","","Surf","Water, Water","2","30","","Earthquake","Fighting, Fighting, Colorless, Colorless","4","60","Does 10 damage to each of your own Benched Pokemon. (Don't apply Weakness and Resistance for Benched Pokemon.)","Grass","x2"
"neo1-46","Quilava","Pokemon","60","Fire","Typhlosion","Cyndaquil","46","Ken Sugimori","Uncommon","This Pokemon is fully covered by nonflammable fur. It can withstand any kind of fire attack.","156",,"https://images.pokemontcg.io/neo1/46.png","https://images.pokemontcg.io/neo1/46_hires.png","Legal",,,"Colorless","1","","","","","","","Ember","Fire, Colorless","2","30","Discard 1 Fire Energy card attached to Quilava in order to use this attack.","Fire Wind","Fire, Fire","2","20","If your opponent has any Benched Pokemon, choose 1 of them. Flip 2 coins. For each heads, this attack does 10 damage to that Pokemon. (Don't apply Weakness and Resistance.)","Water","x2"
"neo1-47","Quilava","Pokemon","70","Fire","Typhlosion","Cyndaquil","47","Ken Sugimori","Uncommon","Be careful if it turns its back during battle. It means that it will attack with the fire on its back.","156",,"https://images.pokemontcg.io/neo1/47.png","https://images.pokemontcg.io/neo1/47_hires.png","Legal",,,"Colorless","1","","","","","","","Smokescreen","Fire, Fire","2","20","If the Defending Pokemon tries to attack during your opponent's next turn, your opponent flips a coin. If tails, that attack does nothing.","Char","Fire, Fire, Fire","3","30","If the Defending Pokemon doesn't have a Char counter on it, flip a coin. If heads, put a Char counter on it. A Char counter requires your opponent to flip a coin after every turn. If tails, put 2 damage counters on the Pokemon with that Char counter. (Char counters stay on the Pokemon as long as it's in play.)","Water","x2"
"neo1-48","Seadra","Pokemon","70","Water","Kingdra","Horsea","48","Shin-ichi Yoshida","Uncommon","An examination of its cells revealed the presence of a gene not found in Horsea. It became a hot topic.","117",,"https://images.pokemontcg.io/neo1/48.png","https://images.pokemontcg.io/neo1/48_hires.png","Legal",,,"Colorless","1","","","","","","","Bubble","Water","1","10","Flip a coin. If heads, the Defending Pokemon is now Paralyzed.","Mud Splash","Water, Water","2","30","If your opponent has any Benched Pokemon, choose 1 of them and flip a coin. If heads, this attack does 10 damage to that Pokemon. (Don't apply Weakness and Resistance for Benched Pokemon.)","Lightning","x2"
"neo1-49","Skiploom","Pokemon","60","Grass","Jumpluff","Hoppip","49","Atsuko Nishida","Uncommon","The bloom on top of its head opens and closes as the temperature fluctuates up and down.","188",,"https://images.pokemontcg.io/neo1/49.png","https://images.pokemontcg.io/neo1/49_hires.png","Legal",,,"",,"","","","","","","Poisonpowder","Grass","1","10","The Defending Pokemon is now Poisoned.","Stun Spore","Grass","1","10","Flip a coin. If heads, the Defending Pokemon is now Paralyzed.","Fire","x2"
"neo1-50","Sunflora","Pokemon","70","Grass","","Sunkern","50","Kagemaru Himeno","Uncommon","It converts sunlight into energy. In the darkness after sunset, it closes its petals and becomes still.","192",,"https://images.pokemontcg.io/neo1/50.png","https://images.pokemontcg.io/neo1/50_hires.png","Legal",,,"Colorless","1","","","","","","","Petal Dance","Grass, Grass, Grass","3","30x","Flip 3 coins. This attack does 30 damage times the number of heads. Sunflora is now Confused (after doing damage).","","","","","","Fire","x2"
"neo1-51","Togepi","Pokemon","40","Colorless","Togetic",,"51","Naoyo Kimura","Uncommon","A proverb claims that happiness will come to anyone who can make a sleeping Togepi stand up.","175",,"https://images.pokemontcg.io/neo1/51.png","https://images.pokemontcg.io/neo1/51_hires.png","Legal",,,"Colorless","1","","","","","","","Poison Barb","Colorless, Colorless","2","10","The Defending Pokemon is now Poisoned.","","","","","",,
"neo1-52","Xatu","Pokemon","80","Psychic","","Natu","52","Ken Sugimori","Uncommon","They say that it stays still and quiet because it is seeing both the past and future at the same time.","178",,"https://images.pokemontcg.io/neo1/52.png","https://images.pokemontcg.io/neo1/52_hires.png","Legal",,,"Colorless","1","","","","","","","Prophecy","Psychic","1","","Look at the top 3 cards of either player's deck and rearrange them as you like.","Confuse Ray","Psychic, Psychic, Psychic","3","30","Flip a coin. If heads, the Defending Pokemon is now Confused.","Psychic","x2"
"neo1-53","Chikorita","Pokemon","40","Grass","Bayleef",,"53","Naoyo Kimura","Common","A sweet aroma gently wafts from the leaf on its head. It is docile and loves to soak up the sun's rays.","152",,"https://images.pokemontcg.io/neo1/53.png","https://images.pokemontcg.io/neo1/53_hires.png","Legal",,,"Colorless","1","","","","","","","Tackle","Colorless","1","10","","Deflector","Grass","1","","During your opponent's next turn, whenever Chikorita takes damage, divide that damage in half (rounded down to the nearest 10). (Any other effects still happen.)","Fire","x2"
"neo1-54","Chikorita","Pokemon","50","Grass","Bayleef",,"54","Ken Sugimori","Common","Its pleasantly aromatic leaf has the ability to check the humidity and temperature.","152",,"https://images.pokemontcg.io/neo1/54.png","https://images.pokemontcg.io/neo1/54_hires.png","Legal",,,"Colorless","1","","","","","","","Growl","Colorless","1","","If the Defending Pokemon attacks Chikorita during your opponent's next turn, any damage done to Chikorita is reduced by 10 (before applying Weakness and Resistance). (Benching or evolving either Pokemon ends this effect.)","Razor Leaf","Grass, Colorless","2","20","","Fire","x2"
"neo1-55","Chinchou","Pokemon","50","Lightning","Lanturn",,"55","Ken Sugimori","Common","It shoots positive and negative electricity between the tips of its two antennae and zaps its enemies.","170",,"https://images.pokemontcg.io/neo1/55.png","https://images.pokemontcg.io/neo1/55_hires.png","Legal",,,"Colorless","1","","","","","","","Supersonic","Lightning","1","","Flip a coin. If heads, the Defending Pokemon is now Confused.","Flail","Water","1","10x","Does 10 damage times the number of damage counters on Chinchou.","Fighting","x2"
"neo1-56","Cyndaquil","Pokemon","40","Fire","Quilava",,"56","Ken Sugimori","Common","It usually stays hunched over. If it is angry or surprised, it shoots flames out of its back.","155",,"https://images.pokemontcg.io/neo1/56.png","https://images.pokemontcg.io/neo1/56_hires.png","Legal",,,"Colorless","1","","","","","","","Leer","Colorless","1","","Flip a coin. If heads, the Defending Pokemon can't attack Cyndaquil during your opponent's next turn. (Benching or evolving either Pokemon ends this effect.)","Swift","Fire, Colorless","2","20","This attack's damage isn't affected by Weakness, Resistance, Pokemon Powers, or any other effects on the Defending Pokemon.","Water","x2"
"neo1-57","Cyndaquil","Pokemon","50","Fire","Quilava",,"57","Shin-ichi Yoshida","Common","It is timid and always curls itself up in a ball. If attacked, it flares up its back for protection.","155",,"https://images.pokemontcg.io/neo1/57.png","https://images.pokemontcg.io/neo1/57_hires.png","Legal",,,"Colorless","1","","","","","","","Fireworks","Fire","1","20","Flip a coin. If tails, discard 1 Energy card attached to Cyndaquil.","Quick Attack","Colorless, Colorless","2","10+","Flip a coin. If heads, this attack does 10 damage plus 20 more damage; if tails, this attack does 10 damage.","Water","x2"
"neo1-58","Girafarig","Pokemon","60","Psychic","",,"58","Ken Sugimori","Common","Its tail has a small brain of its own. Beware! If you get close, it may react to your scent and bite.","203",,"https://images.pokemontcg.io/neo1/58.png","https://images.pokemontcg.io/neo1/58_hires.png","Legal",,,"Colorless","1","","","","","","","Agility","Colorless, Colorless","2","10","Flip a coin. If heads, during your opponent's next turn, prevent all effects of attacks, including damage, done to Girafarig.","Psybeam","Psychic, Psychic","2","20","Flip a coin. If heads, the Defending Pokemon is now Confused.",,
"neo1-59","Gligar","Pokemon","60","Fighting","Gliscor",,"59","Hironobu Yoshida","Common","It flies straight at its target's face, then clamps down on the startled victim to inject poison.","207",,"https://images.pokemontcg.io/neo1/59.png","https://images.pokemontcg.io/neo1/59_hires.png","Legal",,,"",,"","","","","","","Poison Sting","Fighting","1","10","Flip a coin. If heads, the Defending Pokemon is now Poisoned.","Slash","Colorless, Colorless","2","20","","Grass","x2"
"neo1-60","Hoothoot","Pokemon","50","Colorless","Noctowl",,"60","Sumiyoshi Kizuki","Common","It always stands on one foot. It changes feet so fast that the movement can rarely be seen.","163",,"https://images.pokemontcg.io/neo1/60.png","https://images.pokemontcg.io/neo1/60_hires.png","Legal",,,"Colorless","1","","","","","","","Hypnosis","Colorless","1","","The Defending Pokemon is now Asleep.","Peck","Colorless, Colorless","2","20","","Lightning","x2"
"neo1-61","Hoppip","Pokemon","50","Grass","Skiploom",,"61","Atsuko Nishida","Common","To keep from being blown away by the wind, they gather in clusters. They do enjoy gentle breezes, though.","187",,"https://images.pokemontcg.io/neo1/61.png","https://images.pokemontcg.io/neo1/61_hires.png","Legal",,,"",,"","","","","","","Hop","Colorless","1","10","","Sprout","Grass","1","","Search your deck for a Basic Pokemon named Hoppip and put it onto your Bench. Shuffle your deck afterward. (You can't use this attack if your Bench is full.)","Fire","x2"
"neo1-62","Horsea","Pokemon","50","Water","Seadra",,"62","Miki Tanaka","Common","If attacked by a larger enemy, it quickly swims to safety by adeptly controlling its dorsal fin.","116",,"https://images.pokemontcg.io/neo1/62.png","https://images.pokemontcg.io/neo1/62_hires.png","Legal",,,"",,"","","","","","","Fin Slap","Water, Water","2","20+","If an attack damaged Horsea during your opponent's last turn, this attack does 20 damage plus 10 more damage. If not, this attack does 20 damage.","","","","","","Lightning","x2"
"neo1-63","Ledyba","Pokemon","40","Grass","Ledian",,"63","Sumiyoshi Kizuki","Common","It is very timid. It's afraid to move if alone, but it's active if in a group.","165",,"https://images.pokemontcg.io/neo1/63.png","https://images.pokemontcg.io/neo1/63_hires.png","Legal",,,"",,"","","","","","","Supersonic","Grass","1","","Flip a coin. If heads, the Defending Pokemon is now Confused.","Comet Punch","Grass, Grass","2","","Flip 4 coins. This attack does 10 damage times the number of heads.","Fire","x2"
"neo1-64","Mantine","Pokemon","60","Water","",,"64","Ken Sugimori","Common","Swimming freely in open seas, it may fly out of the water and over the waves if it builds up enough speed.","226",,"https://images.pokemontcg.io/neo1/64.png","https://images.pokemontcg.io/neo1/64_hires.png","Legal",,,"Colorless","1","","","","","","","Undulate","Water, Water","2","20","Flip a coin. If heads, during your opponent's next turn, prevent all effects of attacks, including damage, done to Mantine.","","","","","","Lightning","x2"
"neo1-65","Mareep","Pokemon","40","Lightning","Flaaffy",,"65","Ken Sugimori","Common","If static electricity builds in its body, its fleece doubles in volume. Touching it will shock you.","179",,"https://images.pokemontcg.io/neo1/65.png","https://images.pokemontcg.io/neo1/65_hires.png","Legal",,,"Colorless","1","","","","","","","Static Electricity","Lightning","1","","For each Mareep in play, you may search your deck for a Lightning Energy card and attach it to Mareep. Shuffle your deck afterward.","Thundershock","Lightning, Lightning","2","20","Flip a coin. If heads, the Defending Pokemon is now Paralyzed.","Fighting","x2"
"neo1-66","Marill","Pokemon","40","Water","Azumarill",,"66","Atsuko Nishida","Common","The end of its tail serves as a buoy that keeps it from drowning, even in a vicious current.","183",,"https://images.pokemontcg.io/neo1/66.png","https://images.pokemontcg.io/neo1/66_hires.png","Legal",,,"Colorless","1","","","","","","","Defense Curl","Colorless","1","","Flip a coin. If heads, prevent all damage done to Marill during your opponent's next turn. (Any other effects of attacks still happen.)","Bubble Bomb","Water, Water","2","30","Flip a coin. If heads, the Defending Pokemon is now Paralyzed. If tails, Marill does 10 damage to itself.","Lightning","x2"
"neo1-67","Natu","Pokemon","30","Psychic","Xatu",,"67","Ken Sugimori","Common","Because its wings aren't yet fully grown, it has to hop to get around. It is always staring at something.","177",,"https://images.pokemontcg.io/neo1/67.png","https://images.pokemontcg.io/neo1/67_hires.png","Legal",,,"",,"","","","","","","Peck","Colorless","1","10","","Telekinesis","Psychic, Psychic","2","","Choose 1 of your opponent's Pokemon. This attack does 20 damage to that Pokemon. Don't apply Weakness and Resistance for this attack. (Any other effects that would happen after applying Weakness and Resistance still happen.)","Psychic","x2"
"neo1-68","Oddish","Pokemon","40","Grass","Gloom",,"68","Sumiyoshi Kizuki","Common","Awakened by moonlight, it roams actively at night. In the day it stays quietly underground.","43",,"https://images.pokemontcg.io/neo1/68.png","https://images.pokemontcg.io/neo1/68_hires.png","Legal",,,"Colorless","1","","","","","","","Hide","Colorless","1","","Flip a coin. If heads, during your opponent's next turn, prevent all effects of attacks, including damage, done to Oddish.","Absorb","Grass, Grass","2","20","Remove a number of damage counters from Oddish equal to half the damage done to the Defending Pokemon (after applying Weakness and Resistance) (rounded up to the nearest 10). If Oddish has fewer damage counters than that, remove all of them.","Fire","x2"
"neo1-69","Onix","Pokemon","60","Fighting","Steelix",,"69","Mitsuhiro Arita","Common","It twists and squirms through the ground. The thunderous roar of its tunneling echoes a long way.","95",,"https://images.pokemontcg.io/neo1/69.png","https://images.pokemontcg.io/neo1/69_hires.png","Legal",,,"Colorless, Colorless","2","","","","","","","Screech","Colorless","1","","Until the end of your next turn, if an attack damages the Defending Pokemon (after applying Weakness and Resistance), that attack does 20 more damage to the Defending Pokemon.","Rage","Fighting, Fighting","2","10+","Does 10 damage plus 10 more damage for each damage counter on Onix.","Grass","x2"
"neo1-70","Pikachu","Pokemon","50","Lightning","Raichu",,"70","Naoyo Kimura","Common","It raises its tail to check its surroundings. The tail is sometimes struck by lightning in this pose.","25",,"https://images.pokemontcg.io/neo1/70.png","https://images.pokemontcg.io/neo1/70_hires.png","Legal",,,"Colorless","1","","","","","","","Quick Attack","Colorless","1","10+","Flip a coin. If heads, this attack does 10 damage plus 20 more damage; if tails, this attack does 10 damage.","Agility","Lightning, Lightning, Colorless","3","20","Flip a coin. If heads, during your opponent's next turn, prevent all effects of attacks, including damage, done to Pikachu.","Fighting","x2"
"neo1-71","Sentret","Pokemon","40","Colorless","Furret",,"71","Ken Sugimori","Common","A very cautious Pokemon, it raises itself up using its tail to get a better view of its surroundings.","161",,"https://images.pokemontcg.io/neo1/71.png","https://images.pokemontcg.io/neo1/71_hires.png","Legal",,,"Colorless","1","","","","","","","Fury Swipes","Colorless","1","10x","Flip 3 coins. This attack does 10 damage times the number of heads.","","","","","","Fighting","x2"
"neo1-72","Shuckle","Pokemon","50","Grass","",,"72","Ken Sugimori","Common","The Berries it stores in its vaselike shell decompose and become a gooey liquid.","213",,"https://images.pokemontcg.io/neo1/72.png","https://images.pokemontcg.io/neo1/72_hires.png","Legal",,,"Colorless","1","","","","","","","Withdraw","Grass","1","","Flip a coin. If heads, prevent all damage done to Shuckle during your opponent's next turn. (Any other effects of attacks still happen.)","Wrap","Grass, Grass","2","20","Flip a coin. If heads, the Defending Pokemon is now Paralyzed.","Fire","x2"
"neo1-73","Slowpoke","Pokemon","50","Psychic","Slowbro, Slowking",,"73","Tomokazu Komiya","Common","It lazes vacantly near water. If something bites its tail, it won't even notice for a whole day.","79",,"https://images.pokemontcg.io/neo1/73.png","https://images.pokemontcg.io/neo1/73_hires.png","Legal",,,"Colorless","1","","","","","","","Psyshock","Psychic","1","10","Flip a coin. If heads, the Defending Pokemon is now Paralyzed.","Water Gun","Water","1","10+","Does 10 damage plus 10 more damage for each Water Energy attached to Slowpoke but not used to pay for this attack's Energy cost. You can't add more than 20 damage in this way.","Psychic","x2"
"neo1-74","Snubbull","Pokemon","50","Colorless","Granbull",,"74","Mitsuhiro Arita","Common","Although it looks frightening, it is actually kind and affectionate. It is very popular.","209",,"https://images.pokemontcg.io/neo1/74.png","https://images.pokemontcg.io/neo1/74_hires.png","Legal",,,"Colorless","1","","","","","","","Roar","Colorless","1","","Flip a coin. If heads and if your opponent has any Benched Pokemon, he of she chooses 1 of them and switches it with the Defending Pokemon. (Do the damage before switching the Pokemon.)","Lick","Colorless, Colorless","2","10","Flip a coin. If heads, the Defending Pokemon is now Paralyzed.","Fighting","x2"
"neo1-75","Spinarak","Pokemon","40","Grass","Ariados",,"75","Ken Sugimori","Common","It lies still in the same pose for days in its web, waiting for its unsuspecting prey to wander close.","167",,"https://images.pokemontcg.io/neo1/75.png","https://images.pokemontcg.io/neo1/75_hires.png","Legal",,,"Colorless","1","","","","","","","Scary Face","Colorless","1","","Flip a coin. If heads, until the end of your opponent's next turn, the Defending Pokemon can't attack or retreat.","String Shot","Grass","1","10","Flip a coin. If heads, the Defending Pokemon is now Paralyzed.","Fire","x2"
"neo1-76","Stantler","Pokemon","60","Colorless","",,"76","Ken Sugimori","Common","The curved antlers subtly change the flow of air to create a strange space where reality is distorted.","234",,"https://images.pokemontcg.io/neo1/76.png","https://images.pokemontcg.io/neo1/76_hires.png","Legal",,,"Colorless, Colorless","2","","","","","","","Stomp","Colorless, Colorless","2","20+","Flip a coin. If heads, this attack does 20 damage plus 10 more damage; if tails, this attack does 20 damage.","Mystifying Horns","Colorless, Colorless, Colorless","3","20","Flip a coin. If heads, the Defending Pokemon is now Confused.","Fighting","x2"
"neo1-77","Sudowoodo","Pokemon","60","Fighting","",,"77","Ken Sugimori","Common","Although it always pretends to be a tree, its composition appears to be closer to a rock than a plant.","185",,"https://images.pokemontcg.io/neo1/77.png","https://images.pokemontcg.io/neo1/77_hires.png","Legal",,,"Colorless, Colorless, Colorless","3","","","","","","","Flail","Fighting","1","10x","Does 10 damage times the number of damage counters on Sudowoodo.","Rock Throw","Fighting, Colorless","2","30","","Water","x2"
"neo1-78","Sunkern","Pokemon","40","Grass","Sunflora",,"78","Kagemaru Himeno","Common","It may drop out of the sky suddenly. If attacked by a Spearow, it violently shakes its leaves.","191",,"https://images.pokemontcg.io/neo1/78.png","https://images.pokemontcg.io/neo1/78_hires.png","Legal",,,"Colorless, Colorless","2","","","","","","","Growth","Grass","1","","Flip a coin. If heads, you may attach up to 2 Grass Energy cards from your hand to Sunkern.","Mega Drain","Grass, Grass, Grass","3","30","Remove a number of damage counters from Sunkern equal to half the damage done to the Defending Pokemon (after applying Weakness and Resistance) (rounded up to the nearest 10). If Sunkern has fewer damage counters than that, remove all of them.","Fire","x2"
"neo1-79","Swinub","Pokemon","40","Water","Piloswine",,"79","Ken Sugimori","Common","It rubs its snout on the ground to find and dig up food. It sometimes discovers hot springs.","220",,"https://images.pokemontcg.io/neo1/79.png","https://images.pokemontcg.io/neo1/79_hires.png","Legal",,,"Colorless","1","","","","","","","Powder Snow","Water","1","10","The Defending Pokemon is now Asleep.","","","","","","Grass","x2"
