"id","name","supertype","hp","types","evolvesTo","evolvesFrom","number","artist","rarity","flavorText","nationalPokedexNumbers","regulationMark","imageSmall","imageLarge","legalitiesUnlimited","legalitiesStandard","legalitiesExpanded","retreatCost","convertedRetreatCost","Ability1Name","Ability1Text","Ability1Type","Ability2Name","Ability2Text","Ability2Type","Attack1Name","Attack1Cost","Attack1ConvertedCost","Attack1Damage","Attack1Text","Attack2Name","Attack2Cost","Attack2ConvertedCost","Attack2Damage","Attack2Text","Weakness1Type","Weakness1Value"
"np-1","Kyogre ex","Pokémon","120","Water","",,"1","Hiromichi Sugiyama","Promo",,"382",,"https://images.pokemontcg.io/np/1.png","https://images.pokemontcg.io/np/1_hires.png","Legal",,,"Colorless, Colorless, Colorless","3","","","","","","","Major Flood","Water, Water, Water, Water","4","60","Discard a Water Energy card attached to Kyogre ex. Does 10 damage to each Benched Pokémon (both yours and your opponent's). (Don't apply Weakness and Resistance for Benched Pokémon.)","","","","","","Lightning","×2"
"np-2","Groudon ex","Pokémon","120","Fighting","",,"2","Kazuo Yazawa","Promo",,"383",,"https://images.pokemontcg.io/np/2.png","https://images.pokemontcg.io/np/2_hires.png","Legal",,,"Colorless, Colorless, Colorless","3","","","","","","","Major Earthquake","Fighting, Fighting, Fighting, Fighting","4","80","Discard a Fighting Energy card attached to Groudon ex. Does 10 damage to your Benched Pokémon. (Don't apply Weakness and Resistance for Benched Pokémon.)","","","","","","Grass","×2"
"np-3","Treecko","Pokémon","40","Grass","Grovyle",,"3","Atsuko Nishida","Promo",,"252",,"https://images.pokemontcg.io/np/3.png","https://images.pokemontcg.io/np/3_hires.png","Legal",,,"Colorless","1","","","","","","","Tail Slap","Colorless","1","10","","Razor Leaf","Grass, Colorless","2","20","","Fire","×2"
"np-4","Grovyle","Pokémon","70","Grass","Sceptile","Treecko","4","Midori Harada","Promo",,"253",,"https://images.pokemontcg.io/np/4.png","https://images.pokemontcg.io/np/4_hires.png","Legal",,,"Colorless","1","","","","","","","Poison Breath","Colorless, Colorless","2","","The Defending Pokémon is now Poisoned.","Swift","Grass, Colorless, Colorless","3","30","This attack's damage isn't affected by Weakness, Resistance, Poké-Powers, Poké-Bodies, or any other effects on the Defending Pokémon.","Fire","×2"
"np-5","Mudkip","Pokémon","50","Water","Marshtomp",,"5","Ken Sugimori","Promo",,"258",,"https://images.pokemontcg.io/np/5.png","https://images.pokemontcg.io/np/5_hires.png","Legal",,,"Colorless","1","","","","","","","Pound","Colorless","1","10","","Fury Swipes","Colorless, Colorless","2","10×","Flip 3 coins. This attack does 10 damage times the number of heads.","Lightning","×2"
"np-6","Torchic","Pokémon","40","Fire","Combusken",,"6","Ken Sugimori","Promo",,"255",,"https://images.pokemontcg.io/np/6.png","https://images.pokemontcg.io/np/6_hires.png","Legal",,,"Colorless","1","","","","","","","Peck","Colorless","1","10","","Fireworks","Fire, Colorless","2","30","Flip a coin. If tails, discard a Fire Energy card attached to Torchic.","Water","×2"
"np-7","Treecko","Pokémon","40","Grass","Grovyle",,"7","Ken Sugimori","Promo",,"252",,"https://images.pokemontcg.io/np/7.png","https://images.pokemontcg.io/np/7_hires.png","Legal",,,"Colorless","1","","","","","","","Tail Slap","Colorless","1","10","","Razor Leaf","Grass, Colorless","2","20","","Fire","×2"
"np-8","Torchic","Pokémon","40","Fire","Combusken",,"8","Atsuko Nishida","Promo",,"255",,"https://images.pokemontcg.io/np/8.png","https://images.pokemontcg.io/np/8_hires.png","Legal",,,"Colorless","1","","","","","","","Peck","Colorless","1","10","","Fireworks","Fire, Colorless","2","30","Flip a coin. If tails, discard a Fire Energy card attached to Torchic.","Water","×2"
"np-9","Combusken","Pokémon","70","Fire","Blaziken","Torchic","9","Kouki Saitou","Promo",,"256",,"https://images.pokemontcg.io/np/9.png","https://images.pokemontcg.io/np/9_hires.png","Legal",,,"Colorless","1","","","","","","","Flare","Fire","1","20","","Double Kick","Colorless, Colorless, Colorless","3","40×","Flip 2 coins. This attack does 40 damage times the number of heads.","Water","×2"
"np-10","Mudkip","Pokémon","50","Water","Marshtomp",,"10","Atsuko Nishida","Promo",,"258",,"https://images.pokemontcg.io/np/10.png","https://images.pokemontcg.io/np/10_hires.png","Legal",,,"Colorless","1","","","","","","","Pound","Colorless","1","10","","Fury Swipes","Colorless, Colorless","2","10×","Flip 3 coins. This attack does 10 damage times the number of heads.","Lightning","×2"
"np-11","Marshtomp","Pokémon","70","Water","Swampert","Mudkip","11","Mitsuhiro Arita","Promo",,"259",,"https://images.pokemontcg.io/np/11.png","https://images.pokemontcg.io/np/11_hires.png","Legal",,,"Colorless","1","","","","","","","Bubble","Water","1","10","Flip a coin. If heads, the Defending Pokémon is now Paralyzed.","Slash","Colorless, Colorless, Colorless","3","40","","Lightning","×2"
"np-12","Pikachu","Pokémon","50","Lightning","Raichu",,"12","Kouki Saitou","Promo",,"25",,"https://images.pokemontcg.io/np/12.png","https://images.pokemontcg.io/np/12_hires.png","Legal",,,"Colorless","1","","","","","","","Agility","Colorless","1","","Flip a coin. If heads, prevent all effects of an attack, including damage, done to Pikachu during your opponent's next turn.","Thundershock","Lightning, Colorless","2","20","Flip a coin. If heads, the Defending Pokémon is now Paralyzed.","Fighting","×2"
"np-13","Meowth","Pokémon","50","Colorless","Persian",,"13","Kouki Saitou","Promo",,"52",,"https://images.pokemontcg.io/np/13.png","https://images.pokemontcg.io/np/13_hires.png","Legal",,,"Colorless","1","","","","","","","Plunder","Colorless","1","10","Before doing damage, discard all Trainer cards attached to the Defending Pokémon (before they affect the damage.).","Scratch","Colorless, Colorless","2","20","","Fighting","×2"
"np-14","Latias","Pokémon","70","Colorless","",,"14","Ken Sugimori","Promo",,"380",,"https://images.pokemontcg.io/np/14.png","https://images.pokemontcg.io/np/14_hires.png","Legal",,,"Colorless, Colorless","2","","","","","","","Super Psy","Psychic","1","10","","Searing Flame","Fire, Water","2","20","Flip a coin. If heads, the Defending Pokémon is now Burned.","Psychic","×2"
"np-15","Latios","Pokémon","80","Colorless","",,"15","Ken Sugimori","Promo",,"381",,"https://images.pokemontcg.io/np/15.png","https://images.pokemontcg.io/np/15_hires.png","Legal",,,"Colorless, Colorless, Colorless","3","","","","","","","Super Psy","Psychic","1","10","","Freeze Dry","Water, Psychic, Lightning","3","30","Flip a coin. If heads, the Defending Pokémon is now Paralyzed.","Psychic","×2"
"np-16","Treecko","Pokémon","40","Grass","Grovyle",,"16","Kagemaru Himeno","Promo",,"252",,"https://images.pokemontcg.io/np/16.png","https://images.pokemontcg.io/np/16_hires.png","Legal",,,"Colorless","1","","","","","","","Pound","Colorless","1","10","","Sporadic Sponging","Grass","1","10","Flip a coin. If heads, remove 1 damage counter from Treecko.","Fire","×2"
"np-17","Torchic","Pokémon","50","Fire","Combusken",,"17","Kagemaru Himeno","Promo",,"255",,"https://images.pokemontcg.io/np/17.png","https://images.pokemontcg.io/np/17_hires.png","Legal",,,"Colorless","1","","","","","","","Ember","Fire, Colorless","2","30","Discard a Fire Energy card attached to Torchic.","","","","","","Water","×2"
"np-18","Mudkip","Pokémon","50","Water","Marshtomp",,"18","Kagemaru Himeno","Promo",,"258",,"https://images.pokemontcg.io/np/18.png","https://images.pokemontcg.io/np/18_hires.png","Legal",,,"Colorless","1","","","","","","","Surf","Water","1","10","","Whirlpool","Water, Colorless","2","10","Flip a coin. If heads, discard an Energy card attached to the Defending Pokémon.","Lightning","×2"
"np-19","Whismur","Pokémon","50","Colorless","Loudred",,"19","Kagemaru Himeno","Promo",,"293",,"https://images.pokemontcg.io/np/19.png","https://images.pokemontcg.io/np/19_hires.png","Legal",,,"Colorless","1","","","","","","","Supersonic","Colorless","1","","Flip a coin. If heads, the Defending Pokémon is now Confused.","Pound","Colorless","1","10","","Fighting","×2"
"np-20","Ludicolo","Pokémon","90","Water","","Lombre","20","Kouki Saitou","Promo",,"272",,"https://images.pokemontcg.io/np/20.png","https://images.pokemontcg.io/np/20_hires.png","Legal",,,"Colorless, Colorless","2","Rain Dish","At any time between turns, remove 1 damage counter from Ludicolo.","Poké-Body","","","","Fury Swipes","Water, Colorless, Colorless","3","30×","Flip 3 coins. This attack does 30 damage times the number of heads.","","","","","","Lightning","×2"
"np-21","Jirachi","Pokémon","50","Psychic","",,"21","Atsuko Nishida","Promo",,"385",,"https://images.pokemontcg.io/np/21.png","https://images.pokemontcg.io/np/21_hires.png","Legal",,,"Colorless","1","","","","","","","The Third Eye","Colorless","1","","Discard an Energy card attached to Jirachi and draw 3 cards.","Psywave","Psychic","1","10×","Does 10 damage times the amount of Energy attached to the Defending Pokémon.","Psychic","×2"
"np-22","Beldum","Pokémon","50","Metal","Metang",,"22","Mitsuhiro Arita","Promo",,"374",,"https://images.pokemontcg.io/np/22.png","https://images.pokemontcg.io/np/22_hires.png","Legal",,,"Colorless, Colorless","2","Magnetic Call","Once during your turn (before your attack), you may flip a coin. If heads, search your deck for a Metal Basic Pokémon and put it onto your Bench. Shuffle your deck afterward. This power can't be used if Beldum is affected by a Special Condition.","Poké-Power","","","","Metal Charge","Metal, Colorless","2","30","Put 1 damage counter on Beldum.","","","","","","Fire","×2"
"np-23","Metang","Pokémon","80","Metal","Metagross","Beldum","23","Mitsuhiro Arita","Promo",,"375",,"https://images.pokemontcg.io/np/23.png","https://images.pokemontcg.io/np/23_hires.png","Legal",,,"Colorless, Colorless","2","","","","","","","Metal Load","Colorless","1","","Search your discard pile for a Metal Energy card and attach it to Metang.","Metal Claw","Metal, Colorless","2","30","","Fire","×2"
"np-24","Chimecho","Pokémon","70","Psychic","",,"24","Atsuko Nishida","Promo",,"358",,"https://images.pokemontcg.io/np/24.png","https://images.pokemontcg.io/np/24_hires.png","Legal",,,"Colorless","1","","","","","","","Resonate","Colorless","1","","Your opponent switches each Defending Pokémon with his or her Benched Pokémon. If your opponent has only 1 Benched Pokémon, you choose the Defending Pokémon to switch.","Healing Sound","Colorless, Colorless","2","","Remove 3 damage counters from each of your Active Pokémon. Each Defending Pokémon is now Asleep.","Psychic","×2"
"np-25","Flygon","Pokémon","120","Colorless","","Vibrava","25","Kouki Saitou","Promo",,"330",,"https://images.pokemontcg.io/np/25.png","https://images.pokemontcg.io/np/25_hires.png","Legal",,,"Colorless, Colorless","2","","","","","","","Sand Pit","Colorless, Colorless","2","20","The Defending Pokémon can't retreat until the end of your opponent's next turn.","Dragonbreath","Grass, Lightning, Colorless, Colorless","4","80","Flip a coin. If heads, the Defending Pokémon is now Paralyzed. If tails, this attack does nothing.","Colorless","×2"
"np-26","Tropical Wind","Trainer",,"","",,"26","Sumiyoshi Kizuki","Promo",,"",,"https://images.pokemontcg.io/np/26.png","https://images.pokemontcg.io/np/26_hires.png","Legal",,,"",,"","","","","","","","","","","","","","","","",,
"np-27","Tropical Tidal Wave","Trainer",,"","",,"27","Sumiyoshi Kizuki","Promo",,"",,"https://images.pokemontcg.io/np/27.png","https://images.pokemontcg.io/np/27_hires.png","Legal",,,"",,"","","","","","","","","","","","","","","","",,
"np-28","Championship Arena","Trainer",,"","",,"28","Ryo Ueda","Promo",,"",,"https://images.pokemontcg.io/np/28.png","https://images.pokemontcg.io/np/28_hires.png","Legal",,,"",,"","","","","","","","","","","","","","","","",,
"np-29","Celebi","Pokémon","50","Grass","",,"29","Hajime Kusajima","Promo",,"251",,"https://images.pokemontcg.io/np/29.png","https://images.pokemontcg.io/np/29_hires.png","Legal",,,"Colorless","1","","","","","","","Leaf Slice","Grass, Colorless","2","20×","Flip 2 coins. This attack does 20 damage times the number of heads.","","","","","","Fire","×2"
"np-30","Suicune","Pokémon","70","Water","",,"30","Atsuko Nishida","Promo",,"245",,"https://images.pokemontcg.io/np/30.png","https://images.pokemontcg.io/np/30_hires.png","Legal",,,"Colorless","1","Pure Body","Whenever you attach a Water Energy card from your hand to Suicune, discard an Energy card attached to Suicune. (You can't attach a Water Energy card from your hand if Suicune has no Energy cards attached.)","Poké-Body","","","","Hypno Wave","Water, Colorless, Colorless","3","30+","Flip a coin. If heads, this attack does 30 damage plus 20 more damage. If tails, this attack does 30 damage and the Defending Pokémon is now Asleep.","","","","","","Lightning","×2"
"np-31","Moltres ex","Pokémon","100","Fire","",,"31","Ken Ikuji","Promo",,"146",,"https://images.pokemontcg.io/np/31.png","https://images.pokemontcg.io/np/31_hires.png","Legal",,,"Colorless, Colorless","2","Synchronized Lift","As long as you have Articuno ex and Zapdos ex in play, the Retreat Cost for Moltres ex is 0.","Poké-Body","","","","Flame Gift","Colorless","1","10","You may move a Fire Energy card attached to Moltres ex to 1 of your Pokémon.","Scorching Wing","Fire, Fire, Colorless","3","90","Discard all Fire Energy attached to Moltres ex.","Water","×2"
"np-32","Articuno ex","Pokémon","100","Water","",,"32","Nakaoka","Promo",,"144",,"https://images.pokemontcg.io/np/32.png","https://images.pokemontcg.io/np/32_hires.png","Legal",,,"Colorless, Colorless","2","Synchronized Lift","As long as you have Zapdos ex and Moltres ex in play, the Retreat Cost for Articuno ex is 0.","Poké-Body","","","","Ice Gift","Colorless","1","10","You may move a Water Energy attached to Articuno ex to 1 of your Pokémon.","Freezing Wing","Water, Water, Colorless","3","50","Flip a coin. If heads, the Defending Pokémon is now Asleep.","Metal","×2"
"np-33","Zapdos ex","Pokémon","100","Lightning","",,"33","K. Hoshiba","Promo",,"145",,"https://images.pokemontcg.io/np/33.png","https://images.pokemontcg.io/np/33_hires.png","Legal",,,"Colorless, Colorless","2","Synchronized Lift","As long as you have Articuno ex and Moltres ex in play, the Retreat Cost for Zapdos ex is 0.","Poké-Body","","","","Thunder Gift","Colorless","1","10","You may move a Lightning Energy card attached to Zapdos ex to 1 of your Pokémon.","Lightning Wing","Lightning, Lightning, Colorless","3","60","Does 10 damage to 1 of your Benched Pokémon. (Don't apply Weakness and Resistance for Benched Pokémon.)","Lightning","×2"
"np-34","Typhlosion","Pokémon","110","Fire","","Quilava","34","Hajime Kusajima","Promo",,"157",,"https://images.pokemontcg.io/np/34.png","https://images.pokemontcg.io/np/34_hires.png","Legal",,,"Colorless","1","Burning Aura","As long as Typhlosion is your Active Pokémon, put 1 damage counter on each Active Pokémon (both yours and your opponent's) between turns.","Poké-Body","","","","Flickering Flames","Fire","1","20","The Defending Pokémon is now Asleep.","Rage","Fire, Colorless, Colorless","3","50+","Does 50 damage plus 10 more damage for each damage counter on Typhlosion.","Water","×2"
"np-35","Pikachu δ","Pokémon","40","Metal","Raichu",,"35","Ryo Ueda","Promo",,"25",,"https://images.pokemontcg.io/np/35.png","https://images.pokemontcg.io/np/35_hires.png","Legal",,,"Colorless","1","","","","","","","Thunder Wave","Colorless","1","","Flip a coin. If heads, the Defending Pokémon is now Paralyzed.","Iron Tail","Metal, Colorless","2","20×","Flip a coin until you get tails. This attack does 20 damage times the number of heads.","Fighting","×2"
"np-36","Tropical Tidal Wave","Trainer",,"","",,"36","Sumiyoshi Kizuki","Promo",,"",,"https://images.pokemontcg.io/np/36.png","https://images.pokemontcg.io/np/36_hires.png","Legal",,,"",,"","","","","","","","","","","","","","","","",,
"np-37","Kyogre ex","Pokémon","100","Water","",,"37","Ryo Ueda","Promo",,"382",,"https://images.pokemontcg.io/np/37.png","https://images.pokemontcg.io/np/37_hires.png","Legal",,,"Colorless, Colorless","2","Frenzy","As long as your opponent has Groudon, Groudon ex, Rayquaza, or Rayquaza ex in play. Kyogre ex's attacks do 40 more damage to the Defending Pokémon (before applying Weakness and Resistance).","Poké-Body","","","","Aqua Supply","Water, Colorless","2","30","You may attach a basic Energy card from your hand to 1 of your Pokémon.","Tsunami","Water, Colorless, Colorless","3","40","Does 10 damage to each of your opponent's Benched Pokémon. (Don't apply Weakness and Resistance for Benched Pokémon.)","Lightning","×2"
"np-38","Groudon ex","Pokémon","100","Fighting","",,"38","Ryo Ueda","Promo",,"383",,"https://images.pokemontcg.io/np/38.png","https://images.pokemontcg.io/np/38_hires.png","Legal",,,"Colorless, Colorless","2","Frenzy","As long as your opponent has Kyogre, Kyogre ex, Rayquaza, or Rayquaza ex in play, Groudon ex's attacks do 40 more damage to the Defending Pokémon (before applying Weakness and Resistance).","Poké-Body","","","","Mix-Up","Fighting, Colorless","2","30","Flip a coin. If heads, your opponent discards the top card from his or her deck.","Earthquake","Fighting, Colorless, Colorless","3","60","Does 10 damage to each of your Benched Pokémon. (Don't apply Weakness and Resistance for Benched Pokémon.)","Water","×2"
"np-39","Rayquaza ex","Pokémon","100","Colorless","",,"39","Ryo Ueda","Promo",,"384",,"https://images.pokemontcg.io/np/39.png","https://images.pokemontcg.io/np/39_hires.png","Legal",,,"Colorless","1","Frenzy","As long as your opponent has Kyogre, Kyogre ex, Groudon, or Groudon ex in play, Rayquaza ex's attacks do 40 damage to the Defending Pokémon (before applying Weakness and Resistance).","Poké-Body","","","","Dragon Bind","Colorless, Colorless","2","20","Flip a coin. If heads, the Defending Pokémon is now Paralyzed.","Twister","Fire, Lightning, Colorless","3","50","Flip 2 coins. If both are tails, this attack does nothing. For each heads, discard an Energy attached to the Defending Pokémon.","Colorless","×2"
"np-40","Mew","Pokémon","50","Psychic","",,"40","Masakazu Fukuda","Promo",,"151",,"https://images.pokemontcg.io/np/40.png","https://images.pokemontcg.io/np/40_hires.png","Legal",,,"Colorless","1","","","","","","","Psywave","Colorless","1","10×","Does 10 damage times the amount of Energy attached to the Defending Pokémon.","Devolution Beam","Psychic","1","","Flip a coin. If heads, choose 1 of either player's Evolved Pokémon, remove the highest stage Evolution card from that Pokémon, and put it into that player's hand.","Psychic","×2"
