"id","name","supertype","hp","types","evolvesTo","evolvesFrom","number","artist","rarity","flavorText","nationalPokedexNumbers","regulationMark","imageSmall","imageLarge","legalitiesUnlimited","legalitiesStandard","legalitiesExpanded","retreatCost","convertedRetreatCost","Ability1Name","Ability1Text","Ability1Type","Ability2Name","Ability2Text","Ability2Type","Attack1Name","Attack1Cost","Attack1ConvertedCost","Attack1Damage","Attack1Text","Attack2Name","Attack2Cost","Attack2ConvertedCost","Attack2Damage","Attack2Text","Weakness1Type","Weakness1Value"
"svp-1","Sprigatito","Pokemon","70","Grass","",,"1","Yuu Nishida","Promo","Its fluffy fur is similar in composition to plants. This Pokemon frequently washes its face to keep it from drying out.","906","G","https://images.pokemontcg.io/svp/1.png","https://images.pokemontcg.io/svp/1_hires.png","Legal","Legal","Legal","Colorless","1","","","","","","","Mini Drain","Grass","1","10","Heal 10 damage from this Pokemon.","","","","","","Fire","x2"
"svp-2","Fuecoco","Pokemon","80","Fire","",,"2","Ryuta Fuse","Promo","It lies on warm rocks and uses the heat absorbed by its square-shaped scales to create fire energy.","909","G","https://images.pokemontcg.io/svp/2.png","https://images.pokemontcg.io/svp/2_hires.png","Legal","Legal","Legal","Colorless, Colorless","2","","","","","","","Super Singe","Fire, Fire, Colorless","3","30","Your opponent's Active Pokemon is now Burned.","","","","","","Water","x2"
"svp-3","Quaxly","Pokemon","70","Water","",,"3","Narumi Sato","Promo","This Pokemon migrated to Paldea from distant lands long ago. The gel secreted by its feathers repels water and grime.","912","G","https://images.pokemontcg.io/svp/3.png","https://images.pokemontcg.io/svp/3_hires.png","Legal","Legal","Legal","Colorless","1","","","","","","","Water Splash","Water, Colorless","2","20+","Flip a coin. If heads, this attack does 20 more damage.","","","","","","Lightning","x2"
"svp-4","Mimikyu ex","Pokemon","190","Psychic","",,"4","PLANETA Yamashita","Promo",,"778","G","https://images.pokemontcg.io/svp/4.png","https://images.pokemontcg.io/svp/4_hires.png","Legal","Legal","Legal","Colorless","1","","","","","","","Void Return","Psychic","1","30","You may switch this Pokemon with 1 of your Benched Pokemon.","Energy Burst","Psychic, Colorless, Colorless","3","30x","This attack does 30 damage for each Energy attached to both Active Pokemon.","Metal","x2"
"svp-5","Quaquaval","Pokemon","170","Water","","Quaxwell","5","kodama","Promo","A single kick from a Quaquaval can send a truck rolling. This Pokemon uses its powerful legs to perform striking dances from far-off lands.","914","G","https://images.pokemontcg.io/svp/5.png","https://images.pokemontcg.io/svp/5_hires.png","Legal","Legal","Legal","Colorless, Colorless","2","Energy Carnival","Once during your turn, you may attach a Basic Energy card from your hand to 1 of your Pokemon.","Ability","","","","Hydro Kick","Water, Colorless, Colorless","3","140","","","","","","","Lightning","x2"
"svp-6","Pawmot","Pokemon","130","Lightning","","Pawmo","6","GIDORA","Promo","Pawmot's fluffy fur acts as a battery. It can store the same amount of electricity as an electric car.","922","G","https://images.pokemontcg.io/svp/6.png","https://images.pokemontcg.io/svp/6_hires.png","Legal","Legal","Legal","",,"Electrogenesis","Once during your turn, you may search your deck for a Basic Lightning Energy card and attach it to this Pokemon. Then, shuffle your deck.","Ability","","","","Electro Paws","Lightning, Lightning, Colorless","3","230","Discard all Energy from this Pokemon.","","","","","","Fighting","x2"
"svp-7","Hawlucha","Pokemon","70","Fighting","",,"7","Yuya Oka","Promo","Its elegant finishing moves—performed by nimbly leaping around using its wings—are polished in the forest where it was born and raised.","701","G","https://images.pokemontcg.io/svp/7.png","https://images.pokemontcg.io/svp/7_hires.png","Legal","Legal","Legal","Colorless","1","Flying Entry","When you play this Pokemon from your hand onto your Bench during your turn, you may choose 2 of your opponent's Benched Pokemon and put 1 damage counter on each of them.","Ability","","","","Wing Attack","Fighting, Colorless, Colorless","3","70","","","","","","","Psychic","x2"
"svp-8","Revavroom","Pokemon","140","Metal","","Varoom","8","DOM","Promo","It creates a gas out of poison and minerals from rocks. It then detonates the gas in its cylinders— now numbering eight—to generate energy.","966","G","https://images.pokemontcg.io/svp/8.png","https://images.pokemontcg.io/svp/8_hires.png","Legal","Legal","Legal","Colorless, Colorless","2","Rumbling Engine","You must discard an Energy card from your hand in order to use this Ability. Once during your turn, you may draw cards until you have 6 cards in your hand.","Ability","","","","Knock Away","Metal, Colorless, Colorless, Colorless","4","90+","Flip a coin. If heads, this attack does 90 more damage.","","","","","","Fire","x2"
"svp-9","Spidops","Pokemon","120","Grass","","Tarountula","9","Anesaki Dynamic","Promo","It clings to branches and ceilings using its threads and moves without a sound. It takes out its prey before the prey even notices it.","918","G","https://images.pokemontcg.io/svp/9.png","https://images.pokemontcg.io/svp/9_hires.png","Legal","Legal","Legal","Colorless, Colorless","2","","","","","","","String Truss","Grass","1","30","Flip a coin. If heads, your opponent's Active Pokemon is now Paralyzed.","Jet Headbutt","Grass, Colorless, Colorless","3","100","","Fire","x2"
"svp-10","Espathra","Pokemon","110","Psychic","","Flittle","10","Sanosuke Sakuma","Promo","It immobilizes opponents by bathing them in psychic power from its large eyes. Despite its appearance, it has a vicious temperament.","956","G","https://images.pokemontcg.io/svp/10.png","https://images.pokemontcg.io/svp/10_hires.png","Legal","Legal","Legal","",,"","","","","","","Aurora Gain","Colorless","1","30","Heal 30 damage from this Pokemon.","Super Psy Bolt","Psychic, Colorless","2","60","","Darkness","x2"
"svp-11","Arcanine","Pokemon","130","Fire","","Growlithe","11","Ryuta Fuse","Promo","An ancient picture scroll shows that people were captivated by its movement as it ran through prairies.","59","G","https://images.pokemontcg.io/svp/11.png","https://images.pokemontcg.io/svp/11_hires.png","Legal","Legal","Legal","Colorless, Colorless, Colorless","3","","","","","","","Crunch","Fire, Colorless","2","30","Flip a coin. If heads, discard an Energy from your opponent's Active Pokemon.","Fire Mane","Fire, Fire, Colorless","3","120","","Water","x2"
"svp-12","Dondozo","Pokemon","150","Water","",,"12","Shin Nagasawa","Promo","This Pokemon is a glutton, but it's bad at getting food. It teams up with a Tatsugiri to catch prey.","977","G","https://images.pokemontcg.io/svp/12.png","https://images.pokemontcg.io/svp/12_hires.png","Legal","Legal","Legal","Colorless, Colorless, Colorless, Colorless","4","","","","","","","Hammer In","Water, Colorless, Colorless","3","60","","Dangerous Wave","Water, Colorless, Colorless, Colorless","4","100+","Flip 2 coins. If both of them are heads, this attack does 100 more damage.","Lightning","x2"
"svp-13","Miraidon","Pokemon","120","Lightning","",,"13","Akira Komayama","Promo","Much remains unknown about this creature. It resembles Cyclizar, but it is far more ruthless and powerful.","1008","G","https://images.pokemontcg.io/svp/13.png","https://images.pokemontcg.io/svp/13_hires.png","Legal","Legal","Legal","Colorless","1","","","","","","","Sharp Fang","Colorless, Colorless","2","30","","Lightning Laser","Lightning, Lightning, Colorless","3","90","This attack also does 30 damage to 1 of your opponent's Benched Pokemon. (Don't apply Weakness and Resistance for Benched Pokemon.)","Fighting","x2"
"svp-14","Koraidon","Pokemon","130","Fighting","",,"14","Mina Nakai","Promo","This seems to be the Winged King mentioned in an old expedition journal. It was said to have split the land with its bare fists.","1007","G","https://images.pokemontcg.io/svp/14.png","https://images.pokemontcg.io/svp/14_hires.png","Legal","Legal","Legal","Colorless, Colorless","2","","","","","","","Claw Slash","Colorless, Colorless, Colorless","3","70","","Rampaging Fang","Fighting, Fighting, Fighting, Colorless","4","190","Discard 3 Energy from this Pokemon.","Psychic","x2"
"svp-15","Flaaffy","Pokemon","90","Lightning","","Mareep","15","0313","Promo","As a result of storing too much electricity, it developed patches where even downy wool won't grow.","180","G","https://images.pokemontcg.io/svp/15.png","https://images.pokemontcg.io/svp/15_hires.png","Legal","Legal","Legal","Colorless, Colorless","2","","","","","","","Static Shock","Lightning","1","30","","Extreme Current","Lightning, Colorless, Colorless","3","80","Discard an Energy from this Pokemon.","Fighting","x2"
"svp-16","Ampharos ex","Pokemon","330","Lightning","","Flaaffy","16","PLANETA Tsuji","Promo",,"181","G","https://images.pokemontcg.io/svp/16.png","https://images.pokemontcg.io/svp/16_hires.png","Legal","Legal","Legal","Colorless, Colorless","2","","","","","","","Electro Ball","Lightning","1","60","","Thunderstrike Tail","Lightning, Colorless, Colorless","3","140+","You may discard 2 Energy from this Pokemon to have this attack do 100 more damage.","Fighting","x2"
"svp-17","Lucario ex","Pokemon","260","Fighting","","Riolu","17","5ban Graphics","Promo",,"448","G","https://images.pokemontcg.io/svp/17.png","https://images.pokemontcg.io/svp/17_hires.png","Legal","Legal","Legal","Colorless, Colorless","2","","","","","","","Low Sweep","Fighting, Colorless","2","60","","Aura Sphere","Fighting, Fighting, Colorless","3","160","This attack also does 50 damage to 1 of your opponent's Benched Pokemon. (Don't apply Weakness and Resistance for Benched Pokemon.)","Psychic","x2"
"svp-18","Cyclizar ex","Pokemon","210","Colorless","",,"18","5ban Graphics","Promo",,"967","G","https://images.pokemontcg.io/svp/18.png","https://images.pokemontcg.io/svp/18_hires.png","Legal","Legal","Legal","Colorless","1","","","","","","","Power Run","Colorless","1","30","Search your deck for a Basic Energy card and attach it to this Pokemon. Then, shuffle your deck.","Full Throttle","Colorless, Colorless, Colorless","3","180","During your next turn, this Pokemon can't attack.","Fighting","x2"
"svp-19","Baxcalibur","Pokemon","160","Water","","Arctibax","19","Oswaldo KATO","Promo","This Pokemon blasts cryogenic air out from its mouth. This air can instantly freeze even liquid-hot lava.","998","G","https://images.pokemontcg.io/svp/19.png","https://images.pokemontcg.io/svp/19_hires.png","Legal","Legal","Legal","Colorless, Colorless","2","Super Cold","As often as you like during your turn, you may attach a Basic Water Energy card from your hand to 1 of your Pokemon.","Ability","","","","Buster Tail","Water, Water, Colorless","3","130","","","","","","","Metal","x2"
"svp-20","Tinkaton","Pokemon","140","Psychic","","Tinkatuff","20","Anesaki Dynamic","Promo","This intelligent Pokemon has a very daring disposition. It knocks rocks into the sky with its hammer, aiming for flying Corviknight.","959","G","https://images.pokemontcg.io/svp/20.png","https://images.pokemontcg.io/svp/20_hires.png","Legal","Legal","Legal","Colorless, Colorless","2","Gather Materials","You must discard a card from your hand in order to use this Ability. Once during your turn, you may draw 3 cards.","Ability","","","","Special Hammer","Psychic, Colorless","2","90+","If this Pokemon has any Special Energy attached, this attack does 90 more damage.","","","","","","Metal","x2"
"svp-21","Murkrow","Pokemon","60","Darkness","Honchkrow",,"21","Shiburingaru","Promo","Feared and loathed by many, it is believed to bring misfortune to all those who see it at night.","198","G","https://images.pokemontcg.io/svp/21.png","https://images.pokemontcg.io/svp/21_hires.png","Legal","Legal","Legal","Colorless","1","","","","","","","Spin Turn","Colorless","1","10","Switch this Pokemon with 1 of your Benched Pokemon.","United Wings","Darkness","1","20x","This attack does 20 damage for each Pokemon in your discard pile that has the United Wings attack.","Lightning","x2"
"svp-22","Pelipper","Pokemon","120","Colorless","","Wingull","22","Nisota Niso","Promo","It is a flying transporter that carries small Pokemon in its beak. It bobs on the waves to rest its wings.","279","G","https://images.pokemontcg.io/svp/22.png","https://images.pokemontcg.io/svp/22_hires.png","Legal","Legal","Legal","Colorless, Colorless","2","Hearsay","When you play this Pokemon from your hand to evolve 1 of your Pokemon during your turn, you may choose 1: put a Supporter card from your discard pile into your hand; or search your deck for a Supporter card, reveal it, put it into your hand, and then shuffle your deck.","Ability","","","","Wing Attack","Colorless, Colorless, Colorless","3","90","","","","","","","Lightning","x2"
"svp-23","Smoliv","Pokemon","60","Grass","",,"23","Misa Tsutsui","Promo","It protects itself from enemies by emitting oil from the fruit on its head. This oil is bitter and astringent enough to make someone flinch.","928","G","https://images.pokemontcg.io/svp/23.png","https://images.pokemontcg.io/svp/23_hires.png","Legal","Legal","Legal","Colorless","1","","","","","","","Nutrients","Grass","1","","Heal 30 damage from 1 of your Pokemon.","Spray Fluid","Grass, Colorless","2","20","","Fire","x2"
"svp-24","Growlithe","Pokemon","90","Fire","Arcanine",,"24","Uta","Promo","It's very friendly and faithful to people. It will try to repel enemies by barking and biting.","58","G","https://images.pokemontcg.io/svp/24.png","https://images.pokemontcg.io/svp/24_hires.png","Legal","Legal","Legal","Colorless, Colorless, Colorless","3","","","","","","","Stoke","Colorless","1","","Search your deck for up to 2 Basic Fire Energy cards and attach them to this Pokemon. Then, shuffle your deck.","Fire Claws","Fire, Fire, Fire","3","70","","Water","x2"
"svp-25","Tinkatink","Pokemon","70","Psychic","",,"25","Kouki Saitou","Promo","It swings its handmade hammer around to protect itself, but the hammer is often stolen by Pokemon that eat metal.","957","G","https://images.pokemontcg.io/svp/25.png","https://images.pokemontcg.io/svp/25_hires.png","Legal","Legal","Legal","Colorless, Colorless","2","","","","","","","Smithereen Smash","Psychic","1","10","Flip a coin. If heads, discard an Energy from your opponent's Active Pokemon.","","","","","","Metal","x2"
"svp-26","Varoom","Pokemon","60","Metal","",,"26","Mina Nakai","Promo","It is said that this Pokemon was born when an unknown poison Pokemon entered and inspirited an engine left at a scrap-processing factory.","965","G","https://images.pokemontcg.io/svp/26.png","https://images.pokemontcg.io/svp/26_hires.png","Legal","Legal","Legal","Colorless","1","","","","","","","Poison Gas","Colorless","1","","Your opponent's Active Pokemon is now Poisoned.","","","","","","Fire","x2"
"svp-27","Pikachu","Pokemon","60","Lightning","Raichu",,"27","Atsushi Furusawa","Promo","Pikachu seems excited to be going on an adventure, and so do its new pals, from attention-seeking Sprigatito to laid-back Fuecoco and tidy Quaxly.","25","G","https://images.pokemontcg.io/svp/27.png","https://images.pokemontcg.io/svp/27_hires.png","Legal","Legal","Legal","Colorless","1","","","","","","","Adventuring Together","Lightning, Lightning, Lightning","3","30+","This attack does 10 more damage for each of your Benched Pokemon.","","","","","","Fighting","x2"
"svp-28","Miraidon ex","Pokemon","220","Lightning","",,"28","5ban Graphics","Promo",,"1008","G","https://images.pokemontcg.io/svp/28.png","https://images.pokemontcg.io/svp/28_hires.png","Legal","Legal","Legal","Colorless","1","Tandem Unit","Once during your turn, you may search your deck for up to 2 Basic Lightning Pokemon and put them onto your Bench. Then, shuffle your deck.","Ability","","","","Photon Blaster","Lightning, Lightning, Colorless","3","220","During your next turn, this Pokemon can't attack.","","","","","","Fighting","x2"
"svp-29","Koraidon ex","Pokemon","230","Fighting","",,"29","aky CG Works","Promo",,"1007","G","https://images.pokemontcg.io/svp/29.png","https://images.pokemontcg.io/svp/29_hires.png","Legal","Legal","Legal","Colorless, Colorless","2","Dino Cry","Once during your turn, you may attach up to 2 Basic Fighting Energy cards from your discard pile to your Basic Fighting Pokemon in any way you like. If you use this Ability, your turn ends.","Ability","","","","Wild Impact","Fighting, Fighting, Colorless","3","220","During your next turn, this Pokemon can't attack.","","","","","","Psychic","x2"
"svp-30","Chien-Pao ex","Pokemon","220","Water","",,"30","aky CG Works","Promo",,"1002","G","https://images.pokemontcg.io/svp/30.png","https://images.pokemontcg.io/svp/30_hires.png","Legal","Legal","Legal","Colorless, Colorless","2","Shivery Chill","Once during your turn, if this Pokemon is in the Active Spot, you may search your deck for up to 2 Basic Water Energy cards, reveal them, and put them into your hand. Then, shuffle your deck.","Ability","","","","Hail Blade","Water, Water","2","60x","You may discard any amount of Water Energy from your Pokemon. This attack does 60 damage for each card you discarded in this way.","","","","","","Metal","x2"
"svp-31","Tinkaton ex","Pokemon","300","Psychic","","Tinkatuff","31","takuyoa","Promo",,"959","G","https://images.pokemontcg.io/svp/31.png","https://images.pokemontcg.io/svp/31_hires.png","Legal","Legal","Legal","Colorless, Colorless","2","","","","","","","Big Hammer","Colorless, Colorless","2","30x","This attack does 30 damage for each card in your hand.","Pulverizing Press","Psychic, Colorless, Colorless","3","140","This attack's damage isn't affected by any effects on your opponent's Active Pokemon.","Metal","x2"
"svp-32","Annihilape ex","Pokemon","320","Fighting","","Primeape","32","PLANETA Hiiragi","Promo",,"979","G","https://images.pokemontcg.io/svp/32.png","https://images.pokemontcg.io/svp/32_hires.png","Legal","Legal","Legal","Colorless, Colorless","2","","","","","","","Angry Grudge","Fighting","1","20x","Put up to 12 damage counters on this Pokemon. This attack does 20 damage for each damage counter you placed in this way.","Seismic Toss","Fighting, Colorless","2","150","","Psychic","x2"
"svp-33","Meowscarada ex","Pokemon","310","Grass","","Floragato","33","5ban Graphics","Promo",,"908","G","https://images.pokemontcg.io/svp/33.png","https://images.pokemontcg.io/svp/33_hires.png","Legal","Legal","Legal","Colorless, Colorless","2","Bouquet Magic","You must discard a Basic Grass Energy card from your hand in order to use this Ability. Once during your turn, you may put 3 damage counters on 1 of your opponent's Benched Pokemon.","Ability","","","","Scratching Nails","Colorless, Colorless","2","100+","If your opponent's Active Pokemon already has any damage counters on it, this attack does 120 more damage.","","","","","","Fire","x2"
"svp-34","Skeledirge ex","Pokemon","340","Fire","","Crocalor","34","5ban Graphics","Promo",,"911","G","https://images.pokemontcg.io/svp/34.png","https://images.pokemontcg.io/svp/34_hires.png","Legal","Legal","Legal","Colorless, Colorless, Colorless","3","","","","","","","Vitality Song","Fire","1","50","Heal 30 damage from each of your Pokemon.","Burning Voice","Fire, Fire","2","270-","This attack does 10 less damage for each damage counter on this Pokemon.","Water","x2"
"svp-35","Quaquaval ex","Pokemon","320","Water","","Quaxwell","35","5ban Graphics","Promo",,"914","G","https://images.pokemontcg.io/svp/35.png","https://images.pokemontcg.io/svp/35_hires.png","Legal","Legal","Legal","Colorless, Colorless","2","","","","","","","Exciting Dance","Water","1","60","Switch this Pokemon with 1 of your Benched Pokemon. If you do, switch out your opponent's Active Pokemon to the Bench. (Your opponent chooses the new Active Pokemon.)","Spiral Shot","Water, Colorless","2","230","Put 2 Energy attached to this Pokemon into your hand.","Lightning","x2"
"svp-36","Palafin","Pokemon","150","Water","","Finizen","36","nagimiso","Promo","This Pokemon's ancient genes have awakened. It is now so extraordinarily strong that it can easily lift a cruise ship with one fin.","964","G","https://images.pokemontcg.io/svp/36.png","https://images.pokemontcg.io/svp/36_hires.png","Legal","Legal","Legal","Colorless, Colorless","2","","","","","","","Jet Punch","Water","1","30","This attack also does 30 damage to 1 of your opponent's Benched Pokemon. (Don't apply Weakness and Resistance for Benched Pokemon.)","Justice Kick","Water, Water","2","210","If this Pokemon didn't move from the Bench to the Active Spot this turn, this attack does nothing.","Lightning","x2"
"svp-37","Cleffa","Pokemon","30","Psychic","Clefairy",,"37","Mina Nakai","Promo","Because of its unusual, starlike silhouette, people believe that it came here on a meteor.","173","G","https://images.pokemontcg.io/svp/37.png","https://images.pokemontcg.io/svp/37_hires.png","Legal","Legal","Legal","",,"","","","","","","Grasping Draw","","0","","Draw cards until you have 7 cards in your hand.","","","","","","Metal","x2"
"svp-38","Togekiss","Pokemon","150","Psychic","","Togetic","38","OKACHEKE","Promo","Known as a bringer of blessings, it's been depicted on good-luck charms since ancient times.","468","G","https://images.pokemontcg.io/svp/38.png","https://images.pokemontcg.io/svp/38_hires.png","Legal","Legal","Legal","",,"Precious Gift","Once at the end of your turn (after your attack), you may use this Ability. Draw cards until you have 8 cards in your hand.","Ability","","","","Power Cyclone","Colorless, Colorless","2","110","Move an Energy from this Pokemon to 1 of your Benched Pokemon.","","","","","","Metal","x2"
"svp-39","Mawile","Pokemon","90","Metal","",,"39","Souichirou Gunjima","Promo","It chomps with its gaping mouth. Its huge jaws are actually steel horns that have been transformed.","303","G","https://images.pokemontcg.io/svp/39.png","https://images.pokemontcg.io/svp/39_hires.png","Legal","Legal","Legal","Colorless","1","Special Eater","When you play this Pokemon from your hand onto your Bench during your turn, you may discard a Special Energy from your opponent's Active Pokemon.","Ability","","","","Sharp Fang","Metal, Colorless, Colorless","3","90","","","","","","","Fire","x2"
"svp-40","Pawmi","Pokemon","50","Lightning","",,"40","Ryuta Fuse","Promo","It has underdeveloped electric sacs on its cheeks. These sacs can produce electricity only if Pawmi rubs them furiously with the pads on its forepaws.","921","G","https://images.pokemontcg.io/svp/40.png","https://images.pokemontcg.io/svp/40_hires.png","Legal","Legal","Legal","Colorless","1","","","","","","","Static Slap","Lightning, Colorless","2","20","Flip a coin. If heads, discard an Energy from your opponent's Active Pokemon.","","","","","","Fighting","x2"
"svp-41","Paldean Wooper","Pokemon","60","Darkness","Quagsire",,"41","kirisAki","Promo","After losing a territorial struggle, Wooper began living on land. The Pokemon changed over time, developing a poisonous film to protect its body.","194","G","https://images.pokemontcg.io/svp/41.png","https://images.pokemontcg.io/svp/41_hires.png","Legal","Legal","Legal","Colorless","1","","","","","","","Splattering Poison","Darkness","1","","Both Active Pokemon are now Poisoned.","Tail Whap","Darkness, Colorless, Colorless","3","30","","Fighting","x2"
"svp-42","Houndstone","Pokemon","130","Psychic","","Greavard","42","Pani Kobayashi","Promo","Houndstone spends most of its time sleeping in graveyards. Among all the dog Pokemon, this one is most loyal to its master.","972","G","https://images.pokemontcg.io/svp/42.png","https://images.pokemontcg.io/svp/42_hires.png","Legal","Legal","Legal","Colorless, Colorless, Colorless","3","","","","","","","Delve","Colorless, Colorless","2","","Put up to 2 Item cards from your discard pile into your hand.","Spooky Shot","Psychic, Colorless, Colorless","3","100","","Darkness","x2"
"svp-43","Eevee","Pokemon","60","Colorless","Vaporeon, Jolteon, Flareon, Sylveon, Espeon, Umbreon, Leafeon, Glaceon",,"43","saino misaki","Promo","Its ability to evolve into many forms allows it to adapt smoothly and perfectly to any environment.","133","G","https://images.pokemontcg.io/svp/43.png","https://images.pokemontcg.io/svp/43_hires.png","Legal","Legal","Legal","Colorless","1","","","","","","","Call for Family","Colorless","1","","Search your deck for a Basic Pokemon and put it onto your Bench. Then, shuffle your deck.","Tackle","Colorless, Colorless, Colorless","3","30","","Fighting","x2"
"svp-44","Charmander","Pokemon","60","Fire","Charmeleon",,"44","MINAMINAMI Take","Promo","From the time it is born, a flame burns at the tip of its tail. Its life would end if the flame were to go out.","4","G","https://images.pokemontcg.io/svp/44.png","https://images.pokemontcg.io/svp/44_hires.png","Legal","Legal","Legal","Colorless","1","","","","","","","Heat Tackle","Fire","1","30","This Pokemon also does 10 damage to itself.","","","","","","Water","x2"
"svp-45","Paradise Resort","Trainer",,"","",,"45","Naoki Saito","Promo",,"","G","https://images.pokemontcg.io/svp/45.png","https://images.pokemontcg.io/svp/45_hires.png","Legal","Legal","Legal","",,"","","","","","","","","","","","","","","","",,
"svp-46","Bulbasaur","Pokemon","70","Grass","",,"46","OKACHEKE","Promo","While it is young, it uses the nutrients that are stored in the seed on its back in order to grow.","1","G","https://images.pokemontcg.io/svp/46.png","https://images.pokemontcg.io/svp/46_hires.png","Legal","Legal","Legal","Colorless, Colorless","2","","","","","","","Vine Whip","Grass, Colorless, Colorless","3","50","","","","","","","Fire","x2"
