"id","name","supertype","hp","types","evolvesTo","evolvesFrom","number","artist","rarity","flavorText","nationalPokedexNumbers","regulationMark","imageSmall","imageLarge","legalitiesUnlimited","legalitiesStandard","legalitiesExpanded","retreatCost","convertedRetreatCost","Ability1Name","Ability1Text","Ability1Type","Ability2Name","Ability2Text","Ability2Type","Attack1Name","Attack1Cost","Attack1ConvertedCost","Attack1Damage","Attack1Text","Attack2Name","Attack2Cost","Attack2ConvertedCost","Attack2Damage","Attack2Text","Weakness1Type","Weakness1Value"
"svp-92","Miraidon","Pokemon","110","Dragon","",,"92","akagi","Promo","This seems to be the Iron Serpent mentioned in an old book. The Iron Serpent is said to have turned the land to ash with its lightning.","1008","H","https://images.pokemontcg.io/svp/92.png","https://images.pokemontcg.io/svp/92_hires.png","Legal","Legal","Legal","Colorless, Colorless","2","","","","","","","Peak Acceleration","Colorless","1","40","Search your deck for up to 2 Basic Energy cards and attach them to your Future Pokemon in any way you like. Then, shuffle your deck.","Sparking Strike","Lightning, Lightning, Psychic","3","160","",,
"svp-93","Carvanha","Pokemon","50","Water","Sharpedo",,"93","Tonji Matsuno","Promo","These Pokemon have sharp fangs and powerful jaws. Sailors avoid Carvanha dens at all costs.","318","G","https://images.pokemontcg.io/svp/93.png","https://images.pokemontcg.io/svp/93_hires.png","Legal","Legal","Legal","Colorless","1","","","","","","","Sharp Fang","Water","1","20","","","","","","","Lightning","x2"
"svp-94","Bellibolt","Pokemon","130","Lightning","","Tadbulb","94","Mizue","Promo","When this Pokemon expands and contracts its wobbly body, the belly-button dynamo in its stomach produces a huge amount of electricity.","939","G","https://images.pokemontcg.io/svp/94.png","https://images.pokemontcg.io/svp/94_hires.png","Legal","Legal","Legal","Colorless, Colorless, Colorless","3","","","","","","","Thunder Wave","Lightning","1","","Flip a coin. If heads, your opponent's Active Pokemon is now Paralyzed.","Two Bump Bolt","Lightning, Lightning, Colorless","3","10+","You may discard up to 2 Lightning Energy from this Pokemon. This attack does 80 more damage for each card you discarded in this way.","Fighting","x2"
"svp-95","Cleffa","Pokemon","30","Psychic","",,"95","Tika Matsuno","Promo","Because of its unusual, starlike silhouette, people believe that it came here on a meteor.","173","G","https://images.pokemontcg.io/svp/95.png","https://images.pokemontcg.io/svp/95_hires.png","Legal","Legal","Legal","","0","","","","","","","Twinkling Hope","","0","","Search your deck for up to 2 Basic Energy cards, reveal them, and put them into your hand. Then, shuffle your deck.","","","","","","Darkness","x2"
"svp-96","Cyclizar","Pokemon","120","Colorless","",,"96","Hasuno","Promo","Apparently Cyclizar has been allowing people to ride on its back since ancient times. Depictions of this have been found in 10,000-year-old murals.","967","G","https://images.pokemontcg.io/svp/96.png","https://images.pokemontcg.io/svp/96_hires.png","Legal","Legal","Legal","Colorless","1","","","","","","","Flat-Out Dash","Colorless","1","","Flip a coin until you get tails. For each heads, draw a card.","Power Tackle","Colorless, Colorless, Colorless","3","120","During your next turn, this Pokemon can't attack.","Fighting","x2"
"svp-97","Flutter Mane","Pokemon","90","Psychic","",,"97","Takumi Wada","Promo","This Pokemon has characteristics similar to those of Flutter Mane, a creature mentioned in a certain book.","987","H","https://images.pokemontcg.io/svp/97.png","https://images.pokemontcg.io/svp/97_hires.png","Legal","Legal","Legal","Colorless","1","Midnight Fluttering","As long as this Pokemon is in the Active Spot, your opponent's Active Pokemon has no Abilities, except for Midnight Fluttering.","Ability","","","","Hex Hurl","Colorless, Colorless, Colorless","3","90","Put 2 damage counters on your opponent's Benched Pokemon in any way you like.","","","","","","Metal","x2"
"svp-98","Iron Thorns","Pokemon","140","Lightning","",,"98","Tonji Matsuno","Promo","Some of its notable features match those of an object named within a certain expedition journal as Iron Thorns.","995","H","https://images.pokemontcg.io/svp/98.png","https://images.pokemontcg.io/svp/98_hires.png","Legal","Legal","Legal","Colorless, Colorless, Colorless","3","","","","","","","Destructo-Press","Lightning, Colorless","2","70x","Reveal the top 5 cards of your deck. This attack does 70 damage for each Future card you find there. Then, discard those Future cards and shuffle the other cards back into your deck.","Megaton Lariat","Lightning, Lightning, Lightning, Colorless","4","140","","Fighting","x2"
"svp-99","Shroodle","Pokemon","50","Colorless","",,"99","Hitoshi Ariga","Promo","Though usually a mellow Pokemon, it will sink its sharp, poison-soaked front teeth into any that anger it, causing paralysis in the object of its ire.","944","G","https://images.pokemontcg.io/svp/99.png","https://images.pokemontcg.io/svp/99_hires.png","Legal","Legal","Legal","Colorless","1","","","","","","","Scratch","Colorless","1","10","","Toxic Teeth","Colorless, Colorless","2","20","Your opponent's Active Pokemon is now Poisoned.","Fighting","x2"
"svp-100","Grafaiai ex","Pokemon","250","Colorless","","Shroodle","100","aky CG Works","Promo",,"945","G","https://images.pokemontcg.io/svp/100.png","https://images.pokemontcg.io/svp/100_hires.png","Legal","Legal","Legal","Colorless","1","","","","","","","Numbing Saliva","Colorless","1","30","Flip a coin. If heads, your opponent's Active Pokemon is now Paralyzed.","Toxic Throw","Colorless, Colorless, Colorless","3","180","Your opponent's Active Pokemon is now Poisoned. During your next turn, this Pokemon can't use Toxic Throw.","Fighting","x2"
"svp-101","Pikachu","Pokemon","70","Lightning","",,"101","Jiro Sasumo","Promo","When it is angered, it immediately discharges the energy stored in the pouches in its cheeks.","25","G","https://images.pokemontcg.io/svp/101.png","https://images.pokemontcg.io/svp/101_hires.png","Legal","Legal","Legal","Colorless","1","","","","","","","Scrappy Spark","Lightning, Lightning, Colorless","3","30+","Flip a coin until you get tails. This attack does 30 more damage for each heads.","","","","","","Fighting","x2"
"svp-102","Oddish","Pokemon","60","Grass","",,"102","Miranda Branley","Promo","During the day, it stays in the cold underground to avoid the sun. It grows by bathing in moonlight.","43","G","https://images.pokemontcg.io/svp/102.png","https://images.pokemontcg.io/svp/102_hires.png","Legal","Legal","Legal","Colorless","1","","","","","","","Razor Leaf","Grass","1","10","","Grass Knot","Grass, Grass","2","20x","This attack does 20 damage for each Colorless in your opponent's Active Pokemon's Retreat Cost.","Fire","x2"
"svp-103","Houndoom ex","Pokemon","270","Darkness","","Houndour","103","PLANETA Tsuji","Promo",,"229","G","https://images.pokemontcg.io/svp/103.png","https://images.pokemontcg.io/svp/103_hires.png","Legal","Legal","Legal","Colorless, Colorless","2","","","","","","","Evil Claw","Darkness, Darkness","2","90","If the Defending Pokemon is a Basic Pokemon, it can't attack during your opponent's next turn.","Hound's Fang","Darkness, Darkness, Darkness","3","220","This Pokemon also does 30 damage to itself.","Grass","x2"
"svp-104","Melmetal ex","Pokemon","300","Metal","","Meltan","104","PLANETA Igarashi","Promo",,"809","G","https://images.pokemontcg.io/svp/104.png","https://images.pokemontcg.io/svp/104_hires.png","Legal","Legal","Legal","Colorless, Colorless, Colorless, Colorless","4","","","","","","","Metal-bolize","Metal","1","","Search your deck for up to 2 Basic Metal Energy cards and attach them to this Pokemon. Then, shuffle your deck.","Full Metal Knuckle","Colorless, Colorless, Colorless, Colorless","4","90+","This attack does 30 more damage for each Metal Energy attached to this Pokemon.","Fire","x2"
"svp-105","Armarouge ex","Pokemon","260","Fire","","Charcadet","105","PLANETA Tsuji","Promo",,"936","H","https://images.pokemontcg.io/svp/105.png","https://images.pokemontcg.io/svp/105_hires.png","Legal","Legal","Legal","Colorless, Colorless","2","","","","","","","Armor Cannon","Fire, Fire, Colorless","3","200","Discard a Fire Energy from this Pokemon.","","","","","","Water","x2"
"svp-106","Pikachu ex","Pokemon","200","Lightning","Raichu",,"106","takuyoa","Promo",,"25","H","https://images.pokemontcg.io/svp/106.png","https://images.pokemontcg.io/svp/106_hires.png","Legal","Legal","Legal","Colorless","1","","","","","","","Thunderbolt","Lightning, Lightning, Colorless","3","120","","","","","","","Fighting","x2"
"svp-107","Mareep","Pokemon","60","Lightning","Flaaffy",,"107","Orca","Promo",,"179","H","https://images.pokemontcg.io/svp/107.png","https://images.pokemontcg.io/svp/107_hires.png","Legal","Legal","Legal","Colorless","1","","","","","","","Headbutt","Lightning","1","10","","Lightning Ball","Lightning, Colorless","2","20","","Fighting","x2"
"svp-108","Flaaffy","Pokemon","90","Lightning","Ampharos","Mareep","108","Akira Komayama","Promo",,"180","H","https://images.pokemontcg.io/svp/108.png","https://images.pokemontcg.io/svp/108_hires.png","Legal","Legal","Legal","Colorless, Colorless","2","","","","","","","Headbutt","Lightning","1","20","","Electro Ball","Lightning, Colorless","2","50","","Fighting","x2"
"svp-109","Ampharos","Pokemon","160","Lightning","","Flaaffy","109","GIDORA","Promo",,"181","H","https://images.pokemontcg.io/svp/109.png","https://images.pokemontcg.io/svp/109_hires.png","Legal","Legal","Legal","Colorless, Colorless","2","","","","","","","Electric Ball","Lightning, Colorless","2","110","","","","","","","Fighting","x2"
"svp-110","Darkrai ex","Pokemon","210","Darkness","",,"110","5ban Graphics","Promo",,"491","H","https://images.pokemontcg.io/svp/110.png","https://images.pokemontcg.io/svp/110_hires.png","Legal","Legal","Legal","Colorless, Colorless","2","","","","","","","Wind of Darkness","Darkness, Colorless","2","40","","Night Impact","Darkness, Darkness, Colorless","3","110","","Grass","x2"
"svp-111","Pawniard","Pokemon","70","Darkness","Bisharp",,"111","matazo","Promo",,"624","H","https://images.pokemontcg.io/svp/111.png","https://images.pokemontcg.io/svp/111_hires.png","Legal","Legal","Legal","Colorless","1","","","","","","","Pierce","Darkness","1","10","","","","","","","Grass","x2"
"svp-112","Bisharp","Pokemon","100","Darkness","","Pawniard","112","AKIRA EGAWA","Promo",,"625","H","https://images.pokemontcg.io/svp/112.png","https://images.pokemontcg.io/svp/112_hires.png","Legal","Legal","Legal","Colorless","1","","","","","","","Cut","Darkness","1","30","","","","","","","Grass","x2"
"svp-113","Kingambit","Pokemon","170","Darkness","","Bisharp","113","nagimiso","Promo",,"983","H","https://images.pokemontcg.io/svp/113.png","https://images.pokemontcg.io/svp/113_hires.png","Legal","Legal","Legal","Colorless, Colorless","2","","","","","","","Elbow Strike","Darkness","1","40","","Slicing Blade","Darkness, Colorless","2","100","","Grass","x2"
"svp-114","Picnicker","Trainer",,"","",,"114","Susumu Maeya","Promo",,"","H","https://images.pokemontcg.io/svp/114.png","https://images.pokemontcg.io/svp/114_hires.png","Legal","Legal","Legal","",,"","","","","","","","","","","","","","","","",,
"svp-115","Thwackey","Pokemon","100","Grass","Rillaboom","Grookey","115","Uninori","Promo","The faster a Thwackey can beat out a rhythm with its two sticks, the more respect it wins from its peers.","811","H","https://images.pokemontcg.io/svp/115.png","https://images.pokemontcg.io/svp/115_hires.png","Legal","Legal","Legal","Colorless, Colorless","2","Boom Boom Groove","Once during your turn, if your Active Pokemon has the Festival Lead Ability, you may search your deck for a card and put it into your hand. Then, shuffle your deck.","Ability","","","","Beat","Grass, Grass","2","50","","","","","","","Fire","x2"
"svp-116","Infernape","Pokemon","140","Fire","","Monferno","116","Kazumasa Yasukuni","Promo","Its crown of fire is indicative of its fiery nature. It is beaten by none in terms of quickness.","392","H","https://images.pokemontcg.io/svp/116.png","https://images.pokemontcg.io/svp/116_hires.png","Legal","Legal","Legal","Colorless","1","Pyro Dance","Once during your turn, you may attach a Basic Fire Energy card, a Basic Fighting Energy card, or 1 of each from your hand to your Pokemon in any way you like.","Ability","","","","Scorching Fire","Fire, Fire, Colorless","3","200","Discard an Energy from this Pokemon.","","","","","","Water","x2"
"svp-117","Froslass","Pokemon","90","Water","","Snorunt","117","mingo","Promo","It freezes prey by blowing its −58 degree Fahrenheit breath. It is said to then secretly display its prey.","478","H","https://images.pokemontcg.io/svp/117.png","https://images.pokemontcg.io/svp/117_hires.png","Legal","Legal","Legal","Colorless","1","Freezing Shroud","During Pokemon Checkup, put 1 damage counter on each Pokemon that has an Ability (both yours and your opponent's), except any Froslass.","Ability","","","","Frost Smash","Water, Colorless","2","60","","","","","","","Metal","x2"
"svp-118","Tatsugiri","Pokemon","70","Dragon","",,"118","Shimaris Yukichi","Promo","Tatsugiri is an extremely cunning Pokemon. It feigns weakness to lure in prey, then orders its partner to attack.","978","H","https://images.pokemontcg.io/svp/118.png","https://images.pokemontcg.io/svp/118_hires.png","Legal","Legal","Legal","Colorless","1","Attract Customers","Once during your turn, if this Pokemon is in the Active Spot, you may look at the top 6 cards of your deck, reveal a Supporter card you find there, and put it into your hand. Shuffle the other cards back into your deck.","Ability","","","","Surf","Fire, Water","2","50","","","","","","",,
"svp-119","Toxel","Pokemon","70","Lightning","Toxtricity",,"119","Natsumi Yoshida","Promo","It has no problem drinking dirty water. An organ inside Toxel's body filters such water into a poisonous liquid that is harmless to Toxel.","848","G","https://images.pokemontcg.io/svp/119.png","https://images.pokemontcg.io/svp/119_hires.png","Legal","Legal","Legal","Colorless","1","","","","","","","Slight Intrusion","Lightning","1","30","This Pokemon also does 10 damage to itself.","","","","","","Fighting","x2"
"svp-120","Pupitar","Pokemon","80","Fighting","Tyranitar","Larvitar","120","Shiburingaru","Promo","This pupa flies around wildly by venting with great force the gas pressurized inside its body.","247","G","https://images.pokemontcg.io/svp/120.png","https://images.pokemontcg.io/svp/120_hires.png","Legal","Legal","Legal","Colorless","1","","","","","","","Rock Throw","Fighting","1","20","","Blasting Tackle","Fighting, Fighting","2","60","This attack also does 20 damage to 1 of your Benched Pokemon. (Don't apply Weakness and Resistance for Benched Pokemon.)","Grass","x2"
"svp-121","Revavroom","Pokemon","140","Metal","","Varoom","121","Nisota Niso","Promo","It creates a gas out of poison and minerals from rocks. It then detonates the gas in its cylinders— now numbering eight—to generate energy.","966","G","https://images.pokemontcg.io/svp/121.png","https://images.pokemontcg.io/svp/121_hires.png","Legal","Legal","Legal","Colorless, Colorless, Colorless","3","","","","","","","Swagger","Metal","1","","Flip a coin. If heads, discard an Energy from your opponent's Active Pokemon.","Huge Tackle","Colorless, Colorless, Colorless","3","70+","If you have more cards in your hand than your opponent, this attack does 80 more damage.","Fire","x2"
"svp-122","Snorlax","Pokemon","160","Colorless","",,"122","Po-Suzuki","Promo","It is not satisfied unless it eats over 880 pounds of food every day. When it is done eating, it goes promptly to sleep.","143","H","https://images.pokemontcg.io/svp/122.png","https://images.pokemontcg.io/svp/122_hires.png","Legal","Legal","Legal","Colorless, Colorless, Colorless","3","","","","","","","Lazy Press","Colorless, Colorless, Colorless, Colorless","4","120","","","","","","","Fighting","x2"
"svp-123","Teal Mask Ogerpon","Pokemon","110","Grass","",,"123","kodama","Promo","This mischief-loving Pokemon is full of curiosity. It battles by drawing out the type-based energy contained within its masks.","1017","H","https://images.pokemontcg.io/svp/123.png","https://images.pokemontcg.io/svp/123_hires.png","Legal","Legal","Legal","Colorless","1","","","","","","","Mountain Stroll","Colorless","1","","Search your deck for up to 2 Basic Energy cards, reveal them, and put them into your hand. Then, shuffle your deck.","Ogre Comeback","Grass, Colorless","2","20+","This attack does 20 more damage for each of your opponent's Benched Pokemon.","Fire","x2"
"svp-124","Iono","Trainer",,"","",,"124","yuu","Promo",,"","G","https://images.pokemontcg.io/svp/124.png","https://images.pokemontcg.io/svp/124_hires.png","Legal","Legal","Legal","",,"","","","","","","","","","","","","","","","",,
"svp-125","Armarouge ex","Pokemon","260","Fire","","Charcadet","125","5ban Graphics","Promo",,"936","G","https://images.pokemontcg.io/svp/125.png","https://images.pokemontcg.io/svp/125_hires.png","Legal","Legal","Legal","Colorless, Colorless","2","Crimson Armor","If this Pokemon has full HP, it takes 80 less damage from attacks from your opponent's Pokemon (after applying Weakness and Resistance).","Ability","","","","Scorching Bazooka","Colorless, Colorless","2","40+","This attack does 40 more damage for each Fire Energy attached to this Pokemon.","","","","","","Water","x2"
"svp-126","Palafin ex","Pokemon","340","Water","","Finizen","126","PLANETA Mochizuki","Promo",,"964","H","https://images.pokemontcg.io/svp/126.png","https://images.pokemontcg.io/svp/126_hires.png","Legal","Legal","Legal","Colorless, Colorless","2","Hero's Spirit","Put this Pokemon into play only with the effect of Palafin's Zero to Hero Ability.","Ability","","","","Giga Impact","Water","1","250","During your next turn, this Pokemon can't attack.","","","","","","Lightning","x2"
"svp-127","Walking Wake ex","Pokemon","220","Water","",,"127","takuyoa","Promo",,"1009","H","https://images.pokemontcg.io/svp/127.png","https://images.pokemontcg.io/svp/127_hires.png","Legal","Legal","Legal","Colorless","1","Azure Seas","Damage from attacks used by this Pokemon isn't affected by any effects on your opponent's Active Pokemon.","Ability","","","","Catharsis Roar","Water, Colorless, Colorless","3","120+","If your opponent's Active Pokemon is affected by a Special Condition, this attack does 120 more damage.","","","","","","Lightning","x2"
"svp-128","Iron Leaves ex","Pokemon","220","Grass","",,"128","5ban Graphics","Promo",,"1010","H","https://images.pokemontcg.io/svp/128.png","https://images.pokemontcg.io/svp/128_hires.png","Legal","Legal","Legal","Colorless","1","Rapid Vernier","When you play this Pokemon from your hand onto your Bench during your turn, you may switch it with your Active Pokemon. If you do, you may move any amount of Energy from your other Pokemon to this Pokemon.","Ability","","","","Prism Edge","Grass, Grass, Colorless","3","180","During your next turn, this Pokemon can't attack.","","","","","","Fire","x2"
"svp-129","Pecharunt","Pokemon","80","Darkness","",,"129","nagimiso","Promo","Its peach-shaped shell serves as storage for a potent poison. It makes poisonous mochi and serves them to people and Pokemon.","1025","H","https://images.pokemontcg.io/svp/129.png","https://images.pokemontcg.io/svp/129_hires.png","Legal","Legal","Legal","Colorless","1","Toxic Subjugation","As long as this Pokemon is in the Active Spot, put 5 more damage counters on your opponent's Poisoned Pokemon during Pokemon Checkup.","Ability","","","","Poison Chain","Darkness, Colorless","2","10","Your opponent's Active Pokemon is now Poisoned. During your opponent's next turn, that Pokemon can't retreat.","","","","","","Fighting","x2"
"svp-130","Kingambit","Pokemon","180","Metal","","Bisharp","130","Oku","Promo","Only a Bisharp that stands above all others in its vast army can evolve into Kingambit.","983","G","https://images.pokemontcg.io/svp/130.png","https://images.pokemontcg.io/svp/130_hires.png","Legal","Legal","Legal","Colorless, Colorless, Colorless, Colorless","4","","","","","","","Strike Down","Metal","1","","If your opponent's Active Pokemon has 4 or more damage counters on it, that Pokemon is Knocked Out.","Massive Rend","Metal, Colorless, Colorless","3","140","","Fire","x2"
"svp-131","Kingdra ex","Pokemon","310","Water","","Seadra","131","akagi","Promo",,"230","H","https://images.pokemontcg.io/svp/131.png","https://images.pokemontcg.io/svp/131_hires.png","Legal","Legal","Legal","Colorless","1","","","","","","","King's Order","Water","1","","Put up to 3 Water Pokemon from your discard pile onto your Bench.","Hydro Pump","Colorless, Colorless","2","50+","This attack does 50 more damage for each Water Energy attached to this Pokemon.","Lightning","x2"
"svp-132","Greninja ex","Pokemon","300","Water","","Frogadier","132","SIE NANAHARA","Promo",,"658","G","https://images.pokemontcg.io/svp/132.png","https://images.pokemontcg.io/svp/132_hires.png","Legal","Legal","Legal","Colorless","1","","","","","","","Stealthy Shuriken","Colorless","1","","This attack does 40 damage to 1 of your opponent's Pokemon. (Don't apply Weakness and Resistance for Benched Pokemon.)","Torrential Slash","Water, Water","2","120+","If your opponent's Active Pokemon already has any damage counters on it, this attack does 120 more damage.","Lightning","x2"
"svp-133","Ledian","Pokemon","90","Grass","","Ledyba","133","Natsumi Yoshida","Promo","When the stars flicker in the night sky, it flutters about, scattering a glowing powder.","166","H","https://images.pokemontcg.io/svp/133.png","https://images.pokemontcg.io/svp/133_hires.png","Legal","Legal","Legal","",,"Glittering Star Pattern","When you play this Pokemon from your hand to evolve 1 of your Pokemon during your turn, you may switch in 1 of your opponent's Benched Pokemon that has 90 HP or less remaining to the Active Spot.","Ability","","","","Swift","Colorless, Colorless","2","70","This attack's damage isn't affected by Weakness or Resistance, or by any effects on your opponent's Active Pokemon.","","","","","","Fire","x2"
"svp-134","Crabominable","Pokemon","160","Water","","Crabrawler","134","KEIICHIRO ITO","Promo","Though its punches are powerful, this Pokemon's movements are sluggish. It blows icy bubbles from its mouth to immobilize its opponents.","740","H","https://images.pokemontcg.io/svp/134.png","https://images.pokemontcg.io/svp/134_hires.png","Legal","Legal","Legal","Colorless, Colorless, Colorless","3","Food Prep","Attacks used by this Pokemon cost Colorless less for each Kofu card in your discard pile.","Ability","","","","Haymaker","Water, Colorless, Colorless, Colorless, Colorless","5","250","During your next turn, this Pokemon can't use Haymaker.","","","","","","Metal","x2"
"svp-135","Drifblim","Pokemon","130","Psychic","","Drifloon","135","Keisin","Promo","They carry people and Pokemon, but the wind can catch them, so there can't be a fixed destination.","426","H","https://images.pokemontcg.io/svp/135.png","https://images.pokemontcg.io/svp/135_hires.png","Legal","Legal","Legal","Colorless, Colorless","2","","","","","","","Everyone Explode Now","Psychic","1","50x","This attack does 50 damage for each of your Drifloon and Drifblim in play. This attack also does 30 damage to each of your Drifloon and Drifblim. (Don't apply Weakness and Resistance for Benched Pokemon.)","","","","","","Darkness","x2"
"svp-136","Bouffalant","Pokemon","100","Colorless","",,"136","Tonji Matsuno","Promo","These Pokemon can crush a car with no more than a headbutt. Bouffalant with more hair on their heads hold higher positions within the herd.","626","H","https://images.pokemontcg.io/svp/136.png","https://images.pokemontcg.io/svp/136_hires.png","Legal","Legal","Legal","Colorless, Colorless","2","Curly Wall","As long as you have at least 1 other Bouffalant in play, all of your Basic Colorless Pokemon take 60 less damage from attacks from your opponent's Pokemon (after applying Weakness and Resistance). The effect of Curly Wall doesn't stack.","Ability","","","","Boundless Power","Colorless, Colorless, Colorless","3","130","During your next turn, this Pokemon can't attack.","","","","","","Fighting","x2"
"svp-137","Horsea","Pokemon","60","Water","Seadra",,"137","MAHOU","Promo","They swim with dance-like motions and cause whirlpools to form. Horsea compete to see which of them can generate the biggest whirlpool.","116","G","https://images.pokemontcg.io/svp/137.png","https://images.pokemontcg.io/svp/137_hires.png","Legal","Legal","Legal","Colorless","1","","","","","","","Hook","Water","1","20","","","","","","","Lightning","x2"
"svp-138","Porygon2","Pokemon","90","Colorless","Porygon-Z","Porygon","138","GOSSAN","Promo","After artificial intelligence was implemented in Porygon2, the Pokemon began using a strange language that only other Porygon2 understand.","233","G","https://images.pokemontcg.io/svp/138.png","https://images.pokemontcg.io/svp/138_hires.png","Legal","Legal","Legal","Colorless","1","","","","","","","Powered Ball","Colorless","1","50","Discard an Energy from this Pokemon.","","","","","","Fighting","x2"
"svp-139","Latias","Pokemon","110","Psychic","",,"139","hncl","Promo","It can telepathically communicate with people. It changes its appearance using its down that refracts light.","380","G","https://images.pokemontcg.io/svp/139.png","https://images.pokemontcg.io/svp/139_hires.png","Legal","Legal","Legal","Colorless, Colorless","2","Mist Float","If this Pokemon has any Psychic Energy attached, it has no Retreat Cost.","Ability","","","","Psychic Sphere","Psychic, Psychic, Colorless","3","100","","","","","","","Darkness","x2"
