"id","name","supertype","hp","types","evolvesTo","evolvesFrom","number","artist","rarity","flavorText","nationalPokedexNumbers","regulationMark","imageSmall","imageLarge","legalitiesUnlimited","legalitiesStandard","legalitiesExpanded","retreatCost","convertedRetreatCost","Ability1Name","Ability1Text","Ability1Type","Ability2Name","Ability2Text","Ability2Type","Attack1Name","Attack1Cost","Attack1ConvertedCost","Attack1Damage","Attack1Text","Attack2Name","Attack2Cost","Attack2ConvertedCost","Attack2Damage","Attack2Text","Weakness1Type","Weakness1Value"
"svp-47","Charmander","Pokemon","70","Fire","",,"47","NC Empire","Promo","From the time it is born, a flame burns at the tip of its tail. Its life would end if the flame were to go out.","4","G","https://images.pokemontcg.io/svp/47.png","https://images.pokemontcg.io/svp/47_hires.png","Legal","Legal","Legal","Colorless","1","","","","","","","Ember","Fire, Fire","2","40","Discard an Energy from this Pokemon.","","","","","","Water","x2"
"svp-48","Squirtle","Pokemon","70","Water","",,"48","Gemi","Promo","When it feels threatened, it draws its limbs inside its shell and sprays water from its mouth.","7","G","https://images.pokemontcg.io/svp/48.png","https://images.pokemontcg.io/svp/48_hires.png","Legal","Legal","Legal","Colorless, Colorless","2","","","","","","","Bubble","Water, Water","2","20","Flip a coin. If heads, your opponent's Active Pokemon is now Paralyzed.","","","","","","Lightning","x2"
"svp-49","Zapdos ex","Pokemon","200","Lightning","",,"49","takuyoa","Promo",,"145","G","https://images.pokemontcg.io/svp/49.png","https://images.pokemontcg.io/svp/49_hires.png","Legal","Legal","Legal","Colorless, Colorless","2","Voltaic Float","If this Pokemon has any Lightning Energy attached, it has no Retreat Cost.","Ability","","","","Multishot Lightning","Lightning, Lightning, Lightning","3","120","This attack also does 90 damage to 1 of your opponent's Benched Pokemon that has any damage counters on it. (Don't apply Weakness and Resistance for Benched Pokemon.)","","","","","","Lightning","x2"
"svp-50","Alakazam ex","Pokemon","310","Psychic","","Kadabra","50","Mitsuhiro Arita","Promo",,"65","G","https://images.pokemontcg.io/svp/50.png","https://images.pokemontcg.io/svp/50_hires.png","Legal","Legal","Legal","Colorless","1","","","","","","","Mind Jack","Colorless, Colorless","2","90+","This attack does 30 more damage for each of your opponent's Benched Pokemon.","Dimensional Hand","Psychic, Psychic","2","120","This attack can be used even if this Pokemon is on the Bench.","Darkness","x2"
"svp-51","Snorlax","Pokemon","150","Colorless","",,"51","GOSSAN","Promo","This POKeMON's stomach is so strong, even eating moldy or rotten food will not affect it.","143","G","https://images.pokemontcg.io/svp/51.png","https://images.pokemontcg.io/svp/51_hires.png","Legal","Legal","Legal","Colorless, Colorless, Colorless, Colorless","4","Voraciousness","Once during your turn, you may put up to 2 Leftovers cards from your discard pile into your hand.","Ability","","","","Thudding Press","Colorless, Colorless, Colorless","3","130","This Pokemon also does 30 damage to itself.","","","","","","Fighting","x2"
"svp-52","Mewtwo","Pokemon","130","Psychic","",,"52","Bun Toujo","Promo","A Pokemon created by recombining Mew's genes. It's said to have the most savage heart among Pokemon.","150","G","https://images.pokemontcg.io/svp/52.png","https://images.pokemontcg.io/svp/52_hires.png","Legal","Legal","Legal","Colorless, Colorless","2","","","","","","","Reflective Barrier","Colorless, Colorless","2","20","During your opponent's next turn, if this Pokemon is damaged by an attack (even if it is Knocked Out), put damage counters on the Attacking Pokemon equal to the damage done to this Pokemon.","Psyslash","Psychic, Psychic, Colorless","3","130","Discard 2 Energy from this Pokemon.","Darkness","x2"
"svp-53","Mew ex","Pokemon","180","Psychic","",,"53","Natsumi Yoshida","Promo",,"151","G","https://images.pokemontcg.io/svp/53.png","https://images.pokemontcg.io/svp/53_hires.png","Legal","Legal","Legal","",,"Restart","Once during your turn, you may draw cards until you have 3 cards in your hand.","Ability","","","","Genome Hacking","Colorless, Colorless, Colorless","3","","Choose 1 of your opponent's Active Pokemon's attacks and use it as this attack.","","","","","","Darkness","x2"
"svp-54","Greninja ex","Pokemon","300","Water","","Frogadier","54","takuyoa","Promo",,"658","G","https://images.pokemontcg.io/svp/54.png","https://images.pokemontcg.io/svp/54_hires.png","Legal","Legal","Legal","Colorless","1","","","","","","","Stealthy Shuriken","Colorless","1","","This attack does 40 damage to 1 of your opponent's Pokemon. (Don't apply Weakness and Resistance for Benched Pokemon.)","Torrential Slash","Water, Water","2","120+","If your opponent's Active Pokemon already has any damage counters on it, this attack does 120 more damage.","Lightning","x2"
"svp-55","Kangaskhan ex","Pokemon","230","Colorless","",,"55","N-DESIGN Inc.","Promo",,"115","G","https://images.pokemontcg.io/svp/55.png","https://images.pokemontcg.io/svp/55_hires.png","Legal","Legal","Legal","Colorless, Colorless","2","","","","","","","Triple Draw","Colorless","1","","Draw 3 cards.","Incessant Punching","Colorless, Colorless, Colorless","3","100x","Flip 4 coins. This attack does 100 damage for each heads.","Fighting","x2"
"svp-56","Charizard ex","Pokemon","330","Darkness","","Charmeleon","56","takuyoa","Promo",,"6","G","https://images.pokemontcg.io/svp/56.png","https://images.pokemontcg.io/svp/56_hires.png","Legal","Legal","Legal","Colorless, Colorless","2","Infernal Reign","When you play this Pokemon from your hand to evolve 1 of your Pokemon during your turn, you may search your deck for up to 3 Basic Fire Energy cards and attach them to your Pokemon in any way you like. Then, shuffle your deck.","Ability","","","","Burning Darkness","Fire, Fire","2","180+","This attack does 30 more damage for each Prize card your opponent has taken.","","","","","","Grass","x2"
"svp-57","Chi-Yu","Pokemon","110","Fire","",,"57","Dsuke","Promo","It controls flames burning at over 5,400 degrees Fahrenheit. It casually swims through the sea of lava it creates by melting rock and sand.","1004","G","https://images.pokemontcg.io/svp/57.png","https://images.pokemontcg.io/svp/57_hires.png","Legal","Legal","Legal","Colorless","1","","","","","","","Flare Bringer","Fire","1","","Attach up to 2 Basic Fire Energy cards from your discard pile to 1 of your Pokemon.","Megafire of Envy","Fire, Fire","2","50+","If any of your Pokemon were Knocked Out by damage from an attack during your opponent's last turn, this attack does 90 more damage.","Water","x2"
"svp-58","Iron Bundle","Pokemon","100","Water","",,"58","Lee HyunJung","Promo","It resembles a mysterious object mentioned in an old book. There are only two reported sightings of this Pokemon.","991","G","https://images.pokemontcg.io/svp/58.png","https://images.pokemontcg.io/svp/58_hires.png","Legal","Legal","Legal","Colorless","1","Hyper Blower","Once during your turn, if this Pokemon is on your Bench, you may switch out your opponent's Active Pokemon to the Bench. (Your opponent chooses the new Active Pokemon.) If you do, discard this Pokemon and all attached cards.","Ability","","","","Refrigerated Stream","Water, Colorless, Colorless","3","80","If the Defending Pokemon is an Evolution Pokemon, it can't attack during your opponent's next turn.","","","","","","Lightning","x2"
"svp-59","Xatu","Pokemon","100","Psychic","","Natu","59","GOSSAN","Promo","This odd Pokemon can see both the past and the future. It eyes the sun's movement all day.","178","G","https://images.pokemontcg.io/svp/59.png","https://images.pokemontcg.io/svp/59_hires.png","Legal","Legal","Legal","Colorless","1","Clairvoyant Sense","Once during your turn, you may attach a Basic Psychic Energy card from your hand to 1 of your Benched Pokemon. If you attached Energy to a Pokemon in this way, draw 2 cards.","Ability","","","","Super Psy Bolt","Psychic, Colorless, Colorless","3","80","","","","","","","Darkness","x2"
"svp-60","Aegislash","Pokemon","150","Metal","","Doublade","60","Takeshi Nakamura","Promo","Its potent spectral powers allow it to manipulate others. It once used its powers to force people and Pokemon to build a kingdom to its liking.","681","G","https://images.pokemontcg.io/svp/60.png","https://images.pokemontcg.io/svp/60_hires.png","Legal","Legal","Legal","Colorless, Colorless, Colorless","3","Mysterious Shield","Prevent all damage done to this Pokemon by attacks from your opponent's Pokemon ex and Pokemon V.","Ability","","","","Hard Bashing","Metal, Colorless","2","120","This attack's damage isn't affected by any effects on your opponent's Active Pokemon.","","","","","","Fire","x2"
"svp-61","Pineco","Pokemon","70","Grass","Forretress",,"61","Nobuhiro Imagawa","Promo","It likes to make its shell thicker by adding layers of tree bark. The additional weight doesn't bother it.","204","G","https://images.pokemontcg.io/svp/61.png","https://images.pokemontcg.io/svp/61_hires.png","Legal","Legal","Legal","Colorless, Colorless","2","","","","","","","Rollout","Grass, Grass","2","30","","","","","","","Fire","x2"
"svp-62","Sinistea","Pokemon","30","Psychic","Polteageist",,"62","kurumitsu","Promo","The soul of someone who died alone possessed some leftover tea. This Pokemon appears in hotels and houses.","854","G","https://images.pokemontcg.io/svp/62.png","https://images.pokemontcg.io/svp/62_hires.png","Legal","Legal","Legal","Colorless","1","","","","","","","Cold Tea","Psychic","1","10","Flip a coin. If heads, your opponent's Active Pokemon is now Paralyzed.","","","","","","Darkness","x2"
"svp-63","Cetitan","Pokemon","170","Water","","Cetoddle","63","GOSSAN","Promo","This Pokemon wanders around snowy, icy areas. It protects its body with powerful muscles and a thick layer of fat under its skin.","975","G","https://images.pokemontcg.io/svp/63.png","https://images.pokemontcg.io/svp/63_hires.png","Legal","Legal","Legal","Colorless, Colorless, Colorless, Colorless","4","","","","","","","Avalanche","Water","1","30","This attack also does 10 damage to each of your opponent's Benched Pokemon. (Don't apply Weakness and Resistance for Benched Pokemon.)","Rolling Slider","Water, Water, Water","3","100x","Flip 3 coins. This attack does 100 damage for each heads.","Metal","x2"
"svp-64","Arctibax","Pokemon","90","Water","","Frigibax","64","Teeziro","Promo","Arctibax freezes the air around it, protecting its face with an ice mask and turning its dorsal fin into a blade of ice.","997","G","https://images.pokemontcg.io/svp/64.png","https://images.pokemontcg.io/svp/64_hires.png","Legal","Legal","Legal","Colorless, Colorless","2","","","","","","","Sharp Fin","Water, Colorless","2","40","","Frost Smash","Water, Water, Colorless","3","80","","Metal","x2"
"svp-65","Scream Tail","Pokemon","90","Psychic","",,"65","GIDORA","Promo","There has been only one reported sighting of this Pokemon. It resembles a mysterious creature depicted in an old expedition journal.","985","G","https://images.pokemontcg.io/svp/65.png","https://images.pokemontcg.io/svp/65_hires.png","Legal","Legal","Legal","Colorless","1","","","","","","","Slap","Psychic","1","30","","Roaring Scream","Psychic, Colorless","2","","This attack does 20 damage to 1 of your opponent's Pokemon for each damage counter on this Pokemon. (Don't apply Weakness and Resistance for Benched Pokemon.)","Darkness","x2"
"svp-66","Iron Bundle","Pokemon","100","Water","",,"66","Teeziro","Promo","It resembles a mysterious object mentioned in an old book. There are only two reported sightings of this Pokemon.","991","G","https://images.pokemontcg.io/svp/66.png","https://images.pokemontcg.io/svp/66_hires.png","Legal","Legal","Legal","Colorless","1","Hyper Blower","Once during your turn, if this Pokemon is on your Bench, you may switch out your opponent's Active Pokemon to the Bench. (Your opponent chooses the new Active Pokemon.) If you do, discard this Pokemon and all attached cards.","Ability","","","","Refrigerated Stream","Water, Colorless, Colorless","3","80","If the Defending Pokemon is an Evolution Pokemon, it can't attack during your opponent's next turn.","","","","","","Lightning","x2"
"svp-67","Roaring Moon ex","Pokemon","230","Darkness","",,"67","takuyoa","Promo",,"1005","G","https://images.pokemontcg.io/svp/67.png","https://images.pokemontcg.io/svp/67_hires.png","Legal","Legal","Legal","Colorless, Colorless","2","","","","","","","Frenzied Gouging","Darkness, Darkness, Colorless","3","","Knock Out your opponent's Active Pokemon. If your opponent's Active Pokemon is Knocked Out in this way, this Pokemon does 200 damage to itself.","Calamity Storm","Darkness, Darkness, Colorless","3","100+","You may discard a Stadium in play. If you do, this attack does 120 more damage.","Grass","x2"
"svp-68","Iron Valiant ex","Pokemon","220","Psychic","",,"68","aky CG Works","Promo",,"1006","G","https://images.pokemontcg.io/svp/68.png","https://images.pokemontcg.io/svp/68_hires.png","Legal","Legal","Legal","Colorless, Colorless","2","Tachyon Bits","Once during your turn, when this Pokemon moves from your Bench to the Active Spot, you may put 2 damage counters on 1 of your opponent's Pokemon.","Ability","","","","Laser Blade","Psychic, Psychic, Colorless","3","200","During your next turn, this Pokemon can't attack.","","","","","","Metal","x2"
"svp-69","Fidough","Pokemon","50","Psychic","",,"69","sowsow","Promo",,"926","G","https://images.pokemontcg.io/svp/69.png","https://images.pokemontcg.io/svp/69_hires.png","Legal","Legal","Legal","Colorless","1","","","","","","","Rear Kick","Colorless, Colorless","2","20","","","","","","","Metal","x2"
"svp-70","Greavard","Pokemon","70","Psychic","",,"70","Nisota Niso","Promo",,"971","G","https://images.pokemontcg.io/svp/70.png","https://images.pokemontcg.io/svp/70_hires.png","Legal","Legal","Legal","Colorless, Colorless","2","","","","","","","Graveyard Gamboling","Psychic","1","10x","This attack does 10 damage for each Psychic Pokemon in your discard pile.","","","","","","Darkness","x2"
"svp-71","Maschiff","Pokemon","60","Darkness","",,"71","Kagemaru Himeno","Promo",,"942","G","https://images.pokemontcg.io/svp/71.png","https://images.pokemontcg.io/svp/71_hires.png","Legal","Legal","Legal","Colorless","1","","","","","","","Ambush","Darkness","1","10+","Flip a coin. If heads, this attack does 20 more damage.","","","","","","Grass","x2"
"svp-72","Great Tusk ex","Pokemon","250","Fighting","",,"72","5ban Graphics","Promo",,"984","G","https://images.pokemontcg.io/svp/72.png","https://images.pokemontcg.io/svp/72_hires.png","Legal","Legal","Legal","Colorless, Colorless, Colorless, Colorless","4","Quaking Demolition","Once at the end of your turn (after your attack), if this Pokemon is in the Active Spot, you must discard the top 5 cards of your deck.","Ability","","","","Great Bash","Fighting, Colorless, Colorless, Colorless","4","260","This attack's damage isn't affected by any effects on your opponent's Active Pokemon.","","","","","","Psychic","x2"
"svp-73","Iron Treads ex","Pokemon","220","Metal","",,"73","5ban Graphics","Promo",,"990","G","https://images.pokemontcg.io/svp/73.png","https://images.pokemontcg.io/svp/73_hires.png","Legal","Legal","Legal","Colorless, Colorless, Colorless","3","","","","","","","Iron-Clad Roll","Metal, Metal, Colorless","3","150","After doing damage, you may discard all Future Booster Energy Capsules from this Pokemon. If you do, during your opponent's next turn, this Pokemon takes 150 less damage from attacks (after applying Weakness and Resistance).","","","","","","Fire","x2"
"svp-74","Charizard ex","Pokemon","330","Darkness","","Charmeleon","74","5ban Graphics","Promo",,"6","G","https://images.pokemontcg.io/svp/74.png","https://images.pokemontcg.io/svp/74_hires.png","Legal","Legal","Legal","Colorless, Colorless","2","Infernal Reign","When you play this Pokemon from your hand to evolve 1 of your Pokemon during your turn, you may search your deck for up to 3 Basic Fire Energy cards and attach them to your Pokemon in any way you like. Then, shuffle your deck.","Ability","","","","Burning Darkness","Fire, Fire","2","180+","This attack does 30 more damage for each Prize card your opponent has taken.","","","","","","Grass","x2"
"svp-75","Mimikyu","Pokemon","70","Psychic","",,"75","Mitsuhiro Arita","Promo",,"778","G","https://images.pokemontcg.io/svp/75.png","https://images.pokemontcg.io/svp/75_hires.png","Legal","Legal","Legal","Colorless","1","Safeguard","Prevent all damage done to this Pokemon by attacks from your opponent's Pokemon ex and Pokemon V.","Ability","","","","Ghost Eye","Psychic, Colorless","2","","Put 7 damage counters on your opponent's Active Pokemon.","","","","","","Metal","x2"
"svp-76","Sprigatito","Pokemon","60","Grass","",,"76","kurumitsu","Promo","Its fluffy fur is similar in composition to plants. This Pokemon frequently washes its face to keep it from drying out.","906","G","https://images.pokemontcg.io/svp/76.png","https://images.pokemontcg.io/svp/76_hires.png","Legal","Legal","Legal","Colorless","1","","","","","","","Gather Sunlight","Grass","1","","Search your deck for up to 2 Basic Energy cards, reveal them, and put them into your hand. Then, shuffle your deck.","Seed Bomb","Grass","1","10","","Fire","x2"
"svp-77","Floragato","Pokemon","90","Grass","","Sprigatito","77","GIDORA","Promo","Floragato deftly wields the vine hidden beneath its long fur, slamming the hard flower bud against its opponents.","907","G","https://images.pokemontcg.io/svp/77.png","https://images.pokemontcg.io/svp/77_hires.png","Legal","Legal","Legal","Colorless","1","","","","","","","Seed Bomb","Grass","1","30","","Magic Whip","Colorless, Colorless","2","50","Switch out your opponent's Active Pokemon to the Bench. (Your opponent chooses the new Active Pokemon.)","Fire","x2"
"svp-78","Meowscarada ex","Pokemon","310","Grass","","Floragato","78","5ban Graphics","Promo",,"908","G","https://images.pokemontcg.io/svp/78.png","https://images.pokemontcg.io/svp/78_hires.png","Legal","Legal","Legal","Colorless, Colorless","2","Bouquet Magic","You must discard a Basic Grass Energy card from your hand in order to use this Ability. Once during your turn, you may put 3 damage counters on 1 of your opponent's Benched Pokemon.","Ability","","","","Scratching Nails","Colorless, Colorless","2","100+","If your opponent's Active Pokemon already has any damage counters on it, this attack does 120 more damage.","","","","","","Fire","x2"
"svp-79","Fuecoco","Pokemon","80","Fire","",,"79","OKACHEKE","Promo","It lies on warm rocks and uses the heat absorbed by its square-shaped scales to create fire energy.","909","G","https://images.pokemontcg.io/svp/79.png","https://images.pokemontcg.io/svp/79_hires.png","Legal","Legal","Legal","Colorless, Colorless","2","","","","","","","Tackle","Fire","1","20","","","","","","","Water","x2"
"svp-80","Crocalor","Pokemon","110","Fire","","Fuecoco","80","Hideki Ishikawa","Promo","The combination of Crocalor's fire energy and overflowing vitality has caused an egg-shaped fireball to appear on the Pokemon's head.","910","G","https://images.pokemontcg.io/svp/80.png","https://images.pokemontcg.io/svp/80_hires.png","Legal","Legal","Legal","Colorless, Colorless, Colorless","3","","","","","","","Steady Firebreathing","Fire","1","30","","Hyper Voice","Fire, Fire","2","70","","Water","x2"
"svp-81","Skeledirge ex","Pokemon","340","Fire","","Crocalor","81","5ban Graphics","Promo",,"911","G","https://images.pokemontcg.io/svp/81.png","https://images.pokemontcg.io/svp/81_hires.png","Legal","Legal","Legal","Colorless, Colorless, Colorless","3","","","","","","","Vitality Song","Fire","1","50","Heal 30 damage from each of your Pokemon.","Burning Voice","Fire, Fire","2","270-","This attack does 10 less damage for each damage counter on this Pokemon.","Water","x2"
"svp-82","Quaxly","Pokemon","70","Water","",,"82","GIDORA","Promo","This Pokemon migrated to Paldea from distant lands long ago. The gel secreted by its feathers repels water and grime.","912","G","https://images.pokemontcg.io/svp/82.png","https://images.pokemontcg.io/svp/82_hires.png","Legal","Legal","Legal","Colorless","1","","","","","","","Reckless Charge","Water","1","30","This Pokemon also does 10 damage to itself.","","","","","","Lightning","x2"
"svp-83","Quaxwell","Pokemon","90","Water","","Quaxly","83","Atsushi Furusawa","Promo","These Pokemon constantly run through shallow waters to train their legs, then compete with each other to see which of them kicks most gracefully.","913","G","https://images.pokemontcg.io/svp/83.png","https://images.pokemontcg.io/svp/83_hires.png","Legal","Legal","Legal","Colorless","1","","","","","","","Water Gun","Water","1","30","","Wave Splash","Water, Colorless","2","50","","Lightning","x2"
"svp-84","Quaquaval ex","Pokemon","320","Water","","Quaxwell","84","5ban Graphics","Promo",,"914","G","https://images.pokemontcg.io/svp/84.png","https://images.pokemontcg.io/svp/84_hires.png","Legal","Legal","Legal","Colorless, Colorless","2","","","","","","","Exciting Dance","Water","1","60","Switch this Pokemon with 1 of your Benched Pokemon. If you do, switch out your opponent's Active Pokemon to the Bench. (Your opponent chooses the new Active Pokemon.)","Spiral Shot","Water, Colorless","2","230","Put 2 Energy attached to this Pokemon into your hand.","Lightning","x2"
"svp-85","Pikachu with Grey Felt Hat","Pokemon","60","Lightning","",,"85","Naoyo Kimura","Promo","When it is angered, it immediately discharges the energy stored in the pouches of its cheeks.","25","G","https://images.pokemontcg.io/svp/85.png","https://images.pokemontcg.io/svp/85_hires.png","Legal","Legal","Legal","Colorless","1","","","","","","","Pika-Portrait","Lightning","1",,"Search your deck for a Pikachu and put it onto your Bench. Then, shuffle your deck.","","","","","","Fighting","x2"
"svp-86","Mabosstiff ex","Pokemon","260","Darkness","","Maschiff","86","PLANETA Mochizuki","Promo",,"943","G","https://images.pokemontcg.io/svp/86.png","https://images.pokemontcg.io/svp/86_hires.png","Legal","Legal","Legal","Colorless, Colorless, Colorless","3","","","","","","","Daunt","Colorless, Colorless","2","30","During your opponent's next turn, attacks used by the Defending Pokemon do 50 less damage (before applying Weakness and Resistance).","Proud Fangs","Darkness, Colorless, Colorless","3","100+","If your Benched Pokemon have any damage counters on them, this attack does 120 more damage.","Grass","x2"
"svp-87","Sprigatito ex","Pokemon","200","Grass","",,"87","takuyoa","Promo",,"906","H","https://images.pokemontcg.io/svp/87.png","https://images.pokemontcg.io/svp/87_hires.png","Legal","Legal","Legal","Colorless","1","","","","","","","Scratch","Colorless","1","20","","Magical Leaf","Grass, Colorless, Colorless","3","100","Heal 30 damage from this Pokemon.","Fire","x2"
"svp-88","Pikachu","Pokemon","70","Lightning","",,"88","saino misaki","Promo","When it is angered, it immediately discharges the energy stored in the pouches in its cheeks.","25","G","https://images.pokemontcg.io/svp/88.png","https://images.pokemontcg.io/svp/88_hires.png","Legal","Legal","Legal","Colorless","1","","","","","","","Growl","Colorless","1","","During your opponent's next turn, the Defending Pokemon's attacks do 20 less damage (before applying Weakness and Resistance).","Pika Bolt","Lightning, Colorless","2","30","","Fighting","x2"
"svp-89","Feraligatr","Pokemon","180","Water","","Croconaw","89","Kurata So","Promo","It usually moves slowly, but it goes at blinding speed when it attacks and bites prey.","160","H","https://images.pokemontcg.io/svp/89.png","https://images.pokemontcg.io/svp/89_hires.png","Legal","Legal","Legal","Colorless, Colorless, Colorless","3","Torrential Heart","Once during your turn, you may put 5 damage counters on this Pokemon. If you do, during this turn, attacks used by this Pokemon do 120 more damage to your opponent's Active Pokemon (before applying Weakness and Resistance).","Ability","","","","Giant Wave","Water, Water","2","160","During your next turn, this Pokemon can't use Giant Wave.","","","","","","Lightning","x2"
"svp-90","Metang","Pokemon","100","Metal","","Beldum","90","Uta","Promo","Two Beldum have become stuck together via their own magnetic forces. With two brains, the resulting Metang has doubled psychic powers.","375","H","https://images.pokemontcg.io/svp/90.png","https://images.pokemontcg.io/svp/90_hires.png","Legal","Legal","Legal","Colorless, Colorless","2","Metal Maker","Once during your turn, you may look at the top 4 cards of your deck and attach any number of Basic Metal Energy cards you find there to your Pokemon in any way you like. Shuffle the other cards and put them on the bottom of your deck.","Ability","","","","Beam","Metal, Colorless, Colorless","3","60","","","","","","","Fire","x2"
"svp-91","Koraidon","Pokemon","140","Dragon","",,"91","Anesaki Dynamic","Promo","This seems to be the Winged King mentioned in an old expedition journal. It was said to have split the land with its bare fists.","1007","H","https://images.pokemontcg.io/svp/91.png","https://images.pokemontcg.io/svp/91_hires.png","Legal","Legal","Legal","Colorless, Colorless","2","","","","","","","Primordial Beatdown","Fighting, Colorless","2","30x","This attack does 30 damage for each of your Ancient Pokemon in play.","Shred","Fire, Fighting, Colorless","3","130","This attack's damage isn't affected by any effects on your opponent's Active Pokemon.",,
