"id","name","supertype","hp","types","evolvesTo","evolvesFrom","number","artist","rarity","flavorText","nationalPokedexNumbers","regulationMark","imageSmall","imageLarge","legalitiesUnlimited","legalitiesStandard","legalitiesExpanded","retreatCost","convertedRetreatCost","Ability1Name","Ability1Text","Ability1Type","Ability2Name","Ability2Text","Ability2Type","Attack1Name","Attack1Cost","Attack1ConvertedCost","Attack1Damage","Attack1Text","Attack2Name","Attack2Cost","Attack2ConvertedCost","Attack2Damage","Attack2Text","Weakness1Type","Weakness1Value"
"swsh9-47","Electivire","Pokémon","140","Lightning","","Electabuzz","47","AKIRA EGAWA","Rare","The amount of electrical energy this Pokémon produces is proportional to the rate of its pulse. The voltage jumps while Electivire is battling.","466","F","https://images.pokemontcg.io/swsh9/47.png","https://images.pokemontcg.io/swsh9/47_hires.png","Legal","Legal","Legal","Colorless, Colorless, Colorless","3","","","","","","","Explosive Bolt","Lightning","1","30+","If any of your Benched Magmortar have any damage counters on them, this attack does 90 more damage.","High-Voltage Current","Lightning, Lightning, Colorless","3","","This attack does 50 damage to each of your opponent's Pokémon. (Don't apply Weakness and Resistance for Benched Pokémon.)","Fighting","×2"
"swsh9-48","Raikou V","Pokémon","200","Lightning","",,"48","PLANETA Mochizuki","Rare Holo V",,"243","F","https://images.pokemontcg.io/swsh9/48.png","https://images.pokemontcg.io/swsh9/48_hires.png","Legal","Legal","Legal","Colorless","1","Fleet-Footed","Once during your turn, if this Pokémon is in the Active Spot, you may draw a card.","Ability","","","","Lightning Rondo","Lightning, Colorless","2","20+","This attack does 20 more damage for each Benched Pokémon (both yours and your opponent's).","","","","","","Fighting","×2"
"swsh9-49","Shinx","Pokémon","40","Lightning","Luxio",,"49","Mizue","Common","This Pokémon generates electricity by contracting its muscles. Excited trembling is a sign that Shinx is generating a tremendous amount of electricity.","403","F","https://images.pokemontcg.io/swsh9/49.png","https://images.pokemontcg.io/swsh9/49_hires.png","Legal","Legal","Legal","",,"","","","","","","Gnaw","Lightning","1","10","","","","","","","Fighting","×2"
"swsh9-50","Luxio","Pokémon","90","Lightning","Luxray","Shinx","50","kurumitsu","Uncommon","By joining its tail with that of another Luxio, this Pokémon can receive some of the other Luxio's electricity and power up its own electric blasts.","404","F","https://images.pokemontcg.io/swsh9/50.png","https://images.pokemontcg.io/swsh9/50_hires.png","Legal","Legal","Legal","Colorless","1","","","","","","","Thunder Shock","Lightning","1","30","Flip a coin. If heads, your opponent's Active Pokémon is now Paralyzed.","","","","","","Fighting","×2"
"swsh9-51","Luxray","Pokémon","150","Lightning","","Luxio","51","Ayaka Yoshida","Rare","Luxray can see through solid objects. It will instantly spot prey trying to hide behind walls, even if the walls are thick.","405","F","https://images.pokemontcg.io/swsh9/51.png","https://images.pokemontcg.io/swsh9/51_hires.png","Legal","Legal","Legal","Colorless","1","","","","","","","Energy Crush","Lightning","1","50×","This attack does 50 damage for each Energy attached to all of your opponent's Pokémon.","Flash Impact","Lightning","1","110","This attack also does 30 damage to 1 of your Benched Pokémon. (Don't apply Weakness and Resistance for Benched Pokémon.)","Fighting","×2"
"swsh9-52","Pachirisu","Pokémon","70","Lightning","",,"52","HYOGONOSUKE","Uncommon","A pair may be seen rubbing their cheek pouches together in an effort to share stored electricity.","417","F","https://images.pokemontcg.io/swsh9/52.png","https://images.pokemontcg.io/swsh9/52_hires.png","Legal","Legal","Legal","Colorless","1","","","","","","","Windup Thunder","Lightning, Colorless","2","30×","This attack does 30 damage for each Pokémon Tool attached to all of your Pokémon.","","","","","","Fighting","×2"
"swsh9-53","Clefairy","Pokémon","60","Psychic","Clefable",,"53","Yukiko Baba","Common","It is said that happiness will come to those who see a gathering of Clefairy dancing under a full moon.","35","F","https://images.pokemontcg.io/swsh9/53.png","https://images.pokemontcg.io/swsh9/53_hires.png","Legal","Legal","Legal","Colorless","1","","","","","","","Pound","Colorless","1","10","","Magical Shot","Psychic, Colorless","2","30","","Metal","×2"
"swsh9-54","Clefable","Pokémon","100","Psychic","","Clefairy","54","Mizue","Rare","A timid fairy Pokémon that is rarely seen, it will run and hide the moment it senses people.","36","F","https://images.pokemontcg.io/swsh9/54.png","https://images.pokemontcg.io/swsh9/54_hires.png","Legal","Legal","Legal","Colorless","1","","","","","","","Moonlit Miracle","Colorless","1","","Flip 3 coins. Choose a number of your Pokémon in play up to the number of heads. For each of those Pokémon, search your deck for a card that evolves from that Pokémon and put it onto that Pokémon to evolve it. Then, shuffle your deck.","Magical Shot","Psychic, Colorless, Colorless","3","90","","Metal","×2"
"swsh9-55","Starmie","Pokémon","90","Psychic","","Staryu","55","Akira Komayama","Uncommon","This Pokémon has an organ known as its core. The organ glows in seven colors when Starmie is unleashing its potent psychic powers.","121","F","https://images.pokemontcg.io/swsh9/55.png","https://images.pokemontcg.io/swsh9/55_hires.png","Legal","Legal","Legal","",,"","","","","","","Psychic","Psychic","1","10+","This attack does 30 more damage for each Energy attached to your opponent's Active Pokémon.","Power Gem","Psychic","1","60","","Darkness","×2"
"swsh9-56","Mewtwo","Pokémon","130","Psychic","",,"56","Anesaki Dynamic","Rare","A Pokémon created by recombining Mew's genes. It's said to have the most savage heart among Pokémon.","150","F","https://images.pokemontcg.io/swsh9/56.png","https://images.pokemontcg.io/swsh9/56_hires.png","Legal","Legal","Legal","Colorless, Colorless","2","","","","","","","Life Sucker","Psychic","1","20","Heal 20 damage from this Pokémon.","Psyburn","Psychic, Psychic, Colorless","3","110","","Darkness","×2"
"swsh9-57","Granbull V","Pokémon","210","Psychic","",,"57","PLANETA Mochizuki","Rare Holo V",,"210","F","https://images.pokemontcg.io/swsh9/57.png","https://images.pokemontcg.io/swsh9/57_hires.png","Legal","Legal","Legal","Colorless, Colorless","2","","","","","","","Chomp","Colorless, Colorless","2","30+","This attack does 10 more damage for each damage counter on this Pokémon.","Bull Dash","Psychic, Psychic, Colorless","3","190","This Pokémon also does 30 damage to itself.","Metal","×2"
"swsh9-58","Baltoy","Pokémon","50","Psychic","Claydol",,"58","Kyoko Umemoto","Common","It moves while spinning around on its single foot. Some Baltoy have been seen spinning on their heads.","343","F","https://images.pokemontcg.io/swsh9/58.png","https://images.pokemontcg.io/swsh9/58_hires.png","Legal","Legal","Legal","Colorless","1","","","","","","","Triple Spin","Colorless, Colorless","2","20×","Flip 3 coins. This attack does 20 damage for each heads.","","","","","","Darkness","×2"
"swsh9-59","Claydol","Pokémon","110","Psychic","","Baltoy","59","Kazuma Koda","Uncommon","This mysterious Pokémon started life as an ancient clay figurine made over 20,000 years ago.","344","F","https://images.pokemontcg.io/swsh9/59.png","https://images.pokemontcg.io/swsh9/59_hires.png","Legal","Legal","Legal","Colorless, Colorless","2","","","","","","","Spinning Attack","Colorless, Colorless","2","40","","Coinciding Figures","Psychic, Colorless, Colorless","3","90+","If you and your opponent have the same number of Benched Pokémon, this attack does 90 more damage.","Darkness","×2"
"swsh9-60","Duskull","Pokémon","60","Psychic","Dusclops",,"60","SATOSHI NAKAI","Common","If it finds bad children who won't listen to their parents, it will spirit them away—or so it's said.","355","F","https://images.pokemontcg.io/swsh9/60.png","https://images.pokemontcg.io/swsh9/60_hires.png","Legal","Legal","Legal","Colorless","1","","","","","","","Perplex","Psychic","1","10","Flip a coin. If heads, your opponent's Active Pokémon is now Confused.","","","","","","Darkness","×2"
"swsh9-61","Dusclops","Pokémon","90","Psychic","Dusknoir","Duskull","61","miki kudo","Uncommon","Its body is entirely hollow. When it opens its mouth, it sucks everything in as if it were a black hole.","356","F","https://images.pokemontcg.io/swsh9/61.png","https://images.pokemontcg.io/swsh9/61_hires.png","Legal","Legal","Legal","Colorless, Colorless","2","","","","","","","Fade to Black","Psychic","1","30","Your opponent's Active Pokémon is now Confused.","","","","","","Darkness","×2"
"swsh9-62","Dusknoir","Pokémon","160","Psychic","","Dusclops","62","otumami","Rare Holo","At the bidding of transmissions from the spirit world, it steals people and Pokémon away. No one knows whether it has a will of its own.","477","F","https://images.pokemontcg.io/swsh9/62.png","https://images.pokemontcg.io/swsh9/62_hires.png","Legal","Legal","Legal","Colorless, Colorless, Colorless","3","Special Transfer","As often as you like during your turn, you may move a Special Energy from 1 of your Pokémon to another of your Pokémon.","Ability","","","","Devour Soul","Psychic, Colorless, Colorless","3","120","","","","","","","Darkness","×2"
"swsh9-63","Chimecho","Pokémon","70","Psychic","",,"63","MAHOU","Common","Emitting ultrasonic cries, it floats on winds to travel great distances.","358","F","https://images.pokemontcg.io/swsh9/63.png","https://images.pokemontcg.io/swsh9/63_hires.png","Legal","Legal","Legal","Colorless","1","","","","","","","Clear Tone","Colorless","1","","Search your deck for up to 2 Special Energy cards, reveal them, and put them into your hand. Then, shuffle your deck.","Hang Down","Colorless, Colorless","2","30","","Darkness","×2"
"swsh9-64","Whimsicott V","Pokémon","190","Psychic","",,"64","Saki Hayashiro","Rare Holo V",,"547","F","https://images.pokemontcg.io/swsh9/64.png","https://images.pokemontcg.io/swsh9/64_hires.png","Legal","Legal","Legal","Colorless","1","","","","","","","Fluff Gets in the Way","Psychic","1","20","If the Defending Pokémon is a Basic Pokémon, it can't attack during your opponent's next turn.","Cotton Guard","Psychic, Colorless, Colorless","3","90","During your opponent's next turn, this Pokémon takes 30 less damage from attacks (after applying Weakness and Resistance).","Metal","×2"
"swsh9-65","Whimsicott VSTAR","Pokémon","250","Psychic","","Whimsicott V","65","5ban Graphics","Rare Holo VSTAR",,"547","F","https://images.pokemontcg.io/swsh9/65.png","https://images.pokemontcg.io/swsh9/65_hires.png","Legal","Legal","Legal","Colorless","1","","","","","","","Trick Wind","Psychic, Colorless, Colorless","3","160","During your opponent's next turn, they can't play any Pokémon Tool or Special Energy cards from their hand.","Fluffball Star","Psychic","1","","This attack does 60 damage to 1 of your opponent's Pokémon for each Energy attached to this Pokémon. (Don't apply Weakness and Resistance for Benched Pokémon.) (You can't use more than 1 VSTAR Power in a game.)","Metal","×2"
"swsh9-66","Sigilyph","Pokémon","110","Psychic","",,"66","Sumiyoshi Kizuki","Uncommon","Psychic power allows these Pokémon to fly. Some say they were the guardians of an ancient city. Others say they were the guardians' emissaries.","561","F","https://images.pokemontcg.io/swsh9/66.png","https://images.pokemontcg.io/swsh9/66_hires.png","Legal","Legal","Legal","Colorless","1","","","","","","","Tri Recharge","Psychic","1","","Flip 3 coins. Attach a number of basic Energy cards up to the number of heads from your discard pile to your Benched Pokémon in any way you like.","Psychic","Psychic, Colorless","2","10+","This attack does 30 more damage for each Energy attached to your opponent's Active Pokémon.","Lightning","×2"
"swsh9-67","Dedenne","Pokémon","70","Psychic","",,"67","Nagomi Nijo","Common","Since Dedenne can't generate as much electricity on its own, it steals electricity from outlets or other electric Pokémon.","702","E","https://images.pokemontcg.io/swsh9/67.png","https://images.pokemontcg.io/swsh9/67_hires.png","Legal",,"Legal","Colorless","1","","","","","","","Dede-Flash","Psychic","1","20+","If your opponent has exactly 1 Prize card remaining, this attack does 60 more damage, and your opponent's Active Pokémon is now Confused.","","","","","","Metal","×2"
"swsh9-68","Mimikyu V","Pokémon","160","Psychic","",,"68","Eske Yoshinob","Rare Holo V",,"778","E","https://images.pokemontcg.io/swsh9/68.png","https://images.pokemontcg.io/swsh9/68_hires.png","Legal",,"Legal","Colorless, Colorless","2","Dummy Doll","When you play this Pokémon from your hand onto your Bench during your turn, you may prevent all damage done to this Mimikyu V by attacks from your opponent's Pokémon until the end of your opponent's next turn.","Ability","","","","Jealous Eyes","Psychic","1","","Put 3 damage counters on your opponent's Active Pokémon for each Prize card your opponent has taken.","","","","","","Darkness","×2"
"swsh9-69","Mimikyu VMAX","Pokémon","300","Psychic","","Mimikyu V","69","Studio Bora Inc.","Rare Holo VMAX",,"778","E","https://images.pokemontcg.io/swsh9/69.png","https://images.pokemontcg.io/swsh9/69_hires.png","Legal",,"Legal","Colorless","1","","","","","","","Ominous Numbers","Colorless, Colorless","2","","Put 4 damage counters on your opponent's Pokémon in any way you like. If you played Acerola's Premonition from your hand during this turn, place 13 damage counters instead.","Max Shadow","Psychic, Psychic","2","120","Discard a random card from your opponent's hand.","Darkness","×2"
"swsh9-70","Milcery","Pokémon","50","Psychic","Alcremie",,"70","Misa Tsutsui","Common","They say that any patisserie visited by Milcery is guaranteed success and good fortune.","868","E","https://images.pokemontcg.io/swsh9/70.png","https://images.pokemontcg.io/swsh9/70_hires.png","Legal",,"Legal","Colorless","1","","","","","","","Lead","Psychic","1","","Search your deck for a Supporter card, reveal it, and put it into your hand. Then, shuffle your deck.","Ram","Psychic","1","10","","Metal","×2"
"swsh9-71","Alcremie","Pokémon","90","Psychic","","Milcery","71","sowsow","Rare","When Alcremie is content, the cream it secretes from its hands becomes sweeter and richer.","869","E","https://images.pokemontcg.io/swsh9/71.png","https://images.pokemontcg.io/swsh9/71_hires.png","Legal",,"Legal","Colorless","1","Additional Order","As long as this Pokémon is in the Active Spot, your turn does not end when you use Café Master.","Ability","","","","Rainbow Flavor","Colorless, Colorless","2","10+","This attack does 40 more damage for each type of basic Energy attached to all of your Pokémon.","","","","","","Metal","×2"
"swsh9-72","Hitmontop","Pokémon","100","Fighting","",,"72","ryoma uratsuka","Uncommon","It launches kicks while spinning. If it spins at high speed, it may bore its way into the ground.","237","F","https://images.pokemontcg.io/swsh9/72.png","https://images.pokemontcg.io/swsh9/72_hires.png","Legal","Legal","Legal","Colorless","1","","","","","","","Spinning Draw","Colorless","1","20","Draw a card.","Cyclone Kick","Fighting, Fighting, Colorless","3","100","","Psychic","×2"
"swsh9-73","Nosepass","Pokémon","90","Fighting","Probopass",,"73","miki kudo","Common","It hunts without twitching a muscle by pulling in its prey with powerful magnetism. But sometimes it pulls natural enemies in close.","299","F","https://images.pokemontcg.io/swsh9/73.png","https://images.pokemontcg.io/swsh9/73_hires.png","Legal","Legal","Legal","Colorless, Colorless, Colorless, Colorless","4","","","","","","","Ram","Colorless","1","20","","","","","","","Grass","×2"
"swsh9-74","Trapinch","Pokémon","60","Fighting","Vibrava",,"74","zig","Common","Its nest is a sloped, bowl-like pit in the desert. Once something has fallen in, there is no escape.","328","F","https://images.pokemontcg.io/swsh9/74.png","https://images.pokemontcg.io/swsh9/74_hires.png","Legal","Legal","Legal","Colorless","1","","","","","","","Rising Lunge","Fighting","1","10+","Flip a coin. If heads, this attack does 10 more damage.","","","","","","Grass","×2"
"swsh9-75","Vibrava","Pokémon","90","Fighting","Flygon","Trapinch","75","Tomokazu Komiya","Uncommon","The ultrasonic waves it generates by rubbing its two wings together cause severe headaches.","329","F","https://images.pokemontcg.io/swsh9/75.png","https://images.pokemontcg.io/swsh9/75_hires.png","Legal","Legal","Legal","Colorless","1","","","","","","","Razor Wing","Fighting","1","30","","","","","","","Grass","×2"
"swsh9-76","Flygon","Pokémon","150","Fighting","","Vibrava","76","Shin Nagasawa","Rare","This Pokémon hides in the heart of sandstorms it creates and seldom appears where people can see it.","330","F","https://images.pokemontcg.io/swsh9/76.png","https://images.pokemontcg.io/swsh9/76_hires.png","Legal","Legal","Legal","Colorless","1","","","","","","","Desert Pillar","Fighting","1","50×","This attack does 50 damage for each Colorless in your opponent's Active Pokémon's Retreat Cost.","Blasting Wind","Fighting, Colorless","2","110","","Grass","×2"
"swsh9-77","Wormadam","Pokémon","110","Fighting","","Burmy","77","Lee HyunJung","Rare","When Burmy evolved, its cloak became a part of this Pokémon's body. The cloak is never shed.","413","F","https://images.pokemontcg.io/swsh9/77.png","https://images.pokemontcg.io/swsh9/77_hires.png","Legal","Legal","Legal","Colorless, Colorless","2","","","","","","","Matron's Anger","Colorless, Colorless","2","30+","This attack does 10 more damage for each Pokémon in your discard pile.","Bind Down","Fighting, Colorless, Colorless","3","80","During your opponent's next turn, the Defending Pokémon can't retreat.","Grass","×2"
"swsh9-78","Riolu","Pokémon","60","Fighting","Lucario",,"78","Teeziro","Common","It's exceedingly energetic, with enough stamina to keep running all through the night. Taking it for walks can be a challenging experience.","447","F","https://images.pokemontcg.io/swsh9/78.png","https://images.pokemontcg.io/swsh9/78_hires.png","Legal","Legal","Legal","Colorless","1","","","","","","","Low Kick","Fighting, Fighting","2","50","","","","","","","Psychic","×2"
"swsh9-79","Lucario","Pokémon","120","Fighting","","Riolu","79","GIDORA","Rare Holo","It controls waves known as auras, which are powerful enough to pulverize huge rocks. It uses these waves to take down its prey.","448","F","https://images.pokemontcg.io/swsh9/79.png","https://images.pokemontcg.io/swsh9/79_hires.png","Legal","Legal","Legal","Colorless, Colorless","2","Roaring Resolve","Once during your turn, you may put 2 damage counters on this Pokémon. If you do, search your deck for a Fighting Energy card and attach it to this Pokémon. Then, shuffle your deck.","Ability","","","","Aura Sphere Volley","Fighting, Fighting","2","10+","Discard all Fighting Energy from this Pokémon. This attack does 60 more damage for each card you discarded in this way.","","","","","","Psychic","×2"
"swsh9-80","Throh","Pokémon","120","Fighting","",,"80","Teeziro","Common","It performs throwing moves with first-rate skill. Over the course of many battles, Throh's belt grows darker as it absorbs its wearer's sweat.","538","F","https://images.pokemontcg.io/swsh9/80.png","https://images.pokemontcg.io/swsh9/80_hires.png","Legal","Legal","Legal","Colorless, Colorless, Colorless","3","","","","","","","Lunge Out","Colorless, Colorless","2","30","","Seismic Toss","Fighting, Fighting, Colorless","3","110","","Psychic","×2"
"swsh9-81","Sawk","Pokémon","90","Fighting","",,"81","Shinji Kanda","Common","If you see a Sawk training in the mountains in its single-minded pursuit of strength, it's best to quietly pass by.","539","F","https://images.pokemontcg.io/swsh9/81.png","https://images.pokemontcg.io/swsh9/81_hires.png","Legal","Legal","Legal","Colorless","1","","","","","","","Sweep the Leg","Fighting","1","30","Flip a coin. If heads, discard an Energy from your opponent's Active Pokémon.","","","","","","Psychic","×2"
"swsh9-82","Golett","Pokémon","100","Fighting","Golurk",,"82","Eske Yoshinob","Common","They were sculpted from clay in ancient times. No one knows why, but some of them are driven to continually line up boulders.","622","F","https://images.pokemontcg.io/swsh9/82.png","https://images.pokemontcg.io/swsh9/82_hires.png","Legal","Legal","Legal","Colorless, Colorless, Colorless, Colorless","4","","","","","","","Mud-Slap","Fighting","1","10","","Pound","Fighting, Colorless","2","20","","Grass","×2"
"swsh9-83","Golurk","Pokémon","150","Fighting","","Golett","83","Aya Kusube","Rare","Artillery platforms built into the walls of ancient castles served as perches from which Golurk could fire energy beams.","623","F","https://images.pokemontcg.io/swsh9/83.png","https://images.pokemontcg.io/swsh9/83_hires.png","Legal","Legal","Legal","Colorless, Colorless, Colorless, Colorless","4","","","","","","","Big Hand","Colorless, Colorless","2","30+","This attack does 10 more damage for each card in your hand.","Mega Punch","Fighting, Fighting, Colorless","3","120","","Grass","×2"
"swsh9-84","Grimer","Pokémon","80","Darkness","Muk",,"84","Masakazu Fukuda","Common","The wastewater coming from factories is clean these days, so Grimer have nothing to eat. They're said to be on the verge of extinction.","88","F","https://images.pokemontcg.io/swsh9/84.png","https://images.pokemontcg.io/swsh9/84_hires.png","Legal","Legal","Legal","Colorless, Colorless, Colorless","3","","","","","","","Poison Gas","Darkness","1","","Your opponent's Active Pokémon is now Poisoned.","","","","","","Fighting","×2"
"swsh9-85","Muk","Pokémon","130","Darkness","","Grimer","85","Scav","Rare","Because they scatter germs everywhere, they've long been targeted for extermination, leading to a steep decline in their population.","89","F","https://images.pokemontcg.io/swsh9/85.png","https://images.pokemontcg.io/swsh9/85_hires.png","Legal","Legal","Legal","Colorless, Colorless, Colorless","3","Sludge Street","The Retreat Cost of your opponent's Poisoned Pokémon is Colorless more.","Ability","","","","Shrieking Poison","Darkness, Colorless, Colorless","3","90","Your opponent's Active Pokémon is now Confused and Poisoned.","","","","","","Fighting","×2"
"swsh9-86","Sneasel","Pokémon","70","Darkness","Weavile",,"86","yuu","Common","Its paws conceal sharp claws. If attacked, it suddenly extends the claws and startles its enemy.","215","F","https://images.pokemontcg.io/swsh9/86.png","https://images.pokemontcg.io/swsh9/86_hires.png","Legal","Legal","Legal","Colorless","1","","","","","","","Scratch","Darkness","1","10","","Slash","Colorless, Colorless","2","20","","Grass","×2"
"swsh9-87","Weavile","Pokémon","90","Darkness","","Sneasel","87","Hasuno","Uncommon","They attack their quarry in packs. Prey as large as Mamoswine easily fall to the teamwork of a group of Weavile.","461","F","https://images.pokemontcg.io/swsh9/87.png","https://images.pokemontcg.io/swsh9/87_hires.png","Legal","Legal","Legal","Colorless","1","","","","","","","Ransack","Darkness","1","","Flip 2 coins. If either of them is heads, your opponent reveals their hand. For each heads, choose a card you find there and put it on the bottom of your opponent's deck in any order.","Slash","Darkness, Colorless, Colorless","3","100","","Grass","×2"
"swsh9-88","Honchkrow V","Pokémon","200","Darkness","",,"88","PLANETA Mochizuki","Rare Holo V",,"430","F","https://images.pokemontcg.io/swsh9/88.png","https://images.pokemontcg.io/swsh9/88_hires.png","Legal","Legal","Legal","Colorless","1","Boss Pockets","This Pokémon may have up to 4 Pokémon Tools attached to it. If it loses this Ability, discard Pokémon Tools from it until only 1 remains.","Ability","","","","Fearsome Shadow","Darkness, Darkness, Colorless","3","130","Your opponent reveals their hand.","","","","","","Lightning","×2"
"swsh9-89","Spiritomb","Pokémon","70","Darkness","",,"89","Uta","Common","Exactly 108 spirits gathered to become this Pokémon. Apparently there are some ill-natured spirits in the mix.","442","F","https://images.pokemontcg.io/swsh9/89.png","https://images.pokemontcg.io/swsh9/89_hires.png","Legal","Legal","Legal","Colorless","1","","","","","","","Ticking Terror","Colorless","1","","Until the end of your next turn, the Defending Pokémon's Weakness is now Darkness. (The amount of Weakness doesn't change.)","Cursed Drop","Darkness","1","","Put 2 damage counters on your opponent's Pokémon in any way you like.","Grass","×2"
"swsh9-90","Purrloin","Pokémon","60","Darkness","Liepard",,"90","Narumi Sato","Common","It steals things from people just to amuse itself with their frustration. A rivalry exists between this Pokémon and Nickit.","509","F","https://images.pokemontcg.io/swsh9/90.png","https://images.pokemontcg.io/swsh9/90_hires.png","Legal","Legal","Legal","Colorless","1","","","","","","","Surprise Attack","Colorless, Colorless","2","30","Flip a coin. If tails, this attack does nothing.","","","","","","Grass","×2"
"swsh9-91","Liepard","Pokémon","100","Darkness","","Purrloin","91","AKIRA EGAWA","Rare","Don't be fooled by its gorgeous fur and elegant figure. This is a moody and vicious Pokémon.","510","F","https://images.pokemontcg.io/swsh9/91.png","https://images.pokemontcg.io/swsh9/91_hires.png","Legal","Legal","Legal","Colorless","1","Trade","You must discard a card from your hand in order to use this Ability. Once during your turn, you may draw 2 cards.","Ability","","","","Slash","Colorless, Colorless","2","60","","","","","","","Grass","×2"
