"id","name","supertype","hp","types","evolvesTo","evolvesFrom","number","artist","rarity","flavorText","nationalPokedexNumbers","regulationMark","imageSmall","imageLarge","legalitiesUnlimited","legalitiesStandard","legalitiesExpanded","retreatCost","convertedRetreatCost","Ability1Name","Ability1Text","Ability1Type","Ability2Name","Ability2Text","Ability2Type","Attack1Name","Attack1Cost","Attack1ConvertedCost","Attack1Damage","Attack1Text","Attack2Name","Attack2Cost","Attack2ConvertedCost","Attack2Damage","Attack2Text","Weakness1Type","Weakness1Value"
"swsh4-92","Terrakion","Pokemon","140","Fighting","",,"92","NC Empire","Rare","It has phenomenal power. It will mercilessly crush anyone or anything that bullies small Pokemon.","639","D","https://images.pokemontcg.io/swsh4/92.png","https://images.pokemontcg.io/swsh4/92_hires.png","Legal",,"Legal","Colorless, Colorless, Colorless, Colorless","4","","","","","","","Guard Press","Fighting, Colorless","2","30","During your opponent's next turn, this Pokemon takes 30 less damage from attacks (after applying Weakness and Resistance).","Earthen Power","Fighting, Fighting, Colorless","3","80+","If you have a Stadium in play, this attack does 80 more damage.","Grass","x2"
"swsh4-93","Zygarde","Pokemon","150","Fighting","",,"93","Ryuta Fuse","Rare Holo","Born when all of Zygarde's cells have been gathered together, it uses force to neutralize those who harm the ecosystem.","718","D","https://images.pokemontcg.io/swsh4/93.png","https://images.pokemontcg.io/swsh4/93_hires.png","Legal",,"Legal","Colorless, Colorless, Colorless, Colorless","4","","","","","","","Beam","Fighting","1","30","","Core Avenger","Fighting, Colorless, Colorless","3","80+","If you have more Prize cards remaining than your opponent, this attack does 80 more damage.","Grass","x2"
"swsh4-94","Rockruff","Pokemon","70","Fighting","Lycanroc",,"94","Eri Yamaki","Common","When it rubs the rocks on its neck against you, that's proof of its love for you. However, the rocks are sharp, so the gesture is quite painful!","744","D","https://images.pokemontcg.io/swsh4/94.png","https://images.pokemontcg.io/swsh4/94_hires.png","Legal",,"Legal","Colorless","1","","","","","","","Tackle","Fighting","1","10","","Rear Kick","Fighting, Colorless","2","20","","Grass","x2"
"swsh4-95","Lycanroc","Pokemon","120","Fighting","","Rockruff","95","Anesaki Dynamic","Rare","They live alone without forming packs. They will only listen to orders from Trainers who can draw out their true power.","745","D","https://images.pokemontcg.io/swsh4/95.png","https://images.pokemontcg.io/swsh4/95_hires.png","Legal",,"Legal","Colorless, Colorless","2","","","","","","","Rock Throw","Fighting","1","40","","Sharp Mane","Fighting, Colorless","2","70","","Grass","x2"
"swsh4-96","Mudbray","Pokemon","80","Fighting","Mudsdale",,"96","Naoyo Kimura","Common","Loads weighing up to 50 times as much as its own body weight pose no issue for this Pokemon. It's skilled at making use of mud.","749","D","https://images.pokemontcg.io/swsh4/96.png","https://images.pokemontcg.io/swsh4/96_hires.png","Legal",,"Legal","Colorless, Colorless","2","","","","","","","Ram","Colorless","1","10","","Rear Kick","Fighting, Fighting, Colorless","3","60","","Grass","x2"
"swsh4-97","Mudsdale","Pokemon","140","Fighting","","Mudbray","97","tetsuya koizumi","Rare","Mud that hardens around a Mudsdale's legs sets harder than stone. It's so hard that it allows this Pokemon to scrap a truck with a single kick.","750","D","https://images.pokemontcg.io/swsh4/97.png","https://images.pokemontcg.io/swsh4/97_hires.png","Legal",,"Legal","Colorless, Colorless, Colorless","3","","","","","","","Mud Bomb","Fighting, Colorless","2","50","","Heavy Slam","Fighting, Fighting, Colorless","3","180-","This attack does 30 less damage for each Colorless in your opponent's Active Pokemon's Retreat Cost.","Grass","x2"
"swsh4-98","Coalossal V","Pokemon","220","Fighting","",,"98","5ban Graphics","Rare Holo V",,"839","D","https://images.pokemontcg.io/swsh4/98.png","https://images.pokemontcg.io/swsh4/98_hires.png","Legal",,"Legal","Colorless, Colorless, Colorless, Colorless","4","","","","","","","Searing Flame","Fighting, Fighting, Colorless","3","90","Your opponent's Active Pokemon is now Burned.","Boulder Crush","Fighting, Fighting, Fighting, Colorless","4","180","","Grass","x2"
"swsh4-99","Coalossal VMAX","Pokemon","330","Fighting","","Coalossal V","99","5ban Graphics","Rare Holo VMAX",,"839","D","https://images.pokemontcg.io/swsh4/99.png","https://images.pokemontcg.io/swsh4/99_hires.png","Legal",,"Legal","Colorless, Colorless, Colorless, Colorless","4","","","","","","","Eruption Shot","Fighting","1","40+","Discard the top card of your deck. If that card is an Energy card, this attack does 90 more damage, and attach that card to this Pokemon.","G-Max Boulder","Fighting, Fighting, Fighting, Colorless","4","240","","Grass","x2"
"swsh4-100","Clobbopus","Pokemon","80","Fighting","Grapploct",,"100","Misa Tsutsui","Common","It's very curious, but its means of investigating things is to try to punch them with its tentacles. The search for food is what brings it onto land.","852","D","https://images.pokemontcg.io/swsh4/100.png","https://images.pokemontcg.io/swsh4/100_hires.png","Legal",,"Legal","Colorless, Colorless","2","","","","","","","Beat","Fighting","1","20","","Hammer In","Fighting, Colorless","2","40","","Psychic","x2"
"swsh4-101","Grapploct","Pokemon","130","Fighting","","Clobbopus","101","Hitoshi Ariga","Rare","A body made up of nothing but muscle makes the grappling moves this Pokemon performs with its tentacles tremendously powerful.","853","D","https://images.pokemontcg.io/swsh4/101.png","https://images.pokemontcg.io/swsh4/101_hires.png","Legal",,"Legal","Colorless, Colorless","2","","","","","","","Full Nelson","Fighting","1","30","During your opponent's next turn, the Defending Pokemon can't retreat.","Tentacle Buster","Fighting, Colorless","2","50+","If this Pokemon used Full Nelson during your last turn, this attack does 120 more damage.","Psychic","x2"
"swsh4-102","Zamazenta","Pokemon","110","Fighting","",,"102","aky CG Works","Amazing Rare","Its ability to deflect any attack led to it being known as the Fighting Master's Shield. It was feared and respected by all.","889","D","https://images.pokemontcg.io/swsh4/102.png","https://images.pokemontcg.io/swsh4/102_hires.png","Legal",,"Legal","Colorless, Colorless","2","","","","","","","Metal Armament","Colorless","1","30","Attach a basic Energy card from your discard pile to this Pokemon.","Amazing Shield","Lightning, Fighting, Metal","3","180","During your opponent's next turn, prevent all damage done to this Pokemon by attacks from Pokemon VMAX.","Psychic","x2"
"swsh4-103","Poochyena","Pokemon","70","Darkness","Mightyena",,"103","ryoma uratsuka","Common","It has a very tenacious nature. Its acute sense of smell lets it chase a chosen prey without ever losing track.","261","D","https://images.pokemontcg.io/swsh4/103.png","https://images.pokemontcg.io/swsh4/103_hires.png","Legal",,"Legal","Colorless","1","","","","","","","Bite","Darkness","1","10","","Rear Kick","Colorless, Colorless","2","20","","Grass","x2"
"swsh4-104","Mightyena","Pokemon","110","Darkness","","Poochyena","104","Aya Kusube","Uncommon","It chases down prey in a pack of around ten. They defeat foes with perfectly coordinated teamwork.","262","D","https://images.pokemontcg.io/swsh4/104.png","https://images.pokemontcg.io/swsh4/104_hires.png","Legal",,"Legal","Colorless","1","","","","","","","Ferocious Bellow","Darkness","1","20","During your opponent's next turn, the Defending Pokemon's attacks do 50 less damage (before applying Weakness and Resistance).","Pitch-Black Fangs","Darkness, Colorless, Colorless","3","100","","Grass","x2"
"swsh4-105","Sableye","Pokemon","70","Darkness","",,"105","KEIICHIRO ITO","Uncommon","This Pokemon is feared. When its gemstone eyes begin to glow with a sinister shine, it's believed that Sableye will steal people's spirits away.","302","D","https://images.pokemontcg.io/swsh4/105.png","https://images.pokemontcg.io/swsh4/105_hires.png","Legal",,"Legal","Colorless","1","","","","","","","Filch","Colorless","1","","Draw a card.","Torment","Colorless, Colorless","2","30","Choose 1 of your opponent's Active Pokemon's attacks. During your opponent's next turn, that Pokemon can't use that attack.","Grass","x2"
"swsh4-106","Drapion V","Pokemon","210","Darkness","",,"106","Eske Yoshinob","Rare Holo V",,"452","D","https://images.pokemontcg.io/swsh4/106.png","https://images.pokemontcg.io/swsh4/106_hires.png","Legal",,"Legal","Colorless, Colorless, Colorless","3","","","","","","","Wrack Down","Darkness, Colorless, Colorless","3","70","","Hazardous Claws","Darkness, Colorless, Colorless, Colorless","4","130","Discard 2 Energy from this Pokemon. Your opponent's Active Pokemon is now Paralyzed and Poisoned.","Fighting","x2"
"swsh4-107","Sandile","Pokemon","70","Darkness","Krokorok",,"107","Pani Kobayashi","Common","Sandile's still not good at hunting, so it mostly eats things that have collapsed in the desert. It's called ""the cleaner of the desert.""","551","D","https://images.pokemontcg.io/swsh4/107.png","https://images.pokemontcg.io/swsh4/107_hires.png","Legal",,"Legal","Colorless, Colorless","2","","","","","","","Dredge Up","Colorless, Colorless, Colorless, Colorless","4","","Discard the top 3 cards of your opponent's deck.","","","","","","Grass","x2"
"swsh4-108","Krokorok","Pokemon","90","Darkness","Krookodile","Sandile","108","sowsow","Uncommon","It buries some of its prey in the sand to use as emergency meals when its hunts are unsuccessful.","552","D","https://images.pokemontcg.io/swsh4/108.png","https://images.pokemontcg.io/swsh4/108_hires.png","Legal",,"Legal","Colorless, Colorless","2","","","","","","","Bite","Darkness","1","20","","Dredge Up","Colorless, Colorless, Colorless","3","","Discard the top 3 cards of your opponent's deck.","Grass","x2"
"swsh4-109","Krookodile","Pokemon","150","Darkness","","Krokorok","109","Ryuta Fuse","Rare","It conceals itself in sandstorms that Flygon whip up and waits patiently for prey to appear.","553","D","https://images.pokemontcg.io/swsh4/109.png","https://images.pokemontcg.io/swsh4/109_hires.png","Legal",,"Legal","Colorless, Colorless, Colorless","3","","","","","","","Dredge Up","Colorless, Colorless","2","","Discard the top 3 cards of your opponent's deck.","Tantrum","Darkness, Colorless, Colorless, Colorless","4","180","This Pokemon is now Confused.","Grass","x2"
"swsh4-110","Trubbish","Pokemon","70","Darkness","Garbodor",,"110","Kyoko Umemoto","Common","Its favorite places are unsanitary ones. If you leave trash lying around, you could even find one of these Pokemon living in your room.","568","D","https://images.pokemontcg.io/swsh4/110.png","https://images.pokemontcg.io/swsh4/110_hires.png","Legal",,"Legal","Colorless, Colorless","2","","","","","","","Lucky Find","Colorless, Colorless","2","","Search your deck for an Item card, reveal it, and put it into your hand. Then, shuffle your deck.","Sludge Toss","Darkness, Colorless, Colorless","3","30","","Fighting","x2"
"swsh4-111","Garbodor","Pokemon","120","Darkness","","Trubbish","111","Hasuno","Rare","This Pokemon eats trash, which turns into poison inside its body. The main component of the poison depends on what sort of trash was eaten.","569","D","https://images.pokemontcg.io/swsh4/111.png","https://images.pokemontcg.io/swsh4/111_hires.png","Legal",,"Legal","Colorless, Colorless, Colorless","3","","","","","","","Trash Cyclone","Colorless, Colorless","2","30x","This attack does 30 damage for each Pokemon Tool card in your discard pile. Then, shuffle those cards into your deck.","Poison Spray","Darkness, Colorless, Colorless","3","80","Your opponent's Active Pokemon is now Poisoned.","Fighting","x2"
"swsh4-112","Galarian Meowth","Pokemon","70","Metal","Perrserker",,"112","Kouki Saitou","Common","Living with a savage, seafaring people has toughened this Pokemon's body so much that parts of it have turned to iron.","52","D","https://images.pokemontcg.io/swsh4/112.png","https://images.pokemontcg.io/swsh4/112_hires.png","Legal",,"Legal","Colorless","1","","","","","","","Scratch","Metal","1","10","","Fury Swipes","Metal, Colorless","2","20x","Flip 3 coins. This attack does 20 damage for each heads.","Fire","x2"
"swsh4-113","Galarian Perrserker","Pokemon","120","Metal","","Galarian Meowth","113","Shin Nagasawa","Rare","What appears to be an iron helmet is actually hardened hair. This Pokemon lives for the thrill of battle.","863","D","https://images.pokemontcg.io/swsh4/113.png","https://images.pokemontcg.io/swsh4/113_hires.png","Legal",,"Legal","Colorless, Colorless","2","","","","","","","Stealy Claws","Metal","1","20","Flip 3 coins. If any of them are heads, your opponent reveals their hand. Then, for each heads, discard a Trainer card from your opponent's hand.","Claw Slash","Metal, Colorless, Colorless","3","90","","Fire","x2"
"swsh4-114","Forretress","Pokemon","120","Metal","","Pineco","114","Atsuko Nishida","Rare","In the moment that it gulps down its prey, the inside of its shell is exposed, but to this day, no one has ever seen that sight.","205","D","https://images.pokemontcg.io/swsh4/114.png","https://images.pokemontcg.io/swsh4/114_hires.png","Legal",,"Legal","Colorless, Colorless, Colorless","3","","","","","","","Take Down","Metal, Colorless, Colorless","3","120","This Pokemon also does 30 damage to itself.","Double KO","Metal, Metal, Colorless, Colorless","4","","Both Active Pokemon are Knocked Out.","Fire","x2"
"swsh4-115","Steelix V","Pokemon","250","Metal","",,"115","Satoshi Shirai","Rare Holo V",,"208","D","https://images.pokemontcg.io/swsh4/115.png","https://images.pokemontcg.io/swsh4/115_hires.png","Legal",,"Legal","Colorless, Colorless, Colorless, Colorless","4","","","","","","","Raging Hammer","Metal, Colorless","2","30+","This attack does 10 more damage for each damage counter on this Pokemon.","Iron Tackle","Metal, Colorless, Colorless, Colorless, Colorless","5","210","This Pokemon also does 30 damage to itself.","Fire","x2"
"swsh4-116","Beldum","Pokemon","70","Metal","Metang",,"116","Aya Kusube","Common","If you anger it, it will do more than rampage. It will also burst out strong magnetism, causing nearby machines to break.","374","D","https://images.pokemontcg.io/swsh4/116.png","https://images.pokemontcg.io/swsh4/116_hires.png","Legal",,"Legal","Colorless, Colorless","2","","","","","","","Call for Family","Metal","1","","Search your deck for up to 2 Basic Pokemon and put them onto your Bench. Then, shuffle your deck.","Ram","Metal, Colorless","2","20","","Fire","x2"
"swsh4-117","Metang","Pokemon","100","Metal","Metagross","Beldum","117","Kazuma Koda","Uncommon","It flies at high speeds around the skies. When it finds its prey, Metang takes a firm grip with its sharp claws and never lets go.","375","D","https://images.pokemontcg.io/swsh4/117.png","https://images.pokemontcg.io/swsh4/117_hires.png","Legal",,"Legal","Colorless, Colorless, Colorless","3","","","","","","","Metal Claw","Metal, Colorless","2","30","","Magnetic Blast","Metal, Colorless, Colorless","3","60","","Fire","x2"
"swsh4-118","Metagross","Pokemon","170","Metal","","Metang","118","kawayoo","Rare","It analyzes its opponents with more accuracy than a supercomputer, which enables it to calmly back them into a corner.","376","D","https://images.pokemontcg.io/swsh4/118.png","https://images.pokemontcg.io/swsh4/118_hires.png","Legal",,"Legal","Colorless, Colorless, Colorless","3","Levitation Field","Your Pokemon in play have no Retreat Cost.","Ability","","","","Leg Quake","Metal, Colorless, Colorless","3","100","If the Defending Pokemon is an Evolution Pokemon, it can't attack during your opponent's next turn.","","","","","","Fire","x2"
"swsh4-119","Jirachi","Pokemon","70","Metal","",,"119","Sanosuke Sakuma","Amazing Rare","Once every 1,000 years, the singing of a pure voice will rouse this Pokemon from its near-perpetual slumber. It wakes for only seven days.","385","D","https://images.pokemontcg.io/swsh4/119.png","https://images.pokemontcg.io/swsh4/119_hires.png","Legal",,"Legal","Colorless","1","Dreamy Revelation","Once during your turn, if this Pokemon is in the Active Spot, you may look at the top 2 cards of your deck and put 1 of them into your hand. Put the other card back on top of your deck.","Ability","","","","Amazing Star","Psychic, Fighting, Metal","3","","Search your deck for up to 7 basic Energy cards and attach them to your Pokemon in any way you like. Then, shuffle your deck.","","","","","","Fire","x2"
"swsh4-120","Lucario","Pokemon","130","Metal","","Riolu","120","kodama","Rare","It controls waves known as auras, which are powerful enough to pulverize huge rocks. It uses these waves to take down its prey.","448","D","https://images.pokemontcg.io/swsh4/120.png","https://images.pokemontcg.io/swsh4/120_hires.png","Legal",,"Legal","Colorless, Colorless","2","","","","","","","Spike Draw","Metal","1","40","Draw a card.","Knuckle Impact","Metal, Metal, Colorless","3","160","During your next turn, this Pokemon can't attack.","Fire","x2"
"swsh4-121","Dialga","Pokemon","130","Metal","",,"121","Shin Nagasawa","Rare Holo","It has the power to control time. It appears in Sinnoh-region myths as an ancient deity.","483","D","https://images.pokemontcg.io/swsh4/121.png","https://images.pokemontcg.io/swsh4/121_hires.png","Legal",,"Legal","Colorless, Colorless","2","","","","","","","Rewind Time","Colorless","1","","Attach up to 2 Metal Energy cards from your discard pile to 1 of your Pokemon.","Flash of Destruction","Metal, Metal, Colorless","3","130","Discard 2 Energy from this Pokemon.","Fire","x2"
"swsh4-122","Excadrill","Pokemon","130","Metal","","Drilbur","122","Anesaki Dynamic","Uncommon","It's not uncommon for tunnels that appear to have formed naturally to actually be a result of Excadrill's rampant digging.","530","D","https://images.pokemontcg.io/swsh4/122.png","https://images.pokemontcg.io/swsh4/122_hires.png","Legal",,"Legal","Colorless, Colorless, Colorless","3","","","","","","","Drill Run","Metal, Colorless","2","30","Discard an Energy from your opponent's Active Pokemon.","Slashing Claw","Metal, Metal, Colorless","3","130","","Fire","x2"
"swsh4-123","Ferroseed","Pokemon","60","Metal","Ferrothorn",,"123","HYOGONOSUKE","Common","It defends itself by launching spikes, but its aim isn't very good at first. Only after a lot of practice will it improve.","597","D","https://images.pokemontcg.io/swsh4/123.png","https://images.pokemontcg.io/swsh4/123_hires.png","Legal",,"Legal","Colorless, Colorless, Colorless","3","","","","","","","Reaction","Metal","1","10","Switch this Pokemon with 1 of your Benched Pokemon.","","","","","","Fire","x2"
"swsh4-124","Ferrothorn","Pokemon","110","Metal","","Ferroseed","124","Miki Tanaka","Uncommon","This Pokemon scrapes its spikes across rocks, and then uses the tips of its feelers to absorb the nutrients it finds within the stone.","598","D","https://images.pokemontcg.io/swsh4/124.png","https://images.pokemontcg.io/swsh4/124_hires.png","Legal",,"Legal","Colorless, Colorless, Colorless","3","","","","","","","Swift Swing","Metal","1","30x","This attack does 30 damage for each Metal Energy attached to this Pokemon. Switch this Pokemon with 1 of your Benched Pokemon.","","","","","","Fire","x2"
"swsh4-125","Galarian Stunfisk","Pokemon","120","Metal","",,"125","Akira Komayama","Uncommon","Living in mud with a high iron content has given it a strong steel body.","618","D","https://images.pokemontcg.io/swsh4/125.png","https://images.pokemontcg.io/swsh4/125_hires.png","Legal",,"Legal","Colorless, Colorless, Colorless","3","Counterattack","If this Pokemon is in the Active Spot and is damaged by an attack from your opponent's Pokemon (even if this Pokemon is Knocked Out), put 3 damage counters on the Attacking Pokemon.","Ability","","","","Grip and Squeeze","Colorless, Colorless, Colorless","3","90","During your opponent's next turn, the Defending Pokemon can't retreat.","","","","","","Fire","x2"
"swsh4-126","Aegislash V","Pokemon","210","Metal","",,"126","aky CG Works","Rare Holo V",,"681","D","https://images.pokemontcg.io/swsh4/126.png","https://images.pokemontcg.io/swsh4/126_hires.png","Legal",,"Legal","Colorless, Colorless, Colorless","3","","","","","","","Slash","Metal, Colorless","2","50","","Sonic Edge","Metal, Metal, Colorless","3","130","This attack's damage isn't affected by any effects on your opponent's Active Pokemon.","Fire","x2"
"swsh4-127","Aegislash VMAX","Pokemon","320","Metal","","Aegislash V","127","aky CG Works","Rare Holo VMAX",,"681","D","https://images.pokemontcg.io/swsh4/127.png","https://images.pokemontcg.io/swsh4/127_hires.png","Legal",,"Legal","Colorless, Colorless, Colorless","3","","","","","","","Max Hack","Metal, Metal, Colorless","3","160+","This attack does 30 more damage for each Prize card you have taken.","","","","","","Fire","x2"
"swsh4-128","Magearna","Pokemon","90","Metal","",,"128","AKIRA EGAWA","Rare Holo","Built roughly 500 years ago by a scientist, the part called the Soul-Heart is the actual life-form.","801","D","https://images.pokemontcg.io/swsh4/128.png","https://images.pokemontcg.io/swsh4/128_hires.png","Legal",,"Legal","Colorless","1","","","","","","","Overhaul","Metal","1","","Shuffle your hand into your deck. Then, draw 6 cards.","Windup Cannon","Metal, Colorless","2","10+","This attack does 20 more damage for each of your opponent's Benched Pokemon.","Fire","x2"
"swsh4-129","Duraludon","Pokemon","130","Metal","",,"129","kawayoo","Rare Holo","Its body resembles polished metal, and it's both lightweight and strong. The only drawback is that it rusts easily.","884","D","https://images.pokemontcg.io/swsh4/129.png","https://images.pokemontcg.io/swsh4/129_hires.png","Legal",,"Legal","Colorless, Colorless","2","","","","","","","Raging Claws","Colorless, Colorless","2","20+","This attack does 10 more damage for each damage counter on this Pokemon.","Power Blast","Metal, Metal, Colorless","3","120","Discard an Energy from this Pokemon.","Fire","x2"
"swsh4-130","Eevee","Pokemon","70","Colorless","Vaporeon, Jolteon, Flareon, Sylveon, Espeon, Umbreon, Leafeon, Glaceon",,"130","Lee HyunJung","Common","It has the ability to alter the composition of its body to suit its surrounding environment.","133","D","https://images.pokemontcg.io/swsh4/130.png","https://images.pokemontcg.io/swsh4/130_hires.png","Legal",,"Legal","Colorless","1","","","","","","","Gnaw","Colorless","1","10","","Tail Whap","Colorless, Colorless","2","20","","Fighting","x2"
"swsh4-131","Snorlax","Pokemon","130","Colorless","",,"131","Atsuko Nishida","Rare Holo","It is not satisfied unless it eats over 880 pounds of food every day. When it is done eating, it goes promptly to sleep.","143","D","https://images.pokemontcg.io/swsh4/131.png","https://images.pokemontcg.io/swsh4/131_hires.png","Legal",,"Legal","Colorless, Colorless, Colorless","3","Gormandize","Once during your turn, if this Pokemon is in the Active Spot, you may draw cards until you have 7 cards in your hand. If you use this Ability, your turn ends.","Ability","","","","Body Slam","Colorless, Colorless, Colorless, Colorless","4","100","Flip a coin. If heads, your opponent's Active Pokemon is now Paralyzed.","","","","","","Fighting","x2"
"swsh4-132","Lugia","Pokemon","130","Colorless","",,"132","NC Empire","Rare Holo","It is said to be the guardian of the seas. It is rumored to have been seen on the night of a storm.","249","D","https://images.pokemontcg.io/swsh4/132.png","https://images.pokemontcg.io/swsh4/132_hires.png","Legal",,"Legal","Colorless, Colorless","2","","","","","","","Gust","Colorless, Colorless","2","40","","Wind Pressure","Colorless, Colorless, Colorless, Colorless","4","250","If your opponent has 5 or fewer cards in their hand, this attack does nothing.","Lightning","x2"
"swsh4-133","Taillow","Pokemon","60","Colorless","Swellow",,"133","Yuka Morii","Common","It dislikes cold seasons. They migrate to other lands in search of warmth, flying over 180 miles a day.","276","D","https://images.pokemontcg.io/swsh4/133.png","https://images.pokemontcg.io/swsh4/133_hires.png","Legal",,"Legal","Colorless","1","","","","","","","Double Peck","Colorless, Colorless","2","20x","Flip 2 coins. This attack does 20 damage for each heads.","","","","","","Lightning","x2"
"swsh4-134","Swellow","Pokemon","90","Colorless","","Taillow","134","kodama","Uncommon","It dives at a steep angle as soon as it spots its prey. It catches its prey with sharp claws.","277","D","https://images.pokemontcg.io/swsh4/134.png","https://images.pokemontcg.io/swsh4/134_hires.png","Legal",,"Legal","",,"","","","","","","Quick Attack","Colorless","1","20+","Flip a coin. If heads, this attack does 40 more damage.","Energy Assist","Colorless, Colorless","2","40","Attach up to 2 basic Energy cards from your discard pile to 1 of your Benched Pokemon.","Lightning","x2"
"swsh4-135","Whismur","Pokemon","60","Colorless","Loudred",,"135","Tika Matsuno","Common","If it senses danger, it scares the foe by crying out with the volume of a jet-plane engine.","293","D","https://images.pokemontcg.io/swsh4/135.png","https://images.pokemontcg.io/swsh4/135_hires.png","Legal",,"Legal","Colorless","1","","","","","","","Continuous Tumble","Colorless, Colorless","2","40x","Flip a coin until you get tails. This attack does 40 damage for each heads.","","","","","","Fighting","x2"
