"id","name","supertype","hp","types","evolvesTo","evolvesFrom","number","artist","rarity","flavorText","nationalPokedexNumbers","regulationMark","imageSmall","imageLarge","legalitiesUnlimited","legalitiesStandard","legalitiesExpanded","retreatCost","convertedRetreatCost","Ability1Name","Ability1Text","Ability1Type","Ability2Name","Ability2Text","Ability2Type","Attack1Name","Attack1Cost","Attack1ConvertedCost","Attack1Damage","Attack1Text","Attack2Name","Attack2Cost","Attack2ConvertedCost","Attack2Damage","Attack2Text","Weakness1Type","Weakness1Value"
"swsh9-92","Impidimp","Pokémon","60","Darkness","Morgrem",,"92","Rianti Hidayat","Common","Through its nose, it sucks in the emanations produced by people and Pokémon when they feel annoyed. It thrives off this negative energy.","859","F","https://images.pokemontcg.io/swsh9/92.png","https://images.pokemontcg.io/swsh9/92_hires.png","Legal","Legal","Legal","Colorless","1","","","","","","","Call for Family","Darkness","1","","Search your deck for a Basic Pokémon and put it onto your Bench. Then, shuffle your deck.","Bite","Colorless, Colorless","2","30","","Grass","×2"
"swsh9-93","Morgrem","Pokémon","90","Darkness","Grimmsnarl","Impidimp","93","Shiburingaru","Uncommon","When it gets down on all fours as if to beg for forgiveness, it's trying to lure opponents in so that it can stab them with its spear-like hair.","860","F","https://images.pokemontcg.io/swsh9/93.png","https://images.pokemontcg.io/swsh9/93_hires.png","Legal","Legal","Legal","Colorless","1","","","","","","","Smash Kick","Darkness","1","30","","Pierce","Darkness, Colorless","2","50","","Grass","×2"
"swsh9-94","Grimmsnarl","Pokémon","160","Darkness","","Morgrem","94","DOM","Rare","With the hair wrapped around its body helping to enhance its muscles, this Pokémon can overwhelm even Machamp.","861","F","https://images.pokemontcg.io/swsh9/94.png","https://images.pokemontcg.io/swsh9/94_hires.png","Legal","Legal","Legal","Colorless, Colorless","2","","","","","","","Longhair Shot","Darkness","1","","This attack does 30 damage to 1 of your opponent's Pokémon for each Darkness Energy attached to this Pokémon. (Don't apply Weakness and Resistance for Benched Pokémon.)","Darkness Fang","Darkness, Colorless","2","110","","Grass","×2"
"swsh9-95","Morpeko V","Pokémon","190","Darkness","",,"95","PLANETA Mochizuki","Rare Holo V",,"877","F","https://images.pokemontcg.io/swsh9/95.png","https://images.pokemontcg.io/swsh9/95_hires.png","Legal","Legal","Legal","Colorless","1","","","","","","","Gnaw and Run","Colorless, Colorless","2","30","You may switch this Pokémon with 1 of your Benched Pokémon.","Hangry Spike","Darkness, Darkness, Colorless","3","120+","If you played Marnie's Pride from your hand during this turn, this attack does 120 more damage.","Grass","×2"
"swsh9-96","Aggron V","Pokémon","230","Metal","",,"96","PLANETA Mochizuki","Rare Holo V",,"306","F","https://images.pokemontcg.io/swsh9/96.png","https://images.pokemontcg.io/swsh9/96_hires.png","Legal","Legal","Legal","Colorless, Colorless, Colorless, Colorless","4","","","","","","","Rock Slide","Metal, Colorless, Colorless","3","90","This attack also does 30 damage to 2 of your opponent's Benched Pokémon. (Don't apply Weakness and Resistance for Benched Pokémon.)","Merciless Strike","Metal, Colorless, Colorless, Colorless, Colorless","5","150+","If your opponent's Active Pokémon already has any damage counters on it, this attack does 150 more damage.","Fire","×2"
"swsh9-97","Aggron VMAX","Pokémon","330","Metal","","Aggron V","97","5ban Graphics","Rare Holo VMAX",,"306","F","https://images.pokemontcg.io/swsh9/97.png","https://images.pokemontcg.io/swsh9/97_hires.png","Legal","Legal","Legal","Colorless, Colorless, Colorless, Colorless","4","","","","","","","Cracking Stomp","Metal, Colorless, Colorless","3","150","Discard the top card of your opponent's deck.","Max Take Down","Metal, Metal, Colorless, Colorless, Colorless","5","270","This Pokémon also does 30 damage to itself.","Fire","×2"
"swsh9-98","Wormadam","Pokémon","110","Metal","","Burmy","98","Ryo Ueda","Rare","When Burmy evolved, its cloak became a part of this Pokémon's body. The cloak is never shed.","413","F","https://images.pokemontcg.io/swsh9/98.png","https://images.pokemontcg.io/swsh9/98_hires.png","Legal","Legal","Legal","Colorless, Colorless","2","","","","","","","Matron's Anger","Colorless, Colorless","2","30+","This attack does 10 more damage for each Pokémon in your discard pile.","Scrap Drop","Metal, Colorless, Colorless","3","90","","Fire","×2"
"swsh9-99","Probopass","Pokémon","140","Metal","","Nosepass","99","Pani Kobayashi","Uncommon","It uses three small units to catch prey and battle enemies. The main body mostly just gives orders.","476","F","https://images.pokemontcg.io/swsh9/99.png","https://images.pokemontcg.io/swsh9/99_hires.png","Legal","Legal","Legal","Colorless, Colorless, Colorless, Colorless","4","","","","","","","Magnetic Tension","Colorless, Colorless","2","","Switch 1 of your opponent's Benched Pokémon with their Active Pokémon. This attack does 40 damage to the new Active Pokémon.","Iron Tackle","Metal, Colorless, Colorless","3","120","This Pokémon also does 20 damage to itself.","Fire","×2"
"swsh9-100","Heatran","Pokémon","140","Metal","",,"100","Yuya Oka","Rare","Boiling blood, like magma, circulates through its body. It makes its dwelling place in volcanic caves.","485","F","https://images.pokemontcg.io/swsh9/100.png","https://images.pokemontcg.io/swsh9/100_hires.png","Legal","Legal","Legal","Colorless, Colorless, Colorless, Colorless","4","","","","","","","Guard Claw","Colorless, Colorless","2","30","During your opponent's next turn, this Pokémon takes 30 less damage from attacks (after applying Weakness and Resistance).","Iron Hammer","Metal, Metal, Colorless","3","80+","If this Pokémon has any Fire Energy attached, this attack does 80 more damage.","Fire","×2"
"swsh9-101","Escavalier","Pokémon","120","Metal","","Karrablast","101","Nurikabe","Rare","They use shells they've stolen from Shelmet to arm and protect themselves. They're very popular Pokémon in the Galar region.","589","F","https://images.pokemontcg.io/swsh9/101.png","https://images.pokemontcg.io/swsh9/101_hires.png","Legal","Legal","Legal","Colorless, Colorless","2","Miraculous Armor","This Pokémon takes 100 less damage from attacks from your opponent's Pokémon V (after applying Weakness and Resistance).","Ability","","","","Pike","Metal, Colorless, Colorless","3","90","This attack also does 30 damage to 1 of your opponent's Benched Pokémon. (Don't apply Weakness and Resistance for Benched Pokémon.)","","","","","","Fire","×2"
"swsh9-102","Klink","Pokémon","50","Metal","Klang",,"102","OKACHEKE","Common","The two minigears that compose this Pokémon are closer than twins. They mesh well only with each other.","599","F","https://images.pokemontcg.io/swsh9/102.png","https://images.pokemontcg.io/swsh9/102_hires.png","Legal","Legal","Legal","Colorless","1","","","","","","","Vise Grip","Metal","1","10","","Spinning Attack","Metal, Colorless","2","20","","Fire","×2"
"swsh9-103","Klang","Pokémon","90","Metal","Klinklang","Klink","103","Hataya","Uncommon","When Klang goes all out, the minigear links up perfectly with the outer part of the big gear, and this Pokémon's rotation speed increases sharply.","600","F","https://images.pokemontcg.io/swsh9/103.png","https://images.pokemontcg.io/swsh9/103_hires.png","Legal","Legal","Legal","Colorless, Colorless","2","","","","","","","Beam","Metal","1","20","","Guard Press","Metal, Colorless, Colorless","3","70","During your opponent's next turn, this Pokémon takes 30 less damage from attacks (after applying Weakness and Resistance).","Fire","×2"
"swsh9-104","Klinklang","Pokémon","150","Metal","","Klang","104","Megumi Higuchi","Rare","From its spikes, it launches powerful blasts of electricity. Its red core contains an enormous amount of energy.","601","F","https://images.pokemontcg.io/swsh9/104.png","https://images.pokemontcg.io/swsh9/104_hires.png","Legal","Legal","Legal","Colorless, Colorless, Colorless","3","Gear Wall","Your Basic Pokémon take 20 less damage from attacks from your opponent's Pokémon (after applying Weakness and Resistance).","Ability","","","","Tumbling Attack","Metal, Colorless, Colorless","3","90+","Flip a coin. If heads, this attack does 90 more damage.","","","","","","Fire","×2"
"swsh9-105","Zamazenta V","Pokémon","220","Metal","",,"105","PLANETA Mochizuki","Rare Holo V",,"889","F","https://images.pokemontcg.io/swsh9/105.png","https://images.pokemontcg.io/swsh9/105_hires.png","Legal","Legal","Legal","Colorless, Colorless","2","Regal Stance","Once during your turn, you may discard your hand and draw 5 cards. If you use this Ability, your turn ends.","Ability","","","","Revenge Blast","Metal, Colorless, Colorless","3","120+","This attack does 30 more damage for each Prize card your opponent has taken.","","","","","","Fire","×2"
"swsh9-106","Flygon V","Pokémon","220","Dragon","",,"106","PLANETA Mochizuki","Rare Holo V",,"330","F","https://images.pokemontcg.io/swsh9/106.png","https://images.pokemontcg.io/swsh9/106_hires.png","Legal","Legal","Legal","Colorless, Colorless","2","","","","","","","Sand Spray","Grass, Fighting","2","70","","Draconic Impulse","Grass, Fighting, Fighting, Colorless","4","160+","If your opponent's Active Pokémon is a Pokémon VMAX, this attack does 160 more damage, and discard 3 Energy from this Pokémon.",,
"swsh9-107","Gible","Pokémon","70","Dragon","Gabite",,"107","sowsow","Common","Gible prefers to stay in narrow holes in the sides of caves heated by geothermal energy. This way, Gible can stay warm even during a blizzard.","443","F","https://images.pokemontcg.io/swsh9/107.png","https://images.pokemontcg.io/swsh9/107_hires.png","Legal","Legal","Legal","Colorless","1","","","","","","","Gnaw","Water, Fighting","2","30","","","","","","",,
"swsh9-108","Gabite","Pokémon","90","Dragon","Garchomp","Gible","108","hatachu","Uncommon","This Pokémon emits ultrasonic waves from a protrusion on either side of its head to probe pitch-dark caves.","444","F","https://images.pokemontcg.io/swsh9/108.png","https://images.pokemontcg.io/swsh9/108_hires.png","Legal","Legal","Legal","Colorless","1","","","","","","","Dragon Claw","Water, Fighting","2","70","","","","","","",,
"swsh9-109","Garchomp","Pokémon","160","Dragon","","Gabite","109","Nurikabe","Rare Holo","Garchomp makes its home in volcanic mountains. It flies through the sky as fast as a jet airplane, hunting down as much prey as it can.","445","F","https://images.pokemontcg.io/swsh9/109.png","https://images.pokemontcg.io/swsh9/109_hires.png","Legal","Legal","Legal","Colorless","1","Sonic Slip","When you play this Pokémon from your hand to evolve 1 of your Pokémon during your turn, you may prevent all damage from and effects of attacks from your opponent's Pokémon done to this Pokémon until the end of your opponent's next turn.","Ability","","","","Dragonblade","Water, Fighting","2","160","Discard the top 2 cards of your deck.","","","","","",,
"swsh9-110","Axew","Pokémon","60","Dragon","Fraxure",,"110","Saya Tsuruta","Common","These Pokémon nest in the ground and use their tusks to crush hard berries. Crushing berries is also how they test each other's strength.","610","F","https://images.pokemontcg.io/swsh9/110.png","https://images.pokemontcg.io/swsh9/110_hires.png","Legal","Legal","Legal","Colorless","1","","","","","","","Ultra Evolution","Colorless","1","","Flip a coin. If heads, search your deck for a Haxorus and put it onto this Axew to evolve it. Then, shuffle your deck.","","","","","",,
"swsh9-111","Fraxure","Pokémon","100","Dragon","Haxorus","Axew","111","Hataya","Uncommon","After battle, this Pokémon carefully sharpens its tusks on river rocks. It needs to take care of its tusks—if one breaks, it will never grow back.","611","F","https://images.pokemontcg.io/swsh9/111.png","https://images.pokemontcg.io/swsh9/111_hires.png","Legal","Legal","Legal","Colorless, Colorless","2","","","","","","","Sharp Fang","Colorless","1","30","","Dragon Claw","Fighting, Metal","2","60","",,
"swsh9-112","Haxorus","Pokémon","170","Dragon","","Fraxure","112","Uta","Rare","Its resilient tusks are its pride and joy. It licks up dirt to take in the minerals it needs to keep its tusks in top condition.","612","F","https://images.pokemontcg.io/swsh9/112.png","https://images.pokemontcg.io/swsh9/112_hires.png","Legal","Legal","Legal","Colorless, Colorless","2","","","","","","","Slash","Colorless","1","60","","Wild Axe","Fighting, Metal","2","160","This Pokémon also does 30 damage to itself.",,
"swsh9-113","Druddigon","Pokémon","120","Dragon","",,"113","Ryo Ueda","Rare","Druddigon are vicious and cunning. They take up residence in nests dug out by other Pokémon, treating the stolen nests as their own lairs.","621","E","https://images.pokemontcg.io/swsh9/113.png","https://images.pokemontcg.io/swsh9/113_hires.png","Legal",,"Legal","Colorless, Colorless","2","","","","","","","Revenge","Fire, Water","2","40+","If any of your Pokémon were Knocked Out by damage from an attack from your opponent's Pokémon during their last turn, this attack does 120 more damage.","Dragon Claw","Fire, Water, Colorless","3","120","",,
"swsh9-114","Dracovish V","Pokémon","220","Dragon","",,"114","Satoshi Shirai","Rare Holo V",,"882","E","https://images.pokemontcg.io/swsh9/114.png","https://images.pokemontcg.io/swsh9/114_hires.png","Legal",,"Legal","Colorless, Colorless, Colorless","3","","","","","","","Slosh 'n' Crash","Grass, Water","2","60+","Before doing damage, discard all Pokémon Tools from your opponent's Active Pokémon. If you discarded a Pokémon Tool in this way, this attack does 120 more damage.","Dragon Strike","Grass, Water, Water","3","210","During your next turn, this Pokémon can't use Dragon Strike.",,
"swsh9-115","Farfetch'd","Pokémon","80","Colorless","Sirfetch'd",,"115","Tomokazu Komiya","Common","The stalk this Pokémon carries in its wings serves as a sword to cut down opponents. In a dire situation, the stalk can also serve as food.","83","F","https://images.pokemontcg.io/swsh9/115.png","https://images.pokemontcg.io/swsh9/115_hires.png","Legal","Legal","Legal","Colorless","1","","","","","","","Leek Lash","Colorless, Colorless","2","20+","This attack does 10 more damage for each damage counter on your opponent's Active Pokémon.","","","","","","Lightning","×2"
"swsh9-116","Castform","Pokémon","70","Colorless","",,"116","kawayoo","Common","Its form changes depending on the weather. The rougher conditions get, the rougher Castform's disposition!","351","F","https://images.pokemontcg.io/swsh9/116.png","https://images.pokemontcg.io/swsh9/116_hires.png","Legal","Legal","Legal","Colorless","1","","","","","","","Double Draw","Colorless","1","","Draw 2 cards.","Hurricane","Colorless","1","30","Move a basic Energy from this Pokémon to 1 of your Benched Pokémon.","Fighting","×2"
"swsh9-117","Starly","Pokémon","60","Colorless","Staravia",,"117","Saya Tsuruta","Common","They flock around mountains and fields, chasing after bug Pokémon. Their singing is noisy and annoying.","396","F","https://images.pokemontcg.io/swsh9/117.png","https://images.pokemontcg.io/swsh9/117_hires.png","Legal","Legal","Legal","Colorless","1","","","","","","","Claw","Colorless","1","30","Flip a coin. If tails, this attack does nothing.","","","","","","Lightning","×2"
"swsh9-118","Staravia","Pokémon","90","Colorless","Staraptor","Starly","118","Kouki Saitou","Uncommon","It lives in forests and fields. Squabbles over territory occur when flocks collide.","397","F","https://images.pokemontcg.io/swsh9/118.png","https://images.pokemontcg.io/swsh9/118_hires.png","Legal","Legal","Legal","Colorless","1","","","","","","","Wing Attack","Colorless, Colorless","2","50","","","","","","","Lightning","×2"
"swsh9-119","Staraptor","Pokémon","150","Colorless","","Staravia","119","Narumi Sato","Rare","When Staravia evolve into Staraptor, they leave the flock to live alone. They have sturdy wings.","398","F","https://images.pokemontcg.io/swsh9/119.png","https://images.pokemontcg.io/swsh9/119_hires.png","Legal","Legal","Legal","Colorless","1","","","","","","","Strong Breeze","Colorless, Colorless, Colorless","3","","Your opponent shuffles their Active Pokémon and all attached cards into their deck.","Spinning Bird","Colorless, Colorless, Colorless, Colorless","4","180","Discard 2 Energy from this Pokémon.","Lightning","×2"
"swsh9-120","Bidoof","Pokémon","70","Colorless","Bibarel",,"120","Oswaldo KATO","Common","It constantly gnaws on logs and rocks to whittle down its front teeth. It nests alongside water.","399","F","https://images.pokemontcg.io/swsh9/120.png","https://images.pokemontcg.io/swsh9/120_hires.png","Legal","Legal","Legal","Colorless, Colorless","2","","","","","","","Rollout","Colorless, Colorless","2","30","","","","","","","Fighting","×2"
"swsh9-121","Bibarel","Pokémon","120","Colorless","","Bidoof","121","OKACHEKE","Rare Holo","It makes its nest by damming streams with bark and mud. It is known as an industrious worker.","400","F","https://images.pokemontcg.io/swsh9/121.png","https://images.pokemontcg.io/swsh9/121_hires.png","Legal","Legal","Legal","Colorless, Colorless","2","Industrious Incisors","Once during your turn, you may draw cards until you have 5 cards in your hand.","Ability","","","","Tail Smash","Colorless, Colorless, Colorless","3","100","Flip a coin. If tails, this attack does nothing.","","","","","","Fighting","×2"
"swsh9-122","Arceus V","Pokémon","220","Colorless","",,"122","N-DESIGN Inc.","Rare Holo V",,"493","F","https://images.pokemontcg.io/swsh9/122.png","https://images.pokemontcg.io/swsh9/122_hires.png","Legal","Legal","Legal","Colorless, Colorless","2","","","","","","","Trinity Charge","Colorless, Colorless","2","","Search your deck for up to 3 basic Energy cards and attach them to your Pokémon V in any way you like. Then, shuffle your deck.","Power Edge","Colorless, Colorless, Colorless","3","130","","Fighting","×2"
"swsh9-123","Arceus VSTAR","Pokémon","280","Colorless","","Arceus V","123","5ban Graphics","Rare Holo VSTAR",,"493","F","https://images.pokemontcg.io/swsh9/123.png","https://images.pokemontcg.io/swsh9/123_hires.png","Legal","Legal","Legal","Colorless, Colorless","2","Starbirth","During your turn, you may search your deck for up to 2 cards and put them into your hand. Then, shuffle your deck. (You can't use more than 1 VSTAR Power in a game.)","Ability","","","","Trinity Nova","Colorless, Colorless, Colorless","3","200","Search your deck for up to 3 basic Energy cards and attach them to your Pokémon V in any way you like. Then, shuffle your deck.","","","","","","Fighting","×2"
"swsh9-124","Minccino","Pokémon","60","Colorless","Cinccino",,"124","Mina Nakai","Common","The way it brushes away grime with its tail can be helpful when cleaning. But its focus on spotlessness can make cleaning more of a hassle.","572","F","https://images.pokemontcg.io/swsh9/124.png","https://images.pokemontcg.io/swsh9/124_hires.png","Legal","Legal","Legal","Colorless","1","","","","","","","Call for Family","Colorless","1","","Search your deck for up to 2 Basic Pokémon and put them onto your Bench. Then, shuffle your deck.","Pound","Colorless","1","10","","Fighting","×2"
"swsh9-125","Cinccino","Pokémon","90","Colorless","","Minccino","125","Atsuko Nishida","Uncommon","Its body secretes oil that this Pokémon spreads over its nest as a coating to protect it from dust. Cinccino won't tolerate even a speck of the stuff.","573","F","https://images.pokemontcg.io/swsh9/125.png","https://images.pokemontcg.io/swsh9/125_hires.png","Legal","Legal","Legal","Colorless","1","","","","","","","Slap","Colorless","1","40","","Triple Axel","Colorless, Colorless","2","50×","Flip 3 coins. This attack does 50 damage for each heads.","Fighting","×2"
"swsh9-126","Tornadus","Pokémon","120","Colorless","",,"126","Shigenori Negishi","Rare","Tornadus expels massive energy from its tail, causing severe storms. Its power is great enough to blow houses away.","641","F","https://images.pokemontcg.io/swsh9/126.png","https://images.pokemontcg.io/swsh9/126_hires.png","Legal","Legal","Legal","Colorless","1","Sudden Cyclone","When you play this Pokémon from your hand onto your Bench, you may have your opponent switch their Active Pokémon with 1 of their Benched Pokémon.","Ability","","","","Blasting Wind","Colorless, Colorless, Colorless","3","100","","","","","","","Lightning","×2"
"swsh9-127","Hawlucha","Pokémon","70","Colorless","",,"127","Miki Tanaka","Common","It drives its opponents to exhaustion with its agile maneuvers, then ends the fight with a flashy finishing move.","701","F","https://images.pokemontcg.io/swsh9/127.png","https://images.pokemontcg.io/swsh9/127_hires.png","Legal","Legal","Legal","Colorless","1","","","","","","","Showboating Pose","Colorless","1","","Attach up to 2 basic Energy cards from your discard pile to 1 of your Benched Pokémon.","Cross-Cut","Colorless","1","30+","If your opponent's Active Pokémon is an Evolution Pokémon, this attack does 30 more damage.","Lightning","×2"
"swsh9-128","Drampa V","Pokémon","210","Colorless","",,"128","aky CG Works","Rare Holo V",,"780","F","https://images.pokemontcg.io/swsh9/128.png","https://images.pokemontcg.io/swsh9/128_hires.png","Legal","Legal","Legal","Colorless, Colorless","2","","","","","","","Spike Draw","Colorless","1","20","Draw 2 cards.","Dragon Pulse","Colorless, Colorless, Colorless","3","160","Discard the top 2 cards of your deck.","Fighting","×2"
"swsh9-129","Acerola's Premonition","Trainer",,"","",,"129","Shiburingaru","Uncommon",,"","E","https://images.pokemontcg.io/swsh9/129.png","https://images.pokemontcg.io/swsh9/129_hires.png","Legal",,"Legal","",,"","","","","","","","","","","","","","","","",,
"swsh9-130","Barry","Trainer",,"","",,"130","Ken Sugimori","Uncommon",,"","F","https://images.pokemontcg.io/swsh9/130.png","https://images.pokemontcg.io/swsh9/130_hires.png","Legal","Legal","Legal","",,"","","","","","","","","","","","","","","","",,
"swsh9-131","Blunder Policy","Trainer",,"","",,"131","Ayaka Yoshida","Uncommon",,"","E","https://images.pokemontcg.io/swsh9/131.png","https://images.pokemontcg.io/swsh9/131_hires.png","Legal",,"Legal","",,"","","","","","","","","","","","","","","","",,
"swsh9-132","Boss's Orders","Trainer",,"","",,"132","GIDORA","Rare Holo",,"","F","https://images.pokemontcg.io/swsh9/132.png","https://images.pokemontcg.io/swsh9/132_hires.png","Legal","Legal","Legal","",,"","","","","","","","","","","","","","","","",,
"swsh9-133","Café Master","Trainer",,"","",,"133","Hasegawa Saki","Uncommon",,"","E","https://images.pokemontcg.io/swsh9/133.png","https://images.pokemontcg.io/swsh9/133_hires.png","Legal",,"Legal","",,"","","","","","","","","","","","","","","","",,
"swsh9-134","Cheren's Care","Trainer",,"","",,"134","Yusuke Ohmura","Uncommon",,"","F","https://images.pokemontcg.io/swsh9/134.png","https://images.pokemontcg.io/swsh9/134_hires.png","Legal","Legal","Legal","",,"","","","","","","","","","","","","","","","",,
"swsh9-135","Choice Belt","Trainer",,"","",,"135","Studio Bora Inc.","Uncommon",,"","F","https://images.pokemontcg.io/swsh9/135.png","https://images.pokemontcg.io/swsh9/135_hires.png","Legal","Legal","Legal","",,"","","","","","","","","","","","","","","","",,
"swsh9-136","Cleansing Gloves","Trainer",,"","",,"136","Toyste Beach","Uncommon",,"","E","https://images.pokemontcg.io/swsh9/136.png","https://images.pokemontcg.io/swsh9/136_hires.png","Legal",,"Legal","",,"","","","","","","","","","","","","","","","",,
"swsh9-137","Collapsed Stadium","Trainer",,"","",,"137","Oswaldo KATO","Uncommon",,"","F","https://images.pokemontcg.io/swsh9/137.png","https://images.pokemontcg.io/swsh9/137_hires.png","Legal","Legal","Legal","",,"","","","","","","","","","","","","","","","",,
"swsh9-138","Cynthia's Ambition","Trainer",,"","",,"138","Megumi Mizutani","Uncommon",,"","F","https://images.pokemontcg.io/swsh9/138.png","https://images.pokemontcg.io/swsh9/138_hires.png","Legal","Legal","Legal","",,"","","","","","","","","","","","","","","","",,
"swsh9-139","Fresh Water Set","Trainer",,"","",,"139","AYUMI ODASHIMA","Uncommon",,"","F","https://images.pokemontcg.io/swsh9/139.png","https://images.pokemontcg.io/swsh9/139_hires.png","Legal","Legal","Legal","",,"","","","","","","","","","","","","","","","",,
"swsh9-140","Friends in Galar","Trainer",,"","",,"140","Yuu Nishida","Uncommon",,"","E","https://images.pokemontcg.io/swsh9/140.png","https://images.pokemontcg.io/swsh9/140_hires.png","Legal",,"Legal","",,"","","","","","","","","","","","","","","","",,
"swsh9-141","Gloria","Trainer",,"","",,"141","Ken Sugimori","Uncommon",,"","E","https://images.pokemontcg.io/swsh9/141.png","https://images.pokemontcg.io/swsh9/141_hires.png","Legal",,"Legal","",,"","","","","","","","","","","","","","","","",,
"swsh9-142","Hunting Gloves","Trainer",,"","",,"142","Toyste Beach","Uncommon",,"","E","https://images.pokemontcg.io/swsh9/142.png","https://images.pokemontcg.io/swsh9/142_hires.png","Legal",,"Legal","",,"","","","","","","","","","","","","","","","",,
"swsh9-143","Kindler","Trainer",,"","",,"143","Hitoshi Ariga","Uncommon",,"","F","https://images.pokemontcg.io/swsh9/143.png","https://images.pokemontcg.io/swsh9/143_hires.png","Legal","Legal","Legal","",,"","","","","","","","","","","","","","","","",,
"swsh9-144","Magma Basin","Trainer",,"","",,"144","ORBITALLINK Inc.","Uncommon",,"","F","https://images.pokemontcg.io/swsh9/144.png","https://images.pokemontcg.io/swsh9/144_hires.png","Legal","Legal","Legal","",,"","","","","","","","","","","","","","","","",,
