"id","name","supertype","hp","types","evolvesTo","evolvesFrom","number","artist","rarity","flavorText","nationalPokedexNumbers","regulationMark","imageSmall","imageLarge","legalitiesUnlimited","legalitiesStandard","legalitiesExpanded","retreatCost","convertedRetreatCost","Ability1Name","Ability1Text","Ability1Type","Ability2Name","Ability2Text","Ability2Type","Attack1Name","Attack1Cost","Attack1ConvertedCost","Attack1Damage","Attack1Text","Attack2Name","Attack2Cost","Attack2ConvertedCost","Attack2Damage","Attack2Text","Weakness1Type","Weakness1Value"
"swsh3-93","Hippopotas","Pokemon","100","Fighting","Hippowdon",,"93","Shin Nagasawa","Common","It moves through the sands with its mouth open, swallowing sand along with its prey. It gets rid of the sand by spouting it from its nose.","449","D","https://images.pokemontcg.io/swsh3/93.png","https://images.pokemontcg.io/swsh3/93_hires.png","Legal",,"Legal","Colorless, Colorless, Colorless, Colorless","4","","","","","","","Tackle","Colorless","1","10","","Double Stomp","Fighting, Fighting, Fighting, Colorless","4","70+","Flip 2 coins. This attack does 30 more damage for each heads.","Grass","x2"
"swsh3-94","Hippowdon","Pokemon","150","Fighting","","Hippopotas","94","KEIICHIRO ITO","Rare","Stones can get stuck in the ports on their bodies. Dwebble help dislodge such stones, so Hippowdon look after these Pokemon.","450","D","https://images.pokemontcg.io/swsh3/94.png","https://images.pokemontcg.io/swsh3/94_hires.png","Legal",,"Legal","Colorless, Colorless, Colorless, Colorless","4","","","","","","","Triple Smash","Fighting, Fighting, Colorless","3","80x","Flip 3 coins. This attack does 80 damage for each heads.","Land Crush","Fighting, Fighting, Fighting, Colorless","4","150","","Grass","x2"
"swsh3-95","Rhyperior V","Pokemon","230","Fighting","",,"95","Eske Yoshinob","Rare Holo V",,"464","D","https://images.pokemontcg.io/swsh3/95.png","https://images.pokemontcg.io/swsh3/95_hires.png","Legal",,"Legal","Colorless, Colorless, Colorless, Colorless","4","","","","","","","Drill Run","Fighting, Colorless, Colorless","3","80","Discard an Energy from your opponent's Active Pokemon.","Heavy Rock Artillery","Fighting, Colorless, Colorless, Colorless","4","210","During your next turn, this Pokemon can't use Heavy Rock Artillery.","Grass","x2"
"swsh3-96","Diggersby","Pokemon","130","Fighting","","Bunnelby","96","0313","Rare","With power equal to an excavator, it can dig through dense bedrock. It's a huge help during tunnel construction.","660","D","https://images.pokemontcg.io/swsh3/96.png","https://images.pokemontcg.io/swsh3/96_hires.png","Legal",,"Legal","Colorless, Colorless, Colorless","3","","","","","","","Hammer In","Fighting, Colorless, Colorless","3","90","","Land Crush","Fighting, Fighting, Colorless, Colorless","4","140","","Grass","x2"
"swsh3-97","Passimian","Pokemon","110","Fighting","",,"97","SATOSHI NAKAI","Common","Displaying amazing teamwork, they follow the orders of their boss as they all help out in the search for their favorite berries.","766","D","https://images.pokemontcg.io/swsh3/97.png","https://images.pokemontcg.io/swsh3/97_hires.png","Legal",,"Legal","Colorless","1","","","","","","","Call for Family","Colorless","1","","Search your deck for up to 2 Basic Pokemon and put them onto your Bench. Then, shuffle your deck.","Rock Hurl","Fighting, Colorless, Colorless","3","70","This attack's damage isn't affected by Resistance.","Psychic","x2"
"swsh3-98","Galarian Sirfetch'd","Pokemon","130","Fighting","","Galarian Farfetch'd","98","Ryota Murayama","Rare","Only Farfetch'd that have survived many battles can attain this evolution. When this Pokemon's leek withers, it will retire from combat.","865","D","https://images.pokemontcg.io/swsh3/98.png","https://images.pokemontcg.io/swsh3/98_hires.png","Legal",,"Legal","Colorless, Colorless","2","","","","","","","Pierce","Fighting","1","40","","Meteor Assault","Fighting, Colorless, Colorless","3","180","This Pokemon can't use Meteor Assault again until it leaves the Active Spot.","Psychic","x2"
"swsh3-99","Galarian Slowbro V","Pokemon","210","Darkness","",,"99","5ban Graphics","Rare Holo V",,"80","D","https://images.pokemontcg.io/swsh3/99.png","https://images.pokemontcg.io/swsh3/99_hires.png","Legal",,"Legal","Colorless, Colorless, Colorless","3","Rapid-Fire Poison","Once during your turn, if this Pokemon is in the Active Spot, you may make your opponent's Active Pokemon Poisoned.","Ability","","","","Tripping Shot","Darkness, Darkness, Colorless","3","130","During your opponent's next turn, the Defending Pokemon can't retreat.","","","","","","Fighting","x2"
"swsh3-100","Grimer","Pokemon","80","Darkness","Muk",,"100","Ryota Murayama","Common","The wastewater coming from factories is clean these days, so Grimer have nothing to eat. They're said to be on the verge of extinction.","88","D","https://images.pokemontcg.io/swsh3/100.png","https://images.pokemontcg.io/swsh3/100_hires.png","Legal",,"Legal","Colorless, Colorless, Colorless","3","","","","","","","Stomp Off","Darkness","1","","Discard the top card of your opponent's deck.","Sludge Whirlpool","Darkness, Colorless, Colorless","3","50","","Fighting","x2"
"swsh3-101","Muk","Pokemon","140","Darkness","","Grimer","101","Eri Yamaki","Rare","Because they scatter germs everywhere, they've long been targeted for extermination, leading to a steep decline in their population.","89","D","https://images.pokemontcg.io/swsh3/101.png","https://images.pokemontcg.io/swsh3/101_hires.png","Legal",,"Legal","Colorless, Colorless, Colorless, Colorless","4","","","","","","","Triple Poison","Darkness","1","","Your opponent's Active Pokemon is now Poisoned. During Pokemon Checkup, put 3 damage counters on that Pokemon instead of 1.","Sludge Whirlpool","Darkness, Colorless, Colorless, Colorless","4","120","","Fighting","x2"
"swsh3-102","Spinarak","Pokemon","60","Darkness","Ariados",,"102","Kyoko Umemoto","Common","Although the poison from its fangs isn't that strong, it's potent enough to weaken prey that gets caught in its web.","167","D","https://images.pokemontcg.io/swsh3/102.png","https://images.pokemontcg.io/swsh3/102_hires.png","Legal",,"Legal","Colorless","1","","","","","","","Hang Down","Darkness","1","10","","Sting","Darkness, Colorless","2","20","","Fighting","x2"
"swsh3-103","Ariados","Pokemon","110","Darkness","","Spinarak","103","Shin Nagasawa","Uncommon","It spews threads from its mouth to catch its prey. When night falls, it leaves its web to go hunt aggressively.","168","D","https://images.pokemontcg.io/swsh3/103.png","https://images.pokemontcg.io/swsh3/103_hires.png","Legal",,"Legal","Colorless, Colorless","2","Spider Net","When you play this Pokemon from your hand to evolve 1 of your Pokemon during your turn, you may switch 1 of your opponent's Benched Evolution Pokemon with their Active Pokemon.","Ability","","","","Poison Sting","Darkness, Colorless","2","30","Your opponent's Active Pokemon is now Poisoned.","","","","","","Fighting","x2"
"swsh3-104","Crobat V","Pokemon","180","Darkness","",,"104","PLANETA Mochizuki","Rare Holo V",,"169","D","https://images.pokemontcg.io/swsh3/104.png","https://images.pokemontcg.io/swsh3/104_hires.png","Legal",,"Legal","Colorless","1","Dark Asset","When you play this Pokemon from your hand onto your Bench during your turn, you may draw cards until you have 6 cards in your hand. You can't use more than 1 Dark Asset Ability each turn.","Ability","","","","Venomous Fang","Darkness, Colorless","2","70","Your opponent's Active Pokemon is now Poisoned.","","","","","","Fighting","x2"
"swsh3-105","Darkrai","Pokemon","120","Darkness","",,"105","nagimiso","Rare Holo","It can lull people to sleep and make them dream. It is active during nights of the new moon.","491","D","https://images.pokemontcg.io/swsh3/105.png","https://images.pokemontcg.io/swsh3/105_hires.png","Legal",,"Legal","Colorless, Colorless","2","Darkness Guard","If this Pokemon has any Darkness Energy attached, it takes 20 less damage from attacks (after applying Weakness and Resistance).","Ability","","","","Vortex of Darkness","Colorless, Colorless, Colorless","3","60+","This attack does 20 more damage for each Darkness Energy attached to this Pokemon.","","","","","","Grass","x2"
"swsh3-106","Purrloin","Pokemon","70","Darkness","Liepard",,"106","sowsow","Common","It steals things from people just to amuse itself with their frustration. A rivalry exists between this Pokemon and Nickit.","509","D","https://images.pokemontcg.io/swsh3/106.png","https://images.pokemontcg.io/swsh3/106_hires.png","Legal",,"Legal","Colorless","1","","","","","","","Dig Claws","Darkness","1","10","","Fake Out","Colorless, Colorless","2","20","Flip a coin. If heads, your opponent's Active Pokemon is now Paralyzed.","Grass","x2"
"swsh3-107","Liepard","Pokemon","100","Darkness","","Purrloin","107","Hasuno","Rare","Don't be fooled by its gorgeous fur and elegant figure. This is a moody and vicious Pokemon.","510","D","https://images.pokemontcg.io/swsh3/107.png","https://images.pokemontcg.io/swsh3/107_hires.png","Legal",,"Legal","Colorless","1","Limber","This Pokemon can't be Paralyzed.","Ability","","","","Slashing Claw","Darkness, Colorless, Colorless","3","90","","","","","","","Grass","x2"
"swsh3-108","Deino","Pokemon","60","Darkness","Zweilous",,"108","Masakazu Fukuda","Common","When it encounters something, its first urge is usually to bite it. If it likes what it tastes, it will commit the associated scent to memory.","633","D","https://images.pokemontcg.io/swsh3/108.png","https://images.pokemontcg.io/swsh3/108_hires.png","Legal",,"Legal","Colorless","1","","","","","","","Ram","Colorless","1","10","","","","","","","Grass","x2"
"swsh3-109","Zweilous","Pokemon","100","Darkness","Hydreigon","Deino","109","tetsuya koizumi","Uncommon","While hunting for prey, Zweilous wanders its territory, its two heads often bickering over which way to go.","634","D","https://images.pokemontcg.io/swsh3/109.png","https://images.pokemontcg.io/swsh3/109_hires.png","Legal",,"Legal","Colorless, Colorless","2","","","","","","","Corkscrew Punch","Darkness, Colorless","2","30","","Darkness Fang","Darkness, Darkness, Colorless","3","70","","Grass","x2"
"swsh3-110","Hydreigon","Pokemon","160","Darkness","","Zweilous","110","kawayoo","Rare","There are a slew of stories about villages that were destroyed by Hydreigon. It bites anything that moves.","635","D","https://images.pokemontcg.io/swsh3/110.png","https://images.pokemontcg.io/swsh3/110_hires.png","Legal",,"Legal","Colorless, Colorless, Colorless","3","Dark Squall","As often as you like during your turn, you may attach a Darkness Energy card from your hand to 1 of your Pokemon.","Ability","","","","Pitch-Black Fangs","Darkness, Darkness, Colorless","3","130","","","","","","","Grass","x2"
"swsh3-111","Hoopa","Pokemon","120","Darkness","",,"111","so-taro","Rare Holo","It gathers things it likes and passes them through its loop to teleport them to a secret place.","720","D","https://images.pokemontcg.io/swsh3/111.png","https://images.pokemontcg.io/swsh3/111_hires.png","Legal",,"Legal","Colorless, Colorless","2","","","","","","","Assault Gate","Darkness","1","90","If this Pokemon didn't move from the Bench to the Active Spot this turn, this attack does nothing. This attack's damage isn't affected by Weakness.","","","","","","Grass","x2"
"swsh3-112","Nickit","Pokemon","70","Darkness","Thievul",,"112","Misa Tsutsui","Common","Aided by the soft pads on its feet, it silently raids the food stores of other Pokemon. It survives off its ill-gotten gains.","827","D","https://images.pokemontcg.io/swsh3/112.png","https://images.pokemontcg.io/swsh3/112_hires.png","Legal",,"Legal","Colorless","1","","","","","","","Tail Whip","Darkness","1","","Flip a coin. If heads, during your opponent's next turn, the Defending Pokemon can't attack.","","","","","","Grass","x2"
"swsh3-113","Thievul","Pokemon","100","Darkness","","Nickit","113","Akira Komayama","Rare","It secretly marks potential targets with a scent. By following the scent, it stalks its targets and steals from them when they least expect it.","828","D","https://images.pokemontcg.io/swsh3/113.png","https://images.pokemontcg.io/swsh3/113_hires.png","Legal",,"Legal","Colorless","1","","","","","","","Nasty Plot","Darkness","1","","Search your deck for up to 2 cards and put them into your hand. Then, shuffle your deck.","Sharp Fang","Darkness, Darkness","2","70","","Grass","x2"
"swsh3-114","Grimmsnarl V","Pokemon","220","Darkness","",,"114","5ban Graphics","Rare Holo V",,"861","D","https://images.pokemontcg.io/swsh3/114.png","https://images.pokemontcg.io/swsh3/114_hires.png","Legal",,"Legal","Colorless, Colorless","2","","","","","","","Bite","Darkness","1","40","","Spiky Knuckle","Darkness, Darkness, Darkness","3","200","Put 2 Darkness Energy attached to this Pokemon into your hand.","Grass","x2"
"swsh3-115","Grimmsnarl VMAX","Pokemon","330","Darkness","","Grimmsnarl V","115","5ban Graphics","Rare Holo VMAX",,"861","D","https://images.pokemontcg.io/swsh3/115.png","https://images.pokemontcg.io/swsh3/115_hires.png","Legal",,"Legal","Colorless, Colorless, Colorless","3","","","","","","","G-Max Drill","Darkness, Darkness, Darkness","3","170+","This attack does 50 more damage for each extra Darkness Energy attached to this Pokemon (in addition to this attack's cost). You can't add more than 100 damage in this way.","","","","","","Grass","x2"
"swsh3-116","Eternatus V","Pokemon","220","Darkness","",,"116","5ban Graphics","Rare Holo V",,"890","D","https://images.pokemontcg.io/swsh3/116.png","https://images.pokemontcg.io/swsh3/116_hires.png","Legal",,"Legal","Colorless, Colorless","2","","","","","","","Power Accelerator","Colorless","1","30","You may attach a Darkness Energy card from your hand to 1 of your Benched Pokemon.","Dynamax Cannon","Darkness, Colorless, Colorless, Colorless","4","120+","If your opponent's Active Pokemon is a Pokemon VMAX, this attack does 120 more damage.","Fighting","x2"
"swsh3-117","Eternatus VMAX","Pokemon","340","Darkness","","Eternatus V","117","5ban Graphics","Rare Holo VMAX",,"890","D","https://images.pokemontcg.io/swsh3/117.png","https://images.pokemontcg.io/swsh3/117_hires.png","Legal",,"Legal","Colorless, Colorless, Colorless","3","Eternal Zone","If all of your Pokemon in play are Darkness type, you can have up to 8 Pokemon on your Bench, and you can't put non-Darkness Pokemon into play. (If this Ability stops working, discard Pokemon from your Bench until you have 5.)","Ability","","","","Dread End","Darkness, Colorless","2","30x","This attack does 30 damage for each of your Darkness Pokemon in play.","","","","","","Fighting","x2"
"swsh3-118","Scizor V","Pokemon","210","Metal","",,"118","Shin Nagasawa","Rare Holo V",,"212","D","https://images.pokemontcg.io/swsh3/118.png","https://images.pokemontcg.io/swsh3/118_hires.png","Legal",,"Legal","Colorless, Colorless","2","","","","","","","Hack Off","Metal","1","30","Discard a Pokemon Tool and a Special Energy from your opponent's Active Pokemon.","Slashing Claw","Metal, Metal, Colorless","3","140","","Fire","x2"
"swsh3-119","Scizor VMAX","Pokemon","320","Metal","","Scizor V","119","5ban Graphics","Rare Holo VMAX",,"212","D","https://images.pokemontcg.io/swsh3/119.png","https://images.pokemontcg.io/swsh3/119_hires.png","Legal",,"Legal","Colorless, Colorless","2","","","","","","","Hard Scissors","Metal, Colorless","2","90","During your opponent's next turn, this Pokemon takes 30 less damage from attacks (after applying Weakness and Resistance).","Max Steelspike","Metal, Metal, Colorless","3","190","","Fire","x2"
"swsh3-120","Skarmory","Pokemon","120","Metal","",,"120","NC Empire","Common","Its body is draped in steel armor. It looks heavy, but it can fly at speeds of up to 185 miles an hour!","227","D","https://images.pokemontcg.io/swsh3/120.png","https://images.pokemontcg.io/swsh3/120_hires.png","Legal",,"Legal","Colorless","1","","","","","","","Metal Arms","Metal","1","10+","If this Pokemon has a Pokemon Tool attached, this attack does 40 more damage.","Cutting Wind","Metal, Colorless, Colorless","3","80","","Lightning","x2"
"swsh3-121","Aron","Pokemon","70","Metal","Lairon",,"121","Naoyo Kimura","Common","When it evolves, it sheds the steel carapace that covered its whole body and develops a new one.","304","D","https://images.pokemontcg.io/swsh3/121.png","https://images.pokemontcg.io/swsh3/121_hires.png","Legal",,"Legal","Colorless, Colorless","2","","","","","","","Ram","Colorless","1","10","","Headbutt","Metal, Colorless","2","20","","Fire","x2"
"swsh3-122","Lairon","Pokemon","100","Metal","Aggron","Aron","122","Mizue","Uncommon","It habitually shows off its strength with the sparks it creates by ramming its steel body into boulders.","305","D","https://images.pokemontcg.io/swsh3/122.png","https://images.pokemontcg.io/swsh3/122_hires.png","Legal",,"Legal","Colorless, Colorless, Colorless","3","","","","","","","Knock Away","Colorless, Colorless","2","30+","Flip a coin. If heads, this attack does 30 more damage.","Lunge Out","Metal, Colorless, Colorless","3","50","","Fire","x2"
"swsh3-123","Aggron","Pokemon","160","Metal","","Lairon","123","Hasuno","Rare Holo","While seeking iron for food, it digs tunnels by breaking through bedrock with its steel horns.","306","D","https://images.pokemontcg.io/swsh3/123.png","https://images.pokemontcg.io/swsh3/123_hires.png","Legal",,"Legal","Colorless, Colorless, Colorless","3","Sturdy","If this Pokemon has full HP and would be Knocked Out by damage from an attack, it is not Knocked Out, and its remaining HP becomes 10.","Ability","","","","Gigaton Stomp","Metal, Colorless, Colorless, Colorless","4","160","","","","","","","Fire","x2"
"swsh3-124","Escavalier","Pokemon","120","Metal","","Karrablast","124","Anesaki Dynamic","Rare","They use shells they've stolen from Shelmet to arm and protect themselves. They're very popular Pokemon in the Galar region.","589","D","https://images.pokemontcg.io/swsh3/124.png","https://images.pokemontcg.io/swsh3/124_hires.png","Legal",,"Legal","Colorless, Colorless","2","","","","","","","Fury Cutter","Metal","1","10+","Flip 3 coins. If 1 of them is heads, this attack does 20 more damage. If 2 of them are heads, this attack does 70 more damage. If all of them are heads, this attack does 140 more damage.","Seashell Attack","Metal, Colorless","2","60","","Fire","x2"
"swsh3-125","Klink","Pokemon","60","Metal","Klang",,"125","Kouki Saitou","Common","The two minigears that compose this Pokemon are closer than twins. They mesh well only with each other.","599","D","https://images.pokemontcg.io/swsh3/125.png","https://images.pokemontcg.io/swsh3/125_hires.png","Legal",,"Legal","Colorless, Colorless","2","","","","","","","Call for Backup","Metal","1","","Search your deck for a Metal Pokemon, reveal it, and put it into your hand. Then, shuffle your deck.","","","","","","Fire","x2"
"swsh3-126","Klang","Pokemon","90","Metal","Klinklang","Klink","126","NC Empire","Uncommon","When Klang goes all out, the minigear links up perfectly with the outer part of the big gear, and this Pokemon's rotation speed increases sharply.","600","D","https://images.pokemontcg.io/swsh3/126.png","https://images.pokemontcg.io/swsh3/126_hires.png","Legal",,"Legal","Colorless, Colorless, Colorless","3","","","","","","","Call for Backup","Metal","1","","Search your deck for a Metal Pokemon, reveal it, and put it into your hand. Then, shuffle your deck.","Spinning Attack","Metal, Colorless, Colorless","3","60","","Fire","x2"
"swsh3-127","Klinklang","Pokemon","150","Metal","","Klang","127","Naoki Saito","Rare","From its spikes, it launches powerful blasts of electricity. Its red core contains an enormous amount of energy.","601","D","https://images.pokemontcg.io/swsh3/127.png","https://images.pokemontcg.io/swsh3/127_hires.png","Legal",,"Legal","Colorless, Colorless, Colorless","3","","","","","","","Beam","Colorless, Colorless","2","60","","Clockwork","Metal, Colorless, Colorless","3","200","If you don't have Klink and Klang on your Bench, this attack does nothing.","Fire","x2"
"swsh3-128","Galarian Stunfisk V","Pokemon","200","Metal","",,"128","PLANETA Tsuji","Rare Holo V",,"618","D","https://images.pokemontcg.io/swsh3/128.png","https://images.pokemontcg.io/swsh3/128_hires.png","Legal",,"Legal","Colorless, Colorless, Colorless, Colorless","4","Metal Skin","This Pokemon gets +20 HP for each Metal Energy attached to it.","Ability","","","","Trapping Bite","Colorless, Colorless","2","60","During your opponent's next turn, if this Pokemon is damaged by an attack (even if it is Knocked Out), put 12 damage counters on the Attacking Pokemon.","","","","","","Fire","x2"
"swsh3-129","Meltan","Pokemon","70","Metal","Melmetal",,"129","HYOGONOSUKE","Common","It dissolves and eats metal. Circulating liquid metal within its body is how it generates energy.","808","D","https://images.pokemontcg.io/swsh3/129.png","https://images.pokemontcg.io/swsh3/129_hires.png","Legal",,"Legal","Colorless","1","","","","","","","Headbutt","Colorless","1","10","","Beam","Metal, Colorless","2","20","","Fire","x2"
"swsh3-130","Melmetal","Pokemon","150","Metal","","Meltan","130","NC Empire","Rare","At the end of its life-span, Melmetal will rust and fall apart. The small shards left behind will eventually be reborn as Meltan.","809","D","https://images.pokemontcg.io/swsh3/130.png","https://images.pokemontcg.io/swsh3/130_hires.png","Legal",,"Legal","Colorless, Colorless, Colorless, Colorless","4","","","","","","","Energy Link","Metal","1","30","Attach an Energy card from your discard pile to this Pokemon.","Heavy Impact","Metal, Colorless, Colorless, Colorless","4","130","","Fire","x2"
"swsh3-131","Cufant","Pokemon","100","Metal","Copperajah",,"131","Akira Komayama","Common","It digs up the ground with its trunk. It's also very strong, being able to carry loads of over five tons without any problem at all.","878","D","https://images.pokemontcg.io/swsh3/131.png","https://images.pokemontcg.io/swsh3/131_hires.png","Legal",,"Legal","Colorless, Colorless, Colorless","3","","","","","","","Strength","Metal, Colorless, Colorless","3","60","","","","","","","Fire","x2"
"swsh3-132","Copperajah","Pokemon","190","Metal","","Cufant","132","Kouki Saitou","Rare Holo","They came over from another region long ago and worked together with humans. Their green skin is resistant to water.","879","D","https://images.pokemontcg.io/swsh3/132.png","https://images.pokemontcg.io/swsh3/132_hires.png","Legal",,"Legal","Colorless, Colorless, Colorless, Colorless","4","Antibacterial Skin","This Pokemon can't be affected by any Special Conditions.","Ability","","","","Vengeful Stomp","Metal, Metal, Colorless, Colorless","4","120+","If your Benched Pokemon have any damage counters on them, this attack does 120 more damage.","","","","","","Fire","x2"
"swsh3-133","Kangaskhan","Pokemon","130","Colorless","",,"133","kawayoo","Rare Holo","You shouldn't get close to the child when it's playing outside its mother's pouch. Its mother is always nearby watching over it.","115","D","https://images.pokemontcg.io/swsh3/133.png","https://images.pokemontcg.io/swsh3/133_hires.png","Legal",,"Legal","Colorless, Colorless","2","","","","","","","Rally Back","Colorless, Colorless","2","30+","If any of your Pokemon were Knocked Out by damage from an attack from your opponent's Pokemon during their last turn, this attack does 90 more damage.","Hammer In","Colorless, Colorless, Colorless","3","100","","Fighting","x2"
"swsh3-134","Tauros","Pokemon","110","Colorless","",,"134","Anesaki Dynamic","Common","They live in groups. The one with the longest, thickest, and most-scarred horns is the boss of the herd.","128","D","https://images.pokemontcg.io/swsh3/134.png","https://images.pokemontcg.io/swsh3/134_hires.png","Legal",,"Legal","Colorless, Colorless","2","","","","","","","Horn Attack","Colorless, Colorless","2","60","","","","","","","Fighting","x2"
"swsh3-135","Sentret","Pokemon","60","Colorless","Furret",,"135","Mina Nakai","Common","It stands on its tail so it can see a long way. If it spots an enemy, it cries loudly to warn its kind.","161","D","https://images.pokemontcg.io/swsh3/135.png","https://images.pokemontcg.io/swsh3/135_hires.png","Legal",,"Legal","Colorless","1","","","","","","","Call for Family","Colorless","1","","Search your deck for a Basic Pokemon and put it onto your Bench. Then, shuffle your deck.","","","","","","Fighting","x2"
"swsh3-136","Furret","Pokemon","110","Colorless","","Sentret","136","tetsuya koizumi","Uncommon","It makes a nest to suit its long and skinny body. The nest is impossible for other Pokemon to enter.","162","D","https://images.pokemontcg.io/swsh3/136.png","https://images.pokemontcg.io/swsh3/136_hires.png","Legal",,"Legal","Colorless","1","","","","","","","Feelin' Fine","Colorless","1","","Draw 3 cards.","Tail Smash","Colorless","1","90","Flip a coin. If tails, this attack does nothing.","Fighting","x2"
"swsh3-137","Dunsparce","Pokemon","60","Colorless","",,"137","Kazuma Koda","Common","When it sees a person, it digs a hole with its tail to make its escape. If you happen to find one, consider yourself lucky.","206","D","https://images.pokemontcg.io/swsh3/137.png","https://images.pokemontcg.io/swsh3/137_hires.png","Legal",,"Legal","Colorless","1","Final Dig","If this Pokemon is Knocked Out by damage from an attack from your opponent's Pokemon, discard the top 2 cards of your opponent's deck.","Ability","","","","Ram","Colorless","1","20","","","","","","","Fighting","x2"
