"id","name","supertype","hp","types","evolvesTo","evolvesFrom","number","artist","rarity","flavorText","nationalPokedexNumbers","regulationMark","imageSmall","imageLarge","legalitiesUnlimited","legalitiesStandard","legalitiesExpanded","retreatCost","convertedRetreatCost","Ability1Name","Ability1Text","Ability1Type","Ability2Name","Ability2Text","Ability2Type","Attack1Name","Attack1Cost","Attack1ConvertedCost","Attack1Damage","Attack1Text","Attack2Name","Attack2Cost","Attack2ConvertedCost","Attack2Damage","Attack2Text","Weakness1Type","Weakness1Value"
"swsh3-48","Cubchoo","Pokemon","70","Water","Beartic",,"48","Saya Tsuruta","Common","When this Pokemon is in good health, its snot becomes thicker and stickier. It will smear its snot on anyone it doesn't like.","613","D","https://images.pokemontcg.io/swsh3/48.png","https://images.pokemontcg.io/swsh3/48_hires.png","Legal",,"Legal","Colorless, Colorless","2","","","","","","","Chop","Colorless","1","10","","Icicle","Water, Colorless","2","30","","Metal","x2"
"swsh3-49","Beartic","Pokemon","140","Water","","Cubchoo","49","Masakazu Fukuda","Rare","It swims through frigid seas, searching for prey. From its frozen breath, it forms icy fangs that are harder than steel.","614","D","https://images.pokemontcg.io/swsh3/49.png","https://images.pokemontcg.io/swsh3/49_hires.png","Legal",,"Legal","Colorless, Colorless, Colorless","3","","","","","","","Slash","Colorless, Colorless","2","40","","Frozen Slice","Water, Colorless, Colorless","3","150","This Pokemon also does 50 damage to itself.","Metal","x2"
"swsh3-50","Wishiwashi","Pokemon","30","Water","",,"50","sui","Common","Individually, they're incredibly weak. It's by gathering up into schools that they're able to confront opponents.","746","D","https://images.pokemontcg.io/swsh3/50.png","https://images.pokemontcg.io/swsh3/50_hires.png","Legal",,"Legal","Colorless","1","","","","","","","Deep Sea Swirl","Colorless","1","","Shuffle your hand into your deck. Then, draw 8 cards.","Wave Splash","Water","1","20","","Lightning","x2"
"swsh3-51","Mareanie","Pokemon","70","Water","Toxapex",,"51","Tomokazu Komiya","Common","The first symptom of its sting is numbness. The next is an itching sensation so intense that it's impossible to resist the urge to claw at your skin.","747","D","https://images.pokemontcg.io/swsh3/51.png","https://images.pokemontcg.io/swsh3/51_hires.png","Legal",,"Legal","Colorless, Colorless","2","","","","","","","Regeneration","Colorless","1","","Heal 30 damage from this Pokemon.","Poison Tentacles","Water, Colorless","2","20","Your opponent's Active Pokemon is now Poisoned.","Lightning","x2"
"swsh3-52","Toxapex","Pokemon","130","Water","","Mareanie","52","Masakazu Fukuda","Uncommon","To survive in the cold waters of Galar, this Pokemon forms a dome with its legs, enclosing its body so it can capture its own body heat.","748","D","https://images.pokemontcg.io/swsh3/52.png","https://images.pokemontcg.io/swsh3/52_hires.png","Legal",,"Legal","Colorless, Colorless, Colorless","3","","","","","","","Recover","Colorless","1","","Discard an Energy from this Pokemon and heal all damage from it.","Poisonous Whip","Water, Colorless, Colorless","3","80","Your opponent's Active Pokemon is now Poisoned.","Lightning","x2"
"swsh3-53","Dracovish","Pokemon","150","Water","","Rare Fossil","53","Hitoshi Ariga","Rare Holo","Powerful legs and jaws made it the apex predator of its time. Its own overhunting of its prey was what drove it to extinction.","882","D","https://images.pokemontcg.io/swsh3/53.png","https://images.pokemontcg.io/swsh3/53_hires.png","Legal",,"Legal","Colorless, Colorless, Colorless","3","Primal Law","As long as this Pokemon is in the Active Spot, your opponent can't play any Pokemon from their hand to evolve their Pokemon.","Ability","","","","Hammer In","Water, Colorless, Colorless","3","120","","","","","","","Lightning","x2"
"swsh3-54","Arctovish","Pokemon","150","Water","","Rare Fossil","54","Shin Nagasawa","Rare","Though it's able to capture prey by freezing its surroundings, it has trouble eating the prey afterward because its mouth is on top of its head.","883","D","https://images.pokemontcg.io/swsh3/54.png","https://images.pokemontcg.io/swsh3/54_hires.png","Legal",,"Legal","Colorless, Colorless","2","","","","","","","Hard Face","Water, Colorless, Colorless","3","90","During your opponent's next turn, this Pokemon takes 60 less damage from attacks (after applying Weakness and Resistance).","Cold Breath","Water, Colorless, Colorless, Colorless","4","130","Your opponent's Active Pokemon is now Asleep.","Lightning","x2"
"swsh3-55","Mareep","Pokemon","60","Lightning","Flaaffy",,"55","sowsow","Common","Rubbing its fleece generates electricity. You'll want to pet it because it's cute, but if you use your bare hand, you'll get a painful shock.","179","D","https://images.pokemontcg.io/swsh3/55.png","https://images.pokemontcg.io/swsh3/55_hires.png","Legal",,"Legal","Colorless","1","","","","","","","Static Shock","Lightning","1","20","","","","","","","Fighting","x2"
"swsh3-56","Flaaffy","Pokemon","90","Lightning","Ampharos","Mareep","56","Tomokazu Komiya","Uncommon","It stores electricity in its fluffy fleece. If it stores up too much, it will start to go bald in those patches.","180","D","https://images.pokemontcg.io/swsh3/56.png","https://images.pokemontcg.io/swsh3/56_hires.png","Legal",,"Legal","Colorless","1","","","","","","","Static Shock","Lightning","1","40","","","","","","","Fighting","x2"
"swsh3-57","Ampharos","Pokemon","150","Lightning","","Flaaffy","57","kodama","Rare","Its tail shines bright and strong. It has been prized since long ago as a beacon for sailors.","181","D","https://images.pokemontcg.io/swsh3/57.png","https://images.pokemontcg.io/swsh3/57_hires.png","Legal",,"Legal","Colorless, Colorless","2","","","","","","","Dazzle Blast","Lightning","1","50","Your opponent's Active Pokemon is now Confused.","Electric Ball","Lightning, Lightning","2","130","","Fighting","x2"
"swsh3-58","Electrike","Pokemon","60","Lightning","Manectric",,"58","Yumi","Common","It stores static electricity in its fur for discharging. It gives off sparks if a storm approaches.","309","D","https://images.pokemontcg.io/swsh3/58.png","https://images.pokemontcg.io/swsh3/58_hires.png","Legal",,"Legal","Colorless","1","","","","","","","Thunderbolt","Lightning, Colorless","2","50","Discard all Energy from this Pokemon.","","","","","","Fighting","x2"
"swsh3-59","Manectric","Pokemon","110","Lightning","","Electrike","59","nagimiso","Rare","It stimulates its own muscles with electricity, so it can move quickly. It eases its soreness with electricity, too, so it can recover quickly as well.","310","D","https://images.pokemontcg.io/swsh3/59.png","https://images.pokemontcg.io/swsh3/59_hires.png","Legal",,"Legal","Colorless","1","","","","","","","Strafe","Lightning","1","30","You may switch this Pokemon with 1 of your Benched Pokemon.","Flash Impact","Lightning, Lightning, Colorless","3","150","This attack also does 30 damage to 1 of your Benched Pokemon. (Don't apply Weakness and Resistance for Benched Pokemon.)","Fighting","x2"
"swsh3-60","Vikavolt V","Pokemon","210","Lightning","",,"60","Ayaka Yoshida","Rare Holo V",,"738","D","https://images.pokemontcg.io/swsh3/60.png","https://images.pokemontcg.io/swsh3/60_hires.png","Legal",,"Legal","Colorless, Colorless, Colorless","3","","","","","","","Paralyzing Bolt","Lightning, Colorless","2","50","During your opponent's next turn, they can't play any Item cards from their hand.","Super Zap Cannon","Lightning, Lightning, Colorless","3","190","Discard 2 Energy from this Pokemon.","Fighting","x2"
"swsh3-61","Tapu Koko","Pokemon","110","Lightning","",,"61","Hasuno","Rare Holo","The lightning-wielding guardian deity of Melemele, Tapu Koko is brimming with curiosity and appears before people from time to time.","785","D","https://images.pokemontcg.io/swsh3/61.png","https://images.pokemontcg.io/swsh3/61_hires.png","Legal",,"Legal","",,"","","","","","","Allure","Colorless","1","","Draw 2 cards.","Electric Ball","Lightning, Lightning, Colorless","3","110","","Fighting","x2"
"swsh3-62","Toxel","Pokemon","70","Lightning","Toxtricity",,"62","Akira Komayama","Common","It stores poison in an internal poison sac and secretes that poison through its skin. If you touch this Pokemon, a tingling sensation follows.","848","D","https://images.pokemontcg.io/swsh3/62.png","https://images.pokemontcg.io/swsh3/62_hires.png","Legal",,"Legal","Colorless, Colorless","2","","","","","","","Slap","Colorless","1","10","","Static Shock","Lightning, Colorless","2","20","","Fighting","x2"
"swsh3-63","Toxtricity","Pokemon","120","Lightning","","Toxel","63","Shin Nagasawa","Rare Holo","Capable of generating 15,000 volts of electricity, this Pokemon looks down on all that would challenge it.","849","D","https://images.pokemontcg.io/swsh3/63.png","https://images.pokemontcg.io/swsh3/63_hires.png","Legal",,"Legal","Colorless, Colorless","2","","","","","","","Risk Taker","Colorless, Colorless","2","","Flip a coin. If heads, discard the top 5 cards of your opponent's deck. If tails, discard the top 5 cards of your deck.","Thunder Jolt","Lightning, Lightning, Colorless","3","160","This Pokemon also does 30 damage to itself.","Fighting","x2"
"swsh3-64","Pincurchin","Pokemon","80","Lightning","",,"64","Shin Nagasawa","Rare Holo","It feeds on seaweed, using its teeth to scrape it off rocks. Electric current flows from the tips of its spines.","871","D","https://images.pokemontcg.io/swsh3/64.png","https://images.pokemontcg.io/swsh3/64_hires.png","Legal",,"Legal","Colorless, Colorless","2","","","","","","","Double Draw","Lightning","1","","Draw 2 cards.","Zing Zap","Lightning, Colorless, Colorless","3","50","Flip a coin. If heads, your opponent's Active Pokemon is now Paralyzed.","Fighting","x2"
"swsh3-65","Dracozolt","Pokemon","160","Lightning","","Rare Fossil","65","Misa Tsutsui","Rare","In ancient times, it was unbeatable thanks to its powerful lower body, but it went extinct anyway after it depleted all its plant-based food sources.","880","D","https://images.pokemontcg.io/swsh3/65.png","https://images.pokemontcg.io/swsh3/65_hires.png","Legal",,"Legal","Colorless, Colorless, Colorless, Colorless","4","","","","","","","Amping Up","Lightning","1","30","During your next turn, this Pokemon's Amping Up attack does 90 more damage (before applying Weakness and Resistance).","Giga Impact","Colorless, Colorless, Colorless, Colorless","4","200","During your next turn, this Pokemon can't attack.","Fighting","x2"
"swsh3-66","Arctozolt","Pokemon","130","Lightning","","Rare Fossil","66","Hitoshi Ariga","Rare Holo","The shaking of its freezing upper half is what generates its electricity. It has a hard time walking around.","881","D","https://images.pokemontcg.io/swsh3/66.png","https://images.pokemontcg.io/swsh3/66_hires.png","Legal",,"Legal","Colorless, Colorless","2","Biting Whirlpool","Whenever your opponent attaches an Energy card from their hand to 1 of their Pokemon, put 2 damage counters on that Pokemon.","Ability","","","","Electro Ball","Lightning, Colorless","2","70","","","","","","","Fighting","x2"
"swsh3-67","Jigglypuff","Pokemon","70","Psychic","Wigglytuff",,"67","Motofumi Fujiwara","Common","The songs they sing are totally different depending on the region they live in. Some even sound like they're shouting!","39","D","https://images.pokemontcg.io/swsh3/67.png","https://images.pokemontcg.io/swsh3/67_hires.png","Legal",,"Legal","Colorless","1","","","","","","","Mumble","Colorless","1","10","","Moon Kick","Psychic, Colorless","2","20","","Metal","x2"
"swsh3-68","Wigglytuff","Pokemon","120","Psychic","","Jigglypuff","68","Lee HyunJung","Rare","When it gets angry, it inhales with all its might, and its body gradually inflates. Sometimes they can grow 20 times larger!","40","D","https://images.pokemontcg.io/swsh3/68.png","https://images.pokemontcg.io/swsh3/68_hires.png","Legal",,"Legal","Colorless, Colorless","2","","","","","","","Sleep Pulse","Psychic","1","30","Your opponent's Active Pokemon is now Asleep.","Double Smash","Colorless, Colorless, Colorless","3","90x","Flip 2 coins. This attack does 90 damage for each heads.","Metal","x2"
"swsh3-69","Mew V","Pokemon","180","Psychic","",,"69","PLANETA Mochizuki","Rare Holo V",,"151","D","https://images.pokemontcg.io/swsh3/69.png","https://images.pokemontcg.io/swsh3/69_hires.png","Legal",,"Legal","",,"","","","","","","X Ball","Psychic, Psychic","2","30x","This attack does 30 damage for each Energy attached to both Active Pokemon.","","","","","","Darkness","x2"
"swsh3-70","Snubbull","Pokemon","80","Psychic","Granbull",,"70","otumami","Common","In contrast to its appearance, it's quite timid. When playing with other puppy Pokemon, it sometimes gets bullied.","209","D","https://images.pokemontcg.io/swsh3/70.png","https://images.pokemontcg.io/swsh3/70_hires.png","Legal",,"Legal","Colorless, Colorless","2","","","","","","","Sharp Fang","Psychic, Colorless","2","30","","","","","","","Metal","x2"
"swsh3-71","Granbull","Pokemon","130","Psychic","","Snubbull","71","SATOSHI NAKAI","Rare","Although it's popular with young people, Granbull is timid and sensitive, so it's totally incompetent as a watchdog.","210","D","https://images.pokemontcg.io/swsh3/71.png","https://images.pokemontcg.io/swsh3/71_hires.png","Legal",,"Legal","Colorless, Colorless","2","","","","","","","Jaw Lock","Psychic, Colorless","2","50","During your opponent's next turn, the Defending Pokemon can't retreat.","Headbutt Bounce","Psychic, Psychic, Colorless","3","130","","Metal","x2"
"swsh3-72","Lunatone","Pokemon","90","Psychic","",,"72","Miki Tanaka","Uncommon","The phase of the moon apparently has some effect on its power. It's active on the night of a full moon.","337","D","https://images.pokemontcg.io/swsh3/72.png","https://images.pokemontcg.io/swsh3/72_hires.png","Legal",,"Legal","Colorless","1","","","","","","","Future Sight","Colorless","1","","Look at the top 4 cards of either player's deck and put them back in any order.","Psychic","Psychic, Colorless","2","20+","This attack does 20 more damage for each Energy attached to your opponent's Active Pokemon.","Darkness","x2"
"swsh3-73","Gothita","Pokemon","60","Psychic","Gothorita",,"73","Mizue","Common","Though they're still only babies, there's psychic power stored in their ribbonlike feelers, and sometimes they use that power to fight.","574","D","https://images.pokemontcg.io/swsh3/73.png","https://images.pokemontcg.io/swsh3/73_hires.png","Legal",,"Legal","Colorless","1","","","","","","","Fortunate Eye","Psychic","1","","Look at the top 5 cards of your opponent's deck and put them back in any order.","Gentle Slap","Psychic, Colorless","2","30","","Darkness","x2"
"swsh3-74","Gothorita","Pokemon","80","Psychic","Gothitelle","Gothita","74","sowsow","Uncommon","It's said that when stars shine in the night sky, this Pokemon will spirit away sleeping children. Some call it the Witch of Punishment.","575","D","https://images.pokemontcg.io/swsh3/74.png","https://images.pokemontcg.io/swsh3/74_hires.png","Legal",,"Legal","Colorless, Colorless","2","","","","","","","Whiny Voice","Psychic","1","","Choose a random card from your opponent's hand. Your opponent reveals that card and shuffles it into their deck.","Double Spin","Psychic, Colorless","2","30x","Flip 2 coins. This attack does 30 damage for each heads.","Darkness","x2"
"swsh3-75","Gothitelle","Pokemon","140","Psychic","","Gothorita","75","Eri Yamaki","Rare","It has tremendous psychic power, but it dislikes conflict. It's also able to predict the future based on the movement of the stars.","576","D","https://images.pokemontcg.io/swsh3/75.png","https://images.pokemontcg.io/swsh3/75_hires.png","Legal",,"Legal","Colorless, Colorless","2","","","","","","","Mind Bend","Psychic","1","40","Your opponent's Active Pokemon is now Confused.","Bend","Psychic, Colorless","2","90","Choose 2 random cards from your opponent's hand. Your opponent reveals those cards and shuffles them into their deck.","Darkness","x2"
"swsh3-76","Golett","Pokemon","90","Psychic","Golurk",,"76","Ryuta Fuse","Common","They were sculpted from clay in ancient times. No one knows why, but some of them are driven to continually line up boulders.","622","D","https://images.pokemontcg.io/swsh3/76.png","https://images.pokemontcg.io/swsh3/76_hires.png","Legal",,"Legal","Colorless, Colorless, Colorless","3","","","","","","","Rollout","Psychic, Colorless","2","30","","Hammer In","Psychic, Colorless, Colorless","3","50","","Darkness","x2"
"swsh3-77","Golurk","Pokemon","150","Psychic","","Golett","77","Anesaki Dynamic","Rare","Artillery platforms built into the walls of ancient castles served as perches from which Golurk could fire energy beams.","623","D","https://images.pokemontcg.io/swsh3/77.png","https://images.pokemontcg.io/swsh3/77_hires.png","Legal",,"Legal","Colorless, Colorless, Colorless, Colorless","4","","","","","","","Dynamic Chop","Psychic, Colorless, Colorless","3","80","","Golurk Hammer","Psychic, Colorless, Colorless, Colorless, Colorless","5","180","","Darkness","x2"
"swsh3-78","Dedenne","Pokemon","70","Psychic","",,"78","Shibuzoh.","Uncommon","Its upper whiskers are sensors that survey its surroundings. Its lower whiskers are organs that shoot electricity.","702","D","https://images.pokemontcg.io/swsh3/78.png","https://images.pokemontcg.io/swsh3/78_hires.png","Legal",,"Legal","Colorless","1","","","","","","","Mad Party","Psychic, Colorless, Colorless","3","20x","This attack does 20 damage for each Pokemon in your discard pile that has the Mad Party attack.","","","","","","Metal","x2"
"swsh3-79","Morelull","Pokemon","60","Psychic","Shiinotic",,"79","Suwama Chiaki","Common","Pokemon living in the forest eat the delicious caps on Morelull's head. The caps regrow overnight.","755","D","https://images.pokemontcg.io/swsh3/79.png","https://images.pokemontcg.io/swsh3/79_hires.png","Legal",,"Legal","Colorless","1","","","","","","","Spore","Colorless","1","","Your opponent's Active Pokemon is now Asleep.","Flop","Psychic, Colorless","2","20","","Metal","x2"
"swsh3-80","Shiinotic","Pokemon","110","Psychic","","Morelull","80","Misa Tsutsui","Uncommon","Its flickering spores lure in prey and put them to sleep. Once this Pokemon has its prey snoozing, it drains their vitality with its fingertips.","756","D","https://images.pokemontcg.io/swsh3/80.png","https://images.pokemontcg.io/swsh3/80_hires.png","Legal",,"Legal","Colorless, Colorless","2","","","","","","","Flickering Light","Colorless","1","30","Flip a coin. If heads, during your opponent's next turn, the Defending Pokemon can't attack.","Fear the Forest","Psychic, Colorless","2","60+","If Glimwood Tangle is in play, this attack does 60 more damage.","Metal","x2"
"swsh3-81","Mimikyu","Pokemon","70","Psychic","",,"81","Ryota Murayama","Rare","It wears a rag fashioned into a Pikachu costume in an effort to look less scary. Unfortunately, the costume only makes it creepier.","778","D","https://images.pokemontcg.io/swsh3/81.png","https://images.pokemontcg.io/swsh3/81_hires.png","Legal",,"Legal","Colorless","1","Heal Jamming","Your opponent's Benched Pokemon can't be healed.","Ability","","","","Claw Slash","Psychic, Colorless","2","30","","","","","","","Darkness","x2"
"swsh3-82","Sinistea","Pokemon","30","Psychic","Polteageist",,"82","Kouki Saitou","Common","This Pokemon is said to have been born when a lonely spirit possessed a cold, leftover cup of tea.","854","D","https://images.pokemontcg.io/swsh3/82.png","https://images.pokemontcg.io/swsh3/82_hires.png","Legal",,"Legal","Colorless","1","","","","","","","Furtive Drop","Colorless","1","","Put 2 damage counters on your opponent's Active Pokemon.","","","","","","Darkness","x2"
"swsh3-83","Polteageist","Pokemon","60","Psychic","","Sinistea","83","kirisAki","Uncommon","This species lives in antique teapots. Most pots are forgeries, but on rare occasions, an authentic work is found.","855","D","https://images.pokemontcg.io/swsh3/83.png","https://images.pokemontcg.io/swsh3/83_hires.png","Legal",,"Legal","Colorless","1","Tea Break","You must discard a Pokemon that has the Mad Party attack from your hand in order to use this Ability. Once during your turn, you may draw 2 cards.","Ability","","","","Mad Party","Colorless, Colorless","2","20x","This attack does 20 damage for each Pokemon in your discard pile that has the Mad Party attack.","","","","","","Darkness","x2"
"swsh3-84","Diglett","Pokemon","50","Fighting","Dugtrio",,"84","Hideki Ishikawa","Common","If a Diglett digs through a field, it leaves the soil perfectly tilled and ideal for planting crops.","50","D","https://images.pokemontcg.io/swsh3/84.png","https://images.pokemontcg.io/swsh3/84_hires.png","Legal",,"Legal","Colorless","1","","","","","","","Scratch","Fighting","1","20","","","","","","","Grass","x2"
"swsh3-85","Dugtrio","Pokemon","90","Fighting","","Diglett","85","Yukiko Baba","Uncommon","A team of Diglett triplets. It triggers huge earthquakes by burrowing 60 miles underground.","51","D","https://images.pokemontcg.io/swsh3/85.png","https://images.pokemontcg.io/swsh3/85_hires.png","Legal",,"Legal","Colorless","1","","","","","","","Dig","Fighting","1","30","Flip a coin. If heads, during your opponent's next turn, prevent all damage from and effects of attacks done to this Pokemon.","Mud Bomb","Fighting, Colorless","2","70","","Grass","x2"
"swsh3-86","Larvitar","Pokemon","70","Fighting","Pupitar",,"86","Sanosuke Sakuma","Common","Born deep underground, it comes aboveground and becomes a pupa once it has finished eating the surrounding soil.","246","D","https://images.pokemontcg.io/swsh3/86.png","https://images.pokemontcg.io/swsh3/86_hires.png","Legal",,"Legal","Colorless","1","","","","","","","Sand Spray","Fighting","1","10","","Pierce","Colorless, Colorless","2","20","","Grass","x2"
"swsh3-87","Pupitar","Pokemon","80","Fighting","Tyranitar","Larvitar","87","Sekio","Uncommon","Even sealed in its shell, it can move freely. Hard and fast, it has outstanding destructive power.","247","D","https://images.pokemontcg.io/swsh3/87.png","https://images.pokemontcg.io/swsh3/87_hires.png","Legal",,"Legal","Colorless, Colorless, Colorless","3","","","","","","","Sand Spray","Fighting","1","20","","Rocket Evolution","Colorless, Colorless, Colorless","3","40","Search your deck for a card that evolves from this Pokemon and put it onto this Pokemon to evolve it. Then, shuffle your deck.","Grass","x2"
"swsh3-88","Tyranitar","Pokemon","180","Fighting","","Pupitar","88","nagimiso","Rare Holo","Its body can't be harmed by any sort of attack, so it is very eager to make challenges against enemies.","248","D","https://images.pokemontcg.io/swsh3/88.png","https://images.pokemontcg.io/swsh3/88_hires.png","Legal",,"Legal","Colorless, Colorless, Colorless, Colorless","4","","","","","","","Bedrock Breaker","Fighting, Colorless, Colorless","3","120","Discard a Stadium in play.","Mountain Swing","Fighting, Fighting, Colorless, Colorless","4","250","Discard the top 5 cards of your deck.","Grass","x2"
"swsh3-89","Trapinch","Pokemon","60","Fighting","Vibrava",,"89","Asako Ito","Common","Its nest is a sloped, bowl-like pit in the desert. Once something has fallen in, there is no escape.","328","D","https://images.pokemontcg.io/swsh3/89.png","https://images.pokemontcg.io/swsh3/89_hires.png","Legal",,"Legal","Colorless","1","","","","","","","Land's Pulse","Fighting","1","10+","If a Stadium is in play, this attack does 10 more damage.","","","","","","Grass","x2"
"swsh3-90","Vibrava","Pokemon","80","Fighting","Flygon","Trapinch","90","Sumiyoshi Kizuki","Uncommon","The ultrasonic waves it generates by rubbing its two wings together cause severe headaches.","329","D","https://images.pokemontcg.io/swsh3/90.png","https://images.pokemontcg.io/swsh3/90_hires.png","Legal",,"Legal","Colorless","1","","","","","","","Sand Pulse","Fighting","1","20","This attack also does 10 damage to each of your opponent's Benched Pokemon. (Don't apply Weakness and Resistance for Benched Pokemon.)","","","","","","Grass","x2"
"swsh3-91","Flygon","Pokemon","150","Fighting","","Vibrava","91","hatachu","Rare","This Pokemon hides in the heart of sandstorms it creates and seldom appears where people can see it.","330","D","https://images.pokemontcg.io/swsh3/91.png","https://images.pokemontcg.io/swsh3/91_hires.png","Legal",,"Legal","Colorless","1","Labyrinth of Sand","As long as this Pokemon is in the Active Spot, your opponent's Active Pokemon can't retreat.","Ability","","","","Desert Geyser","Fighting, Colorless, Colorless","3","130","If your opponent has a Stadium in play, discard it. If you discarded a Stadium in this way, during your opponent's next turn, prevent all damage from and effects of attacks done to this Pokemon.","","","","","","Grass","x2"
"swsh3-92","Solrock","Pokemon","90","Fighting","",,"92","Miki Tanaka","Uncommon","When it rotates itself, it gives off light similar to the sun, thus blinding its foes.","338","D","https://images.pokemontcg.io/swsh3/92.png","https://images.pokemontcg.io/swsh3/92_hires.png","Legal",,"Legal","Colorless","1","Resistance Shade","If you have Lunatone in play, your opponent's Pokemon in play have no Resistance.","Ability","","","","Rock Throw","Fighting, Colorless","2","30","","","","","","","Grass","x2"
