"id","name","supertype","hp","types","evolvesTo","evolvesFrom","number","artist","rarity","flavorText","nationalPokedexNumbers","regulationMark","imageSmall","imageLarge","legalitiesUnlimited","legalitiesStandard","legalitiesExpanded","retreatCost","convertedRetreatCost","Ability1Name","Ability1Text","Ability1Type","Ability2Name","Ability2Text","Ability2Type","Attack1Name","Attack1Cost","Attack1ConvertedCost","Attack1Damage","Attack1Text","Attack2Name","Attack2Cost","Attack2ConvertedCost","Attack2Damage","Attack2Text","Weakness1Type","Weakness1Value"
"swsh3-1","Butterfree V","Pokemon","190","Grass","",,"1","Saki Hayashiro","Rare Holo V",,"12","D","https://images.pokemontcg.io/swsh3/1.png","https://images.pokemontcg.io/swsh3/1_hires.png","Legal",,"Legal","Colorless","1","","","","","","","Dizzying Poison","Grass","1","","Your opponent's Active Pokemon is now Confused and Poisoned.","Blasting Wind","Grass, Grass, Colorless","3","130","","Fire","x2"
"swsh3-2","Butterfree VMAX","Pokemon","300","Grass","","Butterfree V","2","aky CG Works","Rare Holo VMAX",,"12","D","https://images.pokemontcg.io/swsh3/2.png","https://images.pokemontcg.io/swsh3/2_hires.png","Legal",,"Legal","",,"","","","","","","G-Max Toxbreeze","Grass, Grass, Colorless","3","150","Your opponent's Active Pokemon is now Confused and Poisoned.","","","","","","Fire","x2"
"swsh3-3","Paras","Pokemon","60","Grass","Parasect",,"3","Atsuko Nishida","Common","The mushrooms, known as tochukaso, are controlling the bug. Even if the bug bugs the mushrooms, they tell it to bug off.","46","D","https://images.pokemontcg.io/swsh3/3.png","https://images.pokemontcg.io/swsh3/3_hires.png","Legal",,"Legal","Colorless","1","","","","","","","Scratch","Grass","1","20","","","","","","","Fire","x2"
"swsh3-4","Parasect","Pokemon","120","Grass","","Paras","4","Miki Tanaka","Uncommon","The bug is mostly dead, with the mushroom on its back having become the main body. If the mushroom comes off, the bug stops moving.","47","D","https://images.pokemontcg.io/swsh3/4.png","https://images.pokemontcg.io/swsh3/4_hires.png","Legal",,"Legal","Colorless, Colorless","2","","","","","","","Mushroom Tackle","Grass","1","30","Flip a coin. If heads, your opponent's Active Pokemon is now Paralyzed.","Solar Beam","Grass, Grass, Colorless","3","110","","Fire","x2"
"swsh3-5","Carnivine","Pokemon","90","Grass","",,"5","Masakazu Fukuda","Uncommon","It binds itself to trees in marshes. It attracts prey with its sweet-smelling drool and gulps them down.","455","D","https://images.pokemontcg.io/swsh3/5.png","https://images.pokemontcg.io/swsh3/5_hires.png","Legal",,"Legal","Colorless","1","","","","","","","Return","Colorless","1","20","You may draw cards until you have 5 cards in your hand.","Giga Drain","Grass, Colorless","2","40","Heal from this Pokemon the same amount of damage you did to your opponent's Active Pokemon.","Fire","x2"
"swsh3-6","Pansage","Pokemon","60","Grass","Simisage",,"6","Mina Nakai","Common","It's good at finding berries and gathers them from all over. It's kind enough to share them with friends.","511","D","https://images.pokemontcg.io/swsh3/6.png","https://images.pokemontcg.io/swsh3/6_hires.png","Legal",,"Legal","Colorless","1","","","","","","","Seed Bomb","Grass","1","10","","Bite","Colorless, Colorless","2","20","","Fire","x2"
"swsh3-7","Simisage","Pokemon","100","Grass","","Pansage","7","Hasegawa Saki","Uncommon","Ill tempered, it fights by swinging its barbed tail around wildly. The leaf growing on its head is very bitter.","512","D","https://images.pokemontcg.io/swsh3/7.png","https://images.pokemontcg.io/swsh3/7_hires.png","Legal",,"Legal","Colorless","1","","","","","","","Seed Bomb","Grass","1","30","","Giga Impact","Colorless, Colorless, Colorless","3","110","During your next turn, this Pokemon can't attack.","Fire","x2"
"swsh3-8","Karrablast","Pokemon","60","Grass","Escavalier",,"8","Mizue","Common","Its strange physiology reacts to electrical energy in interesting ways. The presence of a Shelmet will cause this Pokemon to evolve.","588","D","https://images.pokemontcg.io/swsh3/8.png","https://images.pokemontcg.io/swsh3/8_hires.png","Legal",,"Legal","Colorless","1","","","","","","","Continuous Headbutt","Colorless","1","20x","Flip a coin until you get tails. This attack does 20 damage for each heads.","","","","","","Fire","x2"
"swsh3-9","Shelmet","Pokemon","70","Grass","Accelgor",,"9","Megumi Mizutani","Common","When attacked, it tightly shuts the lid of its shell. This reaction fails to protect it from Karrablast, however, because they can still get into the shell.","616","D","https://images.pokemontcg.io/swsh3/9.png","https://images.pokemontcg.io/swsh3/9_hires.png","Legal",,"Legal","Colorless, Colorless, Colorless","3","","","","","","","Spray Fluid","Colorless","1","10","","","","","","","Fire","x2"
"swsh3-10","Accelgor","Pokemon","90","Grass","","Shelmet","10","Shigenori Negishi","Rare","It moves with blinding speed and lobs poison at foes. Featuring Accelgor as a main character is a surefire way to make a movie or comic popular.","617","D","https://images.pokemontcg.io/swsh3/10.png","https://images.pokemontcg.io/swsh3/10_hires.png","Legal",,"Legal","",,"","","","","","","Jet Headbutt","Colorless, Colorless","2","70","","","","","","","Fire","x2"
"swsh3-11","Rowlet","Pokemon","50","Grass","Dartrix",,"11","HYOGONOSUKE","Common","At a distance, it launches its sharp feathers while flying about. If the enemy gets too close, Rowlet switches tactics and delivers vicious kicks.","722","D","https://images.pokemontcg.io/swsh3/11.png","https://images.pokemontcg.io/swsh3/11_hires.png","Legal",,"Legal","Colorless","1","Sky Circus","If you played Bird Keeper from your hand during this turn, ignore all Energy in this Pokemon's attack costs.","Ability","","","","Wind Shard","Colorless, Colorless, Colorless","3","","This attack does 60 damage to 1 of your opponent's Benched Pokemon. (Don't apply Weakness and Resistance for Benched Pokemon.)","","","","","","Fire","x2"
"swsh3-12","Dartrix","Pokemon","80","Grass","Decidueye","Rowlet","12","Mitsuhiro Arita","Uncommon","It throws one knifelike feather after another at its enemies, and each one precisely strikes a weak point. These feathers are known as blade quills.","723","D","https://images.pokemontcg.io/swsh3/12.png","https://images.pokemontcg.io/swsh3/12_hires.png","Legal",,"Legal","Colorless","1","","","","","","","Razor Leaf","Grass","1","40","","","","","","","Fire","x2"
"swsh3-13","Decidueye","Pokemon","140","Grass","","Dartrix","13","Ryota Murayama","Rare Holo","As if wielding a bow, it launches the arrow quills hidden among the feathers of its wings. Decidueye's shots never miss.","724","D","https://images.pokemontcg.io/swsh3/13.png","https://images.pokemontcg.io/swsh3/13_hires.png","Legal",,"Legal","Colorless, Colorless","2","Deep Forest Camo","Prevent all damage done to this Pokemon by attacks from your opponent's Pokemon V and Pokemon-GX.","Ability","","","","Splitting Arrow","Grass, Colorless","2","90","This attack also does 20 damage to 2 of your opponent's Benched Pokemon. (Don't apply Weakness and Resistance for Benched Pokemon.)","","","","","","Fire","x2"
"swsh3-14","Bounsweet","Pokemon","60","Grass","Steenee",,"14","Yuka Morii","Common","Its body gives off a sweet, fruity scent that is extremely appetizing to bird Pokemon.","761","D","https://images.pokemontcg.io/swsh3/14.png","https://images.pokemontcg.io/swsh3/14_hires.png","Legal",,"Legal","Colorless","1","","","","","","","Synthesis","Colorless","1","","Search your deck for a Grass Energy card and attach it to 1 of your Pokemon. Then, shuffle your deck.","Flop","Grass, Colorless","2","20","","Fire","x2"
"swsh3-15","Steenee","Pokemon","80","Grass","Tsareena","Bounsweet","15","sui","Uncommon","As it twirls like a dancer, a sweet smell spreads out around it. Anyone who inhales the scent will feel a surge of happiness.","762","D","https://images.pokemontcg.io/swsh3/15.png","https://images.pokemontcg.io/swsh3/15_hires.png","Legal",,"Legal","Colorless","1","","","","","","","Captivate","Colorless","1","","Switch 1 of your opponent's Benched Pokemon with their Active Pokemon.","Smack","Grass, Colorless","2","40","","Fire","x2"
"swsh3-16","Tsareena","Pokemon","150","Grass","","Steenee","16","so-taro","Rare","This feared Pokemon has long, slender legs and a cruel heart. It shows no mercy as it stomps on its opponents.","763","D","https://images.pokemontcg.io/swsh3/16.png","https://images.pokemontcg.io/swsh3/16_hires.png","Legal",,"Legal","Colorless, Colorless","2","","","","","","","Power Whip","Colorless","1","","This attack does 20 damage to 1 of your opponent's Pokemon for each Energy attached to this Pokemon. (Don't apply Weakness and Resistance for Benched Pokemon.)","Time Out Kick","Grass, Colorless","2","100","You may put an Energy attached to your opponent's Active Pokemon into their hand.","Fire","x2"
"swsh3-17","Wimpod","Pokemon","70","Grass","Golisopod",,"17","MAHOU","Common","It's nature's cleaner—it eats anything and everything, including garbage and rotten things. The ground near its nest is always clean.","767","D","https://images.pokemontcg.io/swsh3/17.png","https://images.pokemontcg.io/swsh3/17_hires.png","Legal",,"Legal","Colorless, Colorless, Colorless","3","","","","","","","Gnaw and Run","Grass","1","10","Switch this Pokemon with 1 of your Benched Pokemon.","","","","","","Fire","x2"
"swsh3-18","Golisopod","Pokemon","130","Grass","","Wimpod","18","Ryuta Fuse","Rare Holo","It will do anything to win, taking advantage of every opening and finishing opponents off with the small claws on its front legs.","768","D","https://images.pokemontcg.io/swsh3/18.png","https://images.pokemontcg.io/swsh3/18_hires.png","Legal",,"Legal","Colorless, Colorless","2","","","","","","","Hard Times Slash","Colorless, Colorless","2","30+","This attack does 50 more damage for each of your opponent's Pokemon V and Pokemon-GX in play.","Smash Turn","Grass, Colorless, Colorless","3","70","Switch this Pokemon with 1 of your Benched Pokemon.","Fire","x2"
"swsh3-19","Charizard V","Pokemon","220","Fire","",,"19","aky CG Works","Rare Holo V",,"6","D","https://images.pokemontcg.io/swsh3/19.png","https://images.pokemontcg.io/swsh3/19_hires.png","Legal",,"Legal","Colorless, Colorless, Colorless","3","","","","","","","Claw Slash","Colorless, Colorless, Colorless","3","80","","Fire Spin","Fire, Fire, Colorless, Colorless","4","220","Discard 2 Energy from this Pokemon.","Water","x2"
"swsh3-20","Charizard VMAX","Pokemon","330","Fire","","Charizard V","20","aky CG Works","Rare Holo VMAX",,"6","D","https://images.pokemontcg.io/swsh3/20.png","https://images.pokemontcg.io/swsh3/20_hires.png","Legal",,"Legal","Colorless, Colorless, Colorless","3","","","","","","","Claw Slash","Colorless, Colorless, Colorless","3","100","","G-Max Wildfire","Fire, Fire, Fire, Colorless, Colorless","5","300","Discard 2 Energy from this Pokemon.","Water","x2"
"swsh3-21","Houndoom V","Pokemon","210","Fire","",,"21","Ayaka Yoshida","Rare Holo V",,"229","D","https://images.pokemontcg.io/swsh3/21.png","https://images.pokemontcg.io/swsh3/21_hires.png","Legal",,"Legal","Colorless","1","","","","","","","Searing Flame","Fire","1","20","Your opponent's Active Pokemon is now Burned.","Vengeful Flame","Fire, Fire, Colorless","3","100+","If your Benched Fire Pokemon have any damage counters on them, this attack does 100 more damage.","Water","x2"
"swsh3-22","Torchic","Pokemon","60","Fire","Combusken",,"22","Yuka Morii","Common","A fire burns inside, so it feels very warm to hug. It launches fireballs of 1,800 degrees Fahrenheit.","255","D","https://images.pokemontcg.io/swsh3/22.png","https://images.pokemontcg.io/swsh3/22_hires.png","Legal",,"Legal","Colorless","1","","","","","","","Call for Family","Colorless","1","","Search your deck for a Basic Pokemon and put it onto your Bench. Then, shuffle your deck.","Live Coal","Fire","1","10","","Water","x2"
"swsh3-23","Combusken","Pokemon","90","Fire","Blaziken","Torchic","23","kodama","Uncommon","During a battle, the hot flame in its body increases. Its kicks have outstanding destructive power.","256","D","https://images.pokemontcg.io/swsh3/23.png","https://images.pokemontcg.io/swsh3/23_hires.png","Legal",,"Legal","Colorless","1","","","","","","","Smash Kick","Fire","1","20","","Heat Beak","Fire, Colorless, Colorless","3","40","Your opponent's Active Pokemon is now Burned.","Water","x2"
"swsh3-24","Blaziken","Pokemon","170","Fire","","Combusken","24","Ryuta Fuse","Rare Holo","When facing a tough foe, it looses flames from its wrists. Its powerful legs let it jump clear over buildings.","257","D","https://images.pokemontcg.io/swsh3/24.png","https://images.pokemontcg.io/swsh3/24_hires.png","Legal",,"Legal","Colorless, Colorless","2","Double Type","As long as this Pokemon is in play, it is Fire and Fighting type.","Ability","","","","Turbo Drive","Fire, Colorless, Colorless","3","130","Attach a basic Energy card from your discard pile to 1 of your Benched Pokemon.","","","","","","Water","x2"
"swsh3-25","Heatran","Pokemon","130","Fire","",,"25","Anesaki Dynamic","Rare Holo","Boiling blood, like magma, circulates through its body. It makes its dwelling place in volcanic caves.","485","D","https://images.pokemontcg.io/swsh3/25.png","https://images.pokemontcg.io/swsh3/25_hires.png","Legal",,"Legal","Colorless, Colorless, Colorless, Colorless","4","","","","","","","Fire Fang","Fire, Colorless","2","30","Your opponent's Active Pokemon is now Burned.","Raging Flare","Fire, Fire, Colorless","3","80+","This attack does 10 more damage for each damage counter on this Pokemon.","Water","x2"
"swsh3-26","Pansear","Pokemon","60","Fire","Simisear",,"26","Megumi Higuchi","Common","This Pokemon lives in caves in volcanoes. The fire within the tuft on its head can reach 600 degrees Fahrenheit.","513","D","https://images.pokemontcg.io/swsh3/26.png","https://images.pokemontcg.io/swsh3/26_hires.png","Legal",,"Legal","Colorless","1","","","","","","","Live Coal","Fire","1","10","","Bite","Colorless, Colorless","2","20","","Water","x2"
"swsh3-27","Simisear","Pokemon","100","Fire","","Pansear","27","0313","Uncommon","When it gets excited, embers rise from its head and tail and it gets hot. For some reason, it loves sweets.","514","D","https://images.pokemontcg.io/swsh3/27.png","https://images.pokemontcg.io/swsh3/27_hires.png","Legal",,"Legal","Colorless","1","","","","","","","Flare","Fire","1","30","","Giga Impact","Colorless, Colorless, Colorless","3","110","During your next turn, this Pokemon can't attack.","Water","x2"
"swsh3-28","Galarian Darmanitan","Pokemon","140","Fire","","Galarian Darumaka","28","Misa Tsutsui","Rare","Anger has reignited its atrophied flame sac. This Pokemon spews fire everywhere as it rampages indiscriminately.","555","D","https://images.pokemontcg.io/swsh3/28.png","https://images.pokemontcg.io/swsh3/28_hires.png","Legal",,"Legal","Colorless, Colorless, Colorless","3","","","","","","","Headbutt","Colorless","1","40","","Frozen Heat","Water, Water, Colorless","3","110+","You may discard all Water Energy from this Pokemon. If you do, this attack does 60 more damage.","Water","x2"
"swsh3-29","Larvesta","Pokemon","70","Fire","Volcarona",,"29","Uta","Common","It protects itself with flame. Long years ago, people believed Larvesta had a nest on the sun.","636","D","https://images.pokemontcg.io/swsh3/29.png","https://images.pokemontcg.io/swsh3/29_hires.png","Legal",,"Legal","Colorless, Colorless","2","","","","","","","Singe","Fire","1","","Your opponent's Active Pokemon is now Burned.","","","","","","Water","x2"
"swsh3-30","Volcarona","Pokemon","120","Fire","","Larvesta","30","NC Empire","Rare","According to legends, it was hatched from a flaming cocoon to save people and Pokemon that were suffering from the cold.","637","D","https://images.pokemontcg.io/swsh3/30.png","https://images.pokemontcg.io/swsh3/30_hires.png","Legal",,"Legal","Colorless","1","","","","","","","Cauterize","Fire","1","80","If your opponent's Active Pokemon has no damage counters on it before this attack does damage, this attack does nothing.","Fire Wing","Fire, Fire, Colorless","3","110","","Water","x2"
"swsh3-31","Fletchinder","Pokemon","70","Fire","Talonflame","Fletchling","31","Mina Nakai","Uncommon","Its speed right after takeoff already puts it in the top speed class of all bird Pokemon.","662","D","https://images.pokemontcg.io/swsh3/31.png","https://images.pokemontcg.io/swsh3/31_hires.png","Legal",,"Legal","Colorless","1","","","","","","","Searing Flame","Colorless","1","20","Your opponent's Active Pokemon is now Burned.","","","","","","Lightning","x2"
"swsh3-32","Talonflame","Pokemon","140","Fire","","Fletchinder","32","kawayoo","Rare","Bird Pokemon make up most of its diet. It approaches at high speeds and smacks them down to the ground with its powerful kick.","663","D","https://images.pokemontcg.io/swsh3/32.png","https://images.pokemontcg.io/swsh3/32_hires.png","Legal",,"Legal","Colorless","1","Scorching Feathers","If this Pokemon is in the Active Spot and is damaged by an attack from your opponent's Pokemon (even if this Pokemon is Knocked Out), the Attacking Pokemon is now Burned.","Ability","","","","Mach Flight","Fire, Colorless, Colorless","3","120","During your opponent's next turn, the Defending Pokemon can't retreat.","","","","","","Lightning","x2"
"swsh3-33","Centiskorch V","Pokemon","210","Fire","",,"33","5ban Graphics","Rare Holo V",,"851","D","https://images.pokemontcg.io/swsh3/33.png","https://images.pokemontcg.io/swsh3/33_hires.png","Legal",,"Legal","Colorless, Colorless, Colorless","3","","","","","","","Radiating Heat","Fire","1","20","You may discard an Energy from this Pokemon. If you do, discard an Energy from your opponent's Active Pokemon.","Burning Train","Fire, Fire, Fire, Fire","4","180","","Water","x2"
"swsh3-34","Centiskorch VMAX","Pokemon","320","Fire","","Centiskorch V","34","5ban Graphics","Rare Holo VMAX",,"851","D","https://images.pokemontcg.io/swsh3/34.png","https://images.pokemontcg.io/swsh3/34_hires.png","Legal",,"Legal","Colorless, Colorless, Colorless","3","","","","","","","G-Max Centiferno","Colorless, Colorless","2","40+","This attack does 40 more damage for each Fire Energy attached to this Pokemon. If you did any damage with this attack, you may attach a Fire Energy card from your discard pile to this Pokemon.","","","","","","Water","x2"
"swsh3-35","Galarian Mr. Mime","Pokemon","80","Water","Mr. Rime",,"35","Misa Tsutsui","Common","Its talent is tap-dancing. It can also manipulate temperatures to create a floor of ice, which this Pokemon can kick up to use as a barrier.","122","D","https://images.pokemontcg.io/swsh3/35.png","https://images.pokemontcg.io/swsh3/35_hires.png","Legal",,"Legal","Colorless","1","","","","","","","Reflect","Water","1","","During your opponent's next turn, this Pokemon takes 30 less damage from attacks (after applying Weakness and Resistance).","Icy Snow","Colorless, Colorless","2","30","","Metal","x2"
"swsh3-36","Galarian Mr. Rime","Pokemon","120","Water","","Galarian Mr. Mime","36","Naoki Saito","Rare","It's highly skilled at tap-dancing. It waves its cane of ice in time with its graceful movements.","866","D","https://images.pokemontcg.io/swsh3/36.png","https://images.pokemontcg.io/swsh3/36_hires.png","Legal",,"Legal","Colorless, Colorless","2","Shuffle Dance","Once during your turn, you may switch 1 of your opponent's face-down Prize cards with the top card of their deck. (The cards stay face down.)","Ability","","","","Mad Party","Water, Colorless, Colorless","3","20x","This attack does 20 damage for each Pokemon in your discard pile that has the Mad Party attack.","","","","","","Metal","x2"
"swsh3-37","Suicune","Pokemon","120","Water","",,"37","so-taro","Rare Holo","Said to be the embodiment of north winds, it can instantly purify filthy, murky water.","245","D","https://images.pokemontcg.io/swsh3/37.png","https://images.pokemontcg.io/swsh3/37_hires.png","Legal",,"Legal","Colorless","1","","","","","","","Wave Splash","Water","1","20","","Aurora Loop","Water, Water, Colorless","3","130","Put 2 Water Energy attached to this Pokemon into your hand.","Lightning","x2"
"swsh3-38","Feebas","Pokemon","30","Water","Milotic",,"38","HYOGONOSUKE","Common","Although unattractive and unpopular, this Pokemon's marvelous vitality has made it a subject of research.","349","D","https://images.pokemontcg.io/swsh3/38.png","https://images.pokemontcg.io/swsh3/38_hires.png","Legal",,"Legal","Colorless","1","","","","","","","Nap","Colorless","1","","Heal 20 damage from this Pokemon.","","","","","","Lightning","x2"
"swsh3-39","Milotic","Pokemon","120","Water","","Feebas","39","AKIRA EGAWA","Rare Holo","Milotic has provided inspiration to many artists. It has even been referred to as the most beautiful Pokemon of all.","350","D","https://images.pokemontcg.io/swsh3/39.png","https://images.pokemontcg.io/swsh3/39_hires.png","Legal",,"Legal","Colorless, Colorless","2","Bright Heal","Once during your turn, you may heal 20 damage from each of your Pokemon.","Ability","","","","Surf","Water, Colorless, Colorless","3","80","","","","","","","Lightning","x2"
"swsh3-40","Relicanth","Pokemon","90","Water","",,"40","MAHOU","Uncommon","The reason it hasn't changed at all in a hundred million years is that it's apparently already a perfect life-form.","369","D","https://images.pokemontcg.io/swsh3/40.png","https://images.pokemontcg.io/swsh3/40_hires.png","Legal",,"Legal","Colorless","1","","","","","","","Fossil Search","Colorless","1","","Search your deck for up to 2 Rare Fossil cards and put them onto your Bench. Then, shuffle your deck.","Surf","Water, Colorless","2","40","","Lightning","x2"
"swsh3-41","Panpour","Pokemon","60","Water","Simipour",,"41","ryoma uratsuka","Common","The water stored inside the tuft on its head is full of nutrients. Plants that receive its water grow large.","515","D","https://images.pokemontcg.io/swsh3/41.png","https://images.pokemontcg.io/swsh3/41_hires.png","Legal",,"Legal","Colorless","1","","","","","","","Water Gun","Water","1","10","","Bite","Colorless, Colorless","2","20","","Lightning","x2"
"swsh3-42","Simipour","Pokemon","100","Water","","Panpour","42","Shigenori Negishi","Uncommon","It prefers places with clean water. When its tuft runs low, it replenishes it by siphoning up water with its tail.","516","D","https://images.pokemontcg.io/swsh3/42.png","https://images.pokemontcg.io/swsh3/42_hires.png","Legal",,"Legal","Colorless","1","","","","","","","Water Gun","Water","1","30","","Giga Impact","Colorless, Colorless, Colorless","3","110","During your next turn, this Pokemon can't attack.","Lightning","x2"
"swsh3-43","Galarian Darumaka","Pokemon","70","Water","Darmanitan",,"43","Shin Nagasawa","Common","It lived in snowy areas for so long that its fire sac cooled off and atrophied. It now has an organ that generates cold instead.","554","D","https://images.pokemontcg.io/swsh3/43.png","https://images.pokemontcg.io/swsh3/43_hires.png","Legal",,"Legal","Colorless","1","","","","","","","Tackle","Colorless","1","10","","Headbutt","Water, Colorless","2","20","","Metal","x2"
"swsh3-44","Galarian Darmanitan","Pokemon","140","Water","","Galarian Darumaka","44","Masakazu Fukuda","Rare","On days when blizzards blow through, it comes down to where people live. It stashes food in the snowball on its head, taking it home for later.","555","D","https://images.pokemontcg.io/swsh3/44.png","https://images.pokemontcg.io/swsh3/44_hires.png","Legal",,"Legal","Colorless, Colorless, Colorless","3","","","","","","","Blizzard","Water, Colorless, Colorless","3","80","This attack also does 10 damage to each of your opponent's Benched Pokemon. (Don't apply Weakness and Resistance for Benched Pokemon.)","Crushing Headbutt","Water, Water, Colorless, Colorless","4","170","During your next turn, this Pokemon can't use Crushing Headbutt.","Metal","x2"
"swsh3-45","Vanillite","Pokemon","60","Water","Vanillish",,"45","Sanosuke Sakuma","Common","Unable to survive in hot areas, it makes itself comfortable by breathing out air cold enough to cause snow. It burrows into the snow to sleep.","582","D","https://images.pokemontcg.io/swsh3/45.png","https://images.pokemontcg.io/swsh3/45_hires.png","Legal",,"Legal","Colorless","1","","","","","","","Ice Over","Water","1","10","Flip a coin. If heads, your opponent's Active Pokemon is now Paralyzed.","","","","","","Metal","x2"
"swsh3-46","Vanillish","Pokemon","80","Water","Vanilluxe","Vanillite","46","Shibuzoh.","Uncommon","By drinking pure water, it grows its icy body. This Pokemon can be hard to find on days with warm, sunny weather.","583","D","https://images.pokemontcg.io/swsh3/46.png","https://images.pokemontcg.io/swsh3/46_hires.png","Legal",,"Legal","Colorless, Colorless","2","","","","","","","Freezing Headbutt","Water","1","30","Flip a coin. If heads, your opponent's Active Pokemon is now Paralyzed.","","","","","","Metal","x2"
"swsh3-47","Vanilluxe","Pokemon","150","Water","","Vanillish","47","kodama","Rare","When its anger reaches a breaking point, this Pokemon unleashes a fierce blizzard that freezes every creature around it, be they friend or foe.","584","D","https://images.pokemontcg.io/swsh3/47.png","https://images.pokemontcg.io/swsh3/47_hires.png","Legal",,"Legal","Colorless, Colorless","2","Bitter Cold","Once during your turn, if this Pokemon is in the Active Spot, you may flip a coin. If heads, your opponent's Active Pokemon is now Paralyzed.","Ability","","","","Frost Smash","Water, Colorless","2","90","","","","","","","Metal","x2"
