"id","name","supertype","hp","types","rarity","retreatCost","convertedRetreatCost","AbilityName","AbilityText","Attack1Name","Attack1Cost","Attack1ConvertedCost","Attack1Damage","Attack1Text","Attack2Name","Attack2Cost","Attack2ConvertedCost","Attack2Damage","Attack2Text","Weakness1Type","Weakness1Value"
"dp7-51","Skarmory","Pokemon","80","Metal","Uncommon","Colorless","1","","","Quick Attack","Metal","1","10+","Flip a coin. If heads, this attack does 10 damage plus 20 more damage.","Mach Blade","Metal, Colorless, Colorless","3","","Flip a coin. If heads, this attack does 50 damage to 1 of your opponent's Pokemon. (Don't apply Weakness and Resistance for Benched Pokemon.)","Lightning","+20"
"dp7-52","Staravia","Pokemon","70","Colorless","Uncommon","","0","","","Wing Attack","Colorless, Colorless","2","30","","Shot Air","Colorless, Colorless, Colorless","3","20","Does 30 damage to 1 of your opponent's Benched Pokemon. (Don't apply Weakness and Resistance for Benched Pokemon.)","Lightning","+20"
"dp7-53","Bagon","Pokemon","50","Colorless","Common","Colorless","1","","","Scary Face","Colorless","1","","Flip a coin. If heads, the Defending Pokemon can't attack or retreat during your opponent's next turn.","Headbutt","Colorless, Colorless","2","30","","Colorless","+10"
"dp7-54","Bidoof","Pokemon","60","Colorless","Common","Colorless, Colorless","2","","","Yawn","Colorless","1","","The Defending Pokemon is now Asleep.","Self-abandonment","Colorless","1","","Flip a coin. If heads, this attack does 30 damage to the Defending Pokemon. If tails, Bidoof does 10 damage to itself.","Fighting","+10"
"dp7-55","Bronzor","Pokemon","60","Psychic","Common","Colorless, Colorless","2","","","Gyro Swap","Psychic","1","","Put a number of damage counters on the Defending Pokemon equal to the number of Colorless Energy in Bronzor's Retreat Cost (after applying effects to the Retreat Cost).","Psyshock","Colorless, Colorless","2","20","Flip a coin. If heads, the Defending Pokemon is now Paralyzed.","Psychic","+10"
"dp7-56","Cherubi","Pokemon","50","Grass","Common","Colorless","1","","","Nap","","0","","Remove 2 damage counters from Cherubi.","Bullet Seed","Grass","1","10x","Flip 4 coins. This attack does 10 damage times the number of heads.","Fire","+10"
"dp7-57","Combee","Pokemon","50","Grass","Common","Colorless","1","","","Alert","Colorless","1","","Draw a card. Then, you may switch Combee with 1 of your Benched Pokemon.","","","","","","Fire","+10"
"dp7-58","Drifloon","Pokemon","50","Psychic","Common","Colorless","1","","","Constrict","Colorless","1","","Flip a coin. If heads, the Defending Pokemon is now Paralyzed.","Linear Attack","Psychic","1","","Choose 1 of your opponent's Pokemon. This attack does 10 damage to that Pokemon. (Don't apply Weakness and Resistance for Benched Pokemon.)","Darkness","+10"
"dp7-59","Duskull","Pokemon","50","Psychic","Common","Colorless","1","","","Silhouette","Psychic","1","","Put 1 damage counter on the Defending Pokemon. If the Defending Pokemon already has any damage counters on it, put 2 damage counters on that Pokemon instead.","Will-o'-the-wisp","Colorless, Colorless","2","20","","Darkness","+10"
"dp7-60","Duskull","Pokemon","50","Psychic","Common","Colorless","1","","","Tackle","Colorless","1","10","","Surprise Attack","Psychic, Colorless","2","30","Flip a coin. If tails, this attack does nothing.","Darkness","+10"
"dp7-61","Finneon","Pokemon","50","Water","Common","Colorless","1","","","Aqua Liner","","0","","Choose 1 of your opponent's Benched Pokemon. This attack does 10 damage to that Pokemon. (Don't apply Weakness and Resistance for Benched Pokemon.)","Mouth Pump","Water","1","10+","Flip a coin. If heads, this attack does 10 damage plus 10 more damage.","Lightning","+10"
"dp7-62","Gastly","Pokemon","50","Psychic","Common","Colorless","1","","","Pitch-Dark","","0","","You opponent can't play any Trainer cards from his or her hand during your opponent's next turn.","Trick Gas","Psychic","1","10","You may switch Gastly with 1 of your Benched Pokemon.","Darkness","+10"
"dp7-63","Larvitar","Pokemon","50","Fighting","Common","Colorless","1","","","Bite","Colorless","1","10","","Rock Slide","Fighting, Colorless","2","20","Does 10 damage to 2 of your opponent's Benched Pokemon. (Don't apply Weakness and Resistance for Benched Pokemon.)","Grass","+10"
"dp7-64","Machop","Pokemon","60","Fighting","Common","Colorless","1","","","Kick","Colorless","1","10","","Knock Back","Fighting, Colorless","2","20","Your opponent switches the Defending Pokemon with 1 of his or her Benched Pokemon.","Psychic","+10"
"dp7-65","Magikarp","Pokemon","30","Water","Common","Colorless","1","","","Sea Spray","","0","","Flip a coin until you get tails. For each heads, draw a card.","Splash","Water","1","10","","Lightning","+10"
"dp7-66","Magnemite","Pokemon","50","Metal","Common","Colorless","1","","","Magnetic Bomb","Lightning, Colorless","2","30+","Flip a coin. If heads, this attack does 30 damage plus 10 more damage. If tails, Magnemite does 10 damage to itself.","","","","","","Fire","+10"
"dp7-67","Magnemite","Pokemon","50","Lightning","Common","Colorless","1","","","Ram","","0","10","","Random Spark","Lightning, Colorless","2","","Choose 1 of your opponent's Pokemon. This attack does 20 damage to that Pokemon. (Don't apply Weakness and Resistance for Benched Pokemon.)","Fighting","+10"
"dp7-68","Misdreavus","Pokemon","60","Psychic","Common","Colorless","1","","","Lullaby","","0","","The Defending Pokemon is now Asleep.","Nightmare Feast","Psychic","1","","If the Defending Pokemon is Asleep, this attack does 50 damage and remove 5 damage counters from Misdreavus. If the Defending Pokemon is not Asleep, this attack does nothing.","Darkness","+10"
"dp7-69","Onix","Pokemon","90","Fighting","Common","Colorless, Colorless, Colorless","3","","","Harden","Colorless","1","","During your opponent's next turn, if Onix would be damaged by an attack, prevent that attack's damage done to Onix if that damage is 40 or less.","Bind","Fighting, Colorless, Colorless","3","30","Flip a coin. If heads, the Defending Pokemon is now Paralyzed.","Grass","+20"
"dp7-70","Pikachu","Pokemon","70","Lightning","Common","Colorless, Colorless","2","","","Pika Punch","Colorless, Colorless","2","20","","Speed Bolt","Lightning, Colorless, Colorless","3","40","If Pikachu evolved from Pichu during this turn, prevent all effects of an attack, including damage, done to Pikachu during your opponent's next turn.","Fighting","+10"
"dp7-71","Ponyta","Pokemon","50","Fire","Common","Colorless","1","","","Smash Kick","Colorless","1","10","","Agility","Fire, Colorless","2","20","Flip a coin. If heads, prevent all effects of an attack, including damage, done to Ponyta during your opponent's next turn.","Water","+10"
"dp7-72","Roselia","Pokemon","70","Psychic","Common","Colorless","1","","","Headbutt","Colorless","1","10","","Petal Spikes","Psychic, Colorless","2","20","Flip a coin. If heads, the Defending Pokemon is now Asleep and Poisoned. If Budew is anywhere under Roselia, the Defending Pokemon is now Asleep and Poisoned.","Fire","+10"
"dp7-73","Skorupi","Pokemon","60","Grass","Common","Colorless, Colorless","2","","","Stalk","Colorless","1","10","The Defending Pokemon can't retreat during your opponent's next turn.","Dangerous Claw","Grass, Colorless","2","20","Flip a coin. If heads, the Defending Pokemon is now Paralyzed. If tails, the Defending Pokemon is now Poisoned.","Psychic","+10"
"dp7-74","Snover","Pokemon","50","Water","Common","Colorless","1","","","Hide","Colorless","1","","Flip a coin. If heads, prevent all effects of an attack, including damage, done to Snover during your opponent's next turn.","Powder Snow","Water","1","10","The Defending Pokemon is now Asleep.","Fire","+10"
"dp7-75","Starly","Pokemon","50","Colorless","Common","Colorless","1","","","Sand Attack","Colorless","1","","If the Defending Pokemon tries to attack during your opponent's next turn, your opponent flips a coin. If tails, that attack does nothing.","Double Stab","Colorless","1","10x","Flip 2 coins. This attack does 10 damage times the number of heads.","Lightning","+10"
"dp7-76","Stunky","Pokemon","60","Darkness","Common","Colorless","1","","","Gnaw and Run","Darkness","1","10","Switch Stunky with 1 of your Benched Pokemon.","Double Scratch","Colorless, Colorless","2","20x","Flip 2 coins. This attack does 20 damage times the number of heads.","Fighting","+10"
"dp7-77","Swinub","Pokemon","50","Fighting","Common","Colorless","1","","","Freezing Breath","Water","1","","Flip a coin. If heads, the Defending Pokemon is now Paralyzed. If tails, the Defending Pokemon is now Asleep.","Take Down","Fighting","1","20","Flip a coin. If tails, Swinub does 10 damage to itself.","Grass","+10"
"dp7-78","Tangela","Pokemon","70","Grass","Common","Colorless","1","","","Ingrain","Colorless","1","","Flip a coin. If tails, this attack does nothing. If heads, search your deck for a Grass Energy card and attach it to Tangela. Shuffle your deck afterward. If you do, prevent all effects of an attack, including damage, done to Tangela during your opponent's next turn.","Tickle","Grass, Colorless","2","20","Flip a coin. If heads, the Defending Pokemon is now Paralyzed.","Fire","+10"
"dp7-79","Treecko","Pokemon","50","Grass","Common","Colorless","1","","","Call for Friends","Colorless","1","","Search your deck for a Basic Pokemon, show it to your opponent, and put it into your hand. Shuffle your deck afterward.","Poison Breath","Grass","1","","Flip a coin. If heads, the Defending Pokemon is now Poisoned.","Fire","+10"
"dp7-80","Voltorb","Pokemon","60","Lightning","Common","Colorless","1","","","Screech","","0","","If an attack does damage to the Defending Pokemon (after applying Weakness and Resistance), that attack does 20 more damage to that Pokemon until the end of your next turn.","Double Spin","Colorless","1","10x","Flip 2 coins. This attack does 10 damage times the number of heads.","Fighting","+10"
"dp7-81","Voltorb","Pokemon","60","Lightning","Common","Colorless","1","","","Outlet","Colorless","1","","Search your deck for a Lightning Energy card, show it to your opponent, and put it into your hand. Shuffle your deck afterward.","Bouncing Ball","Lightning","1","20","Flip a coin. If tails, Voltorb does 10 damage to itself.","Fighting","+10"
"dp7-SH1","Drifloon","Pokemon","50","Psychic","Rare","","0","Unburden","If Drifloon has a Pokemon Tool card attached to it, Drifloon's Retreat Cost is ColorlessColorless more.","Tackle","Colorless","1","10","","Big Explosion","Psychic, Colorless","2","50","Drifloon does 50 damage to itself.","Darkness","+10"
"dp7-SH2","Duskull","Pokemon","60","Psychic","Rare","Colorless","1","","","Counting Song","","0","","Put up to 3 damage counters on Duskull. Then, put that many damage counters on the Defending Pokemon.","Ram","Psychic","1","10","","Darkness","+10"
"dp7-SH3","Voltorb","Pokemon","60","Lightning","Rare","Colorless","1","","","Fastball","Colorless","1","","Choose 1 of your opponent's Pokemon. Flip a coin. If heads, this attack does 20 damage to that Pokemon. (Don't apply Weakness and Resistance for Benched Pokemon.)","Charge Beam","Lightning","1","10","Search your discard pile for a Lightning Energy card and attach it to Voltorb.","Fighting","+10"
