"id","name","supertype","hp","types","rarity","retreatCost","convertedRetreatCost","AbilityName","AbilityText","Attack1Name","Attack1Cost","Attack1ConvertedCost","Attack1Damage","Attack1Text","Attack2Name","Attack2Cost","Attack2ConvertedCost","Attack2Damage","Attack2Text","Weakness1Type","Weakness1Value"
"ex13-1","Armaldo δ","Pokemon","110","Fighting, Metal","Rare Holo","Colorless, Colorless, Colorless","3","","","Delta Edge","Metal, Colorless","2","70","If you have any Supporter cards in play, this attack's base damage is 20 instead of 70.","Fossil Charge","Fighting, Colorless, Colorless","3","50","You may discard a Claw Fossil, Mysterious Fossil, Root Fossil, or Holon Fossil from your hand. If you do, choose 1 of your opponent's Benched Pokemon and do 30 damage to that Pokemon. (Don't apply Weakness and Resistance for Benched Pokemon.)","Grass","x2"
"ex13-2","Cradily δ","Pokemon","100","Darkness, Metal","Rare Holo","Colorless, Colorless","2","","","Harsh Fluid","Darkness, Colorless","2","20","Put 5 damage counters on the Defending Pokemon at the end of your opponent's next turn.","Poison Tentacles","Metal, Colorless, Colorless","3","50","The Defending Pokemon is now Poisoned.","Fire","x2"
"ex13-3","Deoxys δ","Pokemon","70","Darkness","Rare Holo","Colorless","1","Form Change","Once during your turn (before your attack), you may search your deck for another Deoxys and switch it with Deoxys. (Any cards attached to Deoxys, damage counters, Special Conditions, and effects on it are now on the new Pokemon.) If you do, put Deoxys on top of your deck. Shuffle your deck afterward. You can't use more than 1 Form Change Poke-Power each turn.","Energy Loop","Darkness, Colorless, Colorless","3","60","Return 2 Energy attached to Deoxys to your hand.","","","","","","Psychic","x2"
"ex13-4","Deoxys δ","Pokemon","80","Metal","Rare Holo","Colorless, Colorless","2","Form Change","Once during your turn (before your attack), you may search your deck for another Deoxys and switch it with Deoxys. (Any cards attached to Deoxys, damage counters, Special Conditions, and effects on it are now on the new Pokemon.) If you do, put Deoxys on top of your deck. Shuffle your deck afterward. You can't use more than 1 Form Change Poke-Power each turn.","Delta Reduction","Metal, Colorless","2","30","During your opponent's next turn, any damage done to Deoxys by attacks in reduced by 30 (before applying Weakness and Resistance).","","","","","","Psychic","x2"
"ex13-5","Deoxys δ","Pokemon","70","Colorless","Rare Holo","Colorless","1","Form Change","Once during your turn (before your attack), you may search your deck for another Deoxys and switch it with Deoxys. (Any cards attached to Deoxys, damage counters, Special Conditions, and effects on it are now on the new Pokemon.) If you do, put Deoxys on top of your deck. Shuffle your deck afterward. You can't use more than 1 Form Change Poke-Power each turn.","Crystal Laser","Colorless, Colorless","2","20","During your next turn, Deoxys's attacks do 40 more damage to the Defending Pokemon (before applying Weakness and Resistance).","","","","","","Psychic","x2"
"ex13-6","Deoxys δ","Pokemon","60","Lightning","Rare Holo","Colorless","1","Form Change","Once during your turn (before your attack), you may search your deck for another Deoxys and switch it with Deoxys. (Any cards attached to Deoxys, damage counters, Special Conditions, and effects on it are now on the new Pokemon.) If you do, put Deoxys on top of your deck. Shuffle your deck afterward. You can't use more than 1 Form Change Poke-Power each turn.","Teleportation Burst","Lightning","1","20","Switch Deoxys with 1 of your Benched Pokemon.","","","","","","Psychic","x2"
"ex13-7","Flygon δ","Pokemon","110","Grass, Metal","Rare Holo","Colorless, Colorless","2","Delta Supply","Once during your turn (before your attack), you may attach a basic Energy card or a δ Rainbow Energy card from your hand to 1 of your Pokemon that has δ on its card. This power can't be used if Flygon is affected by a Special Condition.","Swift","Grass, Metal, Colorless","3","60","This attack's damage isn't affected by Weakness, Resistance, Poke-Powers, Poke-Bodies, or any other effects on the Defending Pokemon.","","","","","","Colorless","x2"
"ex13-8","Gyarados δ","Pokemon","90","Lightning, Metal","Rare Holo","Colorless, Colorless","2","Delta Reactor","As long as any Stadium card with Holon in its name is in play, each of your Pokemon that has δ on its card does 10 more damage to the Defending Pokemon (before applying Weakness and Resistance).","Hyper Beam","Metal, Colorless","2","20","Flip a coin. If heads, discard an Energy card attached to the Defending Pokemon.","Heavy Impact","Lightning, Metal, Colorless, Colorless, Colorless","5","80","","Lightning","x2"
"ex13-9","Kabutops δ","Pokemon","100","Lightning","Rare Holo","Colorless","1","","","Vital Drain","Lightning, Colorless","2","30","If the Defending Pokemon is Knocked Out by this attack, remove all Special Conditions and 7 damage counters from Kabutops (all if there are less than 7).","Thunderous Blow","Colorless, Colorless, Colorless","3","40+","Does 40 damage plus 10 more damage for each Lightning Energy attached to Kabutops.","Grass","x2"
"ex13-10","Kingdra δ","Pokemon","110","Fire, Metal","Rare Holo","Colorless, Colorless","2","Dragon Curse","Once during your turn (before your attack), if Kingdra is your Active Pokemon, you may put 2 damage counters on 1 of your opponent's Pokemon with δ on its card. This power can't be used if Kingdra is affected by a Special Condition.","Extra Flame","Fire, Colorless","2","30+","If the Defending Pokemon is Pokemon-ex, this attack does 30 damage plus 30 more damage.","Heat Blast","Fire, Metal, Colorless, Colorless","4","80","","Lightning","x2"
"ex13-11","Latias δ","Pokemon","70","Fire","Rare Holo","Colorless","1","Dual Aura","As long as you have Latios or Latios ex in play, each player's Evolved Pokemon (excluding Pokemon-ex) can't use any Poke-Bodies.","Spearhead","Colorless","1","","Draw a card.","Dragon Claw","Fire, Colorless, Colorless","3","40","","Colorless","x2"
"ex13-12","Latios δ","Pokemon","80","Water","Rare Holo","Colorless","1","Dual Aura","As long as you have Latias or Latias ex in play, each player's Evolved Pokemon (excluding Pokemon-ex) can't use any Poke-Bodies.","Dive","Colorless","1","10","","Aqua Blast","Water, Colorless, Colorless","3","50","Discard a Water Energy attached to Latios.","Colorless","x2"
"ex13-13","Omastar δ","Pokemon","110","Psychic","Rare Holo","Colorless, Colorless","2","","","Bind","Psychic, Colorless","2","30","Flip a coin. If heads, the Defending Pokemon is now Paralyzed.","Vengeful Spikes","Psychic, Colorless, Colorless","3","30+","Does 30 damage plus 10 more damage for each Omanyte, Omastar, Kabuto, Kabutops, and Kabutops ex in your discard pile. You can't add more than 60 damage in this way.","Lightning","x2"
"ex13-14","Pidgeot δ","Pokemon","100","Lightning, Metal","Rare Holo","Colorless","1","Delta Reserve","As long as Pidgeot has any Holon Energy cards attached to it, each player's Pokemon (excluding Pokemon that has δ on its card) can't use any Poke-Powers.","Rotating Claws","Lightning, Metal, Colorless","3","50","You may discard an Energy card attached to Pidgeot. If you do, search your discard pile for an Energy card (excluding the one you discarded) and attach it to Pidgeot.","","","","","","Lightning","x2"
"ex13-15","Raichu δ","Pokemon","70","Metal","Rare Holo","","0","","","Zzzap","Colorless","1","","Does 20 damage to each Pokemon that has any Poke-Powers or Poke-Bodies (both yours and your opponent's). Don't apply Weakness or Resistance.","Metallic Thunder","Metal, Metal, Colorless","3","50","You may discard 2 Metal Energy attached to Raichu. If you do, this attack's base damage is 90 instead of 50.","Fighting","x2"
"ex13-16","Rayquaza δ","Pokemon","80","Water, Metal","Rare Holo","Colorless, Colorless","2","Hydro Barrier","As long as Rayquaza has any Holon Energy cards attached to it, each of your Water Pokemon has no Weakness.","Delta Search","Colorless","1","","Search your deck for a Holon Energy card and attach it to Rayquaza. Shuffle your deck afterward.","Ozone Flare","Water, Metal, Colorless, Colorless","4","60","","Colorless","x2"
"ex13-17","Vileplume δ","Pokemon","90","Psychic, Metal","Rare Holo","Colorless","1","Poison Pollen","Once during your turn (before your attack), you may flip a coin. If heads, choose 1 of the Defending Pokemon. That Pokemon is now Poisoned. This power can't be used if Vileplume is affected by a Special Condition.","Poltergeist","Psychic, Metal","2","30+","Look at your opponent's hand. This attack does 30 damage plus 10 more damage for each Trainer card in your opponent's hand.","","","","","","Psychic","x2"
"ex13-18","Absol","Pokemon","70","Darkness","Rare","Colorless","1","","","Foresight","Colorless","1","","Look at the top 5 cards of either player's deck and put them back on top of that player's deck in any order.","Overrun","Darkness, Colorless","2","10","Choose 1 of your opponent's Benched Pokemon. This attack does 20 damage to that Pokemon. (Don't apply Weakness and Resistance for Benched Pokemon.)","Fighting","x2"
"ex13-19","Bellossom δ","Pokemon","100","Water","Rare","Colorless","1","Fellowship","Bellossom can use the attacks of all Oddish, Gloom, Vileplume, Vileplume ex, or other Bellossom you have in play as its own. (You still need the necessary Energy to use each attack.)","Aqua Flower","Water, Colorless","2","40","During your opponent's next turn, Bellossom has no Weakness.","","","","","","Fire","x2"
"ex13-20","Blaziken","Pokemon","100","Fire","Rare","Colorless, Colorless","2","","","Combustion","Fire","1","30","","Blaze Kick","Fire, Fire, Colorless","3","40+","Flip a coin. If heads, this attack does 40 damage plus 20 more damage. If tails, the Defending Pokemon is now Burned.","Water","x2"
"ex13-21","Latias δ","Pokemon","70","Fire","Rare","Colorless","1","","","Combustion","Fire, Colorless","2","20","","Super Singe","Fire, Fire, Colorless","3","40","Flip a coin. If heads, the Defending Pokemon is now Burned.","Colorless","x2"
"ex13-22","Latios δ","Pokemon","80","Water","Rare","Colorless, Colorless","2","","","Aqua Wave","Colorless, Colorless","2","10+","Flip a coin. If heads, this attack does 10 damage plus 20 more damage.","Dragonbreath","Water, Water, Colorless","3","50","Flip a coin. If tails, this attack does nothing. If heads, the Defending Pokemon is now Paralyzed.","Colorless","x2"
"ex13-23","Mawile","Pokemon","60","Metal","Rare","Colorless","1","","","Feint Attack","Colorless","1","","Choose 1 of your opponent's Pokemon. This attack does 10 damage to that Pokemon. This attack's damage isn't affected by Weakness, Resistance, Poke-Powers, Poke-Bodies, or any other effects on that Pokemon.","Surprise","Metal, Colorless","2","20","Choose 1 card from your opponent's hand without looking. Look at the card you chose, then have your opponent shuffle that card into his or her deck.","Fire","x2"
"ex13-24","Mewtwo δ","Pokemon","70","Lightning","Rare","Colorless","1","","","Psychic Erase","Colorless","1","","Choose 1 of the Defending Pokemon's attacks. That Pokemon can't use that attack during your opponent's next turn.","Swift","Lightning, Lightning, Colorless","3","40","This attack's damage isn't affected by Weakness, Resistance, Poke-Powers, Poke-Bodies, or any other effects on that Pokemon.","Psychic","x2"
"ex13-25","Nosepass","Pokemon","60","Fighting","Rare","Colorless","1","","","Supersonic","Colorless","1","10","Flip a coin. If heads, the Defending Pokemon is now Confused.","Rock Slide","Fighting, Colorless","2","20","Does 10 damage to 2 of your opponent's Benched Pokemon. (Don't apply Weakness and Resistance for Benched Pokemon.)","Water","x2"
"ex13-26","Rayquaza δ","Pokemon","80","Fire","Rare","Colorless, Colorless","2","","","Outrage","Fire, Colorless","2","10+","Flip a coin. If tails, this attack does nothing. If heads, this attack does 10 damage plus 10 more damage for each damage counter on Rayquaza.","Flamethrower","Fire, Colorless, Colorless","3","40","Discard a Fire Energy attached to Rayquaza.","Colorless","x2"
"ex13-27","Regice","Pokemon","80","Water","Rare","Colorless, Colorless","2","Clear Body","Regice can't be affected by any Special Conditions.","Icy Wind","Water, Water, Colorless","3","40","Flip a coin. If heads, the Defending Pokemon is now Asleep.","","","","","","Metal","x2"
"ex13-28","Regirock","Pokemon","80","Fighting","Rare","Colorless, Colorless","2","Clear Body","Regirock can't be affected by any Special Conditions.","Rock Slide","Fighting, Fighting, Colorless","3","40","Does 10 damage to 2 of your opponent's Benched Pokemon. (Don't apply Weakness and Resistance for Benched Pokemon.)","","","","","","Water","x2"
"ex13-29","Registeel","Pokemon","80","Metal","Rare","Colorless, Colorless","2","Clear Body","Registeel can't be affected by any Special Conditions.","Hyper Beam","Metal, Metal, Colorless","3","30","Flip a coin. If heads, discard an Energy card attached to the Defending Pokemon.","","","","","","Fire","x2"
"ex13-30","Relicanth","Pokemon","70","Water","Rare","Colorless","1","Aqua Lift","If Relicanth has any Water Energy attached to it, the Retreat Cost for Relicanth is 0.","Knock Away","Colorless, Colorless","2","20+","Flip a coin. If heads, this attack does 20 damage plus 10 more damage.","","","","","","Lightning","x2"
"ex13-31","Sableye","Pokemon","60","Darkness","Rare","Colorless","1","","","Paralyzing Gaze","Colorless","1","","Flip a coin. If heads, the Defending Pokemon is now Paralyzed.","Knock Off","Darkness, Colorless","2","10","Choose 1 card from your opponent's hand without looking and discard it.",,
"ex13-32","Seviper","Pokemon","70","Grass","Rare","Colorless","1","","","Poison Fang","Colorless","1","","Flip a coin. If heads, the Defending Pokemon is now Poisoned.","Bite","Grass, Colorless, Colorless","3","40","","Psychic","x2"
"ex13-33","Torkoal","Pokemon","80","Fire","Rare","Colorless, Colorless","2","","","Grind","Colorless","1","10x","Does 10 damage times the amount of Energy attached to Torkoal.","Combustion","Fire, Colorless, Colorless","3","40","","Water","x2"
"ex13-34","Zangoose","Pokemon","70","Colorless","Rare","Colorless","1","","","Scratch","Colorless","1","10","","Fury Cutter","Colorless, Colorless","2","10+","Flip 3 coins. If 1 of them is heads, this attack does 10 damage plus 10 more damage. If 2 of them are heads, this attack does 10 damage plus 20 more damage. If all of them are heads, this attack does 10 damage plus 40 more damage.","Fighting","x2"
"ex13-35","Aerodactyl δ","Pokemon","70","Fire","Uncommon","","0","Primal Light","Once during your turn (before your attack), you may search your deck for a basic Energy card, show it to your opponent, and put it into your hand. Shuffle your deck afterward. This power can't be used if Aerodactyl is affected by a Special Condition.","Granite Head","Fire, Colorless","2","30","During your opponent's next turn, any damage done to Aerodactyl by attacks is reduced by 10 (after applying Weakness and Resistance).","","","","","","Lightning","x2"
"ex13-36","Camerupt","Pokemon","90","Fire","Uncommon","Colorless, Colorless","2","","","Magnitude","Colorless, Colorless","2","20","Does 10 damage to each Benched Pokemon (both yours and your opponent's). (Don't apply Weakness and Resistance for Benched Pokemon.)","Take Down","Fire, Colorless, Colorless","3","60","Camerupt does 10 damage to itself.","Water","x2"
"ex13-37","Chimecho δ","Pokemon","60","Metal","Uncommon","Colorless","1","Delta Support","Once during your turn (before your attack), if you have a Supporter card with Holon in its name in play, you may search your discard pile for a basic Energy card or a δ Rainbow Energy card, show it to your opponent, and put it into your hand. This power can't be used if Chimecho is affected by a Special Condition.","Hook","Colorless, Colorless","2","20","","","","","","","Psychic","x2"
"ex13-38","Claydol","Pokemon","80","Psychic","Uncommon","Colorless","1","","","Wide Laser","Colorless","1","","Does 10 damage to each of your opponent's Pokemon. (Don't apply Weakness and Resistance for Benched Pokemon.)","Hyper Beam","Psychic, Colorless, Colorless","3","40","Flip a coin. If heads, discard an Energy card attached to the Defending Pokemon.","Psychic","x2"
"ex13-39","Combusken","Pokemon","70","Fire","Uncommon","Colorless","1","","","Slash","Colorless, Colorless","2","20","","Super Singe","Fire, Colorless, Colorless","3","40","Flip a coin. If heads, the Defending Pokemon is now Burned.","Water","x2"
"ex13-40","Donphan","Pokemon","80","Fighting","Uncommon","Colorless","1","","","Rock Hurl","Fighting","1","20","This attack's damage isn't affected by Resistance.","Double Spin","Colorless, Colorless, Colorless","3","50x","Flip 2 coins. This attack does 50 damage times the number of heads.","Grass","x2"
"ex13-41","Exeggutor δ","Pokemon","80","Fighting","Uncommon","Colorless","1","","","Delta Circle","Colorless, Colorless","2","10+","Does 10 damage plus 10 more damage for each Pokemon you have in play that has δ on its card.","Split Bomb","Fighting, Colorless, Colorless","3","","Choose 2 of your opponent's Pokemon. This attack does 30 damage to each of them. (Don't apply Weakness and Resistance for Benched Pokemon.)","Psychic","x2"
"ex13-42","Gloom δ","Pokemon","70","Psychic","Uncommon","Colorless","1","","","Drool","Colorless","1","20","","Acid","Psychic, Colorless","2","30","The Defending Pokemon can't retreat during your opponent's next turn.","Psychic","x2"
"ex13-43","Golduck δ","Pokemon","70","Lightning","Uncommon","Colorless","1","Delta Block","As long as any Stadium card with Holon in its name is in play, your opponent can't play any Stadium cards from his or her hand.","Mind Play","Lightning, Colorless","2","30+","Choose 1 card from your opponent's hand without looking. Look at the card you chose. If that card is a Trainer card, this attack does 30 damage plus 30 more damage, and discard that card. If that card is not a Trainer card, return it to your opponent's hand.","","","","","","Lightning","x2"
"ex13-44","Holon's Castform","Pokemon","50","Colorless","Uncommon","Colorless","1","","","Delta Draw","Colorless","1","","Count the number of Pokemon you have in play that has δ on its card. Draw up to that many cards.","","","","","","Fighting","x2"
"ex13-45","Lairon","Pokemon","80","Metal","Uncommon","Colorless, Colorless","2","","","Tackle","Colorless, Colorless","2","20","","Iron Head","Colorless, Colorless, Colorless","3","30x","Flip a coin until you get tails. This attack does 30 damage times the number of heads.","Fire","x2"
"ex13-46","Manectric","Pokemon","80","Lightning","Uncommon","Colorless","1","","","Plasma","Colorless","1","20","Search your discard pile for a Lightning Energy card and attach it to Manectric.","Quick Blow","Lightning, Colorless, Colorless","3","40+","Flip a coin. If heads, this attack does 40 damage plus 20 more damage.","Fighting","x2"
"ex13-47","Masquerain","Pokemon","70","Grass","Uncommon","","0","","","Sweet Scent","Colorless","1","","Remove 2 damage counters from 1 of your Pokemon.","Quick Attack","Grass, Colorless","2","30+","Flip a coin. If heads, this attack does 30 damage plus 10 more damage.","Fire","x2"
"ex13-48","Persian δ","Pokemon","70","Darkness, Metal","Uncommon","","0","","","Scratch and Draw","Darkness, Colorless","2","30","If any Stadium card with Holon in its name is in play, draw 3 cards.","Deceive","Metal, Colorless","2","","Your opponent chooses 1 of his or her Pokemon. Put 4 damage counters on that Pokemon.","Fighting","x2"
"ex13-49","Pidgeotto δ","Pokemon","70","Lightning","Uncommon","Colorless","1","","","Whirlwind","Lightning, Colorless","2","30","Your opponent switches the Defending Pokemon with 1 of his or her Benched Pokemon.","","","","","","Lightning","x2"
"ex13-50","Primeape δ","Pokemon","70","Fire","Uncommon","","0","","","Wreck","Fire, Colorless","2","30+","If there is any Stadium card in play, this attack does 30 damage plus 30 more damage. Discard that Stadium card.","Flames of Rage","Fire, Colorless, Colorless","3","10+","Discard 2 Energy attached to Primeape. This attack does 10 damage plus 20 more damage for each damage counter on Primeape.","Psychic","x2"
"ex13-51","Raichu","Pokemon","80","Lightning","Uncommon","Colorless","1","","","Thundershock","Colorless, Colorless","2","20","Flip a coin. If heads, the Defending Pokemon is now Paralyzed.","Pika Bolt","Lightning, Colorless, Colorless","3","50","","Fighting","x2"
"ex13-52","Seadra δ","Pokemon","70","Fire","Uncommon","Colorless","1","","","Searing Flame","Colorless, Colorless","2","10","The Defending Pokemon is now Burned.","Combustion","Fire, Colorless, Colorless","3","40","","Lightning","x2"
"ex13-53","Sharpedo δ","Pokemon","70","Fighting","Uncommon","","0","","","Brush Aside","Colorless, Colorless","2","30","If Sharpedo has any Holon Energy cards attached to it, choose 1 card from your opponent's hand without looking and discard it.","Swift Turn","Fighting, Colorless, Colorless","3","50+","If the Defending Pokemon has Fighting Resistance, this attack does 50 damage plus 30 more damage.","Lightning","x2"
"ex13-54","Vibrava δ","Pokemon","80","Grass","Uncommon","Colorless","1","","","Knock Away","Colorless, Colorless","2","20+","Flip a coin. If heads, this attack does 20 damage plus 10 more damage.","Cutting Wind","Grass, Colorless, Colorless","3","40","","Colorless","x2"
"ex13-55","Whiscash","Pokemon","80","Fighting","Uncommon","Colorless","1","","","Pebble Hurl","Colorless","1","20","This attack's damage isn't affected by Resistance.","Earthquake","Fighting, Colorless, Colorless","3","60","Does 10 damage to each of your Benched Pokemon. (Don't apply Weakness and Resistance for Benched Pokemon.)","Grass","x2"
"ex13-56","Wobbuffet","Pokemon","70","Psychic","Uncommon","Colorless, Colorless","2","","","Call for Friends","Colorless","1","","Search your deck for up to 2 Basic Pokemon and put them onto your Bench. Shuffle your deck afterward.","Retaliate","Psychic, Colorless","2","10x","Does 10 damage times the number of damage counters on Wobbuffet.","Psychic","x2"
"ex13-57","Anorith δ","Pokemon","70","Metal","Common","Colorless","1","","","Metal Claw","Metal","1","20","","Rising Lunge","Colorless, Colorless, Colorless","3","30+","Flip a coin. If heads, this attack does 30 damage plus 20 more damage.","Grass","x2"
"ex13-58","Aron","Pokemon","40","Metal","Common","Colorless","1","","","Mud Slap","Colorless","1","10","","Metal Claw","Metal, Colorless","2","20","","Fire","x2"
"ex13-59","Baltoy","Pokemon","50","Psychic","Common","Colorless","1","","","Ram","Colorless","1","10","","Doubleslap","Psychic, Colorless","2","20x","Flip 2 coins. This attack does 20 damage times the number of heads.","Psychic","x2"
"ex13-60","Barboach","Pokemon","50","Fighting","Common","Colorless","1","","","Waterfall","Colorless","1","10","","Flail","Fighting","1","10x","Does 10 damage times the number of damage counters on Barboach.","Grass","x2"
"ex13-61","Carvanha δ","Pokemon","40","Fighting","Common","Colorless","1","","","Bite","Colorless","1","10","","Reckless Charge","Fighting, Colorless","2","30","Flip a coin. If tails, Carvanha does 10 damage to itself.","Lightning","x2"
"ex13-62","Corphish","Pokemon","50","Water","Common","Colorless","1","","","Corkscrew Punch","Colorless","1","10","","Guillotine","Colorless, Colorless, Colorless","3","30","","Lightning","x2"
"ex13-63","Corphish","Pokemon","40","Water","Common","Colorless","1","","","Flail","Colorless","1","10x","Does 10 damage times the number of damage counters on Corphish.","Crabhammer","Water","1","10","","Lightning","x2"
"ex13-64","Electrike","Pokemon","40","Lightning","Common","Colorless","1","","","Thundershock","Colorless","1","10","Flip a coin. If heads, the Defending Pokemon is now Paralyzed.","","","","","","Fighting","x2"
"ex13-65","Exeggcute δ","Pokemon","50","Fighting","Common","Colorless","1","","","Rollout","Colorless","1","10","","Pebble Throw","Fighting, Colorless","2","","Choose 1 of your opponent's Benched Pokemon. This attack does 20 damage to that Pokemon. (Don't apply Weakness and Resistance for Benched Pokemon.)","Psychic","x2"
"ex13-66","Horsea δ","Pokemon","50","Fire","Common","Colorless","1","","","Ram","Colorless","1","10","","Steady Firebreathing","Fire, Colorless","2","20","","Lightning","x2"
"ex13-67","Kabuto δ","Pokemon","70","Lightning","Common","Colorless, Colorless","2","","","Eerie Light","Lightning","1","","The Defending Pokemon is now Confused.","Shell Attack","Colorless, Colorless","2","20","","Grass","x2"
"ex13-68","Lileep δ","Pokemon","80","Darkness","Common","Colorless, Colorless","2","","","Poison Tentacles","Darkness","1","","The Defending Pokemon is now Poisoned.","Mud Shot","Colorless, Colorless","2","20","","Fire","x2"
"ex13-69","Magikarp δ","Pokemon","30","Metal","Common","Colorless","1","","","Splash","Metal","1","10","","","","","","","Lightning","x2"
"ex13-70","Mankey δ","Pokemon","50","Fire","Common","Colorless","1","","","Paralyzing Gaze","Colorless","1","","Flip a coin. If heads, the Defending Pokemon is now Paralyzed.","Low Kick","Fire, Colorless","2","20","","Psychic","x2"
"ex13-71","Meowth δ","Pokemon","50","Darkness, Metal","Common","Colorless","1","","","Slash","Darkness","1","10","","Pay Day","Metal, Colorless","2","10","Draw a card.","Fighting","x2"
"ex13-72","Numel","Pokemon","50","Fire","Common","Colorless","1","","","Singe","Colorless","1","","Flip a coin. If heads, the Defending Pokemon is now Burned.","Flare","Fire, Colorless","2","20","","Water","x2"
"ex13-73","Oddish δ","Pokemon","40","Water","Common","Colorless","1","","","Tackle","Colorless","1","10","","Blot","Water","1","10","Remove 2 damage counters from Oddish.","Fire","x2"
