"id","name","supertype","hp","types","rarity","retreatCost","convertedRetreatCost","AbilityName","AbilityText","Attack1Name","Attack1Cost","Attack1ConvertedCost","Attack1Damage","Attack1Text","Attack2Name","Attack2Cost","Attack2ConvertedCost","Attack2Damage","Attack2Text","Weakness1Type","Weakness1Value"
"swsh11-101","Relicanth","Pokemon","90","Fighting","Uncommon","Colorless","1","","","Into the Deep","Colorless","1","","Put up to 2 basic Energy cards from your discard pile into your hand.","Tackle","Colorless, Colorless, Colorless","3","80","","Grass","x2"
"swsh11-102","Gastrodon","Pokemon","130","Fighting","Uncommon","Colorless, Colorless, Colorless","3","","","Recover","Colorless","1","","Discard an Energy from this Pokemon and heal all damage from it.","Earthquake","Fighting, Fighting, Colorless","3","170","This attack also does 20 damage to each of your Benched Pokemon. (Don't apply Weakness and Resistance for Benched Pokemon.)","Grass","x2"
"swsh11-103","Mienfoo","Pokemon","60","Fighting","Common","Colorless","1","","","Chop","Fighting","1","10","","Spiral Kick","Fighting, Colorless","2","30","","Psychic","x2"
"swsh11-104","Mienshao","Pokemon","90","Fighting","Uncommon","Colorless","1","","","Pound","Fighting","1","30","","Double Smash","Fighting, Colorless","2","70x","Flip 2 coins. This attack does 70 damage for each heads.","Psychic","x2"
"swsh11-105","Landorus","Pokemon","120","Fighting","Rare","Colorless","1","","","Slap Push","Colorless","1","20","","Smashing Edge","Fighting, Fighting, Colorless","3","130","Discard 2 Energy from this Pokemon.","Grass","x2"
"swsh11-106","Binacle","Pokemon","70","Fighting","Common","Colorless, Colorless","2","","","Mud-Slap","Fighting","1","10","","Slash","Colorless, Colorless","2","20","","Grass","x2"
"swsh11-107","Barbaracle","Pokemon","130","Fighting","Rare Holo","Colorless, Colorless, Colorless","3","Lost Block","Your opponent puts any Prize cards they would take in the Lost Zone instead of into their hand.","Dynamic Chop","Fighting, Colorless, Colorless","3","100","","","","","","","Grass","x2"
"swsh11-108","Carbink","Pokemon","90","Fighting","Uncommon","Colorless","1","","","Lucky Find","Colorless","1","","Search your deck for up to 2 Item cards, reveal them, and put them into your hand. Then, shuffle your deck.","Power Gem","Fighting, Colorless, Colorless","3","80","","Grass","x2"
"swsh11-109","Rockruff","Pokemon","60","Fighting","Common","Colorless","1","","","Double Draw","Fighting","1","","Draw 2 cards.","Rear Kick","Fighting, Colorless, Colorless","3","30","","Grass","x2"
"swsh11-110","Falinks","Pokemon","100","Fighting","Common","Colorless","1","","","Fighting Headbutt","Fighting","1","10+","This attack's damage isn't affected by Weakness. If your opponent's Active Pokemon is a Pokemon V, this attack does 50 more damage.","Jet Headbutt","Fighting, Colorless, Colorless","3","80","","Psychic","x2"
"swsh11-111","Stonjourner","Pokemon","140","Fighting","Rare","Colorless, Colorless, Colorless, Colorless","4","","","Power Stone","Colorless","1","","Attach up to 2 Fighting Energy cards from your hand to your Pokemon in any way you like.","Lost Shot","Fighting, Colorless, Colorless, Colorless","4","120","Put the top card of your opponent's deck in the Lost Zone.","Grass","x2"
"swsh11-112","Spinarak","Pokemon","50","Darkness","Common","Colorless","1","","","Poison Sting","Darkness","1","10","Your opponent's Active Pokemon is now Poisoned.","","","","","","Fighting","x2"
"swsh11-113","Ariados","Pokemon","90","Darkness","Rare","Colorless","1","","","String Bind","Darkness","1","10+","This attack does 30 more damage for each Colorless in your opponent's Active Pokemon's Retreat Cost.","Venomous Fang","Darkness, Colorless, Colorless","3","80","Your opponent's Active Pokemon is now Poisoned.","Fighting","x2"
"swsh11-114","Murkrow","Pokemon","60","Darkness","Common","Colorless","1","","","Peck","Colorless","1","10","","Wing Attack","Darkness, Colorless","2","30","","Lightning","x2"
"swsh11-115","Honchkrow","Pokemon","120","Darkness","Rare","Colorless","1","","","Peck","Colorless","1","20","","Night Cyclone","Darkness, Darkness, Colorless","3","160","Move all Energy from this Pokemon to your Benched Pokemon in any way you like.","Lightning","x2"
"swsh11-116","Seviper","Pokemon","110","Darkness","Uncommon","Colorless, Colorless","2","","","Sucker Punch and Turn","Darkness, Darkness","2","60","Switch this Pokemon with 1 of your Benched Darkness Pokemon.","","","","","","Fighting","x2"
"swsh11-117","Spiritomb","Pokemon","60","Darkness","Rare","Colorless, Colorless","2","Cursed Message","If this Pokemon is Knocked Out by damage from an attack from your opponent's Pokemon, search your deck for a card and put it into your hand. Then, shuffle your deck.","Chain of Spirits","Darkness, Darkness","2","10+","This attack does 60 more damage for each Spiritomb in your discard pile.","","","","","","Grass","x2"
"swsh11-120","Darkrai","Pokemon","120","Darkness","Rare Holo","Colorless, Colorless","2","","","Nightmare","Darkness, Colorless","2","30","Your opponent's Active Pokemon is now Asleep.","Pitch-Black Blade","Darkness, Darkness, Colorless","3","130","During your next turn, this Pokemon can't attack.","Grass","x2"
"swsh11-121","Inkay","Pokemon","50","Darkness","Common","Colorless","1","","","Call for Family","Darkness","1","","Search your deck for up to 2 Basic Pokemon and put them onto your Bench. Then, shuffle your deck.","Tackle","Darkness, Colorless","2","20","","Grass","x2"
"swsh11-122","Hoopa","Pokemon","120","Darkness","Rare","Colorless","1","","","Hand of Djinn","Darkness","1","","Search your deck for a Darkness Energy card and attach it to 1 of your Pokemon. Then, shuffle your deck.","Tyrannical Hole","Darkness, Darkness, Colorless","3","100","","Grass","x2"
"swsh11-125","Bronzor","Pokemon","70","Metal","Common","Colorless, Colorless","2","","","Spinning Attack","Colorless","1","10","","","","","","","Fire","x2"
"swsh11-126","Bronzong","Pokemon","130","Metal","Uncommon","Colorless, Colorless, Colorless","3","","","Ram","Colorless, Colorless","2","30","","Gravitational Drop","Metal, Colorless, Colorless","3","40+","This attack does 40 more damage for each Colorless in your opponent's Active Pokemon's Retreat Cost.","Fire","x2"
"swsh11-127","Galarian Stunfisk","Pokemon","100","Metal","Uncommon","Colorless, Colorless, Colorless","3","","","Field Trap","Metal","1","20","If your opponent has a Stadium in play, discard it. If you discarded a Stadium in this way, discard 2 Energy from your opponent's Active Pokemon.","Tackle","Metal, Colorless","2","50","","Fire","x2"
"swsh11-128","Magearna","Pokemon","90","Metal","Rare","Colorless","1","","","Gear Cutter","Metal","1","20","","Windup Beam","Metal, Colorless, Colorless","3","60+","If this Pokemon has a Pokemon Tool attached, this attack does 60 more damage, and your opponent's Active Pokemon is now Confused.","Fire","x2"
"swsh11-132","Goomy","Pokemon","60","Dragon","Common","Colorless, Colorless","2","","","Tackle","Colorless","1","10","","Melt","Water, Metal","2","30","",,
"swsh11-133","Hisuian Sliggoo","Pokemon","90","Dragon","Uncommon","Colorless, Colorless, Colorless","3","","","Rigidify","","0","","During your opponent's next turn, this Pokemon takes 50 less damage from attacks (after applying Weakness and Resistance).","Gentle Slap","Water, Metal","2","40","",,
"swsh11-134","Hisuian Goodra","Pokemon","160","Dragon","Rare Holo","Colorless, Colorless, Colorless","3","Metal Lodging","Prevent all damage done to each of your Basic Pokemon that has any Metal Energy attached by attacks from your opponent's Pokemon V.","Heavy Impact","Water, Metal, Colorless","3","140","","","","","","",,
"swsh11-138","Lickitung","Pokemon","110","Colorless","Common","Colorless, Colorless, Colorless, Colorless","4","","","Drool","Colorless, Colorless","2","30","","","","","","","Fighting","x2"
"swsh11-139","Lickilicky","Pokemon","140","Colorless","Uncommon","Colorless, Colorless, Colorless, Colorless","4","","","Tongue Slap","Colorless, Colorless","2","50","","Heavy Impact","Colorless, Colorless, Colorless, Colorless","4","130","","Fighting","x2"
"swsh11-140","Porygon","Pokemon","60","Colorless","Common","Colorless","1","","","Branch Calculation","Colorless","1","","Look at the top 4 cards of either player's deck and put them back in any order.","Beam","Colorless","1","10","","Fighting","x2"
"swsh11-141","Porygon2","Pokemon","90","Colorless","Uncommon","Colorless","1","","","Garbage Attack","Colorless","1","20x","This attack does 20 damage for each Pokemon Tool card in the Lost Zone (both yours and your opponent's).","","","","","","Fighting","x2"
"swsh11-142","Porygon-Z","Pokemon","150","Colorless","Rare","Colorless, Colorless","2","","","Downgrading Beam","Colorless, Colorless","2","","Devolve 1 of your opponent's evolved Pokemon by removing any number of Evolution cards from it. Your opponent shuffles those cards into their deck.","Power Beam","Colorless, Colorless, Colorless","3","130","","Fighting","x2"
"swsh11-143","Snorlax","Pokemon","150","Colorless","Rare Holo","Colorless, Colorless, Colorless, Colorless","4","Unfazed Fat","Prevent all effects of attacks from your opponent's Pokemon done to this Pokemon. (Damage is not an effect.)","Thumping Snore","Colorless, Colorless, Colorless","3","180","This Pokemon is now Asleep. During Pokemon Checkup, flip 2 coins instead of 1. If either of them is tails, this Pokemon is still Asleep.","","","","","","Fighting","x2"
"swsh11-144","Aipom","Pokemon","60","Colorless","Common","Colorless","1","","","Mischievous Tail","Colorless","1","","Look at the top card of your opponent's deck. You may have your opponent shuffle their deck.","Scratch","Colorless","1","10","","Fighting","x2"
"swsh11-145","Ambipom","Pokemon","90","Colorless","Uncommon","Colorless","1","","","All-You-Can-Grab","Colorless","1","","Flip a coin until you get tails. Search your deck for a number of cards up to the number of heads and put them into your hand. Then, shuffle your deck.","Knock Off","Colorless, Colorless","2","50","Discard a random card from your opponent's hand.","Fighting","x2"
"swsh11-148","Bouffalant","Pokemon","130","Colorless","Rare","Colorless, Colorless","2","","","Lost Headbutt","Colorless, Colorless, Colorless","3","50","Put an Energy attached to your opponent's Active Pokemon in the Lost Zone.","Superpowered Horns","Colorless, Colorless, Colorless, Colorless","4","120","","Fighting","x2"
"swsh11-149","Komala","Pokemon","100","Colorless","Uncommon","Colorless, Colorless","2","All Just a Dream","If this Pokemon is Asleep and is Knocked Out by damage from an attack from your opponent's Pokemon, your opponent can't take any Prize cards for it.","Collapse","Colorless, Colorless","2","60","This Pokemon is now Asleep.","","","","","","Fighting","x2"
"swsh11-150","Skwovet","Pokemon","60","Colorless","Common","Colorless","1","","","Gnaw","Colorless","1","20","","","","","","","Fighting","x2"
"swsh11-151","Greedent","Pokemon","130","Colorless","Rare","Colorless, Colorless, Colorless","3","","","Collect","Colorless","1","","Draw 2 cards.","Spill Out","Colorless, Colorless","2","60+","Discard your hand. If you discarded 5 or more cards in this way, this attack does 150 more damage.","Fighting","x2"
